"«Форд Филд» был открыт в апреле 2002 года, а цена строительства составила 430 млн $ США и финансировался в основном из общественных денег и денег, полученных от продажи прав на название.","«Форд Филд» был открыт в апреле 2002 года, а цена строительства составила 430 млн долларов США и финансировался в основном из общественных денег и денег, полученных от продажи прав на название."
"В 2018 году бренд Mercedes-Benz оценивался в 48,601 млрд $, удерживая второе место (после Toyota) среди компаний-производителей автомобилей и восьмое место среди всех брендов мира.","В 2018 году бренд Mercedes-Benz оценивался в 48,601 млрд долларов, удерживая второе место (после Toyota) среди компаний-производителей автомобилей и восьмое место среди всех брендов мира."
"В январе 2023 года бренд Mercedes-Benz по оценке Brand Finance среди автобрендов занял второе место, оцениваясь в 58,8 млрд $, уступив первое место бренду Tesla.","В январе 2023 года бренд Mercedes-Benz по оценке Brand Finance среди автобрендов занял второе место, оцениваясь в 58,8 млрд долларов, уступив первое место бренду Tesla."
"В FEMA насчитывается около 22,991 работников (сентябрь 2023), бюджет подразделения 29,5 млрд $ США (2023).","В FEMA насчитывается около 22,991 работников (сентябрь 2023), бюджет подразделения 29,5 млрд долларов США (2023)."
"Общая стоимость судна предполагалась в 700 миллионов канадских $.","Общая стоимость судна предполагалась в 700 миллионов канадских долларов."
"Фильм также стал кассовым провалом, заработав 164 миллиона $ по всему миру при производственном бюджете в 160 миллионов $.","Фильм также стал кассовым провалом, заработав 164 миллиона долларов по всему миру при производственном бюджете в 160 миллионов долларов."
"Berkshire не раскрывает численность продаж Kirby, но Gene Windfeldt, руководитель компании в период с 1988 по 1997 гг., оценивал в 1999 году объём продаж вакуумных пылесосов примерно в 1,1 млрд. $ в год.","Berkshire не раскрывает численность продаж Kirby, но Gene Windfeldt, руководитель компании в период с 1988 по 1997 гг., оценивал в 1999 году объём продаж вакуумных пылесосов примерно в 1,1 млрд. долларов в год."
"Open GDF Suez Cagnes-sur-Mer Alpes Maritimes 2009 — 12-й розыгрыш ежегодного профессионального теннисного турнира среди женщин, проводящегося во французском городе Кань-сюр-Мер и являющегося частью тура ITF в рамках серии турниров с призовым фондом в 100 тысяч $ и оплатой проживания.","Open GDF Suez Cagnes-sur-Mer Alpes Maritimes 2009 — 12-й розыгрыш ежегодного профессионального теннисного турнира среди женщин, проводящегося во французском городе Кань-сюр-Мер и являющегося частью тура ITF в рамках серии турниров с призовым фондом в 100 тысяч долларов и оплатой проживания."
"В 2018 году бренд Mercedes-Benz оценивался в 48,601 млрд $, удерживая второе место (после Toyota) среди компаний-производителей автомобилей и восьмое место среди всех брендов мира.","В 2018 году бренд Mercedes-Benz оценивался в 48,601 млрд долларов, удерживая второе место (после Toyota) среди компаний-производителей автомобилей и восьмое место среди всех брендов мира."
"В январе 2023 года бренд Mercedes-Benz по оценке Brand Finance среди автобрендов занял второе место, оцениваясь в 58,8 млрд $, уступив первое место бренду Tesla.","В январе 2023 года бренд Mercedes-Benz по оценке Brand Finance среди автобрендов занял второе место, оцениваясь в 58,8 млрд долларов, уступив первое место бренду Tesla."
"Бюджет фильма: 30 млн $.","Бюджет фильма: 30 млн долларов."
"Кассовые сборы в кинотеатрах США в год показа: 74 810 000 $.","Кассовые сборы в кинотеатрах США в год показа: 74 810 000 долларов."
"Кассовые сборы по всему миру: 94 млн $.","Кассовые сборы по всему миру: 94 млн долларов."
"Звездолёт «Вояджер» дебютировал на телеэкране в январе 1995 года в эпизоде «Опекун», самом дорогом пилоте в истории телевидения, который, как сообщается, стоил 23 миллиона $.","Звездолёт «Вояджер» дебютировал на телеэкране в январе 1995 года в эпизоде «Опекун», самом дорогом пилоте в истории телевидения, который, как сообщается, стоил 23 миллиона долларов."
"В американском прокате фильм прошёл неудачно, собрав лишь 22 миллиона $ США (при бюджете в 45 миллионов).","В американском прокате фильм прошёл неудачно, собрав лишь 22 миллиона долларов США (при бюджете в 45 миллионов)."
"«Who Wants to Be a Millionaire?» — американская телеигра, где каждый участник с помощью своей эрудиции мог заработать 1 миллион $.","«Who Wants to Be a Millionaire?» — американская телеигра, где каждый участник с помощью своей эрудиции мог заработать 1 миллион долларов."
"Согласно Отчёту президента США Гарри Трумэна Конгрессу, по состоянию на 2 сентября 1945 года обратный ленд-лиз из СССР составил 2 212 698 $.","Согласно Отчёту президента США Гарри Трумэна Конгрессу, по состоянию на 2 сентября 1945 года обратный ленд-лиз из СССР составил 2 212 698 долларов."
"Фильм имел коммерческий и критический успех, собрав по всему миру 286 миллионов $ при бюджете в 85 миллионов $, а также став вторым самым кассовым музыкальным байопиком всех времен после «Богемской рапсодии» (2018) и четвёртым самым кассовым фильмом австралийского производства.","Фильм имел коммерческий и критический успех, собрав по всему миру 286 миллионов долларов при бюджете в 85 миллионов долларов, а также став вторым самым кассовым музыкальным байопиком всех времен после «Богемской рапсодии» (2018) и четвёртым самым кассовым фильмом австралийского производства."
"«Ведьма из Блэр: Курсовая с того света» собрал почти 250 миллионов $ по всему миру, став одним из самых успешных независимых фильмов всех времён, а также 41-м самым кассовым фильмом ужасов в истории.","«Ведьма из Блэр: Курсовая с того света» собрал почти 250 миллионов долларов по всему миру, став одним из самых успешных независимых фильмов всех времён, а также 41-м самым кассовым фильмом ужасов в истории."
"Индекс рассчитывается как взятое с поправочным коэффициентом среднее геометрическое взвешенное курсов $ к этим валютам по формуле:","Индекс рассчитывается как взятое с поправочным коэффициентом среднее геометрическое взвешенное курсов доллара к этим валютам по формуле:"
"По состоянию на август 2021 года президентом Иллинойсского университета является Тимоти Киллин, по данным 2020 года за свою работу он получал 835 000 $ в год.","По состоянию на август 2021 года президентом Иллинойсского университета является Тимоти Киллин, по данным 2020 года за свою работу он получал 835 000 долларов в год."
"В 2007 году центр получил грант в размере 30 миллионов $ от благотворительной корпорации Карнеги.","В 2007 году центр получил грант в размере 30 миллионов долларов от благотворительной корпорации Карнеги."
"Парк открылся 1 августа 1961 года, его строительство обошлось в 10 миллионов $.","Парк открылся 1 августа 1961 года, его строительство обошлось в 10 миллионов долларов."
"Чтобы зарезервировать место в очереди, многие участники жертвовали по 10 $.","Чтобы зарезервировать место в очереди, многие участники жертвовали по 10 долларов."
"По расчету стоимости НАСА, проект оценивался в 2,5 млрд $.","По расчету стоимости НАСА, проект оценивался в 2,5 млрд долларов."
"Мост стоимостью 1 миллиард $ США, финансируемый из частных источников, был передан японской фирме IHI Infrastructure System Co.","Мост стоимостью 1 миллиард долларов США, финансируемый из частных источников, был передан японской фирме IHI Infrastructure System Co."
"Миллиарде́рами называют людей, состояние которых превышает 1 миллиард, чаще всего — $ США.","Миллиарде́рами называют людей, состояние которых превышает 1 миллиард, чаще всего — долларов США."
"Фильм стал финансовым разочарованием, собрав 179 миллионов $ во всём мире и оказавшись наименее прибыльным из серии.","Фильм стал финансовым разочарованием, собрав 179 миллионов долларов во всём мире и оказавшись наименее прибыльным из серии."
"Бюджет турнира составил около 2,5 миллиона $, а команда-победитель получила 75 тысяч $.","Бюджет турнира составил около 2,5 миллиона долларов, а команда-победитель получила 75 тысяч долларов."
"Dropbox был признан одним из самых ценных стартапов в США и мире с оценкой более 10 миллиардов $ США.","Dropbox был признан одним из самых ценных стартапов в США и мире с оценкой более 10 миллиардов долларов США."
"Премьера мультфильма состоялась 14 ноября 1998 года, лента собрала в прокате 363 млн $.","Премьера мультфильма состоялась 14 ноября 1998 года, лента собрала в прокате 363 млн долларов."
"Первоначально задуманный и предложенный аниматором Disney Гленом Кином в 2001 году, мультфильм провёл шесть лет в производстве по бюджету, который оценивается в 260 миллионов $, что делает его самым дорогим мультфильмом всех времён и одним из самых дорогих фильмов всех времён.","Первоначально задуманный и предложенный аниматором Disney Гленом Кином в 2001 году, мультфильм провёл шесть лет в производстве по бюджету, который оценивается в 260 миллионов долларов, что делает его самым дорогим мультфильмом всех времён и одним из самых дорогих фильмов всех времён."
"Стоимость реликвии в 2017 году оценивалась в 1 млн. $ или 1 млн. €..","Стоимость реликвии в 2017 году оценивалась в 1 млн. долларов или 1 млн. евро.."
"В 2018 году бренд Mercedes-Benz оценивался в 48,601 млрд $, удерживая второе место (после Toyota) среди компаний-производителей автомобилей и восьмое место среди всех брендов мира.","В 2018 году бренд Mercedes-Benz оценивался в 48,601 млрд долларов, удерживая второе место (после Toyota) среди компаний-производителей автомобилей и восьмое место среди всех брендов мира."
"В январе 2023 года бренд Mercedes-Benz по оценке Brand Finance среди автобрендов занял второе место, оцениваясь в 58,8 млрд $, уступив первое место бренду Tesla.","В январе 2023 года бренд Mercedes-Benz по оценке Brand Finance среди автобрендов занял второе место, оцениваясь в 58,8 млрд долларов, уступив первое место бренду Tesla."
"Unity Technologies объявила о своем плане приобрести Parsec за 320 миллионов $ в августе 2021 года, и ожидается, что сделка будет закрыта к третьему кварталу 2021 года.","Unity Technologies объявила о своем плане приобрести Parsec за 320 миллионов долларов в августе 2021 года, и ожидается, что сделка будет закрыта к третьему кварталу 2021 года."
"Фильм заработал 127 миллионов $ по всему миру и получил в целом негативные отзывы от критиков.","Фильм заработал 127 миллионов долларов по всему миру и получил в целом негативные отзывы от критиков."
"С бюджетом в 8 миллионов $, он считается одним из самых дорогих когда-либо созданных порнофильмов.","С бюджетом в 8 миллионов долларов, он считается одним из самых дорогих когда-либо созданных порнофильмов."
"21 ноября 2008 года фильм «Сумерки» вышел в прокат, он собрал более 393 миллионов $ США по всему миру.","21 ноября 2008 года фильм «Сумерки» вышел в прокат, он собрал более 393 миллионов долларов США по всему миру."
"В 2018 году соревнование относилось к международной категории турниров, проводящейся в рамках WTA Тура с призовым фондом 250 тысяч $ и турнирной сеткой, рассчитанной на 32 участницы в одиночном разряде и 16 пар.","В 2018 году соревнование относилось к международной категории турниров, проводящейся в рамках WTA Тура с призовым фондом 250 тысяч долларов и турнирной сеткой, рассчитанной на 32 участницы в одиночном разряде и 16 пар."
"По данным Forbes, Микати является самым богатым человеком в Ливане, его состояние на 2023 год составило 2,8 миллиарда $.","По данным Forbes, Микати является самым богатым человеком в Ливане, его состояние на 2023 год составило 2,8 миллиарда долларов."
"Биржевой крах 1873 года привёл к банкротству её мужа, и Пинкхэм по совету одного из своих сыновей решила в 1875 году продавать своё средство по $ за бутылочку, а её сыновья выступали в роли рекламщиков и распространителей листовок.","Биржевой крах 1873 года привёл к банкротству её мужа, и Пинкхэм по совету одного из своих сыновей решила в 1875 году продавать своё средство по доллару за бутылочку, а её сыновья выступали в роли рекламщиков и распространителей листовок."
"Каких-либо медицинских исследований настойки Пинкхэм профессиональными медиками никогда не проводилась, но снадобье приобрело достаточно большую популярность в Америке, а Пинкхэм, которая уже смогла позволить себе создать целую лабораторию по его производству, стала зарабатывать более 300 тысяч $ в год.","Каких-либо медицинских исследований настойки Пинкхэм профессиональными медиками никогда не проводилась, но снадобье приобрело достаточно большую популярность в Америке, а Пинкхэм, которая уже смогла позволить себе создать целую лабораторию по его производству, стала зарабатывать более 300 тысяч долларов в год."
"о поставке Li-ion аккумуляторов на 43 миллиона $.","о поставке Li-ion аккумуляторов на 43 миллиона долларов."
"Кири́лл Никола́евич Шама́лов (род. 22 марта 1982, Ленинград) — российский предприниматель, в рейтинге самых богатых российских бизнесменов в 2018 году занимал 75-е место (1400 млн $).","Кири́лл Никола́евич Шама́лов (род. 22 марта 1982, Ленинград) — российский предприниматель, в рейтинге самых богатых российских бизнесменов в 2018 году занимал 75-е место (1400 млн долларов)."
"По состоянию на 2019 год Кирилл Шамалов не является долларовым миллиардером, Forbes оценивает его состояние в 950 млн $.","По состоянию на 2019 год Кирилл Шамалов не является долларовым миллиардером, Forbes оценивает его состояние в 950 млн долларов."
"Стоимость разработки и изготовления камеры составила 101 млн $ США.","Стоимость разработки и изготовления камеры составила 101 млн долларов США."
"Несмотря на в целом благосклонную реакцию критиков фильм провалился в прокате, собрав всего 10 млн $ при бюджете в 17 млн.","Несмотря на в целом благосклонную реакцию критиков фильм провалился в прокате, собрав всего 10 млн долларов при бюджете в 17 млн."
"Сама Валентина Соловьёва назвала сумму в 150 000 000 $.","Сама Валентина Соловьёва назвала сумму в 150 000 000 долларов."
"Принглс (англ. Pringles) — ® пшенично-картофельных чипсов, производимых компанией Kellanova (до 5 апреля 2011 года — Procter & Gamble; в феврале 2012 года ведущий производитель продуктов питания в США компания Kellanova договорилась с Procter & Gamble о приобретении у неё бизнеса по производству чипсов Pringles за 2,7 миллиарда $).","Принглс (англ. Pringles) — торговая марка пшенично-картофельных чипсов, производимых компанией Kellanova (до 5 апреля 2011 года — Procter & Gamble; в феврале 2012 года ведущий производитель продуктов питания в США компания Kellanova договорилась с Procter & Gamble о приобретении у неё бизнеса по производству чипсов Pringles за 2,7 миллиарда долларов)."
"При выходе консоль стоила 499 бразильских песо, но в течение полугода её снизили до 299 (около 170 $ США), а игры продавались по цене около 10 $.","При выходе консоль стоила 499 бразильских песо, но в течение полугода её снизили до 299 (около 170 долларов США), а игры продавались по цене около 10 долларов."
"C бюджетом в 7 миллионов $ фильм набрал > 15 миллионов $.","C бюджетом в 7 миллионов долларов фильм набрал больше 15 миллионов долларов."
