"Будучи одним из самых богатых (107 млн $, 2017) и активных представителей греческой общины США и диаспоры в целом, является основателем, председателем совета директоров и CEO ООО «Chartwell Hotels» (компания основана в 2006 году).","Будучи одним из самых богатых (107 млн долларов, 2017) и активных представителей греческой общины США и диаспоры в целом, является основателем, председателем совета директоров и CEO ООО «Chartwell Hotels» (компания основана в 2006 году)."
"В США фильм собрал 101 071 502 $, а во всём мире — 206 071 052 $.","В США фильм собрал 101 071 502 доллара, а во всём мире — 206 071 052 доллара."
"По данным издания Forbes, в списке богатейших бизнесменов России в 2021 году занимал 32-е место с состоянием 4,7 миллиарда $, в списке наиболее состоятельных людей мира — 608-е место.","По данным издания Forbes, в списке богатейших бизнесменов России в 2021 году занимал 32-е место с состоянием 4,7 миллиарда долларов, в списке наиболее состоятельных людей мира — 608-е место."
"Результатом невыплаты этой задолженности вовремя является то, что компания взимает штраф за просрочку платежа (как правило, в США от 10 до 40 $) и сообщает о несвоевременной оплате агентствам по кредитному рейтингу.","Результатом невыплаты этой задолженности вовремя является то, что компания взимает штраф за просрочку платежа (как правило, в США от 10 до 40 долларов) и сообщает о несвоевременной оплате агентствам по кредитному рейтингу."
"и через год принял участие в создании компании Fonality, предлагающей решения VoIP на основе программного обеспечения с открытым исходным кодом, которая должна была привлечь более 46 млн. $ частного финансирования.","и через год принял участие в создании компании Fonality, предлагающей решения VoIP на основе программного обеспечения с открытым исходным кодом, которая должна была привлечь более 46 млн. долларов частного финансирования."
"В марте 2012 года было объявлено, что в связи с расширеним контракта на постройку кораблей для ВМС США, в ближайшие годы планируется дополнительно инвестировать в развитие производства 160 млн $ и увеличить штат до 4000 человек.","В марте 2012 года было объявлено, что в связи с расширеним контракта на постройку кораблей для ВМС США, в ближайшие годы планируется дополнительно инвестировать в развитие производства 160 млн долларов и увеличить штат до 4000 человек."
"Призовой фонд турнира составляет 5 000 000 иен (примерно 47 000 $).","Призовой фонд турнира составляет 5 000 000 иен (примерно 47 000 долларов)."
"Экономика России занимает 4-е место среди стран мира и 1-е среди стран Европы по объёму ВВП по ППС, который на 2023 год оценивался в 6,45 трлн $ (по данным ВБ).","Экономика России занимает 4-е место среди стран мира и 1-е среди стран Европы по объёму ВВП по ППС, который на 2023 год оценивался в 6,45 трлн долларов (по данным ВБ)."
"10 июня 2016 года было объявлено о начале банкротства Gawker из-за проигранного судебного иска Халку Хогану на сумму в 140 миллионов $, 18 августа Gawker Media объявило о закрытии gawker.com через неделю, и отсутствии влияния этого события на судьбу других активов медиахолдинга.","10 июня 2016 года было объявлено о начале банкротства Gawker из-за проигранного судебного иска Халку Хогану на сумму в 140 миллионов долларов, 18 августа Gawker Media объявило о закрытии gawker.com через неделю, и отсутствии влияния этого события на судьбу других активов медиахолдинга."
"Экономика России занимает 4-е место среди стран мира и 1-е среди стран Европы по объёму ВВП по ППС, который на 2023 год оценивался в 6,45 трлн $ (по данным ВБ).","Экономика России занимает 4-е место среди стран мира и 1-е среди стран Европы по объёму ВВП по ППС, который на 2023 год оценивался в 6,45 трлн долларов (по данным ВБ)."
"По оценке Forbes личное состояние 1,3 млрд $ (2020 год)","По оценке Forbes личное состояние 1,3 млрд долларов (2020 год)"
"Постройка стадиона с благоустройством прилегающих территорий обошлась в 400 млн $ США.","Постройка стадиона с благоустройством прилегающих территорий обошлась в 400 млн долларов США."
"Церковь Святого Иосифа (англ. Saint Joseph's Church, Albany, New York) — римско-католическая церковь в городе Олбани, штат Нью-Йорк; неоготическое здание было построено в 1856—1860 годах по проекту ирландско-американского архитектора Патрика Чарльза Кили (1816—1896); стоимость строительства составила около 250 000 $.","Церковь Святого Иосифа (англ. Saint Joseph's Church, Albany, New York) — римско-католическая церковь в городе Олбани, штат Нью-Йорк; неоготическое здание было построено в 1856—1860 годах по проекту ирландско-американского архитектора Патрика Чарльза Кили (1816—1896); стоимость строительства составила около 250 000 долларов."
"Несмотря на в целом благосклонную реакцию критиков фильм провалился в прокате, собрав всего 10 млн $ при бюджете в 17 млн.","Несмотря на в целом благосклонную реакцию критиков фильм провалился в прокате, собрав всего 10 млн долларов при бюджете в 17 млн."
"Цена шлема составляла порядка 500 и 800 $ США в различные периоды времени.","Цена шлема составляла порядка 500 и 800 долларов США в различные периоды времени."
"В декабре 2015 года корпорация Alibaba Group договорилась с SCMP Group о покупке за 266 млн $ газеты South China Morning Post, агентства наружной рекламы, журналов и интернет-ресурсов (фактически SCMP Group ушла с рынка печатных средств массовой информации, сосредоточившись на других отраслях бизнеса).","В декабре 2015 года корпорация Alibaba Group договорилась с SCMP Group о покупке за 266 млн долларов газеты South China Morning Post, агентства наружной рекламы, журналов и интернет-ресурсов (фактически SCMP Group ушла с рынка печатных средств массовой информации, сосредоточившись на других отраслях бизнеса)."
"По версии журнала «Форбс», по состоянию на январь 2022 года состояние Мошири составляет 2,7 млрд $ США.","По версии журнала «Форбс», по состоянию на январь 2022 года состояние Мошири составляет 2,7 млрд долларов США."
"За свои чрезвычайно «медвежьи» взгляды на $ США, фондовый рынок Соединенных Штатов, рынок облигаций и на экономику Соединённых Штатов он известен под прозвищем «Доктор Судный день» (англ. Dr. Doom).","За свои чрезвычайно «медвежьи» взгляды на доллар США, фондовый рынок Соединенных Штатов, рынок облигаций и на экономику Соединённых Штатов он известен под прозвищем «Доктор Судный день» (англ. Dr. Doom)."
"Во время работы на телевидении Шер зарекомендовала себя как сольный исполнитель, выпустив синглы «Gypsys, Tramps & Thieves», «Half-Breed» и «Dark Lady», которые достигли вершины американских чартов, а после выпуска диско-альбома Take Me Home в 1979 году выступала в Лас-Вегасе в течение трёх лет с 1980 по 1982 год с гонораром 300 000 $ в неделю.","Во время работы на телевидении Шер зарекомендовала себя как сольный исполнитель, выпустив синглы «Gypsys, Tramps & Thieves», «Half-Breed» и «Dark Lady», которые достигли вершины американских чартов, а после выпуска диско-альбома Take Me Home в 1979 году выступала в Лас-Вегасе в течение трёх лет с 1980 по 1982 год с гонораром 300 000 долларов в неделю."
"Мировое турне Living Proof: The Farewell Tour (2002—2005) было признано самым коммерчески успешным турне женщины-исполнителя того времени и до сих пор входит в список самых успешных турне со сборами более 250 миллионов $.","Мировое турне Living Proof: The Farewell Tour (2002—2005) было признано самым коммерчески успешным турне женщины-исполнителя того времени и до сих пор входит в список самых успешных турне со сборами более 250 миллионов долларов."
"Хилл занимал 28-е место в списке самых высокооплачиваемых актёров журнала Forbes с июня 2014 по июнь 2015 года, заработав 16 миллионов $.","Хилл занимал 28-е место в списке самых высокооплачиваемых актёров журнала Forbes с июня 2014 по июнь 2015 года, заработав 16 миллионов долларов."
"Производственный бюджет фильма составил 36 миллионов $, общие сборы — 44 миллиона.","Производственный бюджет фильма составил 36 миллионов долларов, общие сборы — 44 миллиона."
"Во время работы на телевидении Шер зарекомендовала себя как сольный исполнитель, выпустив синглы «Gypsys, Tramps & Thieves», «Half-Breed» и «Dark Lady», которые достигли вершины американских чартов, а после выпуска диско-альбома Take Me Home в 1979 году выступала в Лас-Вегасе в течение трёх лет с 1980 по 1982 год с гонораром 300 000 $ в неделю.","Во время работы на телевидении Шер зарекомендовала себя как сольный исполнитель, выпустив синглы «Gypsys, Tramps & Thieves», «Half-Breed» и «Dark Lady», которые достигли вершины американских чартов, а после выпуска диско-альбома Take Me Home в 1979 году выступала в Лас-Вегасе в течение трёх лет с 1980 по 1982 год с гонораром 300 000 долларов в неделю."
"Мировое турне Living Proof: The Farewell Tour (2002—2005) было признано самым коммерчески успешным турне женщины-исполнителя того времени и до сих пор входит в список самых успешных турне со сборами более 250 миллионов $.","Мировое турне Living Proof: The Farewell Tour (2002—2005) было признано самым коммерчески успешным турне женщины-исполнителя того времени и до сих пор входит в список самых успешных турне со сборами более 250 миллионов долларов."
"Чемпионство на миллион $ (англ. Million Dollar Championship) — это титул по рестлингу в WWE.","Чемпионство на миллион долларов (англ. Million Dollar Championship) — это титул по рестлингу в WWE."
"Первоначально титул был представлен «Человеком на миллион $» Тедом Дибиаси в 1989 году как несанкционированный чемпионат, когда промоушен ещё назывался WWF.","Первоначально титул был представлен «Человеком на миллион долларов» Тедом Дибиаси в 1989 году как несанкционированный чемпионат, когда промоушен ещё назывался WWF."
"Стоимость экспедиции составила свыше 6 миллионов $.","Стоимость экспедиции составила свыше 6 миллионов долларов."
"Empire Slovak Open 2014 — 6-й розыгрыш ежегодного профессионального теннисного турнира среди женщин, проводящегося в словацком городе Трнава и являющегося частью тура ITF в рамках серии турниров с призовым фондом в 75 тысяч $.","Empire Slovak Open 2014 — 6-й розыгрыш ежегодного профессионального теннисного турнира среди женщин, проводящегося в словацком городе Трнава и являющегося частью тура ITF в рамках серии турниров с призовым фондом в 75 тысяч долларов."
"Чемпионом лиги и обладателем 15 тыс. $ США из призового фонда стал коллектив «RoX.KIS».","Чемпионом лиги и обладателем 15 тыс. долларов США из призового фонда стал коллектив «RoX.KIS»."
"Если же курс акций компании «Х» опустится ниже 60 $ за акцию или поднимется выше 80 $, то держатель опциона воспользуется своим правом и будет продавать или покупать акции.","Если же курс акций компании «Х» опустится ниже 60 долларов за акцию или поднимется выше 80 долларов, то держатель опциона воспользуется своим правом и будет продавать или покупать акции."
"С 2010 года ® ∈ британско-нидерландской компании Reckitt Benckiser и оценивается в 3,9 млрд $.","С 2010 года торговая марка принадлежит британско-нидерландской компании Reckitt Benckiser и оценивается в 3,9 млрд долларов."
"Наибольшую известность студии принесли сверхнизкобюджетные (по некоторым оценкам, в районе 200 $) боевики, такие как «Кто убил капитана Алекса?», «Плохой черный», «Тебаатусасула» и т. д.","Наибольшую известность студии принесли сверхнизкобюджетные (по некоторым оценкам, в районе 200 долларов) боевики, такие как «Кто убил капитана Алекса?», «Плохой черный», «Тебаатусасула» и т. д."
"Кампания по сбору средств на разработку игры на сайте Kickstarter была открыта в марте 2012 года и достигла планируемой цели в 400 тысяч $ США уже через 28 часов после старта.","Кампания по сбору средств на разработку игры на сайте Kickstarter была открыта в марте 2012 года и достигла планируемой цели в 400 тысяч долларов США уже через 28 часов после старта."
"В 2014 году средняя стоимость аренды квартиры в месяц составила 1700 $, а покупки — 835 тысяч $.","В 2014 году средняя стоимость аренды квартиры в месяц составила 1700 долларов, а покупки — 835 тысяч долларов."
"После окончания Техасской революции оригинал письма был доставлен семье Тревиса в Алабаму, а в 1893 году один из его потомков продал письмо штату Техас за 85 $.","После окончания Техасской революции оригинал письма был доставлен семье Тревиса в Алабаму, а в 1893 году один из его потомков продал письмо штату Техас за 85 долларов."
"12 мая 2016 года SanDisk была приобретена производителем жёстких дисков Western Digital за 19 млрд $ США.","12 мая 2016 года SanDisk была приобретена производителем жёстких дисков Western Digital за 19 млрд долларов США."
"Mobile Suit Gundam Seed Freedom собрал 32 млн $.","Mobile Suit Gundam Seed Freedom собрал 32 млн долларов."
"8 фильмов франшизы собрали в общей сложности более 1,4 млрд $ в мировом кинопрокате.","8 фильмов франшизы собрали в общей сложности более 1,4 млрд долларов в мировом кинопрокате."
"2,5 $ США с бюстом Свободы — золотая монета США номиналом в 2,5 $, которая чеканилась с 1840 по 1907 годы.","2,5 доллара США с бюстом Свободы — золотая монета США номиналом в 2,5 доллара, которая чеканилась с 1840 по 1907 годы."
"В 1968 году вагоны были проданы городу Монреалю за 1,8 миллиона $ и эксплуатировались Монреальской транзитной комиссией (ныне STM).","В 1968 году вагоны были проданы городу Монреалю за 1,8 миллиона долларов и эксплуатировались Монреальской транзитной комиссией (ныне STM)."
"Победитель получает 10 тысяч американских $, второй и третий хоккеист в опросе, соответственно, 6 и 4 тысячи $.","Победитель получает 10 тысяч американских долларов, второй и третий хоккеист в опросе, соответственно, 6 и 4 тысячи долларов."
"21 ноября 2008 года фильм «Сумерки» вышел в прокат, он собрал более 393 миллионов $ США по всему миру.","21 ноября 2008 года фильм «Сумерки» вышел в прокат, он собрал более 393 миллионов долларов США по всему миру."
"При выходе консоль стоила 499 бразильских песо, но в течение полугода её снизили до 299 (около 170 $ США), а игры продавались по цене около 10 $.","При выходе консоль стоила 499 бразильских песо, но в течение полугода её снизили до 299 (около 170 долларов США), а игры продавались по цене около 10 долларов."
"От 230 до 320 миллиардов $ (в $ 2005 года) было изъято у евреев по всей Европе.","От 230 до 320 миллиардов долларов (в долларах 2005 года) было изъято у евреев по всей Европе."
"Фильм является своеобразным ремейком фильмов «За пригоршню $» Серджо Леоне (1964) и «Телохранитель» Акиры Куросавы (1961).","Фильм является своеобразным ремейком фильмов «За пригоршню долларов» Серджо Леоне (1964) и «Телохранитель» Акиры Куросавы (1961)."
"Среди наиболее примечательных картин с участием Брайана — «Осквернитель праха» (1949), «Путь фламинго» (1949), «За лесом» (1949), «Проклятые не плачут» (1950), «Прорыв» (1950), «Стрелок из Спрингфилда» (1952), «Русалка на миллион $» (1952), «Великий и могучий» (1954), «Пригоршня чудес» (1961) и «Редкая порода» (1966).","Среди наиболее примечательных картин с участием Брайана — «Осквернитель праха» (1949), «Путь фламинго» (1949), «За лесом» (1949), «Проклятые не плачут» (1950), «Прорыв» (1950), «Стрелок из Спрингфилда» (1952), «Русалка на миллион долларов» (1952), «Великий и могучий» (1954), «Пригоршня чудес» (1961) и «Редкая порода» (1966)."
