question,answer,count_simple,count_simple_translated,count_simple_long,count_simple_long_translated,count_cases_translated,count_cases_long
"Миллиарде́рами называют людей, состояние которых превышает 1 миллиард, чаще всего — $ США.","Миллиарде́рами называют людей, состояние которых превышает 1 миллиард, чаще всего — долларов США.",0,0,0,0,1,0
"Фильм показал неплохие результаты в прокате, собрав 16 миллионов $ при бюджете в 6 миллионов, однако получил смешанные отзывы критиков.","Фильм показал неплохие результаты в прокате, собрав 16 миллионов долларов при бюджете в 6 миллионов, однако получил смешанные отзывы критиков.",0,0,0,0,1,0
"В 1937 году, в 1948—1950 годах и с 1954 по 1993 годы экспедиции назывались «Север» с указанием их порядкового №.","В 1937 году, в 1948—1950 годах и с 1954 по 1993 годы экспедиции назывались «Север» с указанием их порядкового номера.",0,0,0,0,1,0
"Осма́нская ли́ра — ¤ Османской империи с 1844 по 29 октября 1923 года.","Осма́нская ли́ра — денежная единица Османской империи с 1844 по 29 октября 1923 года.",0,0,0,0,0,1
"Флаг утверждён 2 октября 2000 года и внесён в Геральдический реестр города Москвы с присвоением регистрационного № ?.","Флаг утверждён 2 октября 2000 года и внесён в Геральдический реестр города Москвы с присвоением регистрационного номера ?.",0,0,0,0,1,0
"Дороми (волоф dërëm; бамана, дьюла, манинка dɔrɔmɛ, drɔme) — обиходное название монеты достоинством пять франков и эквивалентная им неофициальная счётная ¤.","Дороми (волоф dërëm; бамана, дьюла, манинка dɔrɔmɛ, drɔme) — обиходное название монеты достоинством пять франков и эквивалентная им неофициальная счётная денежная единица.",0,0,0,0,0,1
"170-й меридиан западной долготы — линия долготы, отстоящая от Гринвичского меридиана на 170 ° к западу, проходящая от Северного полюса через Северный Ледовитый океан, Россию, Тихий океан, Океанию, Южный океан к Южному полюсу и образующая ортодромию с 10-м меридианом восточной долготы.","170-й меридиан западной долготы — линия долготы, отстоящая от Гринвичского меридиана на 170 градусов к западу, проходящая от Северного полюса через Северный Ледовитый океан, Россию, Тихий океан, Океанию, Южный океан к Южному полюсу и образующая ортодромию с 10-м меридианом восточной долготы.",0,0,0,0,1,0
"Характеристикой дилатансии является ∠ дилатансии, который варьируется от 0 до 6-8 ° для различных грунтов.","Характеристикой дилатансии является угол дилатансии, который варьируется от 0 до 6-8 градусов для различных грунтов.",0,1,0,0,1,0
"Флаг утверждён 28 июня 2006 года и внесён в Государственный геральдический регистр Российской Федерации с присвоением регистрационного № 2555.","Флаг утверждён 28 июня 2006 года и внесён в Государственный геральдический регистр Российской Федерации с присвоением регистрационного номера 2555.",0,0,0,0,1,0
"Забеги прошли в тёплую и солнечную погоду, температура воздуха достигала +28 °.","Забеги прошли в тёплую и солнечную погоду, температура воздуха достигала +28 градусов.",0,0,0,0,1,0
"Серебро́ (химический символ — Ag, от лат. Argentum) — химический элемент 11 группы (по устаревшей классификации — побочной подгруппы первой группы, IB), пятого периода периодической системы химических элементов Д. И. Менделеева, с атомным № 47.","Серебро́ (химический символ — Ag, от лат. Argentum) — химический элемент 11 группы (по устаревшей классификации — побочной подгруппы первой группы, IB), пятого периода периодической системы химических элементов Д. И. Менделеева, с атомным номером 47.",0,0,0,0,1,0
"Чемпионом лиги и обладателем 15 тыс. $ США из призового фонда стал коллектив «RoX.KIS».","Чемпионом лиги и обладателем 15 тыс. долларов США из призового фонда стал коллектив «RoX.KIS».",0,0,0,0,1,0
