question,answer,count_simple,count_simple_translated,count_simple_long,count_simple_long_translated,count_cases_translated,count_cases_long
"«Форд Филд» был открыт в апреле 2002 года, а цена строительства составила 430 млн $ США и финансировался в основном из общественных денег и денег, полученных от продажи прав на название.","«Форд Филд» был открыт в апреле 2002 года, а цена строительства составила 430 млн долларов США и финансировался в основном из общественных денег и денег, полученных от продажи прав на название.",0,0,0,0,1,0
"Флаг утверждён 27 мая 2011 года и внесён в Государственный геральдический регистр Российской Федерации с присвоением регистрационного № 6905.","Флаг утверждён 27 мая 2011 года и внесён в Государственный геральдический регистр Российской Федерации с присвоением регистрационного номера 6905.",0,0,0,0,1,0
"В 2018 году бренд Mercedes-Benz оценивался в 48,601 млрд $, удерживая второе место (после Toyota) среди компаний-производителей автомобилей и восьмое место среди всех брендов мира.","В 2018 году бренд Mercedes-Benz оценивался в 48,601 млрд долларов, удерживая второе место (после Toyota) среди компаний-производителей автомобилей и восьмое место среди всех брендов мира.",0,0,0,0,1,0
"В январе 2023 года бренд Mercedes-Benz по оценке Brand Finance среди автобрендов занял второе место, оцениваясь в 58,8 млрд $, уступив первое место бренду Tesla.","В январе 2023 года бренд Mercedes-Benz по оценке Brand Finance среди автобрендов занял второе место, оцениваясь в 58,8 млрд долларов, уступив первое место бренду Tesla.",0,0,0,0,1,0
"Флаг утверждён 19 февраля 2009 года и внесён в Государственный геральдический регистр Российской Федерации с присвоением регистрационного № 4766.","Флаг утверждён 19 февраля 2009 года и внесён в Государственный геральдический регистр Российской Федерации с присвоением регистрационного номера 4766.",0,0,0,0,1,0
"Обозначения Флемстида подобны обозначениям Байера, однако вместо греческих букв используются №.","Обозначения Флемстида подобны обозначениям Байера, однако вместо греческих букв используются номера.",0,0,0,0,1,0
"поддиапазонах «Б» и «В» – только на ФЧ, имеющих нечётные №.","поддиапазонах «Б» и «В» – только на ФЧ, имеющих нечётные номера.",0,0,0,0,1,0
"Флаг утверждён 14 ноября 2008 года и внесён в Государственный геральдический регистр Российской Федерации с присвоением регистрационного № 4513.","Флаг утверждён 14 ноября 2008 года и внесён в Государственный геральдический регистр Российской Федерации с присвоением регистрационного номера 4513.",0,0,0,0,1,0
"Учреждена в 1959 году в размере 15 000 ₽ (после денежной реформы 1961 года — 1500 ₽).","Учреждена в 1959 году в размере 15 000 рублей (после денежной реформы 1961 года — 1500 рублей).",0,0,0,0,2,0
"Ганский фунт (англ. Ghanaian pound) — ¤ Ганы в 1958—1965 годах.","Ганский фунт (англ. Ghanaian pound) — денежная единица Ганы в 1958—1965 годах.",0,0,0,0,0,1
"Ожидалось, что организация и проведение Олимпиады обойдётся Франции в 8,3 миллиарда €.","Ожидалось, что организация и проведение Олимпиады обойдётся Франции в 8,3 миллиарда евро.",0,0,0,0,1,0
"Состоялась публикация первой и второй части романа «Белая гвардия» — в двух № ежемесячного общественно-литературного журнала «Россия» за 1925 год, третья часть тогда так и не вышла по причине закрытия журнала.","Состоялась публикация первой и второй части романа «Белая гвардия» — в двух номерах ежемесячного общественно-литературного журнала «Россия» за 1925 год, третья часть тогда так и не вышла по причине закрытия журнала.",0,0,0,0,1,0
"В FEMA насчитывается около 22,991 работников (сентябрь 2023), бюджет подразделения 29,5 млрд $ США (2023).","В FEMA насчитывается около 22,991 работников (сентябрь 2023), бюджет подразделения 29,5 млрд долларов США (2023).",0,0,0,0,1,0
"Гостиница основана в 1890 году под названием «Столичные №».","Гостиница основана в 1890 году под названием «Столичные номера».",0,0,0,0,1,0
"Общая стоимость судна предполагалась в 700 миллионов канадских $.","Общая стоимость судна предполагалась в 700 миллионов канадских долларов.",0,0,0,0,1,0
"Первый № газеты вышел 15 марта 1864 года.","Первый номер газеты вышел 15 марта 1864 года.",0,0,0,0,1,0
"83-й меридиан восточной долготы — линия долготы, отстоящая от Гринвичского меридиана на 83 ° к востоку, проходящая от Северного полюса через Северный Ледовитый океан, Россию, Казахстан, Китай, Индию, Индийский океан, Южный океан к Южному полюсу и образующая ортодромию с 97-м меридианом западной долготы.","83-й меридиан восточной долготы — линия долготы, отстоящая от Гринвичского меридиана на 83 градуса к востоку, проходящая от Северного полюса через Северный Ледовитый океан, Россию, Казахстан, Китай, Индию, Индийский океан, Южный океан к Южному полюсу и образующая ортодромию с 97-м меридианом западной долготы.",0,0,0,0,1,0
"Ожидалось, что организация и проведение Олимпиады обойдётся Франции в 8,3 миллиарда €.","Ожидалось, что организация и проведение Олимпиады обойдётся Франции в 8,3 миллиарда евро.",0,0,0,0,1,0
"Флаг утверждён 18 декабря 2006 года и внесён в Государственный геральдический регистр Российской Федерации с присвоением регистрационного № 3390.","Флаг утверждён 18 декабря 2006 года и внесён в Государственный геральдический регистр Российской Федерации с присвоением регистрационного номера 3390.",0,0,0,0,1,0
"30-й меридиан восточной долготы — линия долготы, отстоящая от Гринвичского меридиана на 30 ° к востоку, проходящая от Северного полюса через Северный Ледовитый океан, Восточную Европу, Турцию, Африку, юго-западную часть Индийского океана, Антарктический океан к Южному полюсу и образующая ортодромию со 150-м меридианом западной долготы.","30-й меридиан восточной долготы — линия долготы, отстоящая от Гринвичского меридиана на 30 градусов к востоку, проходящая от Северного полюса через Северный Ледовитый океан, Восточную Европу, Турцию, Африку, юго-западную часть Индийского океана, Антарктический океан к Южному полюсу и образующая ортодромию со 150-м меридианом западной долготы.",0,0,0,0,1,0
"В последние годы существования империи Хань город стал оплотом ¥ Шао.","В последние годы существования империи Хань город стал оплотом Юань Шао.",0,0,0,0,1,0
"На круговом турнире в Портороже в 2001 году был посеян под 3-м №, но набрал пол-очка из 9 партий.","На круговом турнире в Портороже в 2001 году был посеян под 3-м номером, но набрал пол-очка из 9 партий.",0,0,0,0,1,0
"Согласно распоряжению Правительства Российской Федерации вознаграждение за каждую золотую медаль для российских спортсменов составит 4 миллиона ₽, за серебряную — 2,5 млн, за бронзовую — 1,7 млн.","Согласно распоряжению Правительства Российской Федерации вознаграждение за каждую золотую медаль для российских спортсменов составит 4 миллиона рублей, за серебряную — 2,5 млн, за бронзовую — 1,7 млн.",0,0,0,0,1,0
"Фильм также стал кассовым провалом, заработав 164 миллиона $ по всему миру при производственном бюджете в 160 миллионов $.","Фильм также стал кассовым провалом, заработав 164 миллиона долларов по всему миру при производственном бюджете в 160 миллионов долларов.",0,0,0,0,2,0
"Berkshire не раскрывает численность продаж Kirby, но Gene Windfeldt, руководитель компании в период с 1988 по 1997 гг., оценивал в 1999 году объём продаж вакуумных пылесосов примерно в 1,1 млрд. $ в год.","Berkshire не раскрывает численность продаж Kirby, но Gene Windfeldt, руководитель компании в период с 1988 по 1997 гг., оценивал в 1999 году объём продаж вакуумных пылесосов примерно в 1,1 млрд. долларов в год.",0,0,0,0,1,0
"Флаг утверждён 13 октября 2006 года и внесён в Государственный геральдический регистр Российской Федерации с присвоением регистрационного № 2633, а также в Государственный геральдический реестр Республики Татарстан с присвоением регистрационного № 75.","Флаг утверждён 13 октября 2006 года и внесён в Государственный геральдический регистр Российской Федерации с присвоением регистрационного номера 2633, а также в Государственный геральдический реестр Республики Татарстан с присвоением регистрационного номера 75.",0,0,0,0,2,0
"Сто % пожертвований используются, чтобы помочь нуждающимся; накладные расходы на администрирование оплачиваются из общих фондов церкви Святых последних дней.","Сто процентов пожертвований используются, чтобы помочь нуждающимся; накладные расходы на администрирование оплачиваются из общих фондов церкви Святых последних дней.",0,0,0,0,1,0
"По состоянию на февраль 2015 года около 54 миллионов пользователей (46,4 % из тех, у кого есть телевидение) получали Ovation.","По состоянию на февраль 2015 года около 54 миллионов пользователей (46,4 процента из тех, у кого есть телевидение) получали Ovation.",0,0,0,0,1,0
"На драфте НХЛ 2002 года был выбран в 3 раунде под общим 67 № командой «Флорида Пантерз».","На драфте НХЛ 2002 года был выбран в 3 раунде под общим 67 номером командой «Флорида Пантерз».",0,0,0,0,1,0
"Open GDF Suez Cagnes-sur-Mer Alpes Maritimes 2009 — 12-й розыгрыш ежегодного профессионального теннисного турнира среди женщин, проводящегося во французском городе Кань-сюр-Мер и являющегося частью тура ITF в рамках серии турниров с призовым фондом в 100 тысяч $ и оплатой проживания.","Open GDF Suez Cagnes-sur-Mer Alpes Maritimes 2009 — 12-й розыгрыш ежегодного профессионального теннисного турнира среди женщин, проводящегося во французском городе Кань-сюр-Мер и являющегося частью тура ITF в рамках серии турниров с призовым фондом в 100 тысяч долларов и оплатой проживания.",0,0,0,0,1,0
"Флаг утверждён 26 июня 2008 года и внесён в Государственный геральдический регистр Российской Федерации с присвоением регистрационного № 4417.","Флаг утверждён 26 июня 2008 года и внесён в Государственный геральдический регистр Российской Федерации с присвоением регистрационного номера 4417.",0,0,0,0,1,0
"В 2018 году бренд Mercedes-Benz оценивался в 48,601 млрд $, удерживая второе место (после Toyota) среди компаний-производителей автомобилей и восьмое место среди всех брендов мира.","В 2018 году бренд Mercedes-Benz оценивался в 48,601 млрд долларов, удерживая второе место (после Toyota) среди компаний-производителей автомобилей и восьмое место среди всех брендов мира.",0,0,0,0,1,0
"В январе 2023 года бренд Mercedes-Benz по оценке Brand Finance среди автобрендов занял второе место, оцениваясь в 58,8 млрд $, уступив первое место бренду Tesla.","В январе 2023 года бренд Mercedes-Benz по оценке Brand Finance среди автобрендов занял второе место, оцениваясь в 58,8 млрд долларов, уступив первое место бренду Tesla.",0,0,0,0,1,0
"Юй Гохуа́ (кит. трад. 俞國華, упр. 俞国华, пиньинь Yú Guóhuá; 10 января 1914 — 4 октября 2000) — тайваньский политический деятель, Председатель Исполнительного ¥ (1984—1989).","Юй Гохуа́ (кит. трад. 俞國華, упр. 俞国华, пиньинь Yú Guóhuá; 10 января 1914 — 4 октября 2000) — тайваньский политический деятель, Председатель Исполнительного юаня (1984—1989).",0,0,0,0,1,0
"Дирха́м ОАЭ — ¤ Объединённых Арабских Эмиратов.","Дирха́м ОАЭ — денежная единица Объединённых Арабских Эмиратов.",0,0,0,0,0,1
"В 1941 году в начальный период Великой Отечественной войны была уничтожена под Могилёвом и Смоленском и переформирована заново с тем же № и с сохранением всех наград и почётных наименований.","В 1941 году в начальный период Великой Отечественной войны была уничтожена под Могилёвом и Смоленском и переформирована заново с тем же номером и с сохранением всех наград и почётных наименований.",0,0,0,0,1,0
"Пять ₽ Николая I — золотая монета Российской империи регулярного чекана номиналом в пять ₽.","Пять рублей Николая I — золотая монета Российской империи регулярного чекана номиналом в пять рублей.",0,0,0,0,2,0
"Hello, Dolly! (с англ. — «Привет, Долли!») — тридцать первый студийный альбом американской джазовой певицы Эллы Фицджеральд, выпущенный на лейбле Verve Records в 1964 году под студийным № Verve V6-4064.","Hello, Dolly! (с англ. — «Привет, Долли!») — тридцать первый студийный альбом американской джазовой певицы Эллы Фицджеральд, выпущенный на лейбле Verve Records в 1964 году под студийным номером Verve V6-4064.",0,0,0,0,1,0
"В 1990 году Verve перевыпустили запись в формате CD под студийным № Verve B0004675-02.","В 1990 году Verve перевыпустили запись в формате CD под студийным номером Verve B0004675-02.",0,0,0,0,1,0
"На драфте НХЛ 2005 года был выбран в третьем раунде под общим 62-м № командой «Питтсбург Пингвинз».","На драфте НХЛ 2005 года был выбран в третьем раунде под общим 62-м номером командой «Питтсбург Пингвинз».",0,0,0,0,1,0
"Флаг утверждён 24 февраля 2005 года и внесён в Государственный геральдический регистр Российской Федерации с присвоением регистрационного № 1858.","Флаг утверждён 24 февраля 2005 года и внесён в Государственный геральдический регистр Российской Федерации с присвоением регистрационного номера 1858.",0,0,0,0,1,0
"Причиной заболевания и смерти Смайли стало переохлаждение: в городе проводилась кампания по снижению затрат, и в целях экономии энергии температура в аквариуме морского музея была понижена с 27 °C до 22.","Причиной заболевания и смерти Смайли стало переохлаждение: в городе проводилась кампания по снижению затрат, и в целях экономии энергии температура в аквариуме морского музея была понижена с 27 градусов цельсия до 22.",0,0,0,0,0,1
"В общей сложности было показано 65 серий, пять из которых представляют собой разделённый на несколько частей полнометражный мультфильм «Rescue Rangers: To the Rescue», которые выходили с порядковым № серий с 14 по 18 в США.","В общей сложности было показано 65 серий, пять из которых представляют собой разделённый на несколько частей полнометражный мультфильм «Rescue Rangers: To the Rescue», которые выходили с порядковым номером серий с 14 по 18 в США.",0,0,0,0,1,0
"Нумерация по чётной стороне улицы Ломоносова начинается с № 10, расположенного почти на углу с Кедринской улицей.","Нумерация по чётной стороне улицы Ломоносова начинается с номера 10, расположенного почти на углу с Кедринской улицей.",0,0,0,0,1,0
"В «Филадельфии», а после и в «Торонто» Ван Римсдайк выступал под № 21, который он выбрал в честь Петера Форсберга","В «Филадельфии», а после и в «Торонто» Ван Римсдайк выступал под номером 21, который он выбрал в честь Петера Форсберга",0,0,0,0,1,0
"Действующий герб области утверждён Законом «О гербе Новосибирской области», принятом Новосибирским областным Советом депутатов 29 мая 2003 года, подписанном главой администрации области 5 июня 2003 года, и внесён в Государственный геральдический регистр Российской Федерации с присвоением регистрационного № 1214.","Действующий герб области утверждён Законом «О гербе Новосибирской области», принятом Новосибирским областным Советом депутатов 29 мая 2003 года, подписанном главой администрации области 5 июня 2003 года, и внесён в Государственный геральдический регистр Российской Федерации с присвоением регистрационного номера 1214.",0,0,0,0,1,0
