question,answer,count_simple,count_simple_translated,count_simple_long,count_simple_long_translated,count_cases_translated,count_cases_long
"Ожидалось, что организация и проведение Олимпиады обойдётся Франции в 8,3 миллиарда €.","Ожидалось, что организация и проведение Олимпиады обойдётся Франции в 8,3 миллиарда евро.",0,0,0,0,1,0
"Суммарный ущерб от действий грабителей составил более 80 миллионов франков , или в современных ценах более 6,5 миллионов €.","Суммарный ущерб от действий грабителей составил более 80 миллионов франков , или в современных ценах более 6,5 миллионов евро.",0,0,0,0,1,0
"Ахма́товская пре́мия Акаде́мии нау́к — российская академическая премия в размере 1000 ₽.","Ахма́товская пре́мия Акаде́мии нау́к — российская академическая премия в размере 1000 рублей.",0,0,0,0,1,0
"Франк Люцерна — ¤ швейцарского кантона Люцерн в 1803—1850 годах.","Франк Люцерна — денежная единица швейцарского кантона Люцерн в 1803—1850 годах.",0,0,0,0,0,1
"Ожидалось, что организация и проведение Олимпиады обойдётся Франции в 8,3 миллиарда €.","Ожидалось, что организация и проведение Олимпиады обойдётся Франции в 8,3 миллиарда евро.",0,0,0,0,1,0
"Фильм стал третьим самым просматриваемым фильмом 2021 года и собрал более 130 миллионов $ по всему миру.","Фильм стал третьим самым просматриваемым фильмом 2021 года и собрал более 130 миллионов долларов по всему миру.",0,0,0,0,1,0
"Человек-машина (англ. Machine Man; серийный № — Z2P45-9-X-51 (чаще называется сокращённо — X-51, или Икс-51), так же известен под именем Аарон Стак, англ. Aaron Stack) — робот-андроид из комиксов, издаваемых Marvel Comics, член Мстителей.","Человек-машина (англ. Machine Man; серийный номер — Z2P45-9-X-51 (чаще называется сокращённо — X-51, или Икс-51), так же известен под именем Аарон Стак, англ. Aaron Stack) — робот-андроид из комиксов, издаваемых Marvel Comics, член Мстителей.",0,0,0,0,1,0
"Четырёхкратный обладатель приза «Золотой ледоруб Азии» (Piolet D’Or Asia): в 2006 году — за первопроход на Манаслу, в 2009 году — за новый маршрут на Чо-Ойю, в 2011 году — за новый маршрут на пик Победы («Палка к $»).","Четырёхкратный обладатель приза «Золотой ледоруб Азии» (Piolet D’Or Asia): в 2006 году — за первопроход на Манаслу, в 2009 году — за новый маршрут на Чо-Ойю, в 2011 году — за новый маршрут на пик Победы («Палка к доллару»).",0,0,0,0,1,0
"Третий студийный альбом Are You Gonna Go My Way (1993) превзошёл успех предшественника, возглавив чарты в Великобритании (где он до сих пор является единственным альбомом № один Кравица), а также в Канаде, Австралии и Швейцарии.","Третий студийный альбом Are You Gonna Go My Way (1993) превзошёл успех предшественника, возглавив чарты в Великобритании (где он до сих пор является единственным альбомом номер один Кравица), а также в Канаде, Австралии и Швейцарии.",0,0,0,0,1,0
"«Сердца и $» — советский немой сатирический фильм 1924 года режиссёра Николая Петрова, его дебютная работа в области кино.","«Сердца и доллары» — советский немой сатирический фильм 1924 года режиссёра Николая Петрова, его дебютная работа в области кино.",0,0,0,0,1,0
"Фотоаппарат представлен 21 марта и появился в продаже в середине апреля 2013 года; стоимость в США — 750 $ за вариант без объектива в комплекте, 900 $ — за комплект с объективом EF-S 18-55mm f/3.5-5.6 IS STM, и 1099 $ — за комплект с объективом EF-S 18-135mm f/3.5-5.6 IS STM.","Фотоаппарат представлен 21 марта и появился в продаже в середине апреля 2013 года; стоимость в США — 750 долларов за вариант без объектива в комплекте, 900 долларов — за комплект с объективом EF-S 18-55mm f/3.5-5.6 IS STM, и 1099 долларов — за комплект с объективом EF-S 18-135mm f/3.5-5.6 IS STM.",0,0,0,0,3,0
"Вершина горы конусообразная, склоны крутизной до 20-25 °, покрыты смешанным берёзово-еловым лесом.","Вершина горы конусообразная, склоны крутизной до 20-25 градусов, покрыты смешанным берёзово-еловым лесом.",0,0,0,0,1,0
"В 2018 году бренд Mercedes-Benz оценивался в 48,601 млрд $, удерживая второе место (после Toyota) среди компаний-производителей автомобилей и восьмое место среди всех брендов мира.","В 2018 году бренд Mercedes-Benz оценивался в 48,601 млрд долларов, удерживая второе место (после Toyota) среди компаний-производителей автомобилей и восьмое место среди всех брендов мира.",0,0,0,0,1,0
"В январе 2023 года бренд Mercedes-Benz по оценке Brand Finance среди автобрендов занял второе место, оцениваясь в 58,8 млрд $, уступив первое место бренду Tesla.","В январе 2023 года бренд Mercedes-Benz по оценке Brand Finance среди автобрендов занял второе место, оцениваясь в 58,8 млрд долларов, уступив первое место бренду Tesla.",0,0,0,0,1,0
"Ожидалось, что организация и проведение Олимпиады обойдётся Франции в 8,3 миллиарда €.","Ожидалось, что организация и проведение Олимпиады обойдётся Франции в 8,3 миллиарда евро.",0,0,0,0,1,0
"Уте́н — счётная ¤ Древнего Египта периода Нового царства.","Уте́н — счётная денежная единица Древнего Египта периода Нового царства.",0,0,0,0,0,1
"Названа в честь Лилиан Шуман Голдман, пожертвовавшей в 1992 году более 20 млн $ на реконструкцию библиотеки школы права Йельского университета.","Названа в честь Лилиан Шуман Голдман, пожертвовавшей в 1992 году более 20 млн долларов на реконструкцию библиотеки школы права Йельского университета.",0,0,0,0,1,0
"Первый № газеты вышел 28 июля 1879.","Первый номер газеты вышел 28 июля 1879.",0,0,0,0,1,0
"На реке Излучная планируются работы по расчистке русла реки на участке от улицы Шевченко до улицы Парковой, с бюджетом 18 009 070 ₽.","На реке Излучная планируются работы по расчистке русла реки на участке от улицы Шевченко до улицы Парковой, с бюджетом 18 009 070 рублей.",0,0,0,0,1,0
"24 сентября 2019 года под своды домашней арены «Спартака» в Парке Легенд был поднят его именной свитер с № 2.","24 сентября 2019 года под своды домашней арены «Спартака» в Парке Легенд был поднят его именной свитер с номером 2.",0,0,0,0,1,0
"Для перезарядки пистолета ударник оттягивался назад и поворачивался на 90 °.","Для перезарядки пистолета ударник оттягивался назад и поворачивался на 90 градусов.",0,0,0,0,1,0
"Флаг утверждён 28 декабря 2006 года и внесён в Государственный геральдический регистр Российской Федерации с присвоением регистрационного № 2861.","Флаг утверждён 28 декабря 2006 года и внесён в Государственный геральдический регистр Российской Федерации с присвоением регистрационного номера 2861.",0,0,0,0,1,0
"Капитализация рынка акций на VSE составляет 6,6 млрд € и 1 млрд € составляют выпуски облигаций (по состоянию на 9 ноября 2006 года).","Капитализация рынка акций на VSE составляет 6,6 млрд евро и 1 млрд евро составляют выпуски облигаций (по состоянию на 9 ноября 2006 года).",0,0,0,0,2,0
"Тридцать % метеорита составляют богатые железом металлические фазы камасита и тэнита, а остальное в основном состоит из оливина.","Тридцать процентов метеорита составляют богатые железом металлические фазы камасита и тэнита, а остальное в основном состоит из оливина.",0,0,0,0,1,0
"Институт мировой истории Общества Макса Планка (англ. Max Planck Institute for the Science of Human History) — это научно-исследовательское учреждение, базирующееся в городе ¥, Германия, с 2022 года носящее название «Институт геоантропологии Общества Макса Планка» (нем. Das Max-Planck-Institut für Geoanthropologie, MPI-SHH).","Институт мировой истории Общества Макса Планка (англ. Max Planck Institute for the Science of Human History) — это научно-исследовательское учреждение, базирующееся в городе Йена, Германия, с 2022 года носящее название «Институт геоантропологии Общества Макса Планка» (нем. Das Max-Planck-Institut für Geoanthropologie, MPI-SHH).",0,0,0,0,1,0
"«О важности сохранения исторической памяти для будущего Европы» (англ. European Parliament resolution of 19 September 2019 on the importance of European remembrance for the future of Europe, за № — 2019/2819RSP) — резолюция Европейского парламента от 19 сентября 2019 года, в которой высказано осуждение Договора о ненападении между Германией и Советским Союзом и Договора о дружбе и границе между СССР и Германией, которые, согласно резолюции, «поделили Европу и территории независимых государств между двумя тоталитарными режимами, что проложило дорогу к началу Второй мировой войны».","«О важности сохранения исторической памяти для будущего Европы» (англ. European Parliament resolution of 19 September 2019 on the importance of European remembrance for the future of Europe, за номером — 2019/2819RSP) — резолюция Европейского парламента от 19 сентября 2019 года, в которой высказано осуждение Договора о ненападении между Германией и Советским Союзом и Договора о дружбе и границе между СССР и Германией, которые, согласно резолюции, «поделили Европу и территории независимых государств между двумя тоталитарными режимами, что проложило дорогу к началу Второй мировой войны».",0,0,0,0,1,0
"Фильм собрал 2 052 008 $ в американском прокате.","Фильм собрал 2 052 008 долларов в американском прокате.",0,0,0,0,1,0
"Начало продаж фотоаппарата было намечено на март 2012 года, предварительно объявленная стоимость — 6800 $ США.","Начало продаж фотоаппарата было намечено на март 2012 года, предварительно объявленная стоимость — 6800 долларов США.",0,0,0,0,1,0
"Благодаря доступности и невысокой цене как самих контроллеров семейства RTL8139, так и карт на его основе (6-13 $ на 2002 год), а также простого программно-аппаратного интерфейса карты на базе RTL8139 были широко распространены, и в множестве операционных систем была поддержана работа с этим контроллером.","Благодаря доступности и невысокой цене как самих контроллеров семейства RTL8139, так и карт на его основе (6-13 долларов на 2002 год), а также простого программно-аппаратного интерфейса карты на базе RTL8139 были широко распространены, и в множестве операционных систем была поддержана работа с этим контроллером.",0,0,0,0,1,0
"Жуа́нь Цзи, или ¥ Цзи (кит. трад. 阮籍, пиньинь Ruǎn Jí, 210—263) — китайский поэт и философ эпохи троецарствия.","Жуа́нь Цзи, или Юань Цзи (кит. трад. 阮籍, пиньинь Ruǎn Jí, 210—263) — китайский поэт и философ эпохи троецарствия.",0,0,0,0,1,0
"Это список стран Латинской Америки и Карибского бассейна по номинальному значению валового внутреннего продукта выраженного в $ США согласно оценкам Международного валютного фонда опубликованным в базе данных World Economic Outlook за апрель 2019 года.","Это список стран Латинской Америки и Карибского бассейна по номинальному значению валового внутреннего продукта выраженного в долларах США согласно оценкам Международного валютного фонда опубликованным в базе данных World Economic Outlook за апрель 2019 года.",0,0,0,0,1,0
"Цзы ¥-3 (кит. трад. 資源三號, упр. 资源三号, пиньинь Zī yuán sān háo, палл.","Цзы юань-3 (кит. трад. 資源三號, упр. 资源三号, пиньинь Zī yuán sān háo, палл.",0,0,0,0,1,0
"Первый полноразмерный экземпляр часов стоимостью 42 миллиона $ строится в Техасе на участке, принадлежащем Джеффу Безосу и финансируется компанией Bezos Expeditions.","Первый полноразмерный экземпляр часов стоимостью 42 миллиона долларов строится в Техасе на участке, принадлежащем Джеффу Безосу и финансируется компанией Bezos Expeditions.",0,0,0,0,1,0
"Сардинская лира — ¤ Сардинского королевства в 1816—1861 годах.","Сардинская лира — денежная единица Сардинского королевства в 1816—1861 годах.",0,0,0,0,0,1
"Ожидалось, что организация и проведение Олимпиады обойдётся Франции в 8,3 миллиарда €.","Ожидалось, что организация и проведение Олимпиады обойдётся Франции в 8,3 миллиарда евро.",0,0,0,0,1,0
"Общий призовой фонд соревнований составил 26 миллионов ₽.","Общий призовой фонд соревнований составил 26 миллионов рублей.",0,0,0,0,1,0
"Анато́лий Андре́евич Бездво́рный (30 марта 1922, Соледар — 31 октября 1952, Яма, Сталинская область) — участник Великой Отечественной войны, орудийный № батареи 1972-го истребительно-противотанкового артиллерийского полка 45-й истребительно-противотанковой артиллерийской бригады 51-й армии 1-го Прибалтийского фронта, Герой Советского Союза (24.03.1945, в Указе посмертно), красноармеец.","Анато́лий Андре́евич Бездво́рный (30 марта 1922, Соледар — 31 октября 1952, Яма, Сталинская область) — участник Великой Отечественной войны, орудийный номер батареи 1972-го истребительно-противотанкового артиллерийского полка 45-й истребительно-противотанковой артиллерийской бригады 51-й армии 1-го Прибалтийского фронта, Герой Советского Союза (24.03.1945, в Указе посмертно), красноармеец.",0,0,0,0,1,0
"Гурд (гаит. креол. Gourde, фр. Gourde, код ISO 4217 — HTG) — ¤ Гаити.","Гурд (гаит. креол. Gourde, фр. Gourde, код ISO 4217 — HTG) — денежная единица Гаити.",0,0,0,0,0,1
"Авиакатастрофа Boeing 737 в Эфиопии — катастрофа самолёта Boeing 737-200 авиакомпании «Ethiopian Airlines», бортовой № ET-AJA, выполнявшего рейс из Бахр-Дара в Асмэру в четверг, 15 сентября 1988 года.","Авиакатастрофа Boeing 737 в Эфиопии — катастрофа самолёта Boeing 737-200 авиакомпании «Ethiopian Airlines», бортовой номер ET-AJA, выполнявшего рейс из Бахр-Дара в Асмэру в четверг, 15 сентября 1988 года.",0,0,0,0,1,0
"Ранее на месте озера находилось безымянное болото, но в 1922 году оно было выкуплено Миннеаполисской парковой службой за 550 тысяч $.","Ранее на месте озера находилось безымянное болото, но в 1922 году оно было выкуплено Миннеаполисской парковой службой за 550 тысяч долларов.",0,0,0,0,1,0
"Согласно распоряжению Правительства Российской Федерации вознаграждение за каждую золотую медаль для российских спортсменов составит 4 миллиона ₽, за серебряную — 2,5 млн, за бронзовую — 1,7 млн.","Согласно распоряжению Правительства Российской Федерации вознаграждение за каждую золотую медаль для российских спортсменов составит 4 миллиона рублей, за серебряную — 2,5 млн, за бронзовую — 1,7 млн.",0,0,0,0,1,0
"Дира́м — разменная ¤, равная 1/100 таджикского сомони.","Дира́м — разменная денежной единицы, равная 1/100 таджикского сомони.",0,0,0,0,0,2
"Флаг утверждён 12 августа 2003 года как флаг муниципального образования «Охинский район» (после муниципальной реформы — муниципальное образование городской округ «Охинский») и внесён в Государственный геральдический регистр Российской Федерации с присвоением регистрационного № 1282.","Флаг утверждён 12 августа 2003 года как флаг муниципального образования «Охинский район» (после муниципальной реформы — муниципальное образование городской округ «Охинский») и внесён в Государственный геральдический регистр Российской Федерации с присвоением регистрационного номера 1282.",0,0,0,0,1,0
"Третий студийный альбом Are You Gonna Go My Way (1993) превзошёл успех предшественника, возглавив чарты в Великобритании (где он до сих пор является единственным альбомом № один Кравица), а также в Канаде, Австралии и Швейцарии.","Третий студийный альбом Are You Gonna Go My Way (1993) превзошёл успех предшественника, возглавив чарты в Великобритании (где он до сих пор является единственным альбомом номер один Кравица), а также в Канаде, Австралии и Швейцарии.",0,0,0,0,1,0
"Десять лет спустя французы, возглавляемые Эме Жаке, начали с бронзовых медалей €-96, затем победили в финале домашнего чемпионата мира 1998 года.","Десять лет спустя французы, возглавляемые Эме Жаке, начали с бронзовых медалей Евро-96, затем победили в финале домашнего чемпионата мира 1998 года.",0,0,0,0,1,0
