question,answer,count_simple,count_simple_translated,count_simple_long,count_simple_long_translated,count_cases_translated,count_cases_long
"Ильи́нская церковь — историческое здание XVIII века в деревне Белавичи Ивацевичского района, памятник архитектуры (№ 112Г000293).","Ильи́нская церковь — историческое здание XVIII века в деревне Белавичи Ивацевичского района, памятник архитектуры (номер 112Г000293).",0,0,0,0,1,0
"Общий годовой доход университета составляет около 802 млн £, причём около 283 млн только от грантов на научные исследования.","Общий годовой доход университета составляет около 802 млн фунтов стерлингов, причём около 283 млн только от грантов на научные исследования.",0,0,0,0,0,1
"В феврале 2012 Rambus купила (поглотила) компанию производителя ReRAM под названием Unity Semiconductor за 35 миллионов $[значимость факта?].","В феврале 2012 Rambus купила (поглотила) компанию производителя ReRAM под названием Unity Semiconductor за 35 миллионов долларов[значимость факта?].",0,0,0,0,1,0
"Под 39 № вошёл в 50-ку из лучших игроков «Металлурга» (Запорожье) по версии портала football.ua.","Под 39 номером вошёл в 50-ку из лучших игроков «Металлурга» (Запорожье) по версии портала football.ua.",0,0,0,0,1,0
"После приводнения ракета «планирует» под водой по спирали с углом −17 ° до глубины 150 метров, осуществляя поиск цели в пассивном режиме.","После приводнения ракета «планирует» под водой по спирали с углом −17 градусов до глубины 150 метров, осуществляя поиск цели в пассивном режиме.",0,0,0,0,1,0
"Ожидалось, что организация и проведение Олимпиады обойдётся Франции в 8,3 миллиарда €.","Ожидалось, что организация и проведение Олимпиады обойдётся Франции в 8,3 миллиарда евро.",0,0,0,0,1,0
"Формально в Канаде не существовало такой ¤, как су (что позволяло изготовителям токенов избежать обвинений в фальшивомонетничестве или посягательстве на привилегии Королевского монетного двора); фактически «су» приравнивался к половине пенни (условной разменной единицы канадского фунта) и имел примерно тот же размер и массу, что и более поздние «токены местного жителя» номиналом в полпенни.","Формально в Канаде не существовало такой денежной единицы, как су (что позволяло изготовителям токенов избежать обвинений в фальшивомонетничестве или посягательстве на привилегии Королевского монетного двора); фактически «су» приравнивался к половине пенни (условной разменной единицы канадского фунта) и имел примерно тот же размер и массу, что и более поздние «токены местного жителя» номиналом в полпенни.",0,0,0,0,0,1
"«Billboard Top 40 Money Makers» в Музыкальном отчёте за 2009 год написал, что Пинк стала 6-й в рейтинге самых оплачиваемых артистов в 2009 году, с доходом за год только в музыкальной сфере в 36 млн $.","«Billboard Top 40 Money Makers» в Музыкальном отчёте за 2009 год написал, что Пинк стала 6-й в рейтинге самых оплачиваемых артистов в 2009 году, с доходом за год только в музыкальной сфере в 36 млн долларов.",0,0,0,0,1,0
"Флаг утверждён 21 октября 2002 года как флаг «муниципального образования Верхотурский уезд и города Верхотурье» (после муниципальной реформы — «Городской округ Верхотурский») и внесён в Государственный геральдический регистр Российской Федерации с присвоением регистрационного № 1101.","Флаг утверждён 21 октября 2002 года как флаг «муниципального образования Верхотурский уезд и города Верхотурье» (после муниципальной реформы — «Городской округ Верхотурский») и внесён в Государственный геральдический регистр Российской Федерации с присвоением регистрационного номера 1101.",0,0,0,0,1,0
"25 марта 2020 года Сенат США принял CARES Act (англ. Coronavirus Aid, Relief, and Economic Security Act) о выделении 2 триллионов $ для стимулирования экономики в связи с пандемией коронавируса.","25 марта 2020 года Сенат США принял CARES Act (англ. Coronavirus Aid, Relief, and Economic Security Act) о выделении 2 триллионов долларов для стимулирования экономики в связи с пандемией коронавируса.",0,0,0,0,1,0
"«К Азинию Марруцину» (лат. Ad Asinium Marrucinum) — условное название стихотворения римского поэта Гая Валерия Катулла, включённого в состав посмертного сборника («Книги Катулла Веронского») под № 12.","«К Азинию Марруцину» (лат. Ad Asinium Marrucinum) — условное название стихотворения римского поэта Гая Валерия Катулла, включённого в состав посмертного сборника («Книги Катулла Веронского») под номером 12.",0,0,0,0,1,0
"Дуги можно измерять в угловых единицах (например, в ° или радианах) по величине центрального угла дуги, однако равные по центральным углам дуги разных окружностей не обязательно равны по длине — их длины прямо пропорциональны радиусу окружности, так что они равны только при равенстве радиусов.","Дуги можно измерять в угловых единицах (например, в градусах или радианах) по величине центрального угла дуги, однако равные по центральным углам дуги разных окружностей не обязательно равны по длине — их длины прямо пропорциональны радиусу окружности, так что они равны только при равенстве радиусов.",0,0,0,0,1,0
"После своего ухода из группы в 1970 году Росс начала успешную сольную музыкальную карьеру, выпустив свой одноименный дебютный сольный альбом и синглы «Ain’t No Mountain High Enough» — её первый сольный хит № один в США — и «Reach Out and Touch (Somebody’s Hand)».","После своего ухода из группы в 1970 году Росс начала успешную сольную музыкальную карьеру, выпустив свой одноименный дебютный сольный альбом и синглы «Ain’t No Mountain High Enough» — её первый сольный хит номер один в США — и «Reach Out and Touch (Somebody’s Hand)».",0,0,0,0,1,0
"Дэн Му (кит. трад. 鄧牧, упр. 邓牧, пиньинь Dèng Mù, 1247—1306) — китайский философ, независимый социальный мыслитель конца эпохи Сун и начала эпохи ¥.","Дэн Му (кит. трад. 鄧牧, упр. 邓牧, пиньинь Dèng Mù, 1247—1306) — китайский философ, независимый социальный мыслитель конца эпохи Сун и начала эпохи Юань.",0,0,0,0,1,0
"К-472 (заводской № - 338) — советский ракетный подводный крейсер стратегического назначения, корабль проекта 667Б «Мурена».","К-472 (заводской номер - 338) — советский ракетный подводный крейсер стратегического назначения, корабль проекта 667Б «Мурена».",0,0,0,0,1,0
"Флаг утверждён 25 марта 2011 года и 29 марта 2011 года внесён в Государственный геральдический регистр Российской Федерации с присвоением регистрационного № 6719.","Флаг утверждён 25 марта 2011 года и 29 марта 2011 года внесён в Государственный геральдический регистр Российской Федерации с присвоением регистрационного номера 6719.",0,0,0,0,1,0
"МК20-01 (мотовоз калужский, массой 20 т, № первый) — опытный мотовоз типа 0-2-0, построенный Калужским машиностроительным заводом в 1952 году.","МК20-01 (мотовоз калужский, массой 20 т, номер первый) — опытный мотовоз типа 0-2-0, построенный Калужским машиностроительным заводом в 1952 году.",0,0,0,0,1,0
"Ключевым правилами («запретами») для такафула является: гарар — неопределённость или спекуляция, майсир — игра, содержащая риск/пари, риба — ростовщичество (в исламе — это одалживание денег под % независимо от величины этого %).","Ключевым правилами («запретами») для такафула является: гарар — неопределённость или спекуляция, майсир — игра, содержащая риск/пари, риба — ростовщичество (в исламе — это одалживание денег под процент независимо от величины этого процента).",0,0,0,0,2,0
"«Будда Медицины Бхайшаджьягуру» (薬師佛) или «Рай Бхайшаджьягуру» — фреска, созданная около 1319 года во время правления династии ¥.","«Будда Медицины Бхайшаджьягуру» (薬師佛) или «Рай Бхайшаджьягуру» — фреска, созданная около 1319 года во время правления династии Юань.",0,0,0,0,1,0
"Телефонный план нумерации Хорватии — диапазоны телефонных №, выделяемых различным пользователям телефонной сети общего пользования в Хорватии, специальные № и другие особенности набора для совершения телефонных вызовов.","Телефонный план нумерации Хорватии — диапазоны телефонных номеров, выделяемых различным пользователям телефонной сети общего пользования в Хорватии, специальные номера и другие особенности набора для совершения телефонных вызовов.",0,0,0,0,2,0
"Международный телефонный № Хорватии состоит из кода страны 385 и 8 цифр национального №, в котором первые 2 цифры — это код региона, а следующие 6 цифр — № абонента.","Международный телефонный номер Хорватии состоит из кода страны 385 и 8 цифр национального номера, в котором первые 2 цифры — это код региона, а следующие 6 цифр — номер абонента.",0,0,0,0,3,0
"Министр иностранных дел Франции Жан-Ив Ле Дриан назвал данный пакт «ударом в спину», после того, как Австралия без предварительного уведомления аннулировала французско-австралийскую сделку на поставку атомных подводных лодок на сумму в 56 миллиардов € (90 миллиардов австралийских $) и сократила развитие стратегического партнёрства.","Министр иностранных дел Франции Жан-Ив Ле Дриан назвал данный пакт «ударом в спину», после того, как Австралия без предварительного уведомления аннулировала французско-австралийскую сделку на поставку атомных подводных лодок на сумму в 56 миллиардов евро (90 миллиардов австралийских долларов) и сократила развитие стратегического партнёрства.",0,0,0,0,2,0
"Основная секция Атики-Одос — автострада 6, кольцевая автодорога «Имитос» имеет № 62 и кольцевая автодорога «Эгалео» — № 65.","Основная секция Атики-Одос — автострада 6, кольцевая автодорога «Имитос» имеет номер 62 и кольцевая автодорога «Эгалео» — номер 65.",0,0,0,0,2,0
"Посвятив себя производству фильмов, основанных на персонажах Marvel Comics, студия была вовлечена в три серии фильмов о персонажах Marvel, собравшим более одного миллиарда $ кассовой прибыли в Северной Америке: «Люди Икс», «Человек-паук» и кинематографическая вселенная Marvel.","Посвятив себя производству фильмов, основанных на персонажах Marvel Comics, студия была вовлечена в три серии фильмов о персонажах Marvel, собравшим более одного миллиарда долларов кассовой прибыли в Северной Америке: «Люди Икс», «Человек-паук» и кинематографическая вселенная Marvel.",0,0,0,0,1,0
"Публичное акционерное общество «Укрсоцбанк» — один из крупнейших универсальных банков Украины, занимает 7 место по размеру активов (43,08 млрд ₴) на 1 октября 2015 года.","Публичное акционерное общество «Укрсоцбанк» — один из крупнейших универсальных банков Украины, занимает 7 место по размеру активов (43,08 млрд гривен) на 1 октября 2015 года.",0,0,0,0,1,0
"Телефонный план нумерации Северной Македонии — система, используемая для присваивания телефонных № в Северной Македонии.","Телефонный план нумерации Северной Македонии — система, используемая для присваивания телефонных номеров в Северной Македонии.",0,0,0,0,1,0
"Динар Сербской Краины (серб. Динар Републике Српске Краjине) — ¤ Республики Сербская Краина в 1992—1994 годах, обращавшаяся параллельно с югославским динаром.","Динар Сербской Краины (серб. Динар Републике Српске Краjине) — денежная единица Республики Сербская Краина в 1992—1994 годах, обращавшаяся параллельно с югославским динаром.",0,0,0,0,0,1
"Не́мцы Са́нкт-Петербу́рга или не́мцы Ленингра́да — часть населения города Санкт-Петербурга и его окраин, до Октябрьской революции составлявшая самый большой % жителей после русских, которые проживали или трудились в нём в течение достаточно длительного времени и оставили заметный след в городской истории.","Не́мцы Са́нкт-Петербу́рга или не́мцы Ленингра́да — часть населения города Санкт-Петербурга и его окраин, до Октябрьской революции составлявшая самый большой процент жителей после русских, которые проживали или трудились в нём в течение достаточно длительного времени и оставили заметный след в городской истории.",0,0,0,0,1,0
"К осмысленной жизни (англ. Toward a abbrful Life) — книга, написанная хасидским писателем Хабада Саймоном Якобсоном.","К осмысленной жизни (англ. Toward a meaningful Life) — книга, написанная хасидским писателем Хабада Саймоном Якобсоном.",0,0,0,0,0,1
"На драфте НБА 1972 года под первым № клубом «Портленд Трэйл Блэйзерс» был выбран центровой Ларю Мартин из университета Лойолы в Чикаго.","На драфте НБА 1972 года под первым номером клубом «Портленд Трэйл Блэйзерс» был выбран центровой Ларю Мартин из университета Лойолы в Чикаго.",0,0,0,0,1,0
"Памятные монеты в 2 € — специальные европейские монеты, отчеканенные и выпущенные государствами — членами еврозоны с 2004 года, как законное платёжное средство во всех государствах еврозоны.","Памятные монеты в 2 евро — специальные европейские монеты, отчеканенные и выпущенные государствами — членами еврозоны с 2004 года, как законное платёжное средство во всех государствах еврозоны.",0,0,0,0,1,0
"Экономический ущерб от наводнения составил около 400 миллионов франков золотом, что по нынешнему курсу составляет примерно 1,6 миллиарда €, кроме того, 50 миллионов франков золотом ушли в качестве помощи пострадавшим.","Экономический ущерб от наводнения составил около 400 миллионов франков золотом, что по нынешнему курсу составляет примерно 1,6 миллиарда евро, кроме того, 50 миллионов франков золотом ушли в качестве помощи пострадавшим.",0,0,0,0,1,0
"«Ливадия» — бывшая гостиница и историческое здание конца XIX века в Минске, памятник архитектуры (№ 711Е000001).","«Ливадия» — бывшая гостиница и историческое здание конца XIX века в Минске, памятник архитектуры (номер 711Е000001).",0,0,0,0,1,0
"В июле 2009 года, после очередного сезона в «Лионе», Бензема перешёл в мадридский «Реал» за сумму в размере 35 миллионов € (50 миллионов $).","В июле 2009 года, после очередного сезона в «Лионе», Бензема перешёл в мадридский «Реал» за сумму в размере 35 миллионов евро (50 миллионов долларов).",0,0,0,0,2,0
"Отель любви или рабу хотэру (яп. ラブホテル от англ. love hotel) — разновидность гостиниц, в которых арендуются № для секса.","Отель любви или рабу хотэру (яп. ラブホテル от англ. love hotel) — разновидность гостиниц, в которых арендуются номера для секса.",0,0,0,0,1,0
"Депозитный сертификат — ценная бумага, которая удостоверяет сумму внесённого в банк вклада юридического лица и права вкладчика (держателя сертификата) на получение по истечении установленного срока суммы депозита (вклада) и обусловленных в сертификате % в банке, выдавшем сертификат, или в любом филиале этого банка.","Депозитный сертификат — ценная бумага, которая удостоверяет сумму внесённого в банк вклада юридического лица и права вкладчика (держателя сертификата) на получение по истечении установленного срока суммы депозита (вклада) и обусловленных в сертификате процентов в банке, выдавшем сертификат, или в любом филиале этого банка.",0,0,0,0,1,0
"В 2000 году сериал попал под № 16 в список «100 величайших британских телевизионных программ», составленный Британским институтом кинематографии.","В 2000 году сериал попал под номером 16 в список «100 величайших британских телевизионных программ», составленный Британским институтом кинематографии.",0,0,0,0,1,0
