question,answer,count_simple,count_simple_translated,count_simple_long,count_simple_long_translated,count_cases_translated,count_cases_long
"Бери́ллий (химический символ — Be, от лат. Beryllium) — химический элемент 2-й группы (по устаревшей классификации — главной подгруппы второй группы, IIA) второго периода периодической системы химических элементов Д. И. Менделеева с атомным № 4.","Бери́ллий (химический символ — Be, от лат. Beryllium) — химический элемент 2-й группы (по устаревшей классификации — главной подгруппы второй группы, IIA) второго периода периодической системы химических элементов Д. И. Менделеева с атомным номером 4.",0,0,0,0,1,0
"Сан-Марино не входит ни в НАТО, ни в ЕС, но имеет открытые границы с последним, находится с ним в таможенном союзе и входит в Еврозону с правом эмиссии € и чеканки собственных вариантов монет.","Сан-Марино не входит ни в НАТО, ни в ЕС, но имеет открытые границы с последним, находится с ним в таможенном союзе и входит в Еврозону с правом эмиссии евро и чеканки собственных вариантов монет.",0,0,0,0,1,0
"На драфте БАА 1948 года под первым № клубом Провиденс Стимроллерс был выбран разыгрывающий защитник Энди Тонкович из университета Маршалла.","На драфте БАА 1948 года под первым номером клубом Провиденс Стимроллерс был выбран разыгрывающий защитник Энди Тонкович из университета Маршалла.",0,0,0,0,1,0
"Слэнт (косой) — тип маршрута принимающего (англ. Wide receiver) в Американском футболе, когда принимающий бежит вперёд под углом примерно в 45 ° в пространство между линейными команды защиты и лайнбекерами.","Слэнт (косой) — тип маршрута принимающего (англ. Wide receiver) в Американском футболе, когда принимающий бежит вперёд под углом примерно в 45 градусов в пространство между линейными команды защиты и лайнбекерами.",0,0,0,0,1,0
"№ печатной формы (англ. plate number), также листовой №, — №, напечатанный на поле марочного листа или рулона почтовых марок, который указывает на печатную форму, использованную для печати этих почтовых марок.","Номер печатной формы (англ. plate number), также листовой номер, — номер, напечатанный на поле марочного листа или рулона почтовых марок, который указывает на печатную форму, использованную для печати этих почтовых марок.",0,0,0,0,3,0
"Ви́смут — химический элемент с атомным № 83.","Ви́смут — химический элемент с атомным номером 83.",0,0,0,0,1,0
"Спесми́ло (эсп. spesmilo) — устаревшая десятичная международная ¤, которую предложил ввести в 1907 году швейцарский математик и эсперантолог Рене де Соссюр.","Спесми́ло (эсп. spesmilo) — устаревшая десятичная международная денежная единица, которую предложил ввести в 1907 году швейцарский математик и эсперантолог Рене де Соссюр.",0,0,0,0,0,1
"Спесмило (букв. «тысяча спесо») состоял из 10 спесценто (spescento), или 100 спесдеко (spesdeko), или 1000 спесо (speso), и приравнивался по стоимости к 0,733 грамма золота, что в те времена примерно равнялось половине $ США или 2½ швейцарского франка.","Спесмило (букв. «тысяча спесо») состоял из 10 спесценто (spescento), или 100 спесдеко (spesdeko), или 1000 спесо (speso), и приравнивался по стоимости к 0,733 грамма золота, что в те времена примерно равнялось половине доллара США или 2½ швейцарского франка.",0,0,0,0,1,0
"Турнир прошёл в прохладную погоду, при температуре воздуха +13-14 °.","Турнир прошёл в прохладную погоду, при температуре воздуха +13-14 градусов.",0,0,0,0,1,0
"По итогам 2012 года Казахстан стал третьим (после России и Китая) торговым партнером Кыргызстана: на Астану пришлось 12,7 % внешнего товарооборота Бишкека.","По итогам 2012 года Казахстан стал третьим (после России и Китая) торговым партнером Кыргызстана: на Астану пришлось 12,7 процентов внешнего товарооборота Бишкека.",0,0,0,0,1,0
"На драфте НХЛ 1995 года был выбран в 1 раунде под общим 16 № клубом «Баффало Сэйбрз».","На драфте НХЛ 1995 года был выбран в 1 раунде под общим 16 номером клубом «Баффало Сэйбрз».",0,0,0,0,1,0
"Я́вка избира́телей — отношение (выраженное, как правило, в %) числа избирателей, принявших участие в выборах, к общему количеству граждан, имеющих право на участие в этих выборах.","Я́вка избира́телей — отношение (выраженное, как правило, в процентах) числа избирателей, принявших участие в выборах, к общему количеству граждан, имеющих право на участие в этих выборах.",0,0,0,0,1,0
"На драфте НХЛ 1998 года был выбран в первом раунде под общим 27-м № командой «Нью-Джерси Девилз».","На драфте НХЛ 1998 года был выбран в первом раунде под общим 27-м номером командой «Нью-Джерси Девилз».",0,0,0,0,1,0
"Широкую известность получил благодаря своей публичной крайне отрицательной позиции в отношении пенсионной реформы и спору осенью 2018 года с министром труда Саратовской области Наталией Соколовой, которая защищала продуктовую корзину в 3,5 тысячи российских ₽ — месяц жил на указанную сумму и транслировал ход эксперимента в соцсети.","Широкую известность получил благодаря своей публичной крайне отрицательной позиции в отношении пенсионной реформы и спору осенью 2018 года с министром труда Саратовской области Наталией Соколовой, которая защищала продуктовую корзину в 3,5 тысячи российских рублей — месяц жил на указанную сумму и транслировал ход эксперимента в соцсети.",0,0,0,0,1,0
"Ввиду своего исключительного значения для христианства (согласно вероучению абсолютного большинства христианских конфессий Иерусалим — место распятия, смерти и воскресения Иисуса Христа), город, несмотря на не слишком большой % христианского населения в настоящее время, продолжает оставаться местом массового паломничества верующих со всего мира.","Ввиду своего исключительного значения для христианства (согласно вероучению абсолютного большинства христианских конфессий Иерусалим — место распятия, смерти и воскресения Иисуса Христа), город, несмотря на не слишком большой процент христианского населения в настоящее время, продолжает оставаться местом массового паломничества верующих со всего мира.",0,0,0,0,1,0
"Ретиро (исп. Retiro) — городской район Мадрида под № 3, расположенный в центре города.","Ретиро (исп. Retiro) — городской район Мадрида под номером 3, расположенный в центре города.",0,0,0,0,1,0
"Иэн (¥) Честертон (англ. Ian Chesterton) — персонаж британского научно-фантастического сериала «Доктор Кто», сыгранный Уильямом Расселом.","Иэн (Йен) Честертон (англ. Ian Chesterton) — персонаж британского научно-фантастического сериала «Доктор Кто», сыгранный Уильямом Расселом.",0,0,0,0,1,0
"№ дома Венди — 666.","Номер дома Венди — 666.",0,0,0,0,1,0
"Дом Ли́вшица — историческое здание начала XX века в Минске, памятник архитектуры и истории (№ 711Е000001).","Дом Ли́вшица — историческое здание начала XX века в Минске, памятник архитектуры и истории (номер 711Е000001).",0,0,0,0,1,0
"Вест-индский $ ($ Британской Вест-Индии) (англ. British West Indies dollar) — ¤ британских владений, входивших в состав Британской Вест-Индии.","Вест-индский доллар (Доллар Британской Вест-Индии) (англ. British West Indies dollar) — денежная единица британских владений, входивших в состав Британской Вест-Индии.",0,0,0,0,2,1
"В общей сложности министерство обороны Тайваня намерено потратить 12 млрд тайваньских $ (406,5 млн $ США) на покупку 120 ракет Hsiung Feng III для флота.","В общей сложности министерство обороны Тайваня намерено потратить 12 млрд тайваньских долларов (406,5 млн долларов США) на покупку 120 ракет Hsiung Feng III для флота.",0,0,0,0,2,0
"Дэн Му (кит. трад. 鄧牧, упр. 邓牧, пиньинь Dèng Mù, 1247—1306) — китайский философ, независимый социальный мыслитель конца эпохи Сун и начала эпохи ¥.","Дэн Му (кит. трад. 鄧牧, упр. 邓牧, пиньинь Dèng Mù, 1247—1306) — китайский философ, независимый социальный мыслитель конца эпохи Сун и начала эпохи Юань.",0,0,0,0,1,0
"Является крупнейшей европейской платформой для поиска автозапчастей — в 2020 году через интернет-портал Autodoc было куплено более 50 млн автотоваров на сумму 840 млн €.","Является крупнейшей европейской платформой для поиска автозапчастей — в 2020 году через интернет-портал Autodoc было куплено более 50 млн автотоваров на сумму 840 млн евро.",0,0,0,0,1,0
"Премия была создана по завещанию братьев Фредерика и Эрвина Неммерсов, которые оставили 14 миллионов $ США Северо-Западному университету на создание четырёх профессорских позиций в Келлогской школе менеджмента при университете, и на выплату премий по математике и экономике, которые в перспективе могли бы стать столь же престижными, как и Нобелевская премия.","Премия была создана по завещанию братьев Фредерика и Эрвина Неммерсов, которые оставили 14 миллионов долларов США Северо-Западному университету на создание четырёх профессорских позиций в Келлогской школе менеджмента при университете, и на выплату премий по математике и экономике, которые в перспективе могли бы стать столь же престижными, как и Нобелевская премия.",0,0,0,0,1,0
"С 2012 года размер премии составляет 200 тысяч $ США.","С 2012 года размер премии составляет 200 тысяч долларов США.",0,0,0,0,1,0
"Ирвин Джонсон из Университета штата Мичиган, один из игроков попавших на драфт по правилу «нужды», был выбран под первым № «Лос-Анджелес Лейкерс».","Ирвин Джонсон из Университета штата Мичиган, один из игроков попавших на драфт по правилу «нужды», был выбран под первым номером «Лос-Анджелес Лейкерс».",0,0,0,0,1,0
"В России № корреспондентских счетов состоят из 20 десятичных разрядов, при этом первые три разряда (так называемый счёт первого порядка) — 301.","В России номера корреспондентских счетов состоят из 20 десятичных разрядов, при этом первые три разряда (так называемый счёт первого порядка) — 301.",0,0,0,0,1,0
"Последние три цифры № корреспондентского счёта, открываемого в учреждении самого банка (18-й, 19-й, 20-й разряды), содержат 3-значный условный № участника расчётов, соответствующий 7-му, 8-му, 9-му разрядам БИК.","Последние три цифры номера корреспондентского счёта, открываемого в учреждении самого банка (18-й, 19-й, 20-й разряды), содержат 3-значный условный номер участника расчётов, соответствующий 7-му, 8-му, 9-му разрядам БИК.",0,0,0,0,2,0
"Первый № газеты вышел 7 января 1838 года.","Первый номер газеты вышел 7 января 1838 года.",0,0,0,0,1,0
"В одном из № приводится интервью бойца ИГ (воевавшего в Тунисе и отсидевшего во французской тюрьме), который призывает мусульман Франции разрушать французское государство изнутри и убивать неверующих.","В одном из номеров приводится интервью бойца ИГ (воевавшего в Тунисе и отсидевшего во французской тюрьме), который призывает мусульман Франции разрушать французское государство изнутри и убивать неверующих.",0,0,0,0,1,0
"В Книге Праведного упомянут сын Фалека — ¥, являющийся отцом Серуха.","В Книге Праведного упомянут сын Фалека — Йен, являющийся отцом Серуха.",0,0,0,0,1,0
"С бюджетом в 12 млн $ картина стала самым дорогостоящим проектом компании Universal на 1960 год.","С бюджетом в 12 млн долларов картина стала самым дорогостоящим проектом компании Universal на 1960 год.",0,0,0,0,1,0
"Отани был выбран «Хоккайдо Ниппон-Хэм Файтерс» по общим первым № на драфте 2012 года.","Отани был выбран «Хоккайдо Ниппон-Хэм Файтерс» по общим первым номером на драфте 2012 года.",0,0,0,0,1,0
"В декабре 2023 года Отани подписал 10-летний контракт с «Лос-Анджелес Доджерс» на сумму 700 млн $, рекордный в истории бейсбола.","В декабре 2023 года Отани подписал 10-летний контракт с «Лос-Анджелес Доджерс» на сумму 700 млн долларов, рекордный в истории бейсбола.",0,0,0,0,1,0
"Рэй Ду́глас Брэ́дбери (англ. Ray Douglas Bradbury; 22 августа 1920 года, Уокиган, США — 5 июня 2012 года, Лос-Анджелес) — американский писатель, известный по антиутопии «451 ° по Фаренгейту», циклу рассказов «Марсианские хроники» и частично автобиографическому роману «Вино из одуванчиков».","Рэй Ду́глас Брэ́дбери (англ. Ray Douglas Bradbury; 22 августа 1920 года, Уокиган, США — 5 июня 2012 года, Лос-Анджелес) — американский писатель, известный по антиутопии «451 градус по Фаренгейту», циклу рассказов «Марсианские хроники» и частично автобиографическому роману «Вино из одуванчиков».",0,0,0,0,1,0
"Флаг был зарегистрирован Геральдическим советом при президенте РФ и внесён в Государственный геральдический регистр РФ с присвоением регистрационного № 1219.","Флаг был зарегистрирован Геральдическим советом при президенте РФ и внесён в Государственный геральдический регистр РФ с присвоением регистрационного номера 1219.",0,0,0,0,1,0
"Мэнзел был выбран а драфте НФЛ 2014 года под общим 22 № клубом «Кливленд Браунс».","Мэнзел был выбран а драфте НФЛ 2014 года под общим 22 номером клубом «Кливленд Браунс».",0,0,0,0,1,0
"Несмотря на то, что Мэнзел не играл в бейсбол со старшей школы, он был выбран на драфте МЛБ 2014 года под общим 837 № клубом «Сан-Диего Падрес».","Несмотря на то, что Мэнзел не играл в бейсбол со старшей школы, он был выбран на драфте МЛБ 2014 года под общим 837 номером клубом «Сан-Диего Падрес».",0,0,0,0,1,0
"Системы бортовых № гражданских летательных аппаратов в СССР — порядок нумерации самолётов, вертолётов и прочих летательных аппаратов гражданского воздушного флота СССР для их регистрации.","Системы бортовых номеров гражданских летательных аппаратов в СССР — порядок нумерации самолётов, вертолётов и прочих летательных аппаратов гражданского воздушного флота СССР для их регистрации.",0,0,0,0,1,0
"Данцигский талер — ¤ города Данциг до 1772 года, а также Данцигской республики в 1807—1814 годах.","Данцигский талер — денежная единица города Данциг до 1772 года, а также Данцигской республики в 1807—1814 годах.",0,0,0,0,0,1
"Эстонские монеты € — современные денежные знаки Эстонии, введённые в обращение 1 января 2011 года.","Эстонские монеты евро — современные денежные знаки Эстонии, введённые в обращение 1 января 2011 года.",0,0,0,0,1,0
"Впервые информирование населения во время перехода на € ведётся на двух языках: эстонском и русском.","Впервые информирование населения во время перехода на евро ведётся на двух языках: эстонском и русском.",0,0,0,0,1,0
"Желе́зная Ма́ска (фр. Le Masque de Fer), он же Челове́к в желе́зной ма́ске (фр. L'Homme au Masque de Fer; 1640-е — 19 ноября 1703) — таинственный узник под № 64489001 эпохи короля Людовика XIV, арестованный в 1669 или 1670 году и содержавшийся в ряде французских тюрем, в том числе в Бастилии (с 1698 года) и Пиньероль (ныне Пинероло, Италия).","Желе́зная Ма́ска (фр. Le Masque de Fer), он же Челове́к в желе́зной ма́ске (фр. L'Homme au Masque de Fer; 1640-е — 19 ноября 1703) — таинственный узник под номером 64489001 эпохи короля Людовика XIV, арестованный в 1669 или 1670 году и содержавшийся в ряде французских тюрем, в том числе в Бастилии (с 1698 года) и Пиньероль (ныне Пинероло, Италия).",0,0,0,0,1,0
"Ожидалось, что организация и проведение Олимпиады обойдётся Франции в 8,3 миллиарда €.","Ожидалось, что организация и проведение Олимпиады обойдётся Франции в 8,3 миллиарда евро.",0,0,0,0,1,0
"Валюта — € (EUR, код 978).","Валюта — Евро (EUR, код 978).",0,0,0,0,1,0
