question,answer,count_simple,count_simple_translated,count_simple_long,count_simple_long_translated,count_cases_translated,count_cases_long
"Товарищество Санкт-Петербургского (в 1914—1918 гг. Петроградского) вагоностроительного завода осуществляло свою деятельность с 1893 (Устав Высочайше утвержден 3 июля 1893 г.) по 1918 г. Министерством торговли и промышленности Временного правительства 25 апреля 1917 года разрешено увеличить основной капитал Товарищества Петроградского вагоностроительного завода с 11250000 ₽ до 25250000 ₽ посредством выпуска 140000 дополнительных паев на сумму 14000000 ₽ номинальных.","Товарищество Санкт-Петербургского (в 1914—1918 гг. Петроградского) вагоностроительного завода осуществляло свою деятельность с 1893 (Устав Высочайше утвержден 3 июля 1893 г.) по 1918 г. Министерством торговли и промышленности Временного правительства 25 апреля 1917 года разрешено увеличить основной капитал Товарищества Петроградского вагоностроительного завода с 11250000 рублей до 25250000 рублей посредством выпуска 140000 дополнительных паев на сумму 14000000 рублей номинальных.",0,0,0,0,3,0
"Бюджет фильма: 30 млн $.","Бюджет фильма: 30 млн долларов.",0,0,0,0,1,0
"Кассовые сборы в кинотеатрах США в год показа: 74 810 000 $.","Кассовые сборы в кинотеатрах США в год показа: 74 810 000 долларов.",0,0,0,0,1,0
"Кассовые сборы по всему миру: 94 млн $.","Кассовые сборы по всему миру: 94 млн долларов.",0,0,0,0,1,0
"Имя (идентификатор, №) DOI может быть присвоено таким объектам, как публикация или её часть (книга, глава книги, статья) или элемент (рисунок, таблица, формула и т. п.), аудио- и видеоконтенту, наборам данных и базам данных, материальным объектам (DVD, бумажная книга), людям (авторы, композиторы, издатели), организациям и пр.","Имя (идентификатор, номер) DOI может быть присвоено таким объектам, как публикация или её часть (книга, глава книги, статья) или элемент (рисунок, таблица, формула и т. п.), аудио- и видеоконтенту, наборам данных и базам данных, материальным объектам (DVD, бумажная книга), людям (авторы, композиторы, издатели), организациям и пр.",0,0,0,0,1,0
"Мозамбикский реал (порт. Real) — ¤ португальского владения Мозамбик в 1878—1914 годах.","Мозамбикский реал (порт. Real) — денежная единица португальского владения Мозамбик в 1878—1914 годах.",0,0,0,0,0,1
"Албанию на конкурсе песни «Евровидение 2005» представила Ледина Село с песней «Neser shkoj» под 8 № и, набрав 53 балла, заняла 16 место в финале.","Албанию на конкурсе песни «Евровидение 2005» представила Ледина Село с песней «Neser shkoj» под 8 номером и, набрав 53 балла, заняла 16 место в финале.",0,0,0,0,1,0
"Размер премии составляет 5 тысяч € и она вручается начиная с 2014 года один раз в два года выдающимся деятелям серболужицкой культуры и науки.","Размер премии составляет 5 тысяч евро и она вручается начиная с 2014 года один раз в два года выдающимся деятелям серболужицкой культуры и науки.",0,0,0,0,1,0
"Звездолёт «Вояджер» дебютировал на телеэкране в январе 1995 года в эпизоде «Опекун», самом дорогом пилоте в истории телевидения, который, как сообщается, стоил 23 миллиона $.","Звездолёт «Вояджер» дебютировал на телеэкране в январе 1995 года в эпизоде «Опекун», самом дорогом пилоте в истории телевидения, который, как сообщается, стоил 23 миллиона долларов.",0,0,0,0,1,0
"В американском прокате фильм прошёл неудачно, собрав лишь 22 миллиона $ США (при бюджете в 45 миллионов).","В американском прокате фильм прошёл неудачно, собрав лишь 22 миллиона долларов США (при бюджете в 45 миллионов).",0,0,0,0,1,0
"Мистификация была раскрыта самим Сокалом в статье в майском № другого научного журнала, Lingua Franca, в которой он объяснил, что его статья в «Social Text» была «обильно приправлена полной чепухой» и, по его мнению, была опубликована только потому, что хорошо выглядела и льстила «идеологическим предубеждениям» редакторов.","Мистификация была раскрыта самим Сокалом в статье в майском номере другого научного журнала, Lingua Franca, в которой он объяснил, что его статья в «Social Text» была «обильно приправлена полной чепухой» и, по его мнению, была опубликована только потому, что хорошо выглядела и льстила «идеологическим предубеждениям» редакторов.",0,0,0,0,1,0
"Флаг утверждён 30 июня 2008 года и внесён в Государственный геральдический регистр Российской Федерации с присвоением регистрационного № 4224.","Флаг утверждён 30 июня 2008 года и внесён в Государственный геральдический регистр Российской Федерации с присвоением регистрационного номера 4224.",0,0,0,0,1,0
"И́ндий (химический символ — In, от лат. Indium) — химический элемент 13-й группы (по устаревшей классификации — главной подгруппы третьей группы, IIIA), пятого периода периодической системы химических элементов Д. И. Менделеева с атомным № 49.","И́ндий (химический символ — In, от лат. Indium) — химический элемент 13-й группы (по устаревшей классификации — главной подгруппы третьей группы, IIIA), пятого периода периодической системы химических элементов Д. И. Менделеева с атомным номером 49.",0,0,0,0,1,0
"Милль, миль, мил, милльем, мильем, миллим, милесимо — локальные наименования ¤, равных 1⁄1000 основной валюты, имеющие общую этимологию (все они в конечном итоге происходят от лат.","Милль, миль, мил, милльем, мильем, миллим, милесимо — локальные наименования денежных единиц, равных 1⁄1000 основной валюты, имеющие общую этимологию (все они в конечном итоге происходят от лат.",0,0,0,0,0,2
"Первый № газеты вышел 25 августа 1924 года в Самарканде под названием «Ово́зи тоджики́ камбага́л» (тадж. Овози тоҷики камбағал — Голос таджика-бедняка).","Первый номер газеты вышел 25 августа 1924 года в Самарканде под названием «Ово́зи тоджики́ камбага́л» (тадж. Овози тоҷики камбағал — Голос таджика-бедняка).",0,0,0,0,1,0
"«Who Wants to Be a Millionaire?» — американская телеигра, где каждый участник с помощью своей эрудиции мог заработать 1 миллион $.","«Who Wants to Be a Millionaire?» — американская телеигра, где каждый участник с помощью своей эрудиции мог заработать 1 миллион долларов.",0,0,0,0,1,0
"Премьера состоялась 22 мая 1999 года в ¥.","Премьера состоялась 22 мая 1999 года в Йене.",0,0,0,0,1,0
"Согласно Отчёту президента США Гарри Трумэна Конгрессу, по состоянию на 2 сентября 1945 года обратный ленд-лиз из СССР составил 2 212 698 $.","Согласно Отчёту президента США Гарри Трумэна Конгрессу, по состоянию на 2 сентября 1945 года обратный ленд-лиз из СССР составил 2 212 698 долларов.",0,0,0,0,1,0
"Яшен (рус. Молния) — татарский сатирический иллюстрированный журнал, издавался в Казани с августа 1908 по 24 июня 1909 гг., интервал выхода №, 2 раза в месяц.","Яшен (рус. Молния) — татарский сатирический иллюстрированный журнал, издавался в Казани с августа 1908 по 24 июня 1909 гг., интервал выхода номеров, 2 раза в месяц.",0,0,0,0,1,0
"Альбом стал № 2 в хит-параде Великобритании, уступив первое место альбому The Beatles Sgt. Pepper's Lonely Hearts Club Band.","Альбом стал номером 2 в хит-параде Великобритании, уступив первое место альбому The Beatles Sgt. Pepper's Lonely Hearts Club Band.",0,0,0,0,1,0
"Памятник культуры Великопольского воеводства, регистрационный № 2115/A от 30 марта 1987 года.","Памятник культуры Великопольского воеводства, регистрационный номер 2115/A от 30 марта 1987 года.",0,0,0,0,1,0
"Цветноглазые (кит. упр. 色目人, пиньинь sèmùrén, полностью 各色名目之人) — обозначение людей разных национальностей как отдельной группы населения при династии ¥ со стороны монгольской администрации.","Цветноглазые (кит. упр. 色目人, пиньинь sèmùrén, полностью 各色名目之人) — обозначение людей разных национальностей как отдельной группы населения при династии Юань со стороны монгольской администрации.",0,0,0,0,1,0
"Аэродром Папа-Уэстрей имеет обычную лицензию (№ P542), которая разрешает пассажирские перевозки и обучение полётам по патенту Совета Оркнейских островов.","Аэродром Папа-Уэстрей имеет обычную лицензию (номер P542), которая разрешает пассажирские перевозки и обучение полётам по патенту Совета Оркнейских островов.",0,0,0,0,1,0
"Согласно распоряжению Правительства Российской Федерации вознаграждение за каждую золотую медаль для российских спортсменов составит 4 миллиона ₽, за серебряную — 2,5 млн, за бронзовую — 1,7 млн.","Согласно распоряжению Правительства Российской Федерации вознаграждение за каждую золотую медаль для российских спортсменов составит 4 миллиона рублей, за серебряную — 2,5 млн, за бронзовую — 1,7 млн.",0,0,0,0,1,0
"Юаньлинь ¥ (англ. Yuanling Yuan, кит. упр. 袁元凌, пиньинь Yuán Yuánlíng; род.","Юаньлинь Юань (англ. Yuanling Yuan, кит. упр. 袁元凌, пиньинь Yuán Yuánlíng; род.",0,0,0,0,1,0
"На драфте НБА 1982 года под первым № клубом «Лос-Анджелес Лейкерс» был выбран лёгкий форвард Джеймс Уорти из университета Северной Каролины в Чапел-Хилл.","На драфте НБА 1982 года под первым номером клубом «Лос-Анджелес Лейкерс» был выбран лёгкий форвард Джеймс Уорти из университета Северной Каролины в Чапел-Хилл.",0,0,0,0,1,0
"«К Вера́нию, на прие́зд из Испа́нии» (лат. Ad Verannium) — условное название стихотворения римского поэта Гая Валерия Катулла, включённого в состав посмертного сборника («Книги Катулла Веронского») под № 9.","«К Вера́нию, на прие́зд из Испа́нии» (лат. Ad Verannium) — условное название стихотворения римского поэта Гая Валерия Катулла, включённого в состав посмертного сборника («Книги Катулла Веронского») под номером 9.",0,0,0,0,1,0
"Иоганн Вольфганг Дёберейнер (нем. Johann Wolfgang Döbereiner; 13 декабря 1780, Хоф — 24 марта 1849, ¥) — немецкий химик.","Иоганн Вольфганг Дёберейнер (нем. Johann Wolfgang Döbereiner; 13 декабря 1780, Хоф — 24 марта 1849, Йена) — немецкий химик.",0,0,0,0,1,0
