question,answer,count_simple,count_simple_translated,count_simple_long,count_simple_long_translated,count_cases_translated,count_cases_long
"Ирпе́нская у́лица (укр. Ірпі́нська ву́лиця) — улица в Святошинском районе города Киева, жилые массивы Академгородок (первые №) и Беличи (последние №).","Ирпе́нская у́лица (укр. Ірпі́нська ву́лиця) — улица в Святошинском районе города Киева, жилые массивы Академгородок (первые номера) и Беличи (последние номера).",0,0,0,0,2,0
"Флаг утверждён 25 мая 1999 года и внесён в Государственный геральдический регистр Российской Федерации с присвоением регистрационного № 1612.","Флаг утверждён 25 мая 1999 года и внесён в Государственный геральдический регистр Российской Федерации с присвоением регистрационного номера 1612.",0,0,0,0,1,0
"Национальная сборная США под руководством Джино Ориммы легко переиграла команду остальных звёзд ВНБА Брайана Эглера, получившего назначение на этот высокий пост, будучи тренером клуба, который к моменту объявления его имени лидировал по % побед в регулярном чемпионате текущего сезона, со счётом 99:72.","Национальная сборная США под руководством Джино Ориммы легко переиграла команду остальных звёзд ВНБА Брайана Эглера, получившего назначение на этот высокий пост, будучи тренером клуба, который к моменту объявления его имени лидировал по проценту побед в регулярном чемпионате текущего сезона, со счётом 99:72.",0,0,0,0,1,0
"Содержимое альбома было скомпоновано из музыкальных № фильма «Божественное безумие», выход которого состоялся в том же году.","Содержимое альбома было скомпоновано из музыкальных номеров фильма «Божественное безумие», выход которого состоялся в том же году.",0,0,0,0,1,0
"Проект утверждён японским правительством в 2013 году, разработкой занимаются Японское агентство аэрокосмических исследований (JAXA) и компания Mitsubishi Heavy Industries, бюджет составляет 1,9 млрд $ США.","Проект утверждён японским правительством в 2013 году, разработкой занимаются Японское агентство аэрокосмических исследований (JAXA) и компания Mitsubishi Heavy Industries, бюджет составляет 1,9 млрд долларов США.",0,0,0,0,1,0
"Ожидается, что базовая версия H3 без твердотопливных ускорителей (H3-30S) сможет доставить до 4 т на солнечно-синхронную орбиту высотой 500 км, со стоимостью запуска порядка 5 млрд иен (~45 млн $ США).","Ожидается, что базовая версия H3 без твердотопливных ускорителей (H3-30S) сможет доставить до 4 т на солнечно-синхронную орбиту высотой 500 км, со стоимостью запуска порядка 5 млрд иен (~45 млн долларов США).",0,0,0,0,1,0
"«Свинья под дубом» — басня И. А. Крылова, написанная в 1823 году, но напечатанная впервые в 1825 в пятом № политической газеты «Северная пчела».","«Свинья под дубом» — басня И. А. Крылова, написанная в 1823 году, но напечатанная впервые в 1825 в пятом номере политической газеты «Северная пчела».",0,0,0,0,1,0
"Данный флаг утверждён 4 октября 2007 года и внесён в Государственный геральдический регистр Российской Федерации с присвоением регистрационного № 3933.","Данный флаг утверждён 4 октября 2007 года и внесён в Государственный геральдический регистр Российской Федерации с присвоением регистрационного номера 3933.",0,0,0,0,1,0
"В начале 2022 года вышел 73-й № журнала.","В начале 2022 года вышел 73-й номер журнала.",0,0,0,0,1,0
"Памятник культуры Малопольского воеводства: регистрационный № А-826 от 14 апреля 1997 года.","Памятник культуры Малопольского воеводства: регистрационный номер А-826 от 14 апреля 1997 года.",0,0,0,0,1,0
"Фильм получил смешанные отзывы зрителей и критиков, но собрал 89,3 миллионов $ в прокате при бюджете в 3 миллиона.","Фильм получил смешанные отзывы зрителей и критиков, но собрал 89,3 миллионов долларов в прокате при бюджете в 3 миллиона.",0,0,0,0,1,0
"Моте́ль (от англ. motor hotel) — небольшая придорожная гостиница, вход в № которой осуществляется с улицы (с места парковки автомобиля).","Моте́ль (от англ. motor hotel) — небольшая придорожная гостиница, вход в номера которой осуществляется с улицы (с места парковки автомобиля).",0,0,0,0,1,0
"Как правило, мотели имеют всего один или два этажа, количество дополнительных услуг и типов № минимально, что соответствует низкой стоимости проживания.","Как правило, мотели имеют всего один или два этажа, количество дополнительных услуг и типов номеров минимально, что соответствует низкой стоимости проживания.",0,0,0,0,1,0
"Первоначально данный флаг был утверждён 2 марта 1999 года, как флаг муниципального образования «Можайский район Московской области» (после муниципальной реформы 2006 года — Можайский муниципальный район Московской области), и внесён в Государственный геральдический регистр Российской Федерации с присвоением регистрационного № 443.","Первоначально данный флаг был утверждён 2 марта 1999 года, как флаг муниципального образования «Можайский район Московской области» (после муниципальной реформы 2006 года — Можайский муниципальный район Московской области), и внесён в Государственный геральдический регистр Российской Федерации с присвоением регистрационного номера 443.",0,0,0,0,1,0
"Флаг утверждён 18 января 2010 года и внесён в Государственный геральдический регистр Российской Федерации с присвоением регистрационного № 6322.","Флаг утверждён 18 января 2010 года и внесён в Государственный геральдический регистр Российской Федерации с присвоением регистрационного номера 6322.",0,0,0,0,1,0
"Ожидалось, что организация и проведение Олимпиады обойдётся Франции в 8,3 миллиарда €.","Ожидалось, что организация и проведение Олимпиады обойдётся Франции в 8,3 миллиарда евро.",0,0,0,0,1,0
"1 ноября 2008 года Эндрю Таненбаум получил грант в 2,5 млн € от Европейского исследовательского совета для работы над проектом «Исследование действительно надёжного и безопасного системного программного обеспечения».","1 ноября 2008 года Эндрю Таненбаум получил грант в 2,5 млн евро от Европейского исследовательского совета для работы над проектом «Исследование действительно надёжного и безопасного системного программного обеспечения».",0,0,0,0,1,0
"Флаг утверждён 15 февраля 2010 года и внесён в Государственный геральдический регистр Российской Федерации с присвоением регистрационного № 6024.","Флаг утверждён 15 февраля 2010 года и внесён в Государственный геральдический регистр Российской Федерации с присвоением регистрационного номера 6024.",0,0,0,0,1,0
"Ожидалось, что организация и проведение Олимпиады обойдётся Франции в 8,3 миллиарда €.","Ожидалось, что организация и проведение Олимпиады обойдётся Франции в 8,3 миллиарда евро.",0,0,0,0,1,0
"За неполные первые три недели проката картина собрала более 500 миллионов $, став вторым самым кассовым фильмом 2024 года и уже превзошла по сборам первую часть трилогии.","За неполные первые три недели проката картина собрала более 500 миллионов долларов, став вторым самым кассовым фильмом 2024 года и уже превзошла по сборам первую часть трилогии.",0,0,0,0,1,0
"Флаг утверждён 23 декабря 2004 года и внесён в Геральдический реестр города Москвы с присвоением регистрационного № ?.","Флаг утверждён 23 декабря 2004 года и внесён в Геральдический реестр города Москвы с присвоением регистрационного номера ?.",0,0,0,0,1,0
"Нумерация по чётной стороне улицы Ломоносова начинается с № 10, расположенного почти на углу с Кедринской улицей.","Нумерация по чётной стороне улицы Ломоносова начинается с номера 10, расположенного почти на углу с Кедринской улицей.",0,0,0,0,1,0
"Усадьба Плятеров — историческое здание и дворцово-парковый комплекс конца XVIII — начала XIX вв. в деревне Городец Шарковщинского района, памятник архитектуры (№ 212Г000836).","Усадьба Плятеров — историческое здание и дворцово-парковый комплекс конца XVIII — начала XIX вв. в деревне Городец Шарковщинского района, памятник архитектуры (номер 212Г000836).",0,0,0,0,1,0
"¥ Шу (кит. трад. 袁術, упр. 袁术, пиньинь Yuán Shù; ? — 199) — китайский полководец эпохи поздней Хань и Троецарствия, член знатного рода ¥.","Юань Шу (кит. трад. 袁術, упр. 袁术, пиньинь Yuán Shù; ? — 199) — китайский полководец эпохи поздней Хань и Троецарствия, член знатного рода Юаней.",0,0,0,0,2,0
"Один из младших двоюродных братьев ¥ Шао.","Один из младших двоюродных братьев Юань Шао.",0,0,0,0,1,0
"Вскоре ¥ Шу объявил себя императором и начал войну против Цао Цао, к тому времени контролировавшего императора Сянь-ди и приумножившего свои земли.","Вскоре Юань Шу объявил себя императором и начал войну против Цао Цао, к тому времени контролировавшего императора Сянь-ди и приумножившего свои земли.",0,0,0,0,1,0
"Дра́хма (др.-греч. δραχμή — схваченное рукой; другая версия: от ассирийского «дараг-мана» — шестидесятая часть мины) — древнегреческая ¤, а также единица измерения массы, первоначально состоявшая из слитка серебра весом в 1/60 мины.","Дра́хма (др.-греч. δραχμή — схваченное рукой; другая версия: от ассирийского «дараг-мана» — шестидесятая часть мины) — древнегреческая денежной единице, а также единица измерения массы, первоначально состоявшая из слитка серебра весом в 1/60 мины.",0,0,0,0,0,2
"Согласно распоряжению Правительства Российской Федерации вознаграждение за каждую золотую медаль для российских спортсменов составит 4 миллиона ₽, за серебряную — 2,5 млн, за бронзовую — 1,7 млн.","Согласно распоряжению Правительства Российской Федерации вознаграждение за каждую золотую медаль для российских спортсменов составит 4 миллиона рублей, за серебряную — 2,5 млн, за бронзовую — 1,7 млн.",0,0,0,0,1,0
"Флаг утверждён 17 февраля 2010 года и внесён в Государственный геральдический регистр Российской Федерации с присвоением регистрационного № 5945.","Флаг утверждён 17 февраля 2010 года и внесён в Государственный геральдический регистр Российской Федерации с присвоением регистрационного номера 5945.",0,0,0,0,1,0
"«Жёны артистов» — рассказ русского писателя XIX-XX века Антона Павловича Чехова, написанный в 1880 году и впервые опубликованный 7 декабря 1880 года под псевдонимом «Дон Антонио Чехонте» в седьмом № газеты «Минута».","«Жёны артистов» — рассказ русского писателя XIX-XX века Антона Павловича Чехова, написанный в 1880 году и впервые опубликованный 7 декабря 1880 года под псевдонимом «Дон Антонио Чехонте» в седьмом номере газеты «Минута».",0,0,0,0,1,0
"Роман Михайлович Рощин (род. 28 августа 1993 года, Краснодар) — российский регбист, играющий на позиции фулбэка (15 №, замыкающего) в команде «Стрела» и сборной России по регби-7.","Роман Михайлович Рощин (род. 28 августа 1993 года, Краснодар) — российский регбист, играющий на позиции фулбэка (15 номера, замыкающего) в команде «Стрела» и сборной России по регби-7.",0,0,0,0,1,0
"На судах есть рефрижераторный трюм объёмом 507 кубических метров, с температурой охлаждения −28 °.","На судах есть рефрижераторный трюм объёмом 507 кубических метров, с температурой охлаждения −28 градусов.",0,0,0,0,1,0
"Та́ллий (химический символ — Tl, от лат. Thallium) — химический элемент 13-й группы периодической таблицы химических элементов (по устаревшей классификации — элемент главной подгруппы III группы), шестого периода, с атомным № 81.","Та́ллий (химический символ — Tl, от лат. Thallium) — химический элемент 13-й группы периодической таблицы химических элементов (по устаревшей классификации — элемент главной подгруппы III группы), шестого периода, с атомным номером 81.",0,0,0,0,1,0
"В 2011 году в храме Падманабхасвами были обнаружены нетронутыми сокровища правителей Траванкора, оцениваемые в 22 млрд $ США.","В 2011 году в храме Падманабхасвами были обнаружены нетронутыми сокровища правителей Траванкора, оцениваемые в 22 млрд долларов США.",0,0,0,0,1,0
"В 1895—96 годах на заводе дороги у Девяти Вязов построено 10 паровозов, которые получили № 677—686.","В 1895—96 годах на заводе дороги у Девяти Вязов построено 10 паровозов, которые получили номера 677—686.",0,0,0,0,1,0
"Постройка авианосца была начата для КВМС Великобритании, под названием «Маджестик» и № R77, в годы Второй мировой войны.","Постройка авианосца была начата для КВМС Великобритании, под названием «Маджестик» и номером R77, в годы Второй мировой войны.",0,0,0,0,1,0
"Стоимость миссии 686 миллионов $ США.","Стоимость миссии 686 миллионов долларов США.",0,0,0,0,1,0
"Герб Корякского автономного округа утверждён решением Думы Корякского автономного округа 13 июля 1998 года и внесён в Государственный геральдический регистр Российской Федерации под регистрационным № 437.","Герб Корякского автономного округа утверждён решением Думы Корякского автономного округа 13 июля 1998 года и внесён в Государственный геральдический регистр Российской Федерации под регистрационным номером 437.",0,0,0,0,1,0
"Флаг утверждён 13 июля 2001 года и внесён в Геральдический реестр города Москвы с присвоением регистрационного № ?.","Флаг утверждён 13 июля 2001 года и внесён в Геральдический реестр города Москвы с присвоением регистрационного номера ?.",0,0,0,0,1,0
"Фильм получил признание критиков и собрал более 225 миллионов $ в прокате при бюджете в 10 миллионов $.","Фильм получил признание критиков и собрал более 225 миллионов долларов в прокате при бюджете в 10 миллионов долларов.",0,0,0,0,2,0
"«На Мамурру» — условное название трёх стихотворений римского поэта Гая Валерия Катулла, включённых в состав посмертного сборника («Книги Катулла Веронского») под № 94, 114 и 115.","«На Мамурру» — условное название трёх стихотворений римского поэта Гая Валерия Катулла, включённых в состав посмертного сборника («Книги Катулла Веронского») под номерами 94, 114 и 115.",0,0,0,0,1,0
"Общая стоимость судна предполагалась в 700 миллионов канадских $.","Общая стоимость судна предполагалась в 700 миллионов канадских долларов.",0,0,0,0,1,0
"Фильм вышел в мировой прокат 26 июля 2019 года; в России — 8 августа 2019, картина стала лидером российского проката, собрав за первые выходные 516,9 млн ₽.","Фильм вышел в мировой прокат 26 июля 2019 года; в России — 8 августа 2019, картина стала лидером российского проката, собрав за первые выходные 516,9 млн рублей.",0,0,0,0,1,0
"Названа в честь Р. Кросби Кемпера-старшего, который вложил 3,2 млн $ в строительство арены.","Названа в честь Р. Кросби Кемпера-старшего, который вложил 3,2 млн долларов в строительство арены.",0,0,0,0,1,0
"Издаётся с 2003 года, периодичность 6 № в год, объём 84 — 88 стр., формат А4.","Издаётся с 2003 года, периодичность 6 номеров в год, объём 84 — 88 стр., формат А4.",0,0,0,0,1,0
"Определе́ние но́мера — процесс в рамках телефонного вызова, проходящий при помощи оборудования АТС, или услуга, которой может воспользоваться абонент телефонной сети для определения № звонящего или № абонента, принявшего вызов.","Определе́ние но́мера — процесс в рамках телефонного вызова, проходящий при помощи оборудования АТС, или услуга, которой может воспользоваться абонент телефонной сети для определения номера звонящего или номера абонента, принявшего вызов.",0,0,0,0,2,0
