question,answer,count_simple,count_simple_translated,count_simple_long,count_simple_long_translated,count_cases_translated,count_cases_long
"По соображениям конфиденциальности применяется автоматическое затирание лиц людей и № транспортных средств.","По соображениям конфиденциальности применяется автоматическое затирание лиц людей и номеров транспортных средств.",0,0,0,0,1,0
"За всю свою карьеру она снялась более чем в двухсот фильмах, среди которых «Имитация жизни», «Великолепная одержимость», «Ужасная правда», «Роза в сквере Вашингтона», «Они едут ночью», «Рождество в Коннектикуте», «Балалайка», «Милдред Пирс», «Лучшие годы нашей жизни» и «Извините, ошиблись №».","За всю свою карьеру она снялась более чем в двухсот фильмах, среди которых «Имитация жизни», «Великолепная одержимость», «Ужасная правда», «Роза в сквере Вашингтона», «Они едут ночью», «Рождество в Коннектикуте», «Балалайка», «Милдред Пирс», «Лучшие годы нашей жизни» и «Извините, ошиблись номером».",0,0,0,0,1,0
"Комплекс был открыт 18 декабря 1993 года как крупнейший отель во всей Америке — 6852 № (сейчас по этому показателю занимает четвёртое место в мире).","Комплекс был открыт 18 декабря 1993 года как крупнейший отель во всей Америке — 6852 номера (сейчас по этому показателю занимает четвёртое место в мире).",0,0,0,0,1,0
"Це́рий (химический символ — Ce, от лат. Cerium) — химический элемент 3-й группы (по устаревшей классификации — побочной подгруппы третьей группы, IIIB) шестого периода периодической системы химических элементов Д. И. Менделеева с атомным № 58.","Це́рий (химический символ — Ce, от лат. Cerium) — химический элемент 3-й группы (по устаревшей классификации — побочной подгруппы третьей группы, IIIB) шестого периода периодической системы химических элементов Д. И. Менделеева с атомным номером 58.",0,0,0,0,1,0
"Флаг утверждён 26 января 2011 года и внесён в Государственный геральдический регистр Российской Федерации с присвоением регистрационного № 6697.","Флаг утверждён 26 января 2011 года и внесён в Государственный геральдический регистр Российской Федерации с присвоением регистрационного номера 6697.",0,0,0,0,1,0
"Тана Алекса и её муж / соавтор Антонио Санчес были представлены на обложке музыкального журнала DownBeat Magazine в № за май 2020 года.","Тана Алекса и её муж / соавтор Антонио Санчес были представлены на обложке музыкального журнала DownBeat Magazine в номере за май 2020 года.",0,0,0,0,1,0
"Флаг утверждён 28 сентября 2006 и внесён в Государственный геральдический регистр Российской Федерации с присвоением регистрационного № 2658.","Флаг утверждён 28 сентября 2006 и внесён в Государственный геральдический регистр Российской Федерации с присвоением регистрационного номера 2658.",0,0,0,0,1,0
"Победитель получает 10 тысяч американских $, второй и третий хоккеист в опросе, соответственно, 6 и 4 тысячи $.","Победитель получает 10 тысяч американских долларов, второй и третий хоккеист в опросе, соответственно, 6 и 4 тысячи долларов.",0,0,0,0,2,0
"Хуго Шмайссер (нем. Hugo Schmeisser; 24 сентября 1884 года, ¥ — 12 сентября 1953 года, Эрфурт) — немецкий конструктор стрелкового оружия, руководитель фирм по производству огнестрельного и пневматического оружия.","Хуго Шмайссер (нем. Hugo Schmeisser; 24 сентября 1884 года, Йена — 12 сентября 1953 года, Эрфурт) — немецкий конструктор стрелкового оружия, руководитель фирм по производству огнестрельного и пневматического оружия.",0,0,0,0,1,0
