Международный теннисный чемпионат в Делрей-Бич 2011 года — 19-й розыгрыш ежегодного профессионального теннисного турнира среди мужчин, проводящегося в одноимённом американском городе и являющегося частью Тура ATP в рамках серии ATP 250. Турнир прошёл с 21 по 27 февраля. Первым номером посева в одиночном турнире стал Энди Роддик (№ 8 в мире на тот момент).
Основатель и организатор урологической службы в городе Магнитогорске, руководитель урологического отделения Городской больницы № 1 им. Г. И. Дробышева.
Ныне действующий флаг утверждён решением Муниципального Совета Муниципального образования посёлок Стрельна от 17 августа 2010 года № 58 и 25 сентября 2010 года внесён в Государственный геральдический регистр Российской Федерации с присвоением регистрационного номера 6312.
Фильм получил много негативных отзывов кинокритиков. На сайте Rotten Tomatoes у фильма 20 % положительных рецензий из 112, со средним рейтингом 4,3 из 10. На Metacritic — 36 баллов из 100 на основе 28 обзоров.
Образовано 16 сентября 1991 года в соответствии с Федеральным законом № 131 «Об общих принципах организации местного самоуправления в Российской Федерации». В состав сельского поселения вошёл Белокрестский сельсовет.
Днепропетровский информационно-юридический лицей — среднее общеобразовательное учебно-воспитательное заведение в городе Днепре; лицензия АА № 315887 от 07.07.2003 г.
Оле́г Вита́льевич Го́луб (род. 17 апреля 1971 года, Магнитогорск, СССР) — российский актёр и режиссёр театра и кино, сценарист и телеведущий. Известен как актер мюзикла «Норд-Ост», телеведущий Первого канала программы «100%», кинорежиссер и автор сценариев короткометражных фильмов проекта #ЖИТЬ.
Основана музыкантом Натаном Шварцом, выходцем из Одессы. В 1952 году Шварц приобрел 50% акций небольшой обувной фабрики, простаивавшей в городе Абингтон штата Массачусетс, а через три года выкупил ее полностью. Бизнес был семейным, вместе с Натаном управлением занимались его сыновья Герман и Сидни.
Начальное распространение языка во многом связано с инициативой Министерства обороны США, считавшего Кобол удобным и переносимым языком для обработки данных и требовавшего от производителей реализации Кобола в поставляемых машинах. В 1960-х — начале 1970-х годов стал основным языком разработки деловых и экономических программных систем. Хотя с 1980-х годов считается устаревшим, к 1997 году активно использовалось около 240 млрд строк кода на Коболе, кодом на Коболе обрабатывалось около 90 % финансовых транзакций в мире и 75 % коммерческих транзакций, общая стоимость используемого кода — 2 трлн долларов США; по состоянию на 2020-е годы язык по-прежнему широко используется во многих приложениях, особенно для мейнфреймов. Большая часть современного программирования на Коболе предназначена для поддержки существующих приложений; однако многие крупные финансовые учреждения ещё в 2006 году всё ещё разрабатывали новые системы на языке.
Беглец — рассказ Антона Павловича Чехова. Написан в 1887 году, впервые опубликован в 1887 году в «Петербургской газете» № 26 с подписью А. Чехонте.
Луковый клещ Rhizoglyphus hyacinthi живёт в разлагающемся луке: при попадании на кожу, как это показали Штейн и Павловский, вызывает воспаление и служит причиной кожных поражений крестьян, разводящих в большом количестве лук. Луковый клещ проявляет токсическое действие на кожу. Опыты Е. Н. Павловского и А. Штейна, которые втирали свежую кашицу из луковых клещей, вызывали развитие воспалительного процесса в коже человека. При повторном втирании у людей возникали более тяжёлые местные реакции, а также слабость, быстрая утомляемость, повышение температуры тела до 39° С и т. д.
Ла Лига 2009/2010 (Также именуемая исп. Liga BBVA ввиду спонсорского контракта) — 79-й чемпионат Испании по футболу. Барселона защитила чемпионский титул. Сезон стартовал 29 августа 2009 года и завершился 17 мая 2010 года. В чемпионате участвуют 20 команд. По итогам турнира 3 команды, занявшие последние места, вылетели в Сегунду (Вторая лига Испании по футболу). В итоге 17 мая 2010 года каталонская «Барселона» стала чемпионом Испании. Клуб набрал 99 очков и завоевал свой 20-й чемпионский титул. Мадридский «Реал» набрал на 3 очка меньше. Набранные клубами очки стали рекордыми для чемпионов и вицечемпионов испанского чемпионата, также оба клуба выиграли по 31 матчу, что также является рекордом (как по абсолютному числу побед, так и по доле победных игр от их общего числа — 81,6 %).
Спи́сок расте́ний, занесённых в Кра́сную кни́гу Респу́блики Дагеста́н — перечень (список), утверждённый в соответствии с Законом Республики Дагестан от 16 мая 2008 года № 22 «О Красной книге Республики Дагестан». Данный перечень растительного мира составлен 1 декабря 2008 года. В него входит также список объектов растительного мира, исключённых из первого издания Красной книги Республики Дагестан. Предыдущий перечень, составленный на основании постановления правительства Республики Дагестан от 6 апреля 1998 г. № 65 «О Красной книге Республики Дагестан», признан утратившим силу.
«Боевой киносборник № 9» — девятый фильм серии из тринадцати боевых киносборников, вышедших в годы Великой Отечественной войны. Снимался в павильонах Ашхабадской студии на Киевской киностудии. Киносборник выпущен на экраны 4 мая 1942 года.
Эль (англ. ale) — традиционный английский вид пива. Производится верховым (тёплым) брожением, в результате которого получается сладкий, насыщенный и фруктовый вкус. Исторически этот термин обозначал напиток, сваренный без хмеля. Содержание спирта — 5-6,5 %.
Перепись населения США 2020 года была двадцать четвёртой по счету переписью населения, проводимой на территории США. Днём переписи является 1 апреля 2020 года. Помимо пилотного исследования во время переписи 2000 года, это была первая перепись в США, предлагавшая варианты ответа онлайн или по телефону в дополнение к возможности ответа в бумажной форме, как и в предыдущих переписях. По результатам переписи население США составило 331 449 281 человек. Это на 7,35 % больше по сравнению с переписью населения США 2010 года. В четырёх штатах население превысило 20 млн чел: Калифорния — 39 576 757 чел, Техас — 29 183 290 чел, Флорида — 21 570 527 чел, Нью-Йорк — 20 215 751 чел. Самый малонаселённый штат США Вайоминг — 577 719 чел. Штат с самым высоким относительным приростом населения — Юта, штаты, где население снизилось — Западная Виргиния, Миссисипи, Иллинойс. Плотность населения составила 33,6 чел./км².
(21284) Пандион (лат. Pandion, др.-греч. Πανδίων) — типичный троянский астероид Юпитера, движущийся в точке Лагранжа L4, в 60° впереди планеты. Астероид был открыт 5 октября 1996 года бельгийскими астрономом Эриком Эльстом в обсерватории Ла-Силья и назван в честь одного из персонажей древнегреческой мифологии, а именно — царя Пандиона I.
МЧС России осуществляет около 25 % от общего числа всех проверок в стране.
Не считая слов, унаследованных от праязыкового финно-угорского (и далее — уральского) состояния, наибольший вклад в лексику эстонского языка (до трети от всех слов) внесли германские языки, в основном нижнесаконский (средненижненемецкий язык) в эпоху существования Тевтонского ордена на территории Эстонии и верхненемецкий (в том числе стандартный немецкий язык). Доля заимствований из нижнесаксонского и верхненемецкого языков составляет 22—25 %, только из нижнесаксонского — 15 %.
Город расположен вдоль шоссе № 11, на расстоянии приблизительно 5 километров от границы с Эфиопией, на высоте 238 метров над уровнем моря.
Законом Саратовской области от 24 февраля 2016 года № 21-ЗСО, 20 марта 2016 года, были преобразованы, путём их объединения, Александрово-Гайское, Варфоломеевское, Искровское, Камышковское, Новостепновское и Приузенское муниципальные образования — в Александрово-Гайское муниципальное образование, наделённое статусом сельского поселения, с административным центром в селе Александров Гай.
Рынок мобильных приложений к 2020-м годам уже очень развит и продолжает расти. Доход от приложений для Android и iOS достиг 111 млрд $ в 2020 году, что на 24 % больше по сравнению с предыдущим годом. На iOS пришлось 65 % от общего дохода от приложений в 2020 году.
В списке Всеми́рного насле́дия ЮНЕ́СКО в Росси́йской Федера́ции значатся 32 наименования, это составляет 2,6 % от общего числа (1223 на 2024 год). 20 объектов включены в список по культурным критериям, причём 6 из них признаны шедевром человеческого гения (критерий i), и 11 объектов включены по природным критериям, причём 4 из них признаны природными феноменами исключительной красоты и эстетической важности (критерий vii). В 2023 году Россия занимает 9-е место в мире по общему количеству объектов всемирного наследия, а по числу природных объектов — 4-е наравне с Канадой (после Китая, США и Австралии).
Река образуется слиянием двух почти равноценных притоков в точке с координатами 11°25′ ю. ш. 38°31′ в. д.. Более длинный из них, Луженда, течет с юго-запада. Другой, носящий также имя Ровума, — с запада. Её источник находится на холмистом плато на высоте около 1000 м, строго на востоке от озера Ньяса (10°45′ ю. ш. 35°40′ в. д.) Другие значительные притоки, кроме Луженды, — Мсинже и Лучулинго, текут по широким долинам с юга на север. В нижнем течении река заметно расширяется, образует острова, покрытые лесом, многие из которых обитаемы. В сухой сезон реку можно перейти вброд во многих местах. Ширина устья — около 1600 м. Рувума в нижнем течении, в основном, мелководна, хотя её ширина составляет около 800 м. Там она протекает по болотистым равнинам, по бокам которых возвышаются крутые откосы плато, с которых стекают несколько незначительных притоков. Впадает Рувума в Индийский океан. Длина реки — около 760 км.
Кавказ — горный хребет в северо-восточной части видимой с Земли стороны Луны. Протяжённость хребта, по разным источникам, от 445 до 550 километров. Наивысшая точка находится на высоте около 6000 метров. Кавказ и хребет Апеннины замыкают кольцо вокруг Моря Дождей с востока, отделяя его от Моря Ясности и от Моря Паров в юго-восточном направлении. На севере от гор находится кратер Аристотель, кратер Евдокс расположен в самих горах. Горы расположены в районе, ограниченном селенографическими координатами 30,53° — 44,26° с.ш., 6,06° — 14,27° в.д.
Vueling — второй по величине авиаперевозчик Испании после Iberia Airlines. В 2015 году компания перевезла 24 млн пассажиров с средней заполняемостью кресел в 81 %.
Платановый (также корпус № 6, ранее гостиница № 8) — один из корпусов санатория «Гурзуфский» в Гурзуфе, построенный в 1908 году по проекту архитектора Д. Н. Чичагова для гурзуфского комплекса дач-гостиниц, известного, как Гостиницы Губонина. Памятник градостроительства и архитектуры федерального значения России, согласно законодательству Украины — памятник культурного наследия.
Флаг утверждён 19 августа 2014 года решением Совета депутатов городского поселения Андреевка № 65/14−14 и внесён в Государственный геральдический регистр Российской Федерации с присвоением регистрационного номера 9736.
«Анна Снегина» — автобиографическая поэма Сергея Есенина, написанная в декабре 1924 года. В основу легли воспоминания поэта о том, как он посетил родное село, о революции, о безответной любви в юности. Поэма посвящена А. Воронскому. Впервые отрывки из поэмы были опубликованы весной 1925 года в журнале «Город и деревня». Полностью поэму напечатали в газете «Бакинский рабочий» в № 95 и № 96 первого и третьего мая.
Около 7 % населения являются аборигенами островов Торресова пролива и около 6 % родились за пределами Австралии.
Согласно Закону № 17648 от 22 февраля 1968 года об Аргентине общества авторов и композиторов музыки (SADAIC) — «общество авторов и композиторов (SADAIC) признается в качестве гражданского и частного культурного объединения представительного характера для создателей национальной, популярной или классической музыки, с или без слов, для наследников и преемников музыкантов и зарубежных авторов, с которыми общество связано посредством заключения соглашений о взаимной помощи и представительстве».
В соответствии с Законом № 764 от 27.12.2001 об административно-территориальном устройстве Республики Молдова, в состав Кагульского района входит 55 населённых пунктов, в том числе:
15 апреля 1977 года усадебный комплекс был внесён в реестр охраняемых памятников Малопольского воеводства (№ А-442).
Премьера первого сезона сериала «Локи», состоящего из шести эпизодов, состоялась на стриминговом сервисе Disney+ 9 июня 2021 года, эпизоды транслировались еженедельно по средам, и сезон завершился 14 июля. Второй сезон сериала, состоящий также из шести эпизодов, был выпущен на Disney+ 5 октября 2023 года в 21:00 по EST, премьера эпизодов осуществлялась еженедельно по четвергам, а завершился сезон 9 ноября. Специальный показ второго сезона состоялся 2 октября в Голливуде (Лос-Анджелес) в театре «Эль-Капитан». На сайте-агрегаторе рецензий Rotten Tomatoes сериал получил рейтинг одобрения 92 % со средней оценкой 7,85/10 на основе 340 отзывов. На сайте-агрегаторе Metacritic средневзвешенная оценка сериала составляет 74 балла из 100 на основе 32 отзывов, что указывает на «преимущественно положительные отзывы».
Типичное крымское степное сухоречье, или балка, прежде несущая воду только после таяния снегов и дождей — максимальный зафиксированный (у села Знаменка) расход воды — 29,1 м³/сек. На имеющихся топографических картах, начиная с 1842 года по 1941 год река не обозначена, лишь на карте 1817 года ставший впоследствии руслом овраг несёт название Шаирлы. Судя по доступным источникам, статус реки Победная приобрела после прокладки Северо-Крымского канала, когда русло, в результате наполнения грунтовыми и сбросовыми водами, приобрело постоянный водоток (по номенклатуре канала — главный коллектор СКК № 5 (ГК-5) длина 24,5 км, в том числе по руслу реки 18,0 км; площадь с дренажной сетью 3900 гектаров).
Криптовалюта появилась 18 апреля 2014 года как форк Bytecoin (не путать с Bitcoin). Когда выяснилось, что более 80 % от максимального количества Bytecoin уже распределены, сообщество приняло решение о перевыпуске под названием «Monero», начав с нулевым предварительным майнингом.
