«Об ответственности военнослужащих за сдачу в плен и оставление врагу оружия» — приказ Ставки Верховного Главного Командования Красной армии за № 270, от 16 августа 1941 года, подписанный Председателем ГКО И. В. Сталиным, заместителем председателя В. М. Молотовым, маршалами С. М. Будённым, К. Е. Ворошиловым, С. К. Тимошенко, Б. М. Шапошниковым и генералом армии Г. К. Жуковым. Как и Приказ № 227, полный текст приказа № 270 не публиковался вплоть до приближения краха советской системы и был впервые опубликован лишь в сентябре 1988 года в № 9 «Военно-исторического журнала», имена виновных военачальников и руководимых ими войсковых соединений и целых армий (как в случае со 2-й ударной армией генерала Власова или ЗапОВО генерала Павлова) подверглись забвению на многие десятилетия, даже их беглые упоминания в мемуарах возможны были только с негативной оценкой, как дезертиров и предателей, попытки оправдательной оценки или беспристрастного исследования причин неудач натыкались на военную цензуру, объяснявшую сдачу в плен виновностью сдавшихся, а не некомпетентностью верховного командования или сложившейся неблагоприятной боевой обстановкой на фронте.
Муниципальный герб утверждён 24 апреля 2009 года решением Совета депутатов муниципального образования «Сенгилеевское городское поселение» № 010-ЗО «О гербе и флаге Ульяновской области».
Изначально Фонд должен был действовать до 1 января 2013 года, после чего подлежал ликвидации. Позже было принято решение продлить его работу до 2015 года. 16 апреля 2012 года председатель Правительства РФ и избранный Президент РФ Владимир Путин заявил, что работа Фонда может быть продлена и после 2015 года (согласно п. 23 ст. 1 Федерального закона от 25.12.2012 № 270-ФЗ «О внесении изменений в Федеральный закон „О Фонде содействия реформированию жилищно-коммунального хозяйства» — до 1 января 2016 г.). 28 ноября 2018 года Президент РФ Владимир Путин подписал закон, продлевающий работу фонда до 1 января 2026 года.
Географические координаты Земельного суда Фельдкирха: 47°14′11″ с. ш. 9°35′34″ в. д.
По переписи 2002 года население — 30 человек (16 мужчин, 14 женщин). Преобладающая национальность — русские (97 %).
О́стров Буве́ (норв. Bouvetøya) — необитаемый вулканический остров в южной части Атлантического океана. Расположен на южном конце Срединно-Атлантического хребта, площадь — 49 км², 93 % территории покрыто ледниками. Зависимая территория (норв. biland) Норвегии. Один из самых отдалённых от материков островов в мире (после острова Пасхи и островов Тристан-да-Кунья).
В среднем за ночь цикл быстрого/медленного сна повторяется четыре или пять раз. Механизм смены фаз сна до конца не изучен, но есть исследования, согласно которым смена фаз сна может происходить благодаря нейронному переключателю, находящемуся в продолговатом мозге. Продолжительность каждой последующей фазы увеличивается, а глубина сна снижается. Фазы быстрого сна составляют 20—25 % ночного сна, около 90—120 минут, одна фаза длится 10—20 минут и чередуется с фазой медленного сна. Замечено, что общая относительная продолжительность БДГ-сна больше после стресса, испытанного за день (например, у студентов во время учёбы БДГ занимает бо́льшую долю времени), а доля не-БДГ-сна возрастает при физических нагрузках. В фазе быстрого сна более крупные группы мышц находятся в расслабленном состоянии, а деятельность мозга активизируется. Около 85 % подопытных, разбуженных через 4 минуты после начала БДГ-фазы, заявляют, что видели красочные сны. В этой фазе наблюдается интенсивное, с возрастающей амплитудой, движение глазных яблок.
Один из богатейших предпринимателей России (до марта 2022 года) и жителей Великобритании. В 2019 году газета The Times объявила Фридмана богатейшим жителем Лондона с состоянием в $15 млрд. В 2021 году журнал Forbes поставил Михаила Фридмана на 11-е место в списке богатейших предпринимателей России с состоянием в $15,5 млрд. В 2022 году Forbes оценил состояние Михаила Фридмана в $11,8 млрд, что соответствует шестой позиции в рейтинге российских миллиардеров. В 2023 году Фридман также занял 140-е место в мировом рейтинге миллиардеров от Forbes.
Традиционно в США доля ипотечных кредитов с высокой долей риска находилась на низком уровне в 8 %; в 2004—2006 годах она выросла до приблизительно 20 % от общего числа выданных ипотечных кредитов (и даже выше в некоторых регионах США). Значительную часть (в 2006 г. более 90 %) составляли кредиты с плавающей процентной ставкой. Увеличение доли субстандартных кредитов было одним из проявлений более общей тенденции снижения стандартов кредитования, а также вывода на рынок более рискованных ипотечных продуктов. При этом потребительское кредитование в США приобретало всё большую популярность: в конце 2007 г. доля долговых обязательств от общей суммы располагаемого личного дохода выросла до 127 % (в 1990 г. она составляла 90 %), что в значительной мере было вызвано широким распространением ипотечного кредитования.
«Too Good» — песня, записанная канадским певцом и композитором Дрейком с его 4-го студийного альбома Views вышедшая 26 июля 2016 года в качестве пятого сингла на лейблах OVO, BBK, Young Money, Cash Money и Republic при участии Рианны. Песня была написана Aubrey Graham, Robyn Fenty, Paul Jefferies, Maneesh Bidaye, Dwayne Chin-Quee, Andrew Hershey, Andre Sutherland, A. Martin, продюсеры Nineteen85 и Supa Dups. Сингл занял позицию № 3 в хит-параде Великобритании (UK Singles Chart) и вошёл в двадцатки лучших во многих странах мира. Тираж сингла в Великобритании (и в США) превысил 0,6 млн копий и он получил платиновый статус.
First Financial Holding — тайваньская холдинговая компания, в её холдинг входят First Commercial Bank, страховая компания First Life Insurance и компании, предоставляющие финансовые услуги. Крупнейшим акционером является Министерство финансов Китайской Республики (21,5 %). В списке крупнейших публичных компаний мира Forbes Global 2000 за 2021 год заняла 1042-е место (в том числе 297-е по активам).
В списке Всеми́рного насле́дия ЮНЕ́СКО в Росси́йской Федера́ции значатся 32 наименования, это составляет 2,6 % от общего числа (1223 на 2024 год). 20 объектов включены в список по культурным критериям, причём 6 из них признаны шедевром человеческого гения (критерий i), и 11 объектов включены по природным критериям, причём 4 из них признаны природными феноменами исключительной красоты и эстетической важности (критерий vii). В 2023 году Россия занимает 9-е место в мире по общему количеству объектов всемирного наследия, а по числу природных объектов — 4-е наравне с Канадой (после Китая, США и Австралии).
Командуя одним из двух португальских кораблей, впервые в истории европейских географических открытий, пересëк Тропик Рака (23° 26′ 22″ севернее экватора) в ходе морского путешествия вдоль африканского побережья на юг.
Фулуфьеллет — это высокое плато, пронизанное множеством горных рек, впадающих в более крупную Далэльвен, создающее уникальный ландшафт местности. Парк в основном состоит из голых горных вершин и альпийских лугов, характерных для шведских гор, 65 % территории занимает тундра. Голые горы, покрытые лишайником, перемежаются глубокими долинами, где растут древние хвойные леса. Одним из символов парка является птица кукша.
Льезо́н (фр. liaison «связь, соединение») — жидкая смесь яиц, молока (или сливок) и воды или желтков и сливок (для белых соусов); обеспечивает связку пищевого продукта. Другие виды льезона — желатин, трагант, гуммиарабик, агар-агар, крахмалы. Способ введения льезонирующего продукта в блюдо зависит от его вида: белки взбивают до состояния твердой пены и осторожно вводят в основной продукт; крахмалы и желатин разводят в холодной воде, затем желатин смешивают с основным продуктом, подогревают до 40—50°С и остужают, а крахмал вливают при помешивании в кипящий основной продукт и кипятят 1—2 минуты до загустения.
Период обращения вокруг Солнца составляет ок. 55,5 тыс. лет. Плоскость орбиты (i) наклонена на 55,7197°. Астероид пересекает орбиты Юпитера, Сатурна, Урана и Нептуна.
Заболеваемость ВИЧ-инфекцией среди взрослых в Европе в 2018 году варьируется от 1,4% в некоторых регионах европейской части России (Самарская и Оренбургская области) до 0,1% в одиннадцати странах. Из-за высокой доступности антиретровирусной терапии, смертность от СПИДа остаётся на достаточно низком уровне с момента введения ингибиторов протеазы и комбинированной терапии в конце 90-х годов XX века. По некоторым данным, в 2018 году 14% инфицированных получили ВИЧ в результате внутривенного приёма наркотиков.
По данным статистики Федерального управления гражданской авиации США услугами аэропорта в 2007 году воспользовалось 1 018 человек, что на 22 % (1 305 человек) меньше по сравнению с предыдущим годом.
В 2019 году 26,8 % мирового энергопотребления было удовлетворено из возобновляемых источников энергии (из которых большая часть (16 %) составляет гидроэнергетика).
Петтинг получил распространение в странах, где девственность женщины особо ценилась в силу требований норм морали. Также петтинг часто практикуется молодёжью, причём как в качестве самостоятельной формы половой жизни (при условиях нередкого сочетания с вагинальным сексом), так и при обстоятельствах, исключающих возможность совершения полового акта (например, до вступления в брак). Согласно исследованиям Альфреда Кинси, 91 % женщин в возрасте до 25 лет до брака практиковали петтинг, при этом 39 % испытывали в результате петтинга оргазм. Американские сексологи Уильям Мастерс и Вирджиния Джонсон, проведя опрос среди большого количества студентов-первокурсников, установили, что 82 % опрошенных осуществляли петтинг, причём у 40 % девушек и 50 % юношей из числа опрошенных данные сексуальные ласки вызвали оргазм. 
Абдугали Байжуманов, другой вариант имени — Абдигали (каз. Әбдіғали Байжұманов; 1912 год — дата и место смерти не известны) — передовик производства, старший машинист котельного цеха Карагандинской ТЭЦ № 1 Карагандаэнерго Министерства энергетики и электрификации Казахской ССР. Герой Социалистического Труда (1966).
Законом Саратовской области от 24 апреля 2013 года № 63−ЗСО Белоярское и Малоозёрское муниципальные образования преобразованы путём их объединения во вновь образованное муниципальное образование «Белоярское муниципальное образование Новобурасского муниципального района Саратовской области» наделённое статусом сельского поселения.
Климат окрестностей водохранилища — умеренно-тёплый, характерный для сухих степей. Среднегодовая температура равна 12,9 °C, средняя температура июля 23-26 °C, максимальная может достигать 37-40 °С. Зимой температуры держатся около нуля. Ежегодно выпадает 350—600 мм осадков (по другим данным — 240—390 мм). Испарение равно 700—1100 мм. Среднегодовая влажность воздуха — 67 %.
Берхампур, Бахарампур (англ. Baharampur) — город в индийском штате Западная Бенгалия. Административный центр округа Муршидабад. Средняя высота над уровнем моря — 18 метров. По данным всеиндийской переписи 2011 года, в городе проживало 305 609 человек, из которых мужчины составляли 51,20 %, женщины — соответственно 48,80 %. Уровень грамотности взрослого населения составлял 88,38 %. Уровень грамотности среди мужчин составлял 90,98 %, среди женщин — 85,66 %. 7,58 % населения было моложе 6 лет.
У юго-западного подножья горы находится Змейкинское месторождение углекислых гидрокарбонатно-сульфатных кальциево-натриевых вод с минерализацией 3,2—5,6 г/л. Основная их часть добывается с помощью скважины с глубины 1482 м. Температура воды на устье скважины 70—74° С, дебит — 9 л/c.
Уран — радиоактивный элемент, он не имеет стабильных изотопов. Самыми распространёнными изотопами урана являются уран-238 (имеет 146 нейтронов, период полураспада 4,47⋅109 лет, в природном уране составляет 99,2742 %) и уран-235 (143 нейтрона, период полураспада 7,13⋅108 лет, содержание в природном уране 0,7204 %).
Другим вариантом иллюзии Вундта является горизонтально-вертикальная иллюзия, описанная Вундтом в 1858 году. Две пересекающиеся линии равны по длине, хотя при этом вертикальная кажется длиннее горизонтальной примерно на 30 %. Это относится не только к восприятию картинок, но и предметов в естественной обстановке.
Протекает по низменности, сложенной породами осадочного происхождения, высоты которой не превышают 100 метров над уровнем моря. Среднегодовое количество осадков равно 1050 мм. Климат влажный, средняя температура составляет 18 °C. Природа представлена злаковыми степями, в некоторых местах сохранились остатки сельвы.
Дом Каменнова — двухэтажное здание середины XIX века, расположенное в центре города Таганрога по адресу Итальянский переулок, 27. Объект культурного наследия регионального значения Решение № 301 от 18.11.92 г.
27 февраля 1918 г. № 34 «Газеты Рабочего и Крестьянского Правительства» было опубликовано Постановление Высшего Совета Народного Хозяйства «Об объявлении государственной собственностью Николае-Павдинского горного округа».
Социальная значимость выделения СПП из всей популяции студентов обусловлена двумя фактами. Во-первых, СПП находятся в сравнительно неблагополучном положении как с точки зрения их образовательных результатов, так и социально-экономического статуса их и их семей. Во-вторых, значимость проблемы обусловлена её масштабом: доля СПП среди всех студентов в мире колеблется от 30 % в Канаде до 70 % в Италии и Португалии. В России по последним замерам доля СПП составляет около 45 % среди всех студентов. К тому же, СПП являются признаком восходящей социальной мобильности и уменьшения образовательного неравенства. Но для СПП, которые отчисляются из университетов, социальной мобильности не происходит. Как следствие, образовательное неравенство не уменьшается.
По состоянию на 2008 год известно 13 колец. В порядке увеличения расстояния от планеты они расположены так: 1986U2R/ζ, 6, 5, 4, α, β, η, γ, δ, λ, ε, ν и μ. Минимальный радиус имеет кольцо 1986U2R/ζ (38 000 км), максимальный — кольцо μ (приблизительно 98 000 км). Между основными кольцами могут находиться слабые пылевые кольцевые скопления и незамкнутые дуги. Кольца чрезвычайно тёмные, альбедо Бонда для входящих в них частиц не превышает 2 %. Вероятно, они состоят из водяного льда с включениями органики.
НУТЭП — контейнерный терминал, осуществляющий перевалку контейнерных, генеральных и ро-ро грузов в порту Новороссийска. Первый по перевалке контейнеров в Новороссийске (доля НУТЭП в 2022 году составила 76,3%). Мощность терминала составляет 700 тыс. TEU в год. Построен в 2002—2004 годах, входит в структуру стивидорного холдинга «ДелоПортс».
