Ти́хоновка (до 1948 года Тихоновка и Казённый участок № 4; укр. Тихоновка, крымскотат. Tihonovka, Тихоновка) — исчезнувшее село в Красноперекопском районе Республики Крым, располагавшееся на севере района, на Перекопском перешейке, на северном берегу озера Старое, примерно в 2,5 км к северо-востоку от современного села Почётное.
Натуралист (англ. Naturaliste) — небольшой марсианский ударный кратер, расположенный на плато Меридиана на Марсе. Координаты кратера — 1°57′57″ ю. ш. 5°30′48″ з. д.1,9659778° ю. ш. 5,5134500° з. д.﻿ / -1.9659778; -5.5134500. Кратер был осмотрен с восточного края марсоходом «Оппортьюнити» 24 февраля—3 марта 2005 года (387—394 сол с момента посадки): в этот период времени марсоход делал панорамные снимки кратера и близлежащей местности, делал подробные снимки горных обнажений (которые были выброшены при ударе) около кратера при помощи микрокамеры, изучал геологический характер поверхности при помощи панорамной камеры, которая фотографирует с использованием различных светофильтров, а также предпринимал попытки запечатлеть марсианские облака, однако его действия успехом не увенчались. В результате осмотра горных обнажений, на их поверхности были обнаружены шароподобные конкреции гематита, которые наблюдались и ранее в кратере Игл. Диаметр кратера составляет порядка 8 метров, а глубина около 2,5 м. Высота края и толщина слоя выброса не превышает 0,5 м. Находится примерно в 1 км южнее от гораздо большего по размеру, кратера Эндьюранс и в 2788 м севернее от кратера Эребус. Совсем рядом с данным кратером расположено ещё 2 кратера — Географ и Инвестигатор. Эти кратеры, вместе с кратером Натуралист, получили прозвище «кратеры-тройняшки» (англ. Triplet craters), так как вероятнее всего образовались от одного космического тела, развалившегося перед ударом о поверхность на несколько частей.
В 2022 году страна одержала победу на Евровидение-2022 с результатом в 631 балл благодаря хип-хоп группе Kalush с песней «Stefania», установив рекорд Евровидения по голосам зрителей — 439 баллов (93,8 % от всех возможных). Трансляция конкурса проходила на канале UA:Культура, в связи с тем, что на телеканале UA: Первый шла трансляция информационного марафона освещающего вторжение России на Украину.
Природная доломитовая мука залегает среди доломитов, доломитизированных известняков, дедоломитов, других минералов и является продуктом их разрыхления и выщелачивания при выветривании. Она на 30 — 32% состоит из оксида кальция и на 18 — 20% — из оксида магния. Также доломитовая мука производится путём переработки карбонатных пород. В доломитовой муке содержатся фосфор, кобальт, цинк, марганец, медь, железо. Кроме раскислителя почвы, доломитовая мука применяется как сорбент для очистки загрязнённых нефтепродуктами сточных вод, пищевая добавка для скота, компонент строительных материалов.
Условное наименование — войсковая часть № 32364 (в/ч 32364). Сокращённое наименование — 11 гв. одшбр.
Окончил Московскую консерваторию (1929), ученик Константина Сараджева. Работал с духовыми оркестрами, в 1939—1952 гг. дирижёр Симфонического оркестра Всесоюзного радио и телевидения, возглавлявшегося в это время Николаем Головановым. Среди значительных записей Горчакова с этим коллективом — Концерт для фортепиано с оркестром № 20 Вольфганга Амадея Моцарта и Фантазия для фортепиано, хора и оркестра Людвига ван Бетховена с Марией Юдиной, Фантазия на темы Рябинина Антона Аренского с Марией Гринберг, его же фортепианный концерт с Григорием Гинзбургом, скрипичный концерт Сергея Ляпунова с Юлианом Ситковецким.
Проект запущен в ноябре 2014 года в объёме 6 бортов, которые будут иметь на 30 % бо́льшую ёмкость, чем существующая модель. XL способна доставлять две консоли крыла A350 XWB вместо одного. О завершении проектных работ было сообщено 16 ноября 2015 года. Окончательная сборка началась в 2017 году, а эксплуатация — в 2019 году.
Географические координаты Земельного суда Рид-им-Иннкрайс: 48°12′16″ с. ш. 13°29′14″ в. д..
Футбольный фонд мира Санмун (англ. Sunmoon Peace Football Foundation, SPFF или др. название Sun Moon Soccer Foundation) — футбольный фонд в Сувоне, Южная Корея, основанный Мун Сон Мёном в 2002 году и сотрудничающий с Министерством культуры, спорта и туризма Республики Корея. Фонд организовывает Мировой кубок, деньги на призовой фонд которого ($2 млн за первое место и $ 500 тыс. за второе) выделяются ФИФА, а также фонд владеет ведущим клубом «Соннам Ильхва Чхонма» и бразильскими СЭНЭ и «Атлетико Сорокаба». Сам Мун Сон Мён верит в примиряющую силу футбола и организовывал через свою ВАНПО, совместно с Управлением Верховного комиссара Организации Объединённых Наций по делам беженцев товарищеские матчи в смешанных командах между враждующими суннитами и шиитами, и христианами. Также фонд устраивает чемпионат Всемирный кубок короля мира и женский чемпионат Кубок королевы мира (Peace Queen Cup).
Pheidole infernalis  (лат.) — вид муравьёв рода Pheidole из подсемейства Myrmicinae (Formicidae). Неотропика: Боливия (Parque Nacional Noel Kempff Mercado, 14°48’S 60°23’W). Обнаружен в подстилочном слое дождевого тропического леса на высоте 700 м. Мелкие муравьи (1—2 мм) желтовато-коричневого цвета с характерными большеголовыми солдатами. На проподеуме имеются шипы. Усики рабочих и самок 12-члениковые (13 у самцов) с 3-члениковой булавой. Ширина головы крупных рабочих (HW) — 0,72 мм (длина головы — 0,74 мм). Ширина головы мелких рабочих — 0,48 мм (длина головы — 0,52 мм). Pheidole infernalis относится к видовой группе Pheidole flavens Group и сходен с видами Pheidole ademonia, Pheidole peltastes, Pheidole sospes и Pheidole termitobia.
Во время La Niña температура поверхности моря в восточной экваториальной части центральной части Тихого океана становится ниже нормы на 3-5 °C (5,4-9 °F). Проявление La Niña часто сохраняется дольше пяти месяцев. El Niño и La Niña могут быть индикаторами изменений погоды по всему миру. Атлантические и тихоокеанские ураганы могут иметь разные характеристики из-за более низкого или более высокого сдвига ветра и более низкой или более высокой температуры поверхности моря. В настоящее время никто не может отследить принципы вышеуказанных явлений, чтобы описать их более точно.
Группа в значительной степени контролируется Правительством Польши, которому по состоянию на 2 ноября 2016 г. принадлежало 57,39 % акционерного общества.
Официальная история геологической службы Украинской Советской республики началась 1 февраля 1918 года. Государственная служба геологии и недр Украины образована путём реорганизации Министерства охраны окружающей природной среды Украины в соответствии с Указом Президента Украины от 09 декабря 2010 № 1085/2010 «Об оптимизации системы центральных органов исполнительной власти».
Средняя, основная группа, расположена над ущельем, на правобережном покатом склоне, где около десятка грифонов разной мощности изливают воду с температурой до 97 °C. На этих термах устроены купальни.
Герб утверждён решением улусного Собрания муниципального образования «Эвено-Бытантайский национальный улус» № 16-10 от 21 января 2005 года.
В соответствии с отчётом Национального агентства гражданской авиации Бразилии в 2009 году доля пассажирских перевозок TAM Airlines в стране составила 45,60% на внутренних маршрутах и 86,47% на международных рейсах. С сентября 2010 года статистические данные учитывают объёмы пассажирских перевозок всего авиационного холдинга «TAM Group», в состав которого входят авиакомпании TAM Airlines и Pantanal Linhas Aéreas, а в ноябре 2010 года указанные показатели для внутренних и международных авиаперевозок составили 42,66% и 87,64% соответственно.
Законом Удмуртской Республики от 28 апреля 2021 года № 36-РЗ упразднено в связи с преобразованием Шарканского района в муниципальный округ.
Такие звёзды достаточно распространены в Млечном Пути (этот класс представляет 15 % звёзд в окрестностях Солнца) и живут очень долго. Концепция ультрахолодных карликов была введена в 1997 году Киркпатриком, Генри и Ирвином.
Поиск Mail, ранее Поиск Mail.ru — работавшая до 2-го ноября 2022 года поисковая система от VK. По данным на январь 2022 года на рынке Рунета она занимала долю около 1,0 — 1,4 % (третье место в рейтинге поисковых систем на российском рынке). С 1 марта 2010 года руководителем Поиска Mail.ru является Андрей Калинин.
«Новое Варшавское утро» — газета. Издавалась в Минске ежедневно, кроме понедельника, в 1915—1917 гг. на русском языке, принадлежала М. Дворжацу. Редактор И. Я. Радштэйн. с февраля 1916 по ноябрь 1917 гг. — М. Ш. Усман. До Февральской революции имела исключительно информационно-коммерческое содержание. Освещала городскую жизнь (рубрика «Минск»), событий на фронтах («Сообщения из Ставки», «На фронте и в тылу»). Вмещала правительственные распоряжения и приказы местных властей. С марта 1917 г. приобрела политическую окраску. В новых рубриках «Партийная жизнь», «Рабочая жизнь», «По краю», «По губерниям» и др.., Освещала ход установления нового строя, формирования и деятельности национальных движений, партийных, общественно-политических, профессиональных и других организаций. Сообщала о важнейших событиях общественно-политической жизни России. Не заявляя о своей принадлежности к определённой социалистической партии, объявила программой деятельности платформу Петроградского Совета (№ за 25 июня). Вела идейную борьбу против местных сионистов и кадетов. На выборах в городскую думу поддерживала кандидатский список социал-демократов. Октябрьскую революцию встретила враждебно. С 7 по 17 апреля в Минске проходил созванный по инициативе городского Совета первый съезд военных и рабочих депутатов армий и тыла Западного фронта. Вот как представила 8 апреля его открытие местная буржуазная газета «Новое варшавское утро». С утра в городе необыкновенное оживление. Солдатские депутаты, встречаемые на улицах криками «ура», подъезжают к городскому театру на автомобилях-платформах. «Серые герои» (так раньше называли солдат) — теперь граждане республики. В связи с высылкой большевистскими властями из Минска М. Ш. Усмана в декабре 1917 года издание газеты остановлено.
Законом Курганской области от 12 мая 2021 года № 49 к 24 мая 2021 года упразднён в связи с преобразованием муниципального района в муниципальный округ.
PBZ Zagreb Indoors 2009 — 6-й розыгрыш ежегодного профессионального теннисного турнира среди мужчин, проводящегося в хорватском городе Загреб, и являющегося частью Тура ATP в рамках серии ATP 250. Турнир прошёл с 2 по 8 февраля. Приз открывал серию турниров в регионе. Первым номером посева в одиночном турнире стал Игорь Андреев (№ 19 в мире на тот момент).
В 1949 году был кандидатом от консерваторов на президентских выборах. Либералы выборы бойкотировали из-за убийства своего кандидата Хорхе Эльесера Гайтана и жестокого подавления президентом-консерватором Мариано Оспиной Пересом восстания Боготасо. Хотя Гомес остался единственным кандидатом на выборах, голосование всё же состоялось; явка составила 39,8%. 7 августа 1950 года Гомес вступил в должность.
Крымская автономия в составе Украины была образована законом УССР от 12 февраля 1991 № 712-XII как Крымская Автономная Советская Социалистическая Республика.
По переписи 2002 года население — 38 человек (18 мужчин, 20 женщин). Преобладающая национальность — русские (97 %).
Границы города примерно совпадают с одноимённым избирательным округом. Как и большинство сельских жителей провинции Альберта, Уэтаскивин очень консервативен при голосовании. На канадских выборах 2004 г. местный кандидат от консерваторов получил почти 74 % поданных голосов, а кандидат от либералов — чуть меньше 12 %.
Вклад туризма в ВРП Краснодарского края по состоянию на 2010 год составил, по самым строгим расчётам, 14,2%. Для сравнения, по России в целом вклад туризма в ВВП был на уровне 1,3%. Край традиционно привлекает любителей санаторно-курортного, пляжного, гастрономического и горного видов туризма. В тройку самых популярных направлений края входят приморские города Сочи, Геленджик и Анапа. При этом каждый третий турист в крае приезжает именно в Сочи. Во всероссийском масштабе данный город занимает 4-ю строчку по посещаемости россиянами по данным за 2014 год.
Картофельные чипсы являются преобладающей частью рынка закусок и полуфабрикатов в западных странах. Мировой рынок картофельных чипсов в 2005 году составлял 16,49 млрд долларов. В 2017 году этот показатель составил 35,5 % от общего объёма закупочных закусок (46,1 млрд долларов).
По данным социологического опроса, проведённого ВЦИОМ в декабре 2017 года, 61 % опрошенных россиян считали Конституцию Российской Федерации документом полностью или скорее отвечающим нуждам страны и её народа.
В США и Евросоюзе к составу продукта предъявляются жёсткие требования. В частности, установлено, что содержание масла какао не может составлять менее 20 %. В отличие от классического шоколада, белый шоколад не содержит какао-порошка.
Герб Малопольского воеводства (пол. Herb województwa małopolskiego) — один из официальных символов Малопольского воеводства Польши. Утверждён Постановлением Сеймика Малопольского воеводства № VIII / 73/99 от 24 мая 1999 года.
Общая длина береговой линии Одессы — 30 км. Протяжённость пляжей от Черноморки до Крыжановки — около 20 км, площадь — 42,65 га, в том числе 23,7 га — искусственные пляжи, намытые в рамках борьбы с оползнями. Естественные пляжи находятся только в районах Лузановки и Черноморки. Длина берегозащитных сооружений — 13,5 км. Ежегодно шторма вымывают с пляжей до 5 % песка.
6 октября 1944 года лодка была потоплена в Яванском море в районе с координатами 6°20′ ю. ш. 111°28′ в. д. торпедой голландской субмарины HrMs Zwaardvisch. 23 члена экипажа погибли, 27 были спасены.
Абдул Джаббар Аль-Окейди (араб. عبد الجبار العكيدي‎) — сирийский повстанческий лидер, представитель «умеренной оппозиции», командир Сирийской свободной армии в Алеппо, полковник. На начало конфликта служил в армии Башара Асада, но затем поднял мятеж и перешел в оппозицию. По его собственному заявлению, в Алеппо под его началом сражалось 17 тыс. бойцов. В августе 2012 года заявлял, что его бойцы контролируют 60 % Алеппо. В 2013 году отказался от руководства сирийской оппозицией. В 2014 году заявлял Би-Би-Си, что его бойцы поддерживают курдов в борьбе с ИГИЛ. В 2016 году выступил с критикой США, которые, по его мнению, поддержали ИГИЛ.
Население по данным переписи 2011 года составляет 571 936 человек, из них 285 599 мужчин и 286 337 женщин. По данным переписи 2001 года население насчитывало 481 976 человек. Примерно 48 % населения считают родным язык авадхи, 18 % — урду, 17 % — языки тхару и 17 % — непали. 80,62 % населения исповедуют индуизм; 18,16 % — ислам; 0,87 % — буддизм и 0,19 % — христианство.
