Референдум о введении налога на алкоголь в Лихтенштейне был проведён 26 мая 1929 года. Предложение было одобрено 53,9 % избирателей.
Средняя температура в январе −43 °C, в июле 19 °C. В год выпадает около 200 мм осадков, в основном, летом. Основные природные лечебные факторы озера — сульфидная иловая грязь и хлоридно-гидрокарбонатная натриевая рапа. Высота над уровнем моря — 159 м.
Население по данным переписи 2002 года — 52 человека (25 мужчин, 27 женщин). Преобладающая национальность — русские (96 %).
Фильм установил исторические рекорды сборов: в первый уикенд проката в США ($248 млн) и во всем мире ($529 млн); мировые сборы $1 млрд за двенадцать дней.
После изменения Конституции России предыдущим созывом Госдумы, шестой созыв был избран на 5 лет. Выборы проводились по пропорциональной системе — все 450 депутатов избирались по партийным спискам. На выборах в Госдуму по итогам голосования ЛДПР получила 11,68 %, что дало ей право на 56 депутатских мандатов.
Большая глина № 4 (англ. Big Clay #4) — скульптура швейцарского художника Урса Фишера, презентующая акт творения, созидания, преображения. Создана в 2013—2014 г. Выставлялась в Нью-Йорке (2015 г.) и Флоренции (2017 г.). В августе 2021 г., незадолго до открытия центра современного искусства «Дом культуры ГЭС-2», была установлена перед его входным комплексом, на Болотной набережной Москвы, и вызвала крайне неоднозначную оценку.
Закон о защите государства (болг. Законът за защита на държавата) — законодательный акт, принятый 4 января 1924 года и вступил в силу с Указом №2 23 января 1924 года. 
Разработана конструкторским бюро опытного завода № 100 в 1944 году под руководством Жозефа Яковлевича Котина, главного конструктора отечественных тяжёлых танков и САУ того времени. Поводом для создания САУ стало правительственное задание по установке на самоходную базу 122-мм и 152-мм пушек повышенной мощности по сравнению со штатными орудиями Рабоче-крестьянской Красной армии (РККА) этих калибров (152-мм гаубица-пушка образца 1937 года (МЛ-20) и 122-мм пушка образца 1931/1937 года (А-19)). Наряду с точно соответствовавшей этому заданию опытной САУ ИСУ-122-1 было решено попытаться установить на шасси ИСУ морское орудие калибра 130 мм. Центральное артиллерийское конструкторское бюро Народного комиссариата вооружений (ЦАКБ НКВ) под руководством Василия Гавриловича Грабина успешно выполнило работы по переделке морской 130-мм пушки Б-13 в самоходную, которая получила индекс С-26. Это орудие было установлено на шасси ИСУ-122С вместо штатной 122-мм пушки Д-25С. Позже с целью унификации боеприпасов с сухопутными орудиями был выпущен его вариант С-26-1 калибра 122 мм, который также испытывался на опытной САУ ИСУ-122-3.
Устецкий край (чеш. Ústecký kraj) — административная единица Чешской республики, расположен на северо-западе исторической области Богемия. Площадь территории края составляет 5334 км² (6,8 % площади Чехии). В крае расположено 354 населённых пункта, в том числе 46 городов.
С 1985 года А. Н. Талалаенко профессор кафедры фармакологии. На протяжении 1978—1984 годов — был заместителем декана. С 1984 года — был деканом лечебного факультета № 2. С 1987 года занимал должность проректора по учебной работе, а с 2005 года — первого проректора Донецкого государственного медицинского университета (до 2012 г.) и заведующего кафедрой фармакологии (до 2014 г.).
Национальные парки Германии — это ландшафты, которые служат делу сохранения природного многообразия редких видов растений и животных и имеют большое значение для биологического разнообразия. На май 2015 года в Германии насчитывается 16 национальных парков. Общая площадь всех парков составляет 10 478 км². Исключая морские территории Северного и Балтийского морей — это 2145 км², что составляет 0,6 % наземной территории Германии.
Население — 200 567 человек (2019), с пригородами — 1,3 миллионов (в районе живёт более 60 % населения Юты).
Президентские выборы в Уганде проходили 9 мая 1996 года. Они были первыми в стране. Победу одержал Йовери Кагута Мусевени, получив 75,5% голосов. В это время политические партии в Уганде были запрещены, поэтому все кандидаты выдвигались как независимые. Явка составила 72,3%.
Котловина озера вытянута с запада на восток. Склоны котловины суглинистые, высотой 12—15 м, на юго-востоке поросли лесом. Береговая линия извилистая, создаёт большое количество заливов и мысов. Глубины до 2-х метров занимают около 30 % площади. Берега низкие (0,3—0,5 м). Мелководье песчаное и песчано-галечное, глубже дно выстлано кремнеземистым сапропелем.
Серчхип (англ. Serchhip) — округ в индийском штате Мизорам. Образован 15 сентября 1998 года. Административный центр — город Серчхип. Площадь округа — 1422 км². По данным всеиндийской переписи 2001 года население округа составляло 55 539 человек. Уровень грамотности взрослого населения составлял 95,1 %, что значительно выше среднеиндийского уровня (59,5 %). Доля городского населения составляла 48 %.
Своё название метод получил за схожесть записываемых при вычислении строк с силуэтом одноименного судна. При этом косые чёрточки, которые использовались для зачёркивания цифр, напоминали вёсла. Иногда для получения сходства рисунок надо повернуть на 90°.
Площадь — 54 км². Население — 71 750 человек (2020 г.). Большинство населения составляют темнокожие (53,8 %) и мулаты (7,5 %), потомки африканских рабов, 31 % — выходцы из Европы и Северной Америки, 7,7 % — азиаты и индейцы.
Заезды состоялись в расположенной неподалёку от Альбервиля деревне Ла-Плань, строительство санно-бобслейной трассы началось там ещё в 1988 году, в декабре 1990-го объект был сдан в эксплуатацию. Протяжённость трассы составляла 1250 м со средним перепадом высот 8,8 %, при этом женщины стартовали чуть ниже — для них дистанцию укоротили до 1143 м при перепаде высот 8,9 %.
Варуна имеет вытянутую форму — 859×453 км, прежняя оценка диаметра Варуны — около 1060 км. Эксцентриситет орбиты — 0,051, большая полуось орбиты — 43,129 а. е., перигелий — 40,915 а. е., афелий — 45,335 а. е., орбитальный период — 283,20 года. Угол наклона к плоскости эклиптики — 17,2°. Масса ~5,9⋅1020 кг. Предположительно состоит из смеси пористых пород с низкой плотностью (плотность ~1 г/см³). Цвет поверхности — умеренно красный, но чрезвычайно тёмный (альбедо <0,04).
В 1965 году здание было внесено в реестр памятников культуры Малопольского воеводства (№ А-173).
Первым номером посева в одиночном турнире стала Кимико Датэ-Крумм (№ 55 в мире на тот момент).
Детский музей открытки — уникальное собрание более 500 000 открыток, расположенное в Санкт-Петербурге, в доме № 2 на Пионерской улице (Петроградская сторона, станция метро «Спортивная»). Создатель музея — известный петербургский филокартист Виталий Петрович Третьяков.
Бигби Волк (англ. Bigby Wolf) — вымышленный персонаж и главный герой американской серии комиксов Fables, выпускаемой DC Comics и её импринтом Vertigo. Бигби впервые появился в Fables № 1, вышедшем в июле 2002 года. Создателями персонажа являются Билл Уиллингем и Лан Медина. Он также выступает в качестве главного героя в графическом романе Fables: Werewolves Of The Heartland и комиксе Fables: The Wolf Among Us, являющемся адаптацией видеоигры The Wolf Among Us.
Космос-47 — испытание прототипа космического корабля «Восход». Запущен 6 октября 1964 года — корабль серии «Восход 3КВ № 2» — в беспилотном варианте.
Имеет US$ 422,316 млрд активов под управлением (2017).
Хамси́н (араб. خمسين‎ — «пятьдесят») или хамасин (араб. خماسين‎) — сухой, изнуряюще жаркий местный ветер южных направлений на северо-востоке Африки (Египет, Судан) и в странах Ближнего Востока (см. Климат Израиля). Температура воздуха нередко превышает +40  °C, при штормовой силе ветра.
Закон Курганской области от 1 декабря 1997 года № 90 «О гербе и флаге Курганской области» (принят Курганской областной Думой 25 ноября 1997 года). Действует в ред. Законов Курганской области от 13 мая 1998 года № 119, от 03 сентября 2002 года № 218, от 03 октября 2006 года № 180, от 04 мая 2007 года № 247, от 30 ноября 2007 года № 310, от 03 марта 2008 года № 346, от 26 сентября 2008 года № 392, от 04 мая 2010 года № 3.
Башня Алоха (англ. Aloha Tower) — маяк, часовая и смотровая башня, расположенная на пирсе № 9 бухты Гонолулу (Гонолулу, Гавайи, США).
Законом Удмуртской Республики от 11.05.2021 № 42-РЗ к 25 мая 2021 года упразднено в связи с преобразованием муниципального района в муниципальный округ.
Ирава́ди (бирм. ဧရာဝတီ — Эявади) — административная область в Мьянме, расположенная в дельте реки Иравади. Граничит с административными областями Пегу на севере, Янгон на востоке и выходит на Бенгальский залив на западе и Андаманское море на юге. На северо-западе граничит с национальной областью Ракхайн. Округ находится между 15° 40' и 18° 30' с.ш., между 94° 15' и 96° 15' в.д.. Население округа 7 759 243 (2012) человек, это второй населённый округ в Мьянме по численности населения. Плотность населения — 220,82 чел./км².
Международный доллар (обозначается Int'l$., Intl$., Int$), также известен как доллар Гири-Хамиса (англ. Geary–Khamis dollar, обозначается G-K$ или GK$) — условная расчётная денежная единица, применяемая при сравнении макроэкономических показателей разных стран мира.
При нагревании меняет цвет на оранжевый, а выше 400 °C диссоциирует:
На атомной станции установлены два кипящих водных реактора типа BWR-5 мощностью 682,5 МВт каждый. Первый реактор был запущен в 1990 году, второй — в 1995. В 2008—2010 годах на атомной станции проходила модернизация, позволившая увеличить мощность на 20 % до текущего состояния в 1 640 МВт. На текущий момент единственная АЭС в Мексике Лагуна-Верде покрывает лишь 2 % потребности страны в электроэнергии.
Простое вещество олово (при нормальных условиях) — пластичный, ковкий и легкоплавкий блестящий металл серебристо-белого цвета. Известны четыре аллотропные модификации олова: ниже +13,2 °C устойчиво α-олово (серое олово) с кубической решёткой алмазного типа, выше +13,2 °C устойчиво β-олово (белое олово) с тетрагональной кристаллической решёткой. При высоких давлениях обнаружены также γ-олово и σ-олово.
Награды Волгоградской области — награды субъекта Российской Федерации Волгоградской области, учреждённые Волгоградской областной Думой на основании Закона Волгоградской области от 11 апреля 2014 года № 61-ОД «О наградах Волгоградской области» и прошедшие полное обновление в соответствии с Законом Волгоградской области от 28 декабря 2022 года № 131-ОД «О наградах Волгоградской области».
Евге́ний Гера́симович Шелатонь (29 декабря 1914, Борщень, Российская империя — 27 сентября 2009, Саров, Россия) — деятель советской промышленности, директор первого производства (завода № 1) ВНИИЭФ. Герой Социалистического Труда (1981), лауреат Ленинской премии, Сталинской премии и Государственной премии СССР.
Первым номером посева в одиночном турнире стал Роджер Федерер (№ 3 в мире на тот момент).
WASP-34 (CD-23°9677) — звезда в созвездии Чаши на расстоянии приблизительно 391 светового года от нас. Вокруг звезды обращается, как минимум, одна планета.
Радиотелевизионный передающий центр Еврейской автономной области (филиал РТРС «РТПЦ Еврейской автономной области») — подразделение Российской телевизионной и радиовещательной сети (РТРС) основной оператор цифрового эфирного и аналогового эфирного теле- и радиовещания Еврейской автономной области обеспечивает двадцатью бесплатными цифровыми эфирными телеканалами 99,88% населения области.
Террелл расположен в северной части округа Кофмен. Маршрут 80 проходит через центр города, ведущий на запад в Даллас и на восток в 15 милях (24 км) до Уиллс-Пойнт. Автомагистраль 20 проходит через южную часть города, и ведет на запад 19 миль (31 км) к автомагистрали 635 в юго-восточном пригороде Далласа (Балч-Спрингс) и к востоку 27 миль (43 км) до Кантона. Шоссе штата Техас №34 проходит через восточную сторону Террелла, ведущей на северо-восток в 32 мили (51 км) к Гринвиллу и на юг в 12 милях (19 км) к Кофмену.
Могильники темнокожих индоевропейских скотоводов фатьяновской культуры эпохи бронзы обнаружены в Чкаловском, Ветлужском и Краснобаковском районах. К локальному варианту фатьяновской культуры относится балановская культура. На юго-востоке Нижегородской области находится поселение Васильсурек 1 (№ 288) с материалом атликасинского и ошпандинского периодов балановской культуры. Лепная керамика ошпандинского периода найдена на поселении Наумовка I (№ 155). Погребение балановской культуры II тысячелетия до н. э. найдено в Нижнем Новгороде во время археологических исследований, предшествующих строительству административного здания.
Афганистан расположен в Южной Азии, между 60°30' и 75° восточной долготы и 20°21' и 38°30' северной широты, главным образом в пределах северо-восточной части Иранского нагорья.
Парламентские выборы в Испании 1876 года прошли 20 января. На них были избраны 391 член Конгресса депутатов. Явка составила приблизительно 58,90 % от общего числа зарегистрированных избирателей.
Симфония № 1 была написана 17-летним Жоржем Бизе в 1855 году, когда будущий знаменитый композитор учился на курсе Шарля Гуно в Парижской консерватории. Эта юношеская симфония долгое время была утеряна, и даже биографы композитора не знали о её существовании. Партитура была обнаружена в архиве консерватории музыковедом Жаном Шантавуаном лишь в 1933 году. Симфония была впервые исполнена в 1935 году в Базеле оркестром под управлением Феликса Вайнгартнера, и тогда же впервые опубликована, — о чём Баланчин узнал от своего друга и постоянного сотрудника Игоря Стравинского. В 1947 году, будучи во Франции, Баланчин поставил на эту музыку балет «Хрустальный дворец» для труппы парижской Оперы.
ТРЭКОЛ-39294 — российский плавающий шестиколёсный вездеход на шинах сверхнизкого давления. Название «ТРЭКОЛ» происходит от слов «ТРанспорт ЭКОЛогический», так как благодаря шинам сверхнизкого давления вездеход может двигаться по моховому покрову тундры, не повреждая его. Большинство узлов и агрегатов этого вездехода изготовлены с использованием изделий заводов УАЗ, ВАЗ и ГАЗ. Кузов изготовлен из стеклопластика, поэтому отличается очень низкой теплопроводностью и возможностью эксплуатации при температуре от – 60°С до + 60°С. Вместимость пассажирской модели — 8 человек. Максимальная скорость — 70 км/ч. Вездеход может оснащаться рядом бензиновых и дизельных двигателей, а также гребным винтом для движения по воде. ТРЭКОЛ не имеет ограничений по движению по дорогам общего пользования, так как не превышает допустимой ширины (2550 мм).
Берези́т (по названию Берёзовского месторождения на Урале) — метасоматическая горная порода, состоящая из кварца (25—50 %), альбита (5—25 %), серицита (10—15 %), карбоната (до 10 %) и обогащенная пиритом. Березит — признак золоторудных месторождений. 
