В 1970-х годах Кульпарковская улица была расширена, причём старая часть улицы сохранилась и пролегает почти параллельно с правой стороны от домов с № 138 по № 222.
Симфония № 2 си-бемоль мажор "Хвалебный гимн" op. 52 написана немецким композитором Феликсом Мендельсоном-Бартольди в 1840 году.
В настоящее время такие претензии к югу от параллели 60° южной широты официально предъявляют семь государств, успевших их оформить до вступления в силу Договора об Антарктике:
После 2000 года Midway продолжила заниматься разработкой и изданием компьютерных игр для домашних и портативных игровых систем, но столкнулась со значительными годовыми убытками и оказалась заинтересованной в ряде долговых предложений и предложений акций, а также в иных механизмах финансирования и заимствования. Самнер Редстоун (англ. Sumner Redstone), глава Viacom и CBS Corporation, увеличил свою долю в Midway с приблизительно 15 % в 1998 году до примерно 87 % к концу 2007 года. В декабре 2008 Редстоун продал всю свою долю и право требования на долги Midway объёмом в 70 млн долларов США за 100 тыс частному инвестору Марку Томасу (англ. Mark Thomas).
Создан в соответствии с распоряжением Правительства РФ № 1186-р от 19 августа 2009 года, в рамках форума PROEstate 2009.
Школа № 65 — средняя общеобразовательная школа города Магнитогорска с углубленным изучением предметов музыкально-эстетического цикла. Расположена на территории Правобережного района по адресу: Улица Дружбы дом 33.
Условное наименование — Войсковая часть № 07264 (в/ч 07264). Сокращённое наименование — 76 гв. дшд.
Дом Николая Коперника (пол. Dom Kopernika) — название биографическо-исторического музея, находящегося в двух средневековых зданиях Старого города Торуня (Польша) по адресу: улица Коперника, 15/17. Здание № 17 считается наиболее вероятным местом рождения Николая Коперника. В настоящее время Дом Николая Коперника является филиалом Торуньского краеведческого музея.
В спи́ске объе́ктов Всеми́рного насле́дия ЮНЕ́СКО в Кита́йской Наро́дной Респу́блике значатся 52 наименования (на 2017 год), это составляет 4,3 % от общего числа (1223 на 2024 год). 36 объектов включены в список по культурным критериям, 12 объектов — по природным, 4 — по смешанным.
Помимо Венгрии, значительное число венгров проживает в Румынии (историческая область Трансильвания), Сербии (северная часть края Воеводина), Словакии, Украине, Германии, Великобритании, Австрии, США, Чили и Канаде. Больше всего венгров за пределами Венгрии живёт в США — 1,5 миллиона человек. Непосредственно в Венгрии проживает около 9,5 млн венгров (перепись 2001 года), что составляет 93 % от населения государства.
Филиал обеспечивает 99,35% населения региона 20-ю бесплатными цифровыми эфирными телеканалами и радиостанциями.
Соревнования по бобслею на зимних Олимпийских играх 1980 года прошли с 15 по 24 февраля в Лейк-Плэсиде. Олимпийские бобслейные заезды состоялись на этой трассе уже во второй раз — почти полвека назад здесь проходили Игры 1932 года, где тоже была бобслейная программа. За это время трасса существенно изменилась, стала немного короче, впервые здесь была установлена современная система охлаждения желоба. Общая протяжённость трассы составляла 1557 м, высота 148 м, а средний градиент — 9,5 %.
Сокольниково — село в Можайском районе Московской области, центр Юрловского сельского поселения. До 2006 года Сокольниково входило в состав Юрловского сельского округа. В Сокольниково действует средняя школа, детский сад № 21, отделение почты, фельдшерско-акушерский пункт, автобусное сообщение с Можайском.
«Leave the Night On» — песня американского кантри-певца и автора-исполнителя Сэма Ханта, вышедшая 16 июня 2014 года в качестве первого сингла с его дебютного студийного альбома Montevallo (2014). Песня достигла позиции № 1 в американском хит-параде Billboard Country Songs. Авторами песни выступили Сэм Хант, Шейн Маканалли и Джош Осборн
В середине 1960-х годов в советской прессе развернулась кампания, описывавшая нехватку туристических мощностей древнего Суздаля, имевшего гостиницу на 60 мест и ресторан на 48. В 1966 году город посетила комиссия из секретарей ЦК КПСС и ВЦСПС Александра Шелепина и Николая Романова, а также главного архитектора Москвы Михаила Посохина. 1 августа 1967 года Совет министров СССР принял постановление № 735 «О создании туристского центра в г. Суздале». По нему в бывшей слободе Коровники, что в меандре Каменки, должны были возвести туристический центр на 12,5 га с гостиницей, кемпингом, ресторанами, бассейном и обслуживающей его инфраструктурой. Масштабной реконструкции должны были подвергнуться и другие районы Суздаля. Были построены 74 многоквартирных дома на 38 тысяч м2, центральная котельная, поликлиника, школа, заправочная станция, здание банка. Были протянуты обширные сети коммуникаций, из Владимира проложена ветка газопровода. Среди нереализованных объектов были торгово-ремесленные ряды в Ризоположенском, лодочная станция, превращение Старой улицы в ресторанную.
Первая редакция была написана композитором после посещения 8 августа 1829 г. Фингаловой пещеры на острове Стаффа из группы Внутренних Гебрид возле западного побережья Шотландии. Мендельсон был приглашён в Великобританию в возрасте 20 лет, в ходе путешествия посетил и Шотландию, где им была написана Симфония № 3 («Шотландская»). Из путешествия он отправил родным открытку с первой фразой увертюры, написав сестре Фанни: «Для того, чтобы показать, сколь сильно впечатлили меня Гебриды, шлю тебе музыку, которая пришла там в мою голову», — любопытно, что открытка была отправлена за день до посещения Фингаловой пещеры. На тот момент пещера, знаменитая своими базальтовыми колоннами, составляла около 11 м в высоту и более 60 м в глубину.
Большинство населения общины составляют хорваты — 83,82 %, сербы насчитывают 13,16 %.
Гимна́зия №19 и́мени Н.З. Попо́вичевой — среднее муниципальное общеобразовательное учреждение города Липецка. Гимназия расположена по адресу улица Семашко, 68. Носит имя Н.З. Поповичевой, занимавшей пост директора с 1984 по 2002 год. 
Население Андорры —  82 887 человек (по оценке 2020 года). Около 80% населения страны исповедует католицизм. Их святой покровитель — Богоматерь Меричельская. В её честь в стране 8 сентября проходит национальный праздник.
В 1952—1953 военный представитель на заводе № 88. В 1953—1955 преподаватель кафедры теории полета и аэродинамики реактивных снарядов Военной артиллерийской инженерной академии им. Ф.Э. Дзержинского.
Законом Удмуртской Республики от 11.05.2021 № 42-РЗ к 25 мая 2021 года упразднено в связи с преобразованием муниципального района в муниципальный округ.
Выборы депутатов Псковского областного Собрания депутатов седьмого созыва прошли в Псковской области 19 сентября 2021 года в единый день голосования одновременно с выборами в Государственную думу РФ по смешанной избирательной системе: из 26 депутатов 13 были избраны по партийным спискам (пропорциональная система), ещё 13 — по одномандатным округам (мажоритарная система). Для преодоления барьера по пропорциональной системе партиям необходимо было набрать более 5 % голосов. Срок полномочий седьмого созыва — пять лет.
Исследователи видят здесь тот же мотив, что и в стихах «К Лесбии, о поцелуях» (№ 5 и 7).
Киевская городская электричка (укр. Київська міська електричка) — кольцевой маршрут городской электрички в Киеве в пределах киевского железнодорожного узла. Маршрут проходит через центральный железнодорожный вокзал и станцию Дарница и имеет пересадку на все линии киевского метро и скоростного трамвая (кроме маршрута №2).
Соревнования по гигантскому слалому в горнолыжном спорте среди женщин на зимних Олимпийских играх 2010 прошли 24 и 25 февраля. Соревнования должны были быть проведены в Уистлер Криксайд 24 февраля с 10:00 до 11:45 (первая попытка) и с 13:15 до 14:30 (вторая попытка) по местному времени (UTC-8). Несмотря на сильный туман на верхних участках трассы, первая попытка была проведена согласно расписанию. Однако вторая попытка из-за ещё более сгустившегося тумана несколько раз переносилась на более позднее время. В итоге в 15:00 по местному времени вторая попытка была перенесена на следующий день из-за приближающейся темноты. Температура воздуха во время первой попытки -1,4…+0,6°С. Небольшой снег, снег на трассе мокрый. Температура воздуха во время второй попытки -2…+1°С. Облачно, снег на трассе мягкий.
Климат — умеренно континентальный, средняя температура января −2,1 °, июля — +18,4 ° (Бидгош), осадков 500—600 мм в год. Значительные массивы сосновых лесов (Тухольская пуща и др.).
ГКО выпускались на разные сроки — от нескольких месяцев до года — отдельными выпусками в соответствии с «Основными условиями выпуска государственных краткосрочных бескупонных облигаций Российской Федерации», утверждёнными Постановлением Правительства РФ от 8 февраля 1993 года № 107. Для каждого выпуска могли отдельно устанавливаться ограничения для потенциальных владельцев. Выпуск считался состоявшимся, если в процессе размещения было продано не менее 20 % количества предполагавшихся к выпуску ГКО. Непроданные ГКО могли реализовывать позднее. Также был возможен досрочный выкуп ГКО на вторичном рынке.
Родился 24 февраля 1981 года во Флорешты, там же получил среднее образование в городской школе № 1.
Прозвище — «Золотой мальчик» (Golden Boy). 15 апреля 2009 года на пресс-конференции в Лос-Анджелесе объявил о завершении карьеры профессионального боксёра. Бои с его участием были куплены на кабельных телегигантах на сумму в 696,000,000 $. Основатель промоутерской компании Golden Boy Promotions. Оскар был женат на певице Милли Корретхер, до их расставания в 2016 году.
Ram (рус. Баран) — совместный студийный альбом Пола и Линды Маккартни, вышедший в мае 1971 года. Диск поднялся до № 1 в UK Albums Chart и до № 2 в Billboard Top LPs. 9 июня альбом получил в Британии «золотой» статус. Если первый альбом Маккартни написал и записал самостоятельно, то в работе над вторым альбомом, помимо Линды, приняли участие гитаристы Дэйв Спиноза (через два года сыгравший и с Джоном Ленноном в Mind Games) и Хью МакКракен, а также барабанщик Денни Сейвелл, впоследствии ставший участником Wings.
Рекс Мон (англ. Rex Maughan) — основатель и председатель совета директоров Форевер Ливинг Продактс, создатель Terry Labs, филантроп. Рекс Мон присутствует в списке самых богатых людей мира по версии Форбс за 2002 год под номером 368 с чистым капиталом в $600 000 000.
Площадь города составляет 3.826 км², из них 2.063 км² расположено на суше (46 %).
(317) Роксана (перс. رخشانه‎) — небольшой астероид главного пояса, который принадлежит к очень светлому спектральному классу E, характеризующемуся высоким значением альбедо, почти 50%. Он был открыт 11 сентября 1891 года французским астрономом Огюстом Шарлуа в обсерватории Ниццы и назван в честь Роксаны, первой жены Александра Македонского.
Релиз «Бэтмена против Черепашек-ниндзя» на Blu-ray и Digital HD состоялся 4 июня 2019 года. Мультфильм получил положительные отзывы от критиков, а продажи DVD принесли его создателям $ 3,3 млн.
Одна внутренняя лицензия стоит 45$, а 2-10 лицензий для некоммерческого использования стоит 15$ на один компьютер. Однако, цена на один компьютер стремительно уменьшается, чем больше лицензий приобретается у правообладателя.
Андоке — один из индейских языков Колумбии. Распространён на юге страны, в штате Амасонас. Число носителей разнится от источника к источнику, по данным справочника Ethnologue, оно составляет около 370 человек (2007 Pencue), 50 из которых — монолингвы. Данные переписи 2000 года сообщают о 610 носителях. Более 80 % свободно владеют испанским.
Глебовский (до 2002 года — посёлок Глебовской птицефабрики) — посёлок в городском округе Истра Московской области. Население — 11 678 чел. (2021). С центром городского округа связан автобусным сообщением (автобус № 40 и № 46).
Каталинский небесный обзор, Каталинский обзор неба (англ. Catalina Sky Survey) — астрономический обзор, один из трёх обзоров, входящих в объединение Обзор Каталина (в него также входят обзоры Сайдинг-Спринг и Маунт-Леммон). Основной задачей данного объединения является выявление 90 % околоземных астероидов размером более 140 метров (программа финансируется Конгрессом США). Руководитель обзора — Эд Бешор (англ. Ed Beshore).
Накла (бенг. নকলা, англ. Nakla) — город на севере Бангладеш, административный центр одноимённого подокруга. Площадь города равна 4,6 км². По данным переписи 2001 года, в городе проживало 7332 человека, из которых мужчины составляли 53,57 %, женщины — соответственно 46,43 %. Плотность населения равнялась 1593 чел. на 1 км². Уровень грамотности населения составлял 47,3 % (при среднем по Бангладеш показателе 43,1 %). 
Антильский свистун (лат. Leptodactylus fallax) — вид бесхвостых земноводных из семейства свистуновых. Эндемик, встречающийся только на карибских островах Монтсеррат и Доминика, запечатлен на гербе Доминики. За последние 10 лет популяция вида сократилась на 81 % и сейчас он находится под угрозой исчезновения. В 2004 году было сделано предположение, что в популяции всего 8000 лягушек. Одна из основных причин сокращения их числа — потребление людьми. Местные жители едят Leptodactylus fallax и даже прозвали представителей вида «горными цыплятами» за вкус их мяса. Свою роль играет и болезнь, вызываемая патогенным грибом Batrachochytrium dendrobatidis.
Протеогликаны — сложные белки. Высокомолекулярные соединения, состоящие из белка (на белковую часть приходится 5-10% от общей массы) с высокой степенью гликозилирования (на углеводную часть приходится 90-95% от общей массы), углеводные остатки которых представляют собой длинные неразветвленные полисахаридные цепи — гликозаминогликаны, образованные чередующимися остатками гексозамина и уроновой кислоты (глюкуроновой, идуроновой или галактуроновой) либо галактозы. Гликозаминогликановые цепи зачастую сульфированы.
Опционное соглашение по Южному Тиролю (нем. Option in Südtirol, итал. Opzioni in Alto Adige) — соглашение, относящееся к периоду между 1939 и 1943 годами, когда коренному немецкоязычному населению Южного Тироля и трех коммун в провинции Беллуно была предоставлена возможность либо эмигрировать в соседнюю нацистскую Германию (частью которой была и Австрия после аншлюса 1938 года), либо остаться в фашистской Италии и насильственно интегрироваться в господствующую итальянскую культуру, тем самым теряя свой язык и культурное наследие. Более 80 % немецкоязычного населения данных регионов решило переехать в Германию.
Парламентские выборы в Иордании прошли 4 ноября 1997 года, они стали 3-ми выборами после политической либерализации 1989 года. Основные политические партии бойкотировали выборы. Из 80 мест парламента 75 мест заняли беспартийные. Явка составила 44,7% (822 318 избирателей). 
