А́бу-Да́би, вариант ударения Абу́-Да́би (араб. أَبو ظَبِي‎ [ɐˈbuˈðˤɑbi]) — столица Объединённых Арабских Эмиратов и эмирата Абу-Даби. Политический, промышленный, торговый и культурный центр страны, его вклад в ВВП ОАЭ превышает 56 % (2008). Население города 1 483 000 жителей (2020). Ранее город назывался А́бу-За́би.
Женат, имеет четверых детей. Нагиб имеет аттестат зрелости German Protestant School (англ. German Protestant School), также получил образование бизнес-администратора в Швейцарской высшей технической школе Цюриха (степень аналогичная мастеру). В 2012 году Forbes поставил его на 2 место в списке богатейших людей Египта (3,1 млрд $). Исповедует христианство коптской православной церкви.
По данным исследовательского центра Pew Research Center в 2010 году в Швейцарии проживало 6,35 млн христиан, которые составляли 82,9 % населения этой страны. Жан-Франсуа Майер оценивает долю христиан в 2010 году в 82,3 % (6,23 млн верующих).
Анато́лий Степа́нович Котко́в (род. 13 июня 1947, Нижний Тагил, РСФСР, СССР) — российский политик, журналист. Депутат Государственной думы Российской Федерации II созыва от Нижнетагильского одномандатного округа № 164.
Виталий Григорьевич Майданник (2 января 1957 — 29 сентября 2020) — украинский учёный-педиатр, академик НАМН Украины (2010, членкор 2003), доктор медицинских наук (1989), профессор (1991). Заведующий одной из ведущих кафедр педиатрии (№ 4) Национального медицинского университета имени А. А. Богомольца (с 1990 года), являлся проректором университета. Экс-главный внештатный педиатр Главного управления здравоохранения г. Киева (2004—2011), Заслуженный врач Украины (2001). Лауреат Госпремии Украины в области науки и техники (2009).
Мартовский — разъезд (объект административно-территориального деления) в составе муниципального образования «Посёлок Верхний Баскунчак» Ахтубинского района Астраханской области. Население разъезда 25 человек (2007), 12 (2010), 100 % из них — казахи.
Начало берёт из ледников южного склона Гиссарского хребта на высоте 4400 метров над уровнем моря. Общая площадь ледников расположенных в бассейне реки — 27,2 км². Согласно данным справочника «Ресурсы поверхностных вод СССР» (1969, 1971) питание реки — снего-ледниковое, имеет следующий состав: основное грунтовое — 25 %, ледниковое — 10 %, снеговое — 62 % и дождевое — 3 % от годового стока. Месяц максимального стока — апрель.
Герб утверждён Решением Белозерской районной Думы от 22 мая 2020 года № 302.
Расположен на площади Стачек, дом № 4 в Кировском районе Санкт-Петербурга, рядом со станцией метро «Нарвская».
Брате́евский прое́зд (также на картах Яндекса: проектируемый проезд № 5301) — проезд в Южном административном округе города Москвы на территории района Братеево.
В 2009 году Zyvex объявила о создании Zyvex Marine, нового подразделения, которое занимается проектированием и разработкой современных морских платформ. К 2010 году подразделение смогло изготовить легкий опытный образец, который потребляет на 75% меньше топлива. 
Биверлодж (англ. Beaverlodge) — город на севере провинции Альберта в Канаде. Город находится на Шоссе № 43 (англ. Highway 43).
Баймен Алманович Алманов(каз. Баймен Алманұлы Алманов; 1896, аул № 8, по другим данным аул № 2, Иргизский уезд, Тургайская область, Российская империя — 1943) — партийный советский деятель, активный участник гражданской войны и установления советской власти в Казахстане.
Организовал ряд резонансных террористических актов на территории Российской Федерации. Был внесён в списки террористов ООН, Государственного департамента США и Европейского союза. В России официально значился как террорист № 1, убит 10 июля 2006 года в результате взрыва грузовика на территории Ингушетии недалеко от Назрани.
Малый Монок - улус в верхнем течении одноименной речки. Рядом с ним возникла дер. Ново-Покровка ( в просторечьи - Покровка) , которая была основана после 1871 года несколькими казаками-переселенцами Монукского казачьего форпоста, лишенными этого служебного статуса после реформы Енисейского казачьего конного полка от 19 мая 1871 года. Несколько семей отставных казаков, в частности-братьев Байкаловых, переехали сюда на новое место жительства из-за конфликта по земле с местным атаманом. Основными занятиями местного населения были скотоводство, земледелие, охота. Позднее на р. Малый Монок стали обустраиваться и другие русские переселенцы,  так и образовалась дер. Ново-Покровка.  Первоначально все население  деревни  Ново-Покровки было русским, но постепенно стали образовываться смешанные семьи. В предвоенные годы здесь был образован колхоз "Сибстрелок". В годы Великой Отечественной войны многие мужчины этого сельского поселения ушли на фронт и погибли в боях за Родину. В 1954 году улус Малый Монок и дер. Ново-Покровка были объединены в один населённый пункт - Малый Монок стал подразделением совхоза «Бондаревский» фермой №5. Работают начальная школа, библиотека, медпункт.
«Яхонт» (рус. дореф. Яхонтъ) — деревянный парусно-винтовой клипер I ранга Российского императорского флота. Принадлежал к 3-й серии клиперов, построенных в 1862—1863 годах по типу клипера «Алмаз». Служил на Балтийском флоте. Приказом № 175 от 11 июня 1867 года «Яхонт» переклассфицирован из I ранга во II ранг. 7 ноября 1881 года исключён из списков кораблей Российского императорского флота и продан на слом.
Double Fantasy (с англ. — «Двойная фантазия») — пятый студийный альбом Джона Леннона и Йоко Оно, вышедший в 1980 году, за три недели до трагической гибели Леннона. Альбом достиг первого места в британском и американском хит-парадах. Два сингла («(Just Like) Starting Over» и «Woman») возглавили хит-парад Великобритании (и № 1 и № 2 в США, соответственно). В 1982 году Дуглас, Леннон и Оно выиграли премию «Грэмми» в категории «Лучший альбом года». В 1989 году альбом был включён под № 29 в список 100 лучших альбомов 1980-х годов журнала Rolling Stone. Является седьмым и самым последним студийным альбомом, выпущенный при жизни Джона Леннона
Интернет на Филиппинах появился в 1994 году. По состоянию на 30 сентября 2011 года, в стране более 30 миллионов пользователей Интернета (33 % от общей численности населения). Домен верхнего уровня — .ph.
Love Me Do (с англ. — «Люби же меня») — первый сингл британской группы The Beatles и их первая пластинка на лейбле Parlophone. В Великобритании сингл был выпущен 5 октября 1962 года и достиг № 17 в хит-параде страны. В Соединённых Штатах Америки он вышел в 1964 году и достиг № 1 хит-парада Billboard Hot 100.
За несколько недель песня дошла до первого места чарта Hot Country Songs журнала Billboard, оставаясь на № 1 четыре недели в феврале и марте 1992 года. По итогам года песня заняла второе место в Канаде (RPM Top 100 Country Tracks of 1992) и 4-е в США в списке Best of 1992: Country Songs журнала Billboard.
N 59° 55' 38.125'' E 30° 15' 28.667''
Таджики в Санкт-Петербурге — собирательное название лиц таджикской национальности, проживающих временно/постоянно или нелегально в городе Санкт-Петербурге. По данным переписи населения 2010 года, на территории города проживают 12072 таджиков, что составляет 0,25 % от всего населения Петербурга. По примерным данным национального информационного агентства Таджикистана, в городе трудится около 100,000 граждан Таджикистана. Таким образом, таджики являются вторым крупнейшим национальным меньшинством в городе после узбеков.
Первым номером посева в одиночном турнире стала Елена Дементьева (№ 8 в мире на тот момент).
Республика Закистан (англ. Republic of Zaqistan) — виртуальное государство, расположенное в округе Бокс-Элдер, штат Юта (США). Основана самопровозглашённым президентом Заком Ландсбергом. Государство бесплатно предоставляет гражданство всем желающим с возможностью получить паспорт за 50$.
У большинства заразившихся инфекция протекает в лёгкой форме или бессимптомно. Примерно в 80 % какое-либо специфическое лечение не требуется, а выздоровление происходит само по себе. Примерно в 15 % случаев заболевание протекает в тяжёлой форме с необходимостью применения кислородной терапии, ещё в 5 % состояние больных критическое. Ранние данные показывают, что омикрон-штамм вызывает менее тяжёлую инфекцию, нежели предыдущие варианты. В редких случаях поражение вирусом детей и подростков, предположительно, может приводить к развитию воспалительного синдрома. Также возможны долгосрочные последствия, называемые постковидным синдромом.
Манхэттен-центр — здание, построенное в 1906 году, расположенное на 34-й улице в Мидтауне (или Среднем Манхэттене) и вмещающее в себя Manhattan Center Studios (звукозаписывающие студии), большой бальный зал, бальный зал Гаммерштейна (одно и самых известных мест проведения музыкальных представлений и телепрограмм). В 1976 году здание было приобретено нынешним владельцем, Церковью объединения, за 3 млн $.
Работал трактористом автотранспортной конторы треста буровых работ № 2, буровым рабочим цеха капитального ремонта скважин, оператором по подземному ремонту скважин, бурильщиком цеха законтурного заводнения нефтегазодобывающего управления «Первомайнефть» объединения «Куйбышевнефть».
Арун является крупнейшей рекой Непала, пересекающей Гималаи. Бассейн Аруна составляет более половины бассейна реки Сапт-Коси, однако он привносит лишь около четверти всего стока. Это противоречие объясняется тем, что более 80 % бассейна находится в дождевой тени Гималаев. Средняя норма осадков в тибетской части бассейна Аруна не превышает 300 мм. После пересечения Гималаев река становится значительно полноводнее, так как попадает во влажный муссонный климат восточного Непала. Рельеф бассейна Аруна к югу от границы с Китаем характеризуется как горный, сильно расчленённый речными долинами. Данный регион отличается высокой сейсмической активностью. В бассейне Аруна проживают около полумиллиона человек, большинство из них живут в нижнем течении реки, на высотах от 300 до 1000 м.
17 ноября 2010 года, решением Совета депутатов городского округа Котельники № 110/13, решение от 26 мая 1998 года было признано утратившим силу и было утверждено новое положение о флаге городского округа Котельники.
Бригада дислоцируется в Приморском крае, город Уссурийск, улица Афанасьева, дом № 4. Ракетное соединение находится в составе 5-й гвардейской общевойсковой армии Восточного военного округа.
В 1995 году академия объявила о введении новой номинации «Лучший рэп-альбом». В следующем году первым лауреатом награды стала группа Naughty by Nature с пластинкой Poverty's Paradise. Номинация содержит следующие требования: «Свыше 51 % материала альбома должны быть новые рэп-записи».
Толеген Жунусов (каз. Төлеген Жүнісов, 1895 года, аул № 7, Семпалатинская область, Российская империя — 1974 года, Каркаралинский район, Карагандинская область, Казахская ССР) — скотник колхоза «Уш-тобе» Каркаралинского района Карагандинской области. Герой Социалистического Труда (1949). Заслуженный мастер животноводства Казахской ССР (1957).
Условное наименование — Войсковая часть № 07264 (в/ч 07264). Сокращённое наименование — 76 гв. дшд.
Позднеево расположено чуть в стороне от трассы Богашёвский тракт. Транспортная связь деревни с Томском осуществляется автобусным маршрутом № 27.
В середине мая более 95 % поверхности озера ещё покрыто льдом. На озере селятся канадские казарки, утки-морянки, морские песочники, белолобые гуси.
Впервые был получен путём охлаждения воды до −13 °C (260 K) при давлении 0,55 ГПа; было обнаружено, что он существует в области фазовой стабильности льда V. Позже было показано, что лёд XII можно создать и вне этого диапазона. Чистый лёд XII можно получить изо льда Ih при температуре −196 °C (77 K) путём быстрого сжатия (0,81-1,00 ГПа/мин) или посредством нагрева аморфного льда высокой плотности до −90 °C (183 К) в диапазоне давлений между 0,8 и 1,6 ГПа. Разновидность льда XII с упорядоченным расположением протонов называют льдом XIV.
Третий список лишённых гражданства Германской империи — перечень 28 лиц, которые в 1934 году по решению национал-социалистического правительства были лишены немецкого подданства и тем самым стали апатридами. Правовым основанием для данного списка стал § 2 закона об отказе в предоставлении немецкого гражданства и его лишении, принятый 14 июля 1933 года.
Воспитанник детско-юношеской школы Новочебоксарского производственного объединения «Лад». Окончил Новочебоксарское ПТУ № 14.
Согласно § 5033 Статьи 10 Свода законов США, начальник ВМО США назначается на пост президентом США с согласия Сената на четырёхлетний срок из числа адмиралов ВМС. В военное время и в условиях объявленной Конгрессом США чрезвычайной ситуации, срок полномочий начальника ВМО может быть продлён, но не более чем на 4 года. От кандидата на должность начальника ВМО требуется значительный опыт работы в объединённых штабах, включая как минимум один полный тур в качестве флагманского офицера. Президент может отменить последнее требование, если посчитает это необходимым для национальных интересов.
В 19-й раз победившему кандидату не удалось набрать и 50% ото всех голосов избирателей.
Квемо-Кулари (груз. ქვემო ყულარი, азерб. Aşağı Qullar) — село Марнеульского муниципалитета, края Квемо-Картли республики Грузия с 96%-ным азербайджанским населением. Находится на юге Грузии, на территории исторической области Борчалы.
Представитель Национальной партии Хуан Орландо Эрнандес получил 36 % голосов и был избран президентом страны.
По переписи 2002 года население — 87 человек (43 мужчины, 44 женщины). Преобладающая национальность — русские (99 %).
С принятием Налогового кодекса полностью меняется система налогообложения на Украине. Количество налогов уменьшается почти в два раза. Предусмотрено поэтапное, в течение нескольких лет, снижение базовых ставок по основным налоговым платежам. Вводится дополнительная ставка по налогу на доходы физических лиц, тем самым создается подобие прогрессивной шкалы налогообложения. Изменены «правила игры» для плательщиков единого налога. Так, из их числа с принятием налогового кодекса исключаются юридические лица, сужается круг видов деятельности, которыми позволено заниматься плательщиков единого налога, увеличиваются ставки налога. Также утрачивают силу нормативные документы, регулирующие порядок обложения налогами и сборами, которые вошли в налоговый кодекс, а также Закон № 2181, определяющий порядок администрирования налогов.
В 2020 году занял 55-е место в рейтинге Forbes «200 богатейших бизнесменов России» с состоянием в $1,7 млрд. Самая высокая позиция — № 46 с $1,9 млрд в 2015 году.
