Здание Княжевской подстанции построено в 1914—1915 годах как часть инфраструктуры Ораниенбаумской электрической железной дороги (Оранэлы). Расположено по адресу: проспект Стачек, дом № 91. Объект культурного наследия регионального значения.
Шаганская крепость (азерб. Şağan qalası) — оборонительное сооружение, останки которого расположены в посёлке Шаган, в Хазарском районе города Баку. Распоряжением Кабинета министров Азербайджанской Республики от 2 августа 2001 года останки крепости взяты под охрану государства как архитектурный памятник истории и культуры национального значения (инв № 94).
Шахта № 4/6 (японское название «Сиритори») и шахта № 7 (японское название «Хигаси-Сакутан») были основаны в период японского владения Южным Сахалином. В 1947 году в городе Макарове был создан трест «Макаровуголь» комбината «Сахалинуголь», в состав которого были включены эти две шахты. Трест был ликвидирован в 1957 году, шахты были переданы в непосредственное подчинение комбинату. В 1971 году шахты № 7 и № 4/6 были объединены в шахту «Макаровская».
Нормальный кубический метр — внесистемная единица измерения количества вещества, которое в газообразном состоянии занимает один кубический метр при условиях, называемых «нормальными условиями» (давление 760 мм рт. ст., что соответствует 101325 Па, и температура 0 °С), что отличается от принятого ИЮПАК системного понятия «стандартных условий» (давление 105 Па, температура 273,15 К, или 0 °С). Обозначается как «н.м³» (либо «Нм³» — в газовой отрасли).
Трасса Нардо (итал. Pista di Nardò) — испытательный трек, расположенный в Италии, на юге Апулии, в провинции Лече, близ городка Нардо (в 20 км к северо-западу от города). Трасса была построена в 1970-е гг. на общественные средства в рамках развития южных регионов. Трек представляет собой круглую кольцевую трассу с большим переменным по ширине бэнкингом. Длина кольца достигает 12,6 км при диаметре 4 км, в итоге сочетание бэнкинга с малым углом поворота делает возможным езду по внешнему краю без движений рулем, как по прямой. Ширина полотна достигает 16 м, и оно разделено на 4 полосы, каждая со своей так называемой нейтральной скоростью, то есть скоростью, не требующей движений рулем: на первой (внутренней) полосе — 100 км/ч, на второй — 140, на третьей — 190, и на четвертой — 240. В обычные дни не разрешается движение быстрее 240 км/ч, для этого необходимо арендовать весь трек. Трасса Нардо используется для тестирования скоростных возможностей автомобиля, позволяя развивать скорости до 400 км/ч и более, однако для больших скоростей (свыше 240 км/ч) работа рулем требуется, хотя и возможна езда при постоянном угле поворота (30° в случае с Koenigsegg). Рекорд принадлежит автомобилю Koenigsegg CCR (387,9 км/ч 28 февраля 2005 г.), однако был побит автомобилем Bugatti Veyron на другом треке. Также установлены рекорды скорости для электромобилей: автомобиль Eliica показал скорость 370 км/ч. Ежегодно на трассе проходят фестивали скорости, в которых различные тюнинговые ателье выставляют свои автомобили для побития тех или иных рекордов скорости. За все время существования трассы был только один смертельный инцидент. В марте 2008 г. внутри овала был открыт еще один 6,2-км трек.
Судно снабжено дизельным двигателем мощностью 225 л. с., рефрижераторным трюмом общим объёмом 52,3 кубических метра, с температурой охлаждения от 0 до −2 °C.
Музей-усадьба находится в ведении Министерства культуры Российской Федерации в соответствии с распоряжением Правительства Российской Федерации от 5 января 2005 года № 5-р. и официально именуется Государственный мемориальный и природный заповедник «Музей-усадьба Л. Н. Толстого „Ясная Поляна“».
Законом Курганской области от 12 мая 2021 года № 49 к 24 мая 2021 года упразднён в связи с преобразованием муниципального района в муниципальный округ.
Кло́штар-По́дравски (хорв. Kloštar Podravski) — община с центром в одноимённом посёлке на севере Хорватии, в Копривницко-Крижевацкой жупании. Население — 1535 человек в самом посёлке и 3303 человека во всей общине (2011). Подавляющее большинство населения — хорваты (99 %). В состав общины, кроме Клоштара-Подравски, входят ещё 4 деревни.
Взрыв в жилом доме в Нижнем Тагиле произошёл 1 августа 2024 года около 12:00 по местному времени в одном из подъездов между первым и пятым этажами в пятиэтажном доме № 81 на улице Сибирской. Произошёл взрыв газовоздушной смеси. Погибли 11 человек, в том числе шестеро детей. 26 человек пострадало, среди них 10 детей, госпитализированы 11 пострадавших, в том числе 5 детей. В результате взрыва разрушились два подъезда дома.
«Белая уточка» — русская народная сказка, записана фольклористом А. Н. Афанасьевым и входит во второй том его сборника «Народные русские сказки» под № 265.
Живет до 7 лет, максимальная длина достигает 40 см, а вес — 2 кг. Достижение половой зрелости происходит в возрасте 1,5…2 лет. При помощи своих мощных клешней могут рыть себе норы, но в основном пользуются и готовыми убежищами — полостями под корягами и камнями; данный вид считается «мало копающим». Смертельная температура — ниже 10 °С и выше 36 °С. Требователен к качеству воды. Может выживать при низком содержании кислорода и высоком содержании нитратов. Самым опасным для данного рака является даже ничтожное содержание меди, цинка в воде.
На мелководье дно песчаное, на глубине — сапропель и ил. Берега заросшие (ширина 3—20 м, около 13 % поверхности). Подводная часть котловины корытообразной формы. Литоральнные и сублиторальные склоны крутые. Глубины до 2 м занимают 16 % площади озера.
По переписи 2002 года население — 85 человек (38 мужчин, 47 женщин). Преобладающая национальность — русские (97 %).
Участвовал в своей единственной гонке Формулы-1 в сезоне 1953 года (Гран-при Германии) за команду автозаводов Айзенаха. Выступал за рулём машины Veritas, в которой стартовал под № 33. Сошёл с трассы на втором круге. В 1954 году заменил Колина Чепмена в гонке 1000 километров Нюрбургринга в составе команды Lotus и занял 4 место в классе автомобилей с 1500-кубовыми двигателями. В 1958 году занял в этой же гонке 10 место, однако не понял, что финишировал, и продолжил ездить в боевом режиме. Бауэр попытался обогнать медленно идущую машину, вылетел с трассы и врезался в деревья. От полученных травм Эрвин Бауэр скончался.
В ноябре 2017 года компания Amazon приобрела права на адаптацию «Властелина колец» в формате сериала за $250 млн, взяв на себя обязательства по производству пяти сезонов с бюджетом не менее $1 млрд. Это сделало проект самым дорогостоящим в истории. Дж. Д. Пейн и Патрик Маккей получили должности создателей в июле 2018 года. Сериал в основном основан на приложениях к «Властелину колец», которые включают описание событий Второй эпохи, и, в соответствии с требованиями представителей Tolkien Estate, проект не является продолжением кинотрилогий «Властелин колец» и «Хоббит».
Путя́евские пруды́ — комплекс водоёмов на северо-востоке Москвы, на территории парка Сокольники, в районе 4-го Лучевого просека, рядом с платформой «Маленковская» Ярославского направления Московской железной дороги. Представляют собой каскад из шести прудов, в состав которого входят Верхний Путяевский пруд (№ 1), Пруд змейки (№ 2), Чёртов пруд (№ 3), Моржовый пруд (№ 4), № 5 и Нижний пруд (№ 6).
Наиболее знаменитыми битмейкерами в рамках Mobb Music являются такие продюсеры, как Mike Mosley, Sean T, One Drop Scott, Cellski, Ant Banks, JT the Bigga Figga, DJ Darryl, Khayree, Rick Rock и Studio Tone. Рэперы из Северной Калифорнии, такие как E-40, B-Legit, Suga-T, D-Shot, Too $hort, Mac Dre, San Quinn, The Luniz, Yukmouth, Numskull, RBL Posse, Ceaese, Dru Down, Mac Mall, Celly Cel, C-Bo, JT the Bigga Figga, 11/5, Cold World Hustlers, 3x Krazy, UDI, Guce и Spice 1, являются наиболее известными из тех, кто внес вклад в развитие этого поднаправления.
Владелец банка до 2007 года — Австрийская федерация профсоюзов (OEGB). В мае 2007 года была завершена сделка по приобретению 100% акций банка консорциумом инвесторов во главе с американским фондом прямых инвестиций Cerberus Capital Management. Сумма сделки составила 3,2 млрд евро, из которых 2,6 млрд было уплачено продавцу и 600 млн должно было быть внесено денежными средствами в капитал банка.
80,52 % (2022).
Перси́дский язы́к (новоперси́дский язы́к, фарси́, زبان فارسی [zæ'bɒːne fɒːɾˈsiː]) — ведущий по числу носителей язык иранской группы индоевропейской семьи языков, обладающий богатой многовековой литературной традицией, включая признанные шедевры мировой литературы. Новоперсидский язык возник как продолжение среднеперсидского языка в эпоху исламизации Ирана после арабского завоевания и испытал сильное воздействие арабского языка (в частности, в его сегодняшнем лексическом составе обнаруживается до 60 % арабизмов). В свою очередь, многочисленные персизмы проникли во многие тюркские, индоарийские, нахско-дагестанские языки; в меньшем количестве заимствования из персидского языка имеются и в некоторых славянских языках, в том числе в русском.
Hezhang County, Shuitangbao Township, Caoziping Village, пещера Shenren Cave, под камнями и детритом в глубинной зоне (температура: 13 °C, влажность: 90 %) [27°0′55.82″N, 104°40′36.98″E], 2042 м над уровнем моря. Видовое название происходит от латинского слова «altus», означающего высокий, что относится к видам, обитающим на больших высотах.
Всеобщие парламентские выборы 1904 года прошли 3 (первый тур) и 10 июня (второй тур). На них были выбраны 508 членов Палаты депутатов Королевства Италия. Победителем выборов стала правящая либеральная партия «Левая», представлявшая итальянскую буржуазию, получив почти 67 % мест в парламенте. Впервые второй партией Италии по количеству голосов стали социалисты, хотя по количеству мандатов второй партией парламента по прежнему оставались правые, а третьими были как и раньше радикалы.
Líncoln — американский автомобильный производитель, принадлежащий Ford Motor Company. В 2011 году объём продаж подразделения в США составил 85 643 автомобиля (падение по сравнению с 2010 годом — 0,22 %).
Согласно данным пресс-службы клуба, по итогам сезона 2023/24 «Реал Мадрид» стал первым в истории, чей операционный доход суммарно превысил €1 млрд. В 2024 году согласно данным Forbes признан самым дорогим футбольным клубом мира, с совокупной стоимостью $6,6 млрд.
«Озеро горных духов» — рассказ Ивана Ефремова, написанный в ранний период его творчества. Основой для произведения послужила картина алтайского художника Г. И. Гуркина, экфрасис позволил герою-геологу обнаружить месторождение ртути. Первая публикация состоялась в журнале «Техника — молодёжи», 1944, № 1, под названием «Тайна горного озера»; в том же году рассказ был напечатан в составе сборника «Пять румбов». С тех пор неоднократно переиздавался.
Подновляющее большинство жителей — христиане. Согласно проводившимся опросам 54 % населения Французской Полинезии исповедуют протестантизм, 30 % — католицизм, 10 % исповедуют другие религии и 6 % являются атеистами.
Сирануш Ованесовна Кулян (25 декабря 1913 — 10 сентября 1985) — передовик советского сельского хозяйства, звеньевая Лазаревского совхоза № 4, город Сочи Краснодарского края, Герой Социалистического Труда (1966).
Джаландхар (в.-пандж. ਜਲੰਧਰ ਜ਼ਿਲਾ; хинди जलंधर ज़िला; англ. Jalandhar) — округ в индийском штате Пенджаб. Образован в 1846 году. Административный центр — город Джаландхар. Площадь округа — 2634 км². По данным всеиндийской переписи 2001 года население округа составляло 1 962 700 человек. Уровень грамотности взрослого населения составлял 78 %, что значительно выше среднеиндийского уровня (59,5 %). Доля городского населения составляла 47,5 %. 7 ноября 1995 года из частей территорий округов Джаландхар и Хошиарпур образован округ Шахидбхагатсингхнагар.
Старинная концертная форма применяется в первых частях и часто в финалах всех концертов эпохи барокко (для оркестра, солиста с оркестром, сольных), быстрых частях сонат. В оркестровом варианте встречается как вступительная часть кантаты (например, в кантатах И. С. Баха BWV 146 и BWV 142). В медленных частях применяется редко (Бранденбургский концерт № 5 D-dur И. С. Баха, 2-я часть).
Загарье — деревня, вошедшая в состав города Перми. Ныне — улица Загарьинская и часть улицы Коломенская (дома № 13, 15, 17) в Свердловском районе. Деревня дала название дачным посёлкам, бурно развивавшихся в 1920-х и обозначенные на карте Перми 1940 года как Загарье 1-е, Загарье 2-е, Загарье 3-е и Загарье 4-е и второе название микрорайону Владимирский.
Географические координаты службы занятости Бургенланда: 47°50′55″ с. ш. 16°31′42″ в. д.
Дом Гаджи Мустафы Расулова (азерб. Hacı Mustafa Rəsulovun mülkü) — здание, построенное Антоном Кандиновым и Никанором Твердохлебовым в 1884–1885 годах по заказу Гаджи Мустафы Расулова. До 1918 г., на первом этаже здания размещались различные магазины и склады, а на втором этаже располагалась гостиница Исламийя. Во время мартовского геноцида 1918 г. здание было подожжено армянами.Постановлением Кабинета министров Азербайджанской Республики № 132 от 2 августа 2001 года здание охраняется государством и внесена в список памятников архитектуры.
Почтовые марки № 51—57, 59, 66—69, 71 и 72 были напечатаны московской типографией «Гознак», № 56-II, 56-IV, 58, К8Н, Л8Г, 60—63 и 70 — напечатаны государственным предприятием «Полиграфический комбинат „Украина“», а № 64 и 65 напечатаны в канадской типографии Canadian Bank Note Company.
У большинства заразившихся инфекция протекает в лёгкой форме или бессимптомно. Примерно в 80 % какое-либо специфическое лечение не требуется, а выздоровление происходит само по себе. Примерно в 15 % случаев заболевание протекает в тяжёлой форме с необходимостью применения кислородной терапии, ещё в 5 % состояние больных критическое. Ранние данные показывают, что омикрон-штамм вызывает менее тяжёлую инфекцию, нежели предыдущие варианты. В редких случаях поражение вирусом детей и подростков, предположительно, может приводить к развитию воспалительного синдрома. Также возможны долгосрочные последствия, называемые постковидным синдромом.
Центральная ревизионная комиссия (19.11.1842 года, дело № 1899) подтвердила дворянское происхождение рода Скоповских по Подольской губернии Российской империи.
Снегоболотоходы марки «ENWIX» изготовлены в соответствии с ТУ 29.10.59-001-46112916-2021 «Снегоболотоходы (вездеходы)», главная особенность техники — модульность конструкции. Продукция ENWIX соответствует требования технического регламента Таможенного союза «О безопасности машин и оборудования» (ТР ТС 010/2011). Сертификат соответствия выдан на основании протокола испытаний № 1008/9АТС-2021.
