question,answer,count_simple,count_simple_translated,count_simple_long,count_simple_long_translated,count_cases_translated,count_cases_long
"КрАЗ Н23.2 (англ. KrAZ H23.2) — семейство украинских крупнотоннажных грузовых автомобилей АвтоКрАЗ с компоновочной схемой «кабина над двигателем» и колесной формулой 6×4.","КрАЗ Н23.2 (англ. KrAZ H23.2) — семейство украинских крупнотоннажных грузовых автомобилей АвтоКрАЗ с компоновочной схемой «кабина над двигателем» и колесной формулой 6умножить на4.",0,0,1,0,0,0
"Активный борец за ∪ Дунайских княжеств.","Активный борец за объединение Дунайских княжеств.",0,1,0,0,0,0
"Британец Дэвид Гриндли стал автором двух рекордов соревнований, сначала выиграв личный бег на 400 метров с результатом 44,75, а затем финишировав первым на последнем этапе эстафеты 4×400 метров — 3.00,25.","Британец Дэвид Гриндли стал автором двух рекордов соревнований, сначала выиграв личный бег на 400 метров с результатом 44,75, а затем финишировав первым на последнем этапе эстафеты 4умножить на400 метров — 3.00,25.",0,0,1,0,0,0
"Три раза первой становилась россиянка Ирина Привалова, выигравшая индивидуальные дистанции 100 и 200 метров, а также эстафету 4×100 метров.","Три раза первой становилась россиянка Ирина Привалова, выигравшая индивидуальные дистанции 100 и 200 метров, а также эстафету 4умножить на100 метров.",0,0,1,0,0,0
"Scope Group — рейтинговое агентство, занимающееся исследованиями и анализом рисков ∀ групп активов со штаб-квартирой в г. Берлине.","Scope Group — рейтинговое агентство, занимающееся исследованиями и анализом рисков для всех групп активов со штаб-квартирой в г. Берлине.",0,0,0,1,0,0
"Ближайшие населённые пункты: Вирятино, Атманов ∠, Перкино, Семикино.","Ближайшие населённые пункты: Вирятино, Атманов Угол, Перкино, Семикино.",0,1,0,0,0,0
"Игра ∋ 30 популярных рок-песен, датирующиеся начиная от 1960-х годов вплоть до 2005 года, а также бонусные песни.","Игра содержит 30 популярных рок-песен, датирующиеся начиная от 1960-х годов вплоть до 2005 года, а также бонусные песни.",0,1,0,0,0,0
"Обладатель бывшего мирового рекорда по сборке кубика Рубика 3×3×3, решив головоломку за 4,74 секунды в 2016 году, а также является бывшим обладателем мирового рекорда по сборке куба 4×4.","Обладатель бывшего мирового рекорда по сборке кубика Рубика 3умножить на3умножить на3, решив головоломку за 4,74 секунды в 2016 году, а также является бывшим обладателем мирового рекорда по сборке куба 4умножить на4.",0,0,1,0,0,0
"∃ множество FAQ, посвящённых самым разным темам.","Существует множество FAQ, посвящённых самым разным темам.",0,1,0,0,0,0
"Изоли́рованная то́чка в общей топологии — это такая точка множества, что ∩ некоторой её окрестности с множеством состоит только из этой точки.","Изоли́рованная то́чка в общей топологии — это такая точка множества, что пересечение некоторой её окрестности с множеством состоит только из этой точки.",0,1,0,0,0,0
"Несмотря на покой и статичность, присущие ренессансу, произведение > тяготеет к маньеризму.","Несмотря на покой и статичность, присущие ренессансу, произведение больше тяготеет к маньеризму.",0,1,0,0,0,0
"∃ пассажирское движение по маршруту Вохтога — Каменка (прицепной вагон).","Существует пассажирское движение по маршруту Вохтога — Каменка (прицепной вагон).",0,1,0,0,0,0
"4,6×30 мм — пистолетный патрон, созданный в 2001 году в рамках программы «Персональное оружие самообороны».","4,6умножить на30 мм — пистолетный патрон, созданный в 2001 году в рамках программы «Персональное оружие самообороны».",0,0,1,0,0,0
"Статья ∋ полную информацию по дискографии советской и российской певицы Аллы Пугачёвой, которая состоит из 100 сольных пластинок, компакт-кассет, CD и DVD дисков, среди которых:","Статья содержит полную информацию по дискографии советской и российской певицы Аллы Пугачёвой, которая состоит из 100 сольных пластинок, компакт-кассет, CD и DVD дисков, среди которых:",0,1,0,0,0,0
"θ Циркуля (англ. Theta Circini, θ Cir), θ Циркуля — двойная звезда в созвездии Циркуля к северу от Альфы Циркуля.","Тета Циркуля (англ. Theta Circini, θ Cir), θ Циркуля — двойная звезда в созвездии Циркуля к северу от Альфы Циркуля.",0,1,0,0,0,0
"θ Циркуля является астрометрической двойной звёздной системой с орбитальным периодом около 39,6 лет, эксцентриситетом около 0,3 и большой полуосью орбиты 85,64 мсд.","Тета Циркуля является астрометрической двойной звёздной системой с орбитальным периодом около 39,6 лет, эксцентриситетом около 0,3 и большой полуосью орбиты 85,64 мсд.",0,1,0,0,0,0
"Природный висмут, представленный одним изотопом 209Bi, долгое время считался стабильным (нерадиоактивным) элементом, но в 2003 году был экспериментально обнаружен его крайне медленный α-распад.","Природный висмут, представленный одним изотопом 209Bi, долгое время считался стабильным (нерадиоактивным) элементом, но в 2003 году был экспериментально обнаружен его крайне медленный альфа-распад.",0,1,0,0,0,0
"Его роль была значительна в таких издательских проектах, как «Искусство ∀» и руководств по истории и истории искусств для начальных и средних школ.","Его роль была значительна в таких издательских проектах, как «Искусство для всех» и руководств по истории и истории искусств для начальных и средних школ.",0,0,0,1,0,0
"Список экзопланет в созвездии Хамелеона ∋ 5 экзопланет в 5 разных планетных системах, находящихся в соответствующем созвездии.","Список экзопланет в созвездии Хамелеона содержит 5 экзопланет в 5 разных планетных системах, находящихся в соответствующем созвездии.",0,1,0,0,0,0
"Представленная в 1984 году и снятая с производства в 1987 году, Professional Graphics Controller (так же называемая «Professional Graphics Adapter» и иногда «Professional Graphics Array») предлагала несколько большее графическое разрешение и глубину цвета, чем EGA — до 640×480 пикселей и 256 цветов (из палитры в 4096 цветов) при 60 Гц.","Представленная в 1984 году и снятая с производства в 1987 году, Professional Graphics Controller (так же называемая «Professional Graphics Adapter» и иногда «Professional Graphics Array») предлагала несколько большее графическое разрешение и глубину цвета, чем EGA — до 640умножить на480 пикселей и 256 цветов (из палитры в 4096 цветов) при 60 Гц.",0,0,1,0,0,0
"Пунчаны близки к агути но, как правило, гораздо < и имеют заметный хвост.","Пунчаны близки к агути но, как правило, гораздо меньше и имеют заметный хвост.",0,1,0,0,0,0
"Пунчаны < зависят от воды, чем представители рода агути, но их никогда не находили далеко от источника воды.","Пунчаны меньше зависят от воды, чем представители рода агути, но их никогда не находили далеко от источника воды.",0,1,0,0,0,0
"∈ к числу наиболее старинных индонезийских блюд.","Принадлежит к числу наиболее старинных индонезийских блюд.",0,1,0,0,0,0
"Завийява, Алараф, β Девы (лат. β Virginis), 5 Девы (лат. 5 Virginis) — тройная звезда в созвездии Девы на расстоянии приблизительно 36 световых лет (около 11 парсек) от Солнца.","Завийява, Алараф, Бета Девы (лат. β Virginis), 5 Девы (лат. 5 Virginis) — тройная звезда в созвездии Девы на расстоянии приблизительно 36 световых лет (около 11 парсек) от Солнца.",0,1,0,0,0,0
"∃ несколько предварительных рисунков к картине, созданных непосредственно на месте.","Существует несколько предварительных рисунков к картине, созданных непосредственно на месте.",0,1,0,0,0,0
"Женская сборная Австралии по баскетболу 3×3 представляет Австралию на международных соревнованиях по баскетболу 3×3.","Женская сборная Австралии по баскетболу 3умножить на3 представляет Австралию на международных соревнованиях по баскетболу 3умножить на3.",0,0,1,0,0,0
"По состоянию на 26 августа 2024, женская сборная Австралии по баскетболу 3×3 занимает 19-е место в мировом рейтинге ФИБА женских сборных по баскетболу 3×3.","По состоянию на 26 августа 2024, женская сборная Австралии по баскетболу 3умножить на3 занимает 19-е место в мировом рейтинге ФИБА женских сборных по баскетболу 3умножить на3.",0,0,1,0,0,0
"Существуют телескопы ∀ диапазонов электромагнитного излучения:","Существуют телескопы для всех диапазонов электромагнитного излучения:",0,0,0,1,0,0
"Отсутствие пастеризации для пива потенциально опасно, так как из-за частого отсутствия фильтрации продукт ∋ остаточные дрожжи.","Отсутствие пастеризации для пива потенциально опасно, так как из-за частого отсутствия фильтрации продукт содержит остаточные дрожжи.",0,1,0,0,0,0
"Общество осенних салонов, укороченное название Осенний салон (фр. Société du Salon d’automne, также Salon d’automne) — ∪ деятелей искусства во Франции, основанное в 1903 году архитектором Францем Журденом в сотрудничестве с такими художниками, как Жорж Руо, Эдуар Вюйяр, Альбер Марке.","Общество осенних салонов, укороченное название Осенний салон (фр. Société du Salon d’automne, также Salon d’automne) — объединение деятелей искусства во Франции, основанное в 1903 году архитектором Францем Журденом в сотрудничестве с такими художниками, как Жорж Руо, Эдуар Вюйяр, Альбер Марке.",0,1,0,0,0,0
"В Германии ∃ два города с названием Франкфурт: Франкфурт-на-Майне (земля Гессен) и Франкфурт-на-Одере (земля Бранденбург).","В Германии существует два города с названием Франкфурт: Франкфурт-на-Майне (земля Гессен) и Франкфурт-на-Одере (земля Бранденбург).",0,1,0,0,0,0
"20-я гвардейская общевойсковая Краснознамённая армия (сокр. 20 ОА, в/ч 89425) — общевойсковое формирование (∪, армия) Вооружённых сил Российской Федерации в составе Московского военного округа.","20-я гвардейская общевойсковая Краснознамённая армия (сокр. 20 ОА, в/ч 89425) — общевойсковое формирование (объединение, армия) Вооружённых сил Российской Федерации в составе Московского военного округа.",0,1,0,0,0,0
"Кроме точных сведений о подлинных исторических событиях «Великая хроника» ∋ много мифов, легенд, преданий и литературных обработок, в том числе повести о Троянской войне, Александре Македонском («Александрия»), Куликовской битве 1380 года и др.","Кроме точных сведений о подлинных исторических событиях «Великая хроника» содержит много мифов, легенд, преданий и литературных обработок, в том числе повести о Троянской войне, Александре Македонском («Александрия»), Куликовской битве 1380 года и др.",0,1,0,0,0,0
"Когда потребитель опаздывает с платежом, ∃ вероятность, что другие кредиторы, включая тех кредиторов, для которых потребитель не опоздал с оплатой, могут повысить для него процентные ставки.","Когда потребитель опаздывает с платежом, существует вероятность, что другие кредиторы, включая тех кредиторов, для которых потребитель не опоздал с оплатой, могут повысить для него процентные ставки.",0,1,0,0,0,0
"∃ мнение, что фильм «Крик 3» (а, возможно, и вся серия) режиссёра Уэсли Крэйвена также является частью вселенной View Askewniverse.","Существует мнение, что фильм «Крик 3» (а, возможно, и вся серия) режиссёра Уэсли Крэйвена также является частью вселенной View Askewniverse.",0,1,0,0,0,0
"∃ также версия песни, записанная для альбома Sleepless Nights Brooklyn Dreams, на которой уже Донна Саммер выступает в качестве бэк-вокалистки.","Существует также версия песни, записанная для альбома Sleepless Nights Brooklyn Dreams, на которой уже Донна Саммер выступает в качестве бэк-вокалистки.",0,1,0,0,0,0
"Последняя слабая активность вулкана была 16 августа 1997 года, в результате которой поднялись грунтовые воды и произошёл их выброс, который длился чуть > часа.","Последняя слабая активность вулкана была 16 августа 1997 года, в результате которой поднялись грунтовые воды и произошёл их выброс, который длился чуть больше часа.",0,1,0,0,0,0
"Мужская сборная Австрии по баскетболу 3×3 представляет Австрию на международных соревнованиях по баскетболу 3×3.","Мужская сборная Австрии по баскетболу 3умножить на3 представляет Австрию на международных соревнованиях по баскетболу 3умножить на3.",0,0,1,0,0,0
"По состоянию на 6 сентября 2024, мужская сборная Австрии по баскетболу 3×3 занимает 9-е место в мировом рейтинге ФИБА мужских сборных по баскетболу 3×3.","По состоянию на 6 сентября 2024, мужская сборная Австрии по баскетболу 3умножить на3 занимает 9-е место в мировом рейтинге ФИБА мужских сборных по баскетболу 3умножить на3.",0,0,1,0,0,0
"Между тем, особенности ядра Spring применимы в любом Java-приложении, и ∃ множество расширений и усовершенствований для построения веб-приложений на Java Enterprise платформе.","Между тем, особенности ядра Spring применимы в любом Java-приложении, и существует множество расширений и усовершенствований для построения веб-приложений на Java Enterprise платформе.",0,1,0,0,0,0
"Западная зона ПВО — оперативное ∪ войск ПВО СССР накануне и во время Великой Отечественной войны осуществлявшее оборону войск и важных административно-политических и промышленных центров, расположенных в границах Западного особого военного округа.","Западная зона ПВО — оперативное объединение войск ПВО СССР накануне и во время Великой Отечественной войны осуществлявшее оборону войск и важных административно-политических и промышленных центров, расположенных в границах Западного особого военного округа.",0,1,0,0,0,0
"Список начальствующего военно-технического состава Морских сил Рабоче-Крестьянской Красной Армии СССР ∋ фамилии получивших званиеинженер-флагман 3-го ранга, инженер-флагман 2-го ранга, инженер-флагман 1-го ранга, инженер-флагман флота в период с 1935 по 1940 год.","Список начальствующего военно-технического состава Морских сил Рабоче-Крестьянской Красной Армии СССР содержит фамилии получивших званиеинженер-флагман 3-го ранга, инженер-флагман 2-го ранга, инженер-флагман 1-го ранга, инженер-флагман флота в период с 1935 по 1940 год.",0,1,0,0,0,0
"Зо́нтичная организа́ция — тип организации, представляющий собой ∪ учреждений, организаций или других юридических лиц, которые работают вместе в какой-либо отрасли, вместе координируют свою деятельность или распределяют ресурсы.","Зо́нтичная организа́ция — тип организации, представляющий собой объединение учреждений, организаций или других юридических лиц, которые работают вместе в какой-либо отрасли, вместе координируют свою деятельность или распределяют ресурсы.",0,1,0,0,0,0
"Мужская сборная Гонконга по баскетболу 3×3 представляет Гонконг на международных соревнованиях по баскетболу 3×3.","Мужская сборная Гонконга по баскетболу 3умножить на3 представляет Гонконг на международных соревнованиях по баскетболу 3умножить на3.",0,0,1,0,0,0
"По состоянию на 16 августа 2024, мужская сборная Гонконга по баскетболу 3×3 занимает 61-е место в мировом рейтинге ФИБА мужских сборных по баскетболу 3×3.","По состоянию на 16 августа 2024, мужская сборная Гонконга по баскетболу 3умножить на3 занимает 61-е место в мировом рейтинге ФИБА мужских сборных по баскетболу 3умножить на3.",0,0,1,0,0,0
"Кроме оригинальной чёрно-белой версии, ∃ также раскрашенная, сделанная в 1997 году.","Кроме оригинальной чёрно-белой версии, существует также раскрашенная, сделанная в 1997 году.",0,1,0,0,0,0
