question,answer,count_simple,count_simple_translated,count_simple_long,count_simple_long_translated,count_cases_translated,count_cases_long
"В центре ∃ сцена для концертов и представлений, библиотека, лекционная аудитория и конференц-зал.","В центре существует сцена для концертов и представлений, библиотека, лекционная аудитория и конференц-зал.",0,1,0,0,0,0
"У женщин мировой рекорд в беге на 100 м ∈ Флоренс Гриффит-Джойнер; установлен 16 июля 1988 года и составляет 10,49 с.","У женщин мировой рекорд в беге на 100 м принадлежит Флоренс Гриффит-Джойнер; установлен 16 июля 1988 года и составляет 10,49 с.",0,1,0,0,0,0
"Арте́ль — добровольное ∪ людей для совместной работы или иной коллективной деятельности, часто с участием в общих доходах и общей ответственностью на основе круговой поруки.","Арте́ль — добровольное объединение людей для совместной работы или иной коллективной деятельности, часто с участием в общих доходах и общей ответственностью на основе круговой поруки.",0,1,0,0,0,0
"∃ так же схема подключения ldisc, при которой файлами виртуальных устройств заменяется как консоль, так и UART.","Существует так же схема подключения ldisc, при которой файлами виртуальных устройств заменяется как консоль, так и UART.",0,1,0,0,0,0
"Одно из первых упоминаний данного термина было сделано в 1988 году, в книге Database Marketing, которая ∋ детальные рабочие примеры.","Одно из первых упоминаний данного термина было сделано в 1988 году, в книге Database Marketing, которая содержит детальные рабочие примеры.",0,1,0,0,0,0
"Здание ∋ более 12 тыс. квадратных метров площади, большинство из которых занимают ряд галерей, а также частные залы и коммунальное хозяйство.","Здание содержит более 12 тыс. квадратных метров площади, большинство из которых занимают ряд галерей, а также частные залы и коммунальное хозяйство.",0,1,0,0,0,0
"∃ определённое разнообразие форм чашелистиков среди цветковых.","Существует определённое разнообразие форм чашелистиков среди цветковых.",0,1,0,0,0,0
"«Ван Андел Арена», вмещающая 10 834 зрителей для хоккея с шайбой и до 13 184 зрителей для концертов, является четвёртой по величине ареной в Мичигане, а также крупнейшей в Западном Мичигане; > только «Литтл Сизарс-арена» в Детройте, «Центр студенческих мероприятий имени Джека Бреслина» в Ист-Лансинге и «Крайслер-центр» в Анн-Арборе.","«Ван Андел Арена», вмещающая 10 834 зрителей для хоккея с шайбой и до 13 184 зрителей для концертов, является четвёртой по величине ареной в Мичигане, а также крупнейшей в Западном Мичигане; больше только «Литтл Сизарс-арена» в Детройте, «Центр студенческих мероприятий имени Джека Бреслина» в Ист-Лансинге и «Крайслер-центр» в Анн-Арборе.",0,1,0,0,0,0
"«Бубновый валет» — общество художников, русская художественная группа, самое крупное творческое ∪ раннего авангарда, существовавшее с 1911 по 1917 год.","«Бубновый валет» — общество художников, русская художественная группа, самое крупное творческое объединение раннего авангарда, существовавшее с 1911 по 1917 год.",0,1,0,0,0,0
"Общероссийская общественная организация «Творческий союз художников России» (ТСХР) — добровольное общественное ∪ творческих работников в области изобразительного искусства, а также других лиц, занятых в сфере искусства и культуры.","Общероссийская общественная организация «Творческий союз художников России» (ТСХР) — добровольное общественное объединение творческих работников в области изобразительного искусства, а также других лиц, занятых в сфере искусства и культуры.",0,1,0,0,0,0
"Центр считается одним из лучших мест для проведения конференций на всём континенте, несмотря на то, что его возраст >, чем у множества других мест проведения мероприятий по всей Африке.","Центр считается одним из лучших мест для проведения конференций на всём континенте, несмотря на то, что его возраст больше, чем у множества других мест проведения мероприятий по всей Африке.",0,1,0,0,0,0
"Эта статья ∋ список всех песен данной группы каталогизированных по альбомам.","Эта статья содержит список всех песен данной группы каталогизированных по альбомам.",0,1,0,0,0,0
"Общество считает, что русские являются коренными жителями Латвии, будучи потомками древних балтийских славян (венедов, варягов-русь, кривичей), = как латыши являются коренными, будучи потомками различных балтских племён.","Общество считает, что русские являются коренными жителями Латвии, будучи потомками древних балтийских славян (венедов, варягов-русь, кривичей), равно как латыши являются коренными, будучи потомками различных балтских племён.",0,1,0,0,0,0
"По условиям контракта, спутник должен был быть выведен на орбиту с точностью ± 120 км.","По условиям контракта, спутник должен был быть выведен на орбиту с точностью плюс-минус 120 км.",0,1,0,0,0,0
"Знаком × отмечены виды, имеющие гибридное происхождение.","Знаком умножить на отмечены виды, имеющие гибридное происхождение.",0,0,1,0,0,0
"Знаком × отмечены виды, имеющие гибридное происхождение.","Знаком умножить на отмечены виды, имеющие гибридное происхождение.",0,0,1,0,0,0
"Дмитрий Юрьевич Бурдяев (21 февраля 1969, Москва — 17 июня 1995, Будённовск, Ставропольский край) — лейтенант, сотрудник Управления «А» («α») ФСБ Российской Федерации, активный участник специальной операции по освобождению заложников в Будённовске, погиб при исполнении служебных обязанностей.","Дмитрий Юрьевич Бурдяев (21 февраля 1969, Москва — 17 июня 1995, Будённовск, Ставропольский край) — лейтенант, сотрудник Управления «А» («Альфа») ФСБ Российской Федерации, активный участник специальной операции по освобождению заложников в Будённовске, погиб при исполнении служебных обязанностей.",0,1,0,0,0,0
"Смоле́нский вое́нный о́круг — оперативно-стратегическое территориальное ∪ Вооружённых сил СССР, существовавшее в 1945—1946 годах.","Смоле́нский вое́нный о́круг — оперативно-стратегическое территориальное объединение Вооружённых сил СССР, существовавшее в 1945—1946 годах.",0,1,0,0,0,0
"∃ проект по мелиорации окрестных земель, в котором водоём будет играть важную роль.","Существует проект по мелиорации окрестных земель, в котором водоём будет играть важную роль.",0,1,0,0,0,0
"∪ было завершено Объединенным координационным комитетом после 8 месяцев планирования.","Объединение было завершено Объединенным координационным комитетом после 8 месяцев планирования.",0,1,0,0,0,0
"ζ Девы (лат. ζ Virginis), 79 Девы (лат. 79 Virginis), HD 118098 — тройная звезда в созвездии Девы на расстоянии приблизительно 76 световых лет (около 23,3 парсек) от Солнца.","Дзета Девы (лат. ζ Virginis), 79 Девы (лат. 79 Virginis), HD 118098 — тройная звезда в созвездии Девы на расстоянии приблизительно 76 световых лет (около 23,3 парсек) от Солнца.",0,1,0,0,0,0
"Ныне на Голд-стрит расположены муниципальные здания, такие как Министерство жилищного строительства, планирования и развития (Голд-стрит, 100) и 6-е пожарное депо Нью-Йорка (∩ с Бикман-стрит), а также жилые здания, среди которых оформленное в стиле романского возрождения здание 1888 года постройки, принадлежавшее компании Excelsior Power Company.","Ныне на Голд-стрит расположены муниципальные здания, такие как Министерство жилищного строительства, планирования и развития (Голд-стрит, 100) и 6-е пожарное депо Нью-Йорка (пересечение с Бикман-стрит), а также жилые здания, среди которых оформленное в стиле романского возрождения здание 1888 года постройки, принадлежавшее компании Excelsior Power Company.",0,1,0,0,0,0
"Ма́ргарет Де́низ Куи́гли (англ. Margaret Denise Quigley); также Ли Μ Ки (вьет. Lý Mỹ Kỳ, кит. 李美琪), более известна как Мэ́гги Кью (англ. Maggie Q; род. 22 мая 1979, Гонолулу, Гавайи, США) — актриса и модель вьетнамского происхождения.","Ма́ргарет Де́низ Куи́гли (англ. Margaret Denise Quigley); также Ли Ми Ки (вьет. Lý Mỹ Kỳ, кит. 李美琪), более известна как Мэ́гги Кью (англ. Maggie Q; род. 22 мая 1979, Гонолулу, Гавайи, США) — актриса и модель вьетнамского происхождения.",0,1,0,0,0,0
"На́ксос (греч. Νάξος) — остров в Эгейском море, ∈ Греции.","На́ксос (греч. Νάξος) — остров в Эгейском море, принадлежит Греции.",0,1,0,0,0,0
"«Таллиби» ∈ рекордное количество погружений и всплытий (730) в ВМФ США.","«Таллиби» принадлежит рекордное количество погружений и всплытий (730) в ВМФ США.",0,1,0,0,0,0
"Также ∃ 3-х часовая телевизионная версия фильма, которая была впервые показана 22 мая 1996 года.","Также существует 3-х часовая телевизионная версия фильма, которая была впервые показана 22 мая 1996 года.",0,1,0,0,0,0
"5 мая 2023 года глава ВОЗ Тедрос Адханом Гебрейесус объявил, что COVID-19 > не является мировой чрезвычайной угрозой в области здравоохранения, хотя опасность продолжает оставаться серьёзной.","5 мая 2023 года глава ВОЗ Тедрос Адханом Гебрейесус объявил, что COVID-19 больше не является мировой чрезвычайной угрозой в области здравоохранения, хотя опасность продолжает оставаться серьёзной.",0,1,0,0,0,0
"Идея заполнения поля треугольного фронтона скульптурой ∈ древним грекам.","Идея заполнения поля треугольного фронтона скульптурой принадлежит древним грекам.",0,1,0,0,0,0
"∃ множество сайтов, посвящённых Worms.","Существует множество сайтов, посвящённых Worms.",0,1,0,0,0,0
"В городе ∃ футбольная команда, выступающая в Баварской футбольной лиге.","В городе существует футбольная команда, выступающая в Баварской футбольной лиге.",0,1,0,0,0,0
"LINPACK — программная библиотека, написанная на языке Фортран, которая ∋ набор подпрограмм для анализа и решения плотных систем линейных алгебраических уравнений.","LINPACK — программная библиотека, написанная на языке Фортран, которая содержит набор подпрограмм для анализа и решения плотных систем линейных алгебраических уравнений.",0,1,0,0,0,0
"Список фильмов, запрещённых к показу на Украине — данный информационный список ∋ российские фильмы и сериалы, которые запретили власти Украины.","Список фильмов, запрещённых к показу на Украине — данный информационный список содержит российские фильмы и сериалы, которые запретили власти Украины.",0,1,0,0,0,0
"Печать ∋ те же символы, что и флаг Макао.","Печать содержит те же символы, что и флаг Макао.",0,1,0,0,0,0
"С 2009 года реконструкцию и консервацию руин осуществляет гражданское ∪ по спасению замка Бреков, которое с 2009 года является членом объединения Zachráňme hrady (Сохраним замки).","С 2009 года реконструкцию и консервацию руин осуществляет гражданское объединение по спасению замка Бреков, которое с 2009 года является членом объединения Zachráňme hrady (Сохраним замки).",0,1,0,0,0,0
"Всеукраинское ∪ «Национальный совет тюрков-карапапаков Украины» — Всеукраинская общественная организация, которая объединяет все действующие на Украине тюрко-карапапакские организации, тюркоязычные общины и представителей тюркских народов.","Всеукраинское объединение «Национальный совет тюрков-карапапаков Украины» — Всеукраинская общественная организация, которая объединяет все действующие на Украине тюрко-карапапакские организации, тюркоязычные общины и представителей тюркских народов.",0,1,0,0,0,0
"∃ аналогичный термин «руссландферште́ерство» (нем. Russlandversteher; также «понимающие Россию»), образованный от слов «Россия» (Russland) и «понимать» (verstehen).","Существует аналогичный термин «руссландферште́ерство» (нем. Russlandversteher; также «понимающие Россию»), образованный от слов «Россия» (Russland) и «понимать» (verstehen).",0,1,0,0,0,0
"α Микроскопа (Alpha Microscopii, α Microscopii) — звезда в созвездии Микроскопа.","Альфа Микроскопа (Alpha Microscopii, α Microscopii) — звезда в созвездии Микроскопа.",0,1,0,0,0,0
"α Микроскопа является гигантской звездой спектрального класса G7 III на поздней стадии эволюции.","Альфа Микроскопа является гигантской звездой спектрального класса G7 III на поздней стадии эволюции.",0,1,0,0,0,0
"Не ∃ стандартного размера для РПИ — это вопрос удобства администрирования для задействованной страны (или стран).","Не существует стандартного размера для РПИ — это вопрос удобства администрирования для задействованной страны (или стран).",0,1,0,0,0,0
"∃ официальное предложение по стандартизации в языке C++ прикладного программного интерфейса отрисовки двумерной графики на основе библиотеки Cairo.","Существует официальное предложение по стандартизации в языке C++ прикладного программного интерфейса отрисовки двумерной графики на основе библиотеки Cairo.",0,1,0,0,0,0
"В 1818 году Г. Лазэр открыл в Бухаресте первую школу с преподаванием на румынском языке — школу имени Святого Саввы, которая ∃ и поныне, называясь Национальный колледж имени Святого Саввы.","В 1818 году Г. Лазэр открыл в Бухаресте первую школу с преподаванием на румынском языке — школу имени Святого Саввы, которая существует и поныне, называясь Национальный колледж имени Святого Саввы.",0,1,0,0,0,0
"Большой опыт создания зенитных неуправляемых ракет, ∪ разработки ракеты и двигателя в одном коллективе организаций ОКБ-3 НИИ-88 позволили быстро завершить этап наземной отработки и с середины 1950-х годов перейти к практическим испытаниям, которые прошли успешно и подтвердили достижение заданных характеристик комплекса.","Большой опыт создания зенитных неуправляемых ракет, объединение разработки ракеты и двигателя в одном коллективе организаций ОКБ-3 НИИ-88 позволили быстро завершить этап наземной отработки и с середины 1950-х годов перейти к практическим испытаниям, которые прошли успешно и подтвердили достижение заданных характеристик комплекса.",0,1,0,0,0,0
"Эйч π Ба́кстер (нем. H. P. Baxxter), имя при рождении Ханс Пе́тер Ге́рдес (нем. Hans Peter Geerdes; род. 16 марта 1964, Лер, ФРГ) — вокалист и фронтмен немецкой группы Scooter.","Эйч Пи Ба́кстер (нем. H. P. Baxxter), имя при рождении Ханс Пе́тер Ге́рдес (нем. Hans Peter Geerdes; род. 16 марта 1964, Лер, ФРГ) — вокалист и фронтмен немецкой группы Scooter.",0,1,0,0,0,0
"Береговая линия Восточной Малайзии протянулась на 2250 км по северному побережью острова Калимантан, на востоке она расчленена на глубоко врезавшиеся в сушу заливы (Дарвел, Сандакан, Киманис, Лабук, Маруду) и острова, наиболее крупные из которых — Джамбонган, Банги, Лабуан и северная часть Себатика (южная ∈ Индонезии).","Береговая линия Восточной Малайзии протянулась на 2250 км по северному побережью острова Калимантан, на востоке она расчленена на глубоко врезавшиеся в сушу заливы (Дарвел, Сандакан, Киманис, Лабук, Маруду) и острова, наиболее крупные из которых — Джамбонган, Банги, Лабуан и северная часть Себатика (южная принадлежит Индонезии).",0,1,0,0,0,0
"(766) Могунтия (лат. Moguntia) — астероид внешней части главного пояса, который ∈ спектральному классу M.","(766) Могунтия (лат. Moguntia) — астероид внешней части главного пояса, который принадлежит спектральному классу M.",0,1,0,0,0,0
"Дельта-дю-Флёв-Сенегаль, или Δ Сенегала, — трансграничный биосферный резерват, основанный в 2005 году в дельте реки Сенегал на территории Сенегала и Мавритании.","Дельта-дю-Флёв-Сенегаль, или дельта Сенегала, — трансграничный биосферный резерват, основанный в 2005 году в дельте реки Сенегал на территории Сенегала и Мавритании.",0,1,0,0,0,0
