question,answer,count_simple,count_simple_translated,count_simple_long,count_simple_long_translated,count_cases_translated,count_cases_long
"Во время суда Борман утверждала, что она присоединилась к свите СС в 1938 году, «чтобы заработать > денег».","Во время суда Борман утверждала, что она присоединилась к свите СС в 1938 году, «чтобы заработать больше денег».",0,1,0,0,0,0
"υ Ориона (υ Ориона, Upsilon Orionis, υ Orionis, сокращ. ups Ori, υ Ori) — звезда в экваториальном созвездии Ориона, расположенная к югу от Йоты Ориона.","Ипсилон Ориона (υ Ориона, Upsilon Orionis, υ Orionis, сокращ. ups Ori, υ Ori) — звезда в экваториальном созвездии Ориона, расположенная к югу от Йоты Ориона.",0,1,0,0,0,0
"Женская сборная Бразилии по баскетболу 3×3 представляет Бразилию на международных соревнованиях по баскетболу 3×3.","Женская сборная Бразилии по баскетболу 3умножить на3 представляет Бразилию на международных соревнованиях по баскетболу 3умножить на3.",0,0,1,0,0,0
"По состоянию на 11 сентября 2024, женская сборная Бразилии по баскетболу 3×3 занимает 51-е место в мировом рейтинге ФИБА женских сборных по баскетболу 3×3.","По состоянию на 11 сентября 2024, женская сборная Бразилии по баскетболу 3умножить на3 занимает 51-е место в мировом рейтинге ФИБА женских сборных по баскетболу 3умножить на3.",0,0,1,0,0,0
"Карл фон Бэр сформулировал закон в 1828 году, и он звучит следующим образом: «Чем более ранние стадии индивидуального развития сравниваются, тем > сходства удается обнаружить».","Карл фон Бэр сформулировал закон в 1828 году, и он звучит следующим образом: «Чем более ранние стадии индивидуального развития сравниваются, тем больше сходства удается обнаружить».",0,1,0,0,0,0
"Стабильная популяция ∃ на территории североперуанского национального парка Рио-Абисео.","Стабильная популяция существует на территории североперуанского национального парка Рио-Абисео.",0,1,0,0,0,0
"Гимнофтальмиды являются небольшими ящерицами, взрослые особи имеют длину < чем 60-миллиметров.","Гимнофтальмиды являются небольшими ящерицами, взрослые особи имеют длину меньше чем 60-миллиметров.",0,1,0,0,0,0
"Флавия Тавр Селевк Кир (лат. Flavius Taurus Seleucus Cyrus), > известный как Кир Панопольский (греч. Κύρος ὁ Πανοπολίτης), был влиятельным лицом в Восточной Римской империи, эпическим поэтом, философом и любителем греческого искусства.","Флавия Тавр Селевк Кир (лат. Flavius Taurus Seleucus Cyrus), больше известный как Кир Панопольский (греч. Κύρος ὁ Πανοπολίτης), был влиятельным лицом в Восточной Римской империи, эпическим поэтом, философом и любителем греческого искусства.",0,1,0,0,0,0
"∃ версия, что сабатиновцы принимали участие в разгроме Микенской Греции.","Существует версия, что сабатиновцы принимали участие в разгроме Микенской Греции.",0,1,0,0,0,0
"«Ёжик + черепаха» — советский кукольный мультфильм 1981 года по мотивам сказки Редьярда Киплинга «Откуда взялись броненосцы».","«Ёжик плюс черепаха» — советский кукольный мультфильм 1981 года по мотивам сказки Редьярда Киплинга «Откуда взялись броненосцы».",0,1,0,0,0,0
"π Ориона (π Ориона, Pi Orionis, π Orionis , сокращ. Pi Ori, π Ori) — группа довольно компактных звёзд в северном созвездии Ориона, где они образуют астеризм Щит Ориона, или Лук Ориона.","Пи Ориона (π Ориона, Pi Orionis, π Orionis , сокращ. Pi Ori, π Ori) — группа довольно компактных звёзд в северном созвездии Ориона, где они образуют астеризм Щит Ориона, или Лук Ориона.",0,1,0,0,0,0
"В профессиональном рестлинге Пуш (англ. Push) (рус. Продвижение) — это попытка букера заставить рестлера выиграть > матчей и стать более популярным или более оскорбленным фанатами в зависимости от того, кем он является героическим персонажем («фейсом») или злодеем («хил»).","В профессиональном рестлинге Пуш (англ. Push) (рус. Продвижение) — это попытка букера заставить рестлера выиграть больше матчей и стать более популярным или более оскорбленным фанатами в зависимости от того, кем он является героическим персонажем («фейсом») или злодеем («хил»).",0,1,0,0,0,0
"(6144) Кондодзиро (лат. Kondojiro) — небольшой астероид, который ∈ к тёмному спектральному классу D.","(6144) Кондодзиро (лат. Kondojiro) — небольшой астероид, который принадлежит к тёмному спектральному классу D.",0,1,0,0,0,0
"Международная ассоциация филателистических экспертов (АИЕП, от фр. Association internationale des experts en philatélie — AIEP) — учреждённое в 1954 году некоммерческое добровольное ∪ филателистических экспертов из разных государств мира.","Международная ассоциация филателистических экспертов (АИЕП, от фр. Association internationale des experts en philatélie — AIEP) — учреждённое в 1954 году некоммерческое добровольное объединение филателистических экспертов из разных государств мира.",0,1,0,0,0,0
"Список мечетей Казахстана с внутренней вместимостью > 500 человек на август 2022 года по данным Комитета по делам религии Министерства общественного развития Казахстана.","Список мечетей Казахстана с внутренней вместимостью больше 500 человек на август 2022 года по данным Комитета по делам религии Министерства общественного развития Казахстана.",0,1,0,0,0,0
"Изначально термином «сателлитная ДНК» обозначали ту часть эукариотического генома, которая отделялась при градиентном ультрацентрифугировании и, ⇒, по плотности и по содержанию пар АТ/ГЦ должна была отличаться от основной массы ДНК.","Изначально термином «сателлитная ДНК» обозначали ту часть эукариотического генома, которая отделялась при градиентном ультрацентрифугировании и, следовательно, по плотности и по содержанию пар АТ/ГЦ должна была отличаться от основной массы ДНК.",0,1,0,0,0,0
"Val × Love (яп. 戦×恋 (ヴァルラヴ) икуса × кой (варураву)) — манга Рёсукэ Асакуры, выходящая с декабря 2015 года в журнале Monthly Shonen Gangan издательства Square Enix.","Val умножить на Love (яп. 戦умножить на恋 (ヴァルラヴ) икуса умножить на кой (варураву)) — манга Рёсукэ Асакуры, выходящая с декабря 2015 года в журнале Monthly Shonen Gangan издательства Square Enix.",0,0,1,0,0,0
"Латинская буква R произошла от греческой ρ (ρ).","Латинская буква R произошла от греческой ро (ρ).",0,1,0,0,0,0
"Адрес: Ростовская область, г. Константиновск, ∩ Комсомольской и Коммунистической.","Адрес: Ростовская область, г. Константиновск, пересечение Комсомольской и Коммунистической.",0,1,0,0,0,0
"Зеленогорская рукопись целиком написана зелёными чернилами (что для средневековья абсолютно нехарактерно) и ∋ четыре пергаментных листа, основную часть которых занимает неоконченная поэма «Суд Либуши» (120 стихов) — о том, как княжна Либуше созвала суд, чтобы рассудить спор двух братьев, Хрудоша и Стяглава, по поводу наследства.","Зеленогорская рукопись целиком написана зелёными чернилами (что для средневековья абсолютно нехарактерно) и содержит четыре пергаментных листа, основную часть которых занимает неоконченная поэма «Суд Либуши» (120 стихов) — о том, как княжна Либуше созвала суд, чтобы рассудить спор двух братьев, Хрудоша и Стяглава, по поводу наследства.",0,1,0,0,0,0
"Термином «партнёрский маркетинг» также обозначают целую отрасль, в которой ∃ ряд специализированных компаний и профессионалов-одиночек, реализующих эту форму интернет-маркетинга во всем её многообразии.","Термином «партнёрский маркетинг» также обозначают целую отрасль, в которой существует ряд специализированных компаний и профессионалов-одиночек, реализующих эту форму интернет-маркетинга во всем её многообразии.",0,1,0,0,0,0
"> всего медалей по биатлону на зимних Паралимпийских играх 2018 собрала Украина (золотых медалей - 4, серебряных - 5, бронзовых - 5, всего - 14).","Больше всего медалей по биатлону на зимних Паралимпийских играх 2018 собрала Украина (золотых медалей - 4, серебряных - 5, бронзовых - 5, всего - 14).",0,1,0,0,0,0
"Shadow.tech — платформа облачного гейминга, созданная французской компанией Blade (с недавнего времени ∈ OVHcloud).","Shadow.tech — платформа облачного гейминга, созданная французской компанией Blade (с недавнего времени принадлежит OVHcloud).",0,1,0,0,0,0
"По поводу начала периода Чжаньго среди историков ∃ два мнения.","По поводу начала периода Чжаньго среди историков существует два мнения.",0,1,0,0,0,0
"9G-Tronic (код 725) или NAG3 — ® 9-ступенчатых автоматических коробок передач немецкой компании Mercedes-Benz, заменивших в 2013 году модель 7G-Tronic.","9G-Tronic (код 725) или NAG3 — торговая марка 9-ступенчатых автоматических коробок передач немецкой компании Mercedes-Benz, заменивших в 2013 году модель 7G-Tronic.",0,0,0,1,0,0
"В большинстве современных программ персональный счёт участника пополняется за каждый полет ∝ расстоянию и в зависимости от класса перевозки, реже — ∝ стоимости билета.","В большинстве современных программ персональный счёт участника пополняется за каждый полет пропорционально расстоянию и в зависимости от класса перевозки, реже — пропорционально стоимости билета.",0,2,0,0,0,0
'Ассоциация профессиональных директоров АНД (ранее Некоммерческое партнерство содействия профессиональной деятельности "∪ независимых корпоративных директоров") или АНД — профессиональное ∪ независимых корпоративных директоров, созданное в 2002 году.','Ассоциация профессиональных директоров АНД (ранее Некоммерческое партнерство содействия профессиональной деятельности "Объединение независимых корпоративных директоров") или АНД — профессиональное объединение независимых корпоративных директоров, созданное в 2002 году.',0,2,0,0,0,0
"Консульский патент ∋ полное имя консула, его ранг, должность, консульский округ и местонахождение консульства.","Консульский патент содержит полное имя консула, его ранг, должность, консульский округ и местонахождение консульства.",0,1,0,0,0,0
"Изоморфным представлением рассмотренной алгебры паравекторов является известная алгебра комплексных матриц 2×2 – алгебра Паули, повседневно используемая в квантовой механике: базисом этой алгебры служат матрицы Паули.","Изоморфным представлением рассмотренной алгебры паравекторов является известная алгебра комплексных матриц 2умножить на2 – алгебра Паули, повседневно используемая в квантовой механике: базисом этой алгебры служат матрицы Паули.",0,0,1,0,0,0
"Всего официально ∃ 3 вида наград, остальные награды не присутствуют на сайте наград YouTube.","Всего официально существует 3 вида наград, остальные награды не присутствуют на сайте наград YouTube.",0,1,0,0,0,0
"Игра ∈ к семейству манкала, включающему такие игры, как вари или калах.","Игра принадлежит к семейству манкала, включающему такие игры, как вари или калах.",0,1,0,0,0,0
"Хромосома эукариот образуется из единственной и чрезвычайно длинной молекулы ДНК, которая ∋ линейную группу множества генов.","Хромосома эукариот образуется из единственной и чрезвычайно длинной молекулы ДНК, которая содержит линейную группу множества генов.",0,1,0,0,0,0
"Мюзену ∈ четыре сборника упражнений для скрипки, ряд салонных пьес.","Мюзену принадлежит четыре сборника упражнений для скрипки, ряд салонных пьес.",0,1,0,0,0,0
"(443) Фотографика (фр. photographie ) — астероид главного пояса, который ∈ к светлому спектральному классу S.","(443) Фотографика (фр. photographie ) — астероид главного пояса, который принадлежит к светлому спектральному классу S.",0,1,0,0,0,0
"Кругово́й перекрёсток или кольцевое ∩ — перекрёсток, где приближающиеся транспортные средства замедляются и начинают круговое движение вокруг центрального «острова» в направлении против часовой стрелки на дорогах с правосторонним движением либо по часовой стрелке на дорогах с левосторонним движением, до выезда на одном из поворотов (ответвлений) с кругового перекрёстка.","Кругово́й перекрёсток или кольцевое пересечение — перекрёсток, где приближающиеся транспортные средства замедляются и начинают круговое движение вокруг центрального «острова» в направлении против часовой стрелки на дорогах с правосторонним движением либо по часовой стрелке на дорогах с левосторонним движением, до выезда на одном из поворотов (ответвлений) с кругового перекрёстка.",0,1,0,0,0,0
"В настоящее время ∃ большое количество дву- и многоязычных переводных словарей.","В настоящее время существует большое количество дву- и многоязычных переводных словарей.",0,1,0,0,0,0
"Пруннеру ∈ ряд транскрипций для контрабаса, в том числе сочинений Иоганна Себастьяна Баха и Людвига ван Бетховена.","Пруннеру принадлежит ряд транскрипций для контрабаса, в том числе сочинений Иоганна Себастьяна Баха и Людвига ван Бетховена.",0,1,0,0,0,0
"Брезици (серб. Брезици, хорв. Brezici) — населенный пункт (деревня) в общине Дервента, который ∈ энтитету Республике Сербской, Босния и Герцеговина.","Брезици (серб. Брезици, хорв. Brezici) — населенный пункт (деревня) в общине Дервента, который принадлежит энтитету Республике Сербской, Босния и Герцеговина.",0,1,0,0,0,0
"Сперджен 38 лет был пастором церкви «New Park Street Chapel» (рус. «Часовня на улице Нью Парк», позже «Metropolitan Tabernacle» (рус. «Метрополитанская скиния»)) в Лондоне, крупнейшей баптистской церкви в Англии . Он был участником нескольких конфликтов с Баптистским союзом Великобритании и позже покинул это ∪ по причине расхождения в убеждениях.","Сперджен 38 лет был пастором церкви «New Park Street Chapel» (рус. «Часовня на улице Нью Парк», позже «Metropolitan Tabernacle» (рус. «Метрополитанская скиния»)) в Лондоне, крупнейшей баптистской церкви в Англии . Он был участником нескольких конфликтов с Баптистским союзом Великобритании и позже покинул это объединение по причине расхождения в убеждениях.",0,1,0,0,0,0
"Знаком × отмечены виды, имеющие гибридное происхождение.","Знаком умножить на отмечены виды, имеющие гибридное происхождение.",0,0,1,0,0,0
"Γ-коррекция или коррекция гаммы (иногда — Γ) — предыскажения яркости чёрно-белого или цветоделённых составляющих цветного изображения при его записи в телевидении и цифровой фотографии.","Гамма-коррекция или коррекция гаммы (иногда — гамма) — предыскажения яркости чёрно-белого или цветоделённых составляющих цветного изображения при его записи в телевидении и цифровой фотографии.",0,2,0,0,0,0
"За свою карьеру Хэдли сыграл более чем в 100 фильмах, среди них «Сражающийся легион Зорро» (1939), «Банковский сыщик» (1940), «Приключения капитана Марвела» (1941), «Вперёд, путешественник» (1942), «На одном крыле и молитве» (1944), «Бог ей судья» (1945), «Тёмный ∠» (1946), «Капитан из Кастильи» (1947), «Я застрелил Джесси Джеймса» (1949) и «Аризонский барон» (1950).","За свою карьеру Хэдли сыграл более чем в 100 фильмах, среди них «Сражающийся легион Зорро» (1939), «Банковский сыщик» (1940), «Приключения капитана Марвела» (1941), «Вперёд, путешественник» (1942), «На одном крыле и молитве» (1944), «Бог ей судья» (1945), «Тёмный угол» (1946), «Капитан из Кастильи» (1947), «Я застрелил Джесси Джеймса» (1949) и «Аризонский барон» (1950).",0,1,0,0,0,0
