question,answer,count_simple,count_simple_translated,count_simple_long,count_simple_long_translated,count_cases_translated,count_cases_long
"Гусман Ситтыкович Косанов (каз. Ғұсман Сыйттықұлы Қосанов) (1935—1990) — заслуженный мастер спорта СССР (1965), советский легкоатлет, серебряный призёр Олимпиады-1960 в Риме (эстафета 4×100 метров), первый призёр Олимпийских игр — уроженец Казахстана и этнический казах.","Гусман Ситтыкович Косанов (каз. Ғұсман Сыйттықұлы Қосанов) (1935—1990) — заслуженный мастер спорта СССР (1965), советский легкоатлет, серебряный призёр Олимпиады-1960 в Риме (эстафета 4умножить на100 метров), первый призёр Олимпийских игр — уроженец Казахстана и этнический казах.",0,0,1,0,0,0
"Четвёртая космическая скорость не постоянна ∀ точек галактики, а зависит от координаты.","Четвёртая космическая скорость не постоянна для всех точек галактики, а зависит от координаты.",0,0,0,1,0,0
"По мнению рецензента Anime News Network, «данное произведение не является столь новаторским и революционным, как „Евангелион“, и его дух > соответствует Gunbuster 2.","По мнению рецензента Anime News Network, «данное произведение не является столь новаторским и революционным, как „Евангелион“, и его дух больше соответствует Gunbuster 2.",0,1,0,0,0,0
"Список начальствующего военно-ветеринарного состава Рабоче-Крестьянской Красной Армии и войск НКВД ∋ фамилии получивших звания бригветврач, дивветврач, корветврач в период с 1935 по 1943 год и присвоенные им после 1943 года звания полковник ветеринарной службы, генерал-майор ветеринарной службы и генерал-лейтенант ветеринарной службы.","Список начальствующего военно-ветеринарного состава Рабоче-Крестьянской Красной Армии и войск НКВД содержит фамилии получивших звания бригветврач, дивветврач, корветврач в период с 1935 по 1943 год и присвоенные им после 1943 года звания полковник ветеринарной службы, генерал-майор ветеринарной службы и генерал-лейтенант ветеринарной службы.",0,1,0,0,0,0
"Кёллингу ∈ оперетта «Бабочки» (нем. Schmetterlinge, либретто Ф. В. Вульфа), поставленная в 1891 г. в Гамбурге, оркестровые сочинения и пользовавшиеся значительной популярностью многочисленные салонные фортепианные пьесы, в общей сложности около 500 произведений.","Кёллингу принадлежит оперетта «Бабочки» (нем. Schmetterlinge, либретто Ф. В. Вульфа), поставленная в 1891 г. в Гамбурге, оркестровые сочинения и пользовавшиеся значительной популярностью многочисленные салонные фортепианные пьесы, в общей сложности около 500 произведений.",0,1,0,0,0,0
"Последнее прижизненное издание сборника де Мельо ∋ 150 песен (3 тома).","Последнее прижизненное издание сборника де Мельо содержит 150 песен (3 тома).",0,1,0,0,0,0
"Большинство скатов живёт в морской воде, однако ∃ и несколько пресноводных видов (моторо и другие).","Большинство скатов живёт в морской воде, однако существует и несколько пресноводных видов (моторо и другие).",0,1,0,0,0,0
"Традиционно название меча толковалось, как «Меч, скашивающий траву», но в XXI веке > распространено толкование «Меч, [разящий] змея» (т.к. в древнеяпонском слово «наги» обозначало «змей»).","Традиционно название меча толковалось, как «Меч, скашивающий траву», но в XXI веке больше распространено толкование «Меч, [разящий] змея» (т.к. в древнеяпонском слово «наги» обозначало «змей»).",0,1,0,0,0,0
"Фактически «Раскол» стал номерным альбомом, многих его композиций не ∃ в студийных версиях, а при подготовке издания звукорежиссёр убрал аплодисменты зрительного зала, приблизив тем самым звучание к студийному.","Фактически «Раскол» стал номерным альбомом, многих его композиций не существует в студийных версиях, а при подготовке издания звукорежиссёр убрал аплодисменты зрительного зала, приблизив тем самым звучание к студийному.",0,1,0,0,0,0
"Гербовое изображение организации ∋ портрет российского и советского учёного В. И. Вернадского.","Гербовое изображение организации содержит портрет российского и советского учёного В. И. Вернадского.",0,1,0,0,0,0
"В Германии ∃ большое разнообразие сортов пива, как распространённых только регионально, так и продающихся по всей стране.","В Германии существует большое разнообразие сортов пива, как распространённых только регионально, так и продающихся по всей стране.",0,1,0,0,0,0
"ТЭ2 (тепловоз с электрической передачей, 2-я модель, прозвища — Бычок, Люська, Монголка, Фердинанд) — советский восьмиосный двухсекционный (тип 2(20—20)) грузопассажирский тепловоз мощностью 2×1000 л.с., выпускавшийся с 1948 по 1955 гг. на Харьковском заводе транспортного машиностроения при участии Харьковского электротехнического завода (ХЭТЗ).","ТЭ2 (тепловоз с электрической передачей, 2-я модель, прозвища — Бычок, Люська, Монголка, Фердинанд) — советский восьмиосный двухсекционный (тип 2(20—20)) грузопассажирский тепловоз мощностью 2умножить на1000 л.с., выпускавшийся с 1948 по 1955 гг. на Харьковском заводе транспортного машиностроения при участии Харьковского электротехнического завода (ХЭТЗ).",0,0,1,0,0,0
"Baal — мини-альбом Дэвида Боуи, вышедший в 1982 году, диск ∋ композиции написанные для одноименной пьесы Бертольта Брехта.","Baal — мини-альбом Дэвида Боуи, вышедший в 1982 году, диск содержит композиции написанные для одноименной пьесы Бертольта Брехта.",0,1,0,0,0,0
"Ему ∈ «Словарь американской лингвистической терминологии» (русский перевод 1964).","Ему принадлежит «Словарь американской лингвистической терминологии» (русский перевод 1964).",0,1,0,0,0,0
"«5×2» (фр. 5×2; также Cinq fois deux) — французский художественный фильм режиссёра Франсуа Озона.","«5умножить на2» (фр. 5умножить на2; также Cinq fois deux) — французский художественный фильм режиссёра Франсуа Озона.",0,0,1,0,0,0
"«Más» (рус. >) — второй сингл с альбома Рики Мартина Música + Alma + Sexo.","«Más» (рус. Больше) — второй сингл с альбома Рики Мартина Música + Alma + Sexo.",0,1,0,0,0,0
"1-я гвардейская танковая Краснознамённая армия (сокр. 1 ТА, в/ч 73621) — гвардейское оперативное ∪ в составе Вооружённых сил СССР (1943—1991) и России (1991—1999, 2014 — н. в.).","1-я гвардейская танковая Краснознамённая армия (сокр. 1 ТА, в/ч 73621) — гвардейское оперативное объединение в составе Вооружённых сил СССР (1943—1991) и России (1991—1999, 2014 — н. в.).",0,1,0,0,0,0
"Месторождение ∋ семь залежей конденсатсодержащего газа.","Месторождение содержит семь залежей конденсатсодержащего газа.",0,1,0,0,0,0
"Церковь ∈ монашескому ордену лазаристов, которые прибыли в Краков в 1682 году по приглашению краковского епископа Яна Малаховского.","Церковь принадлежит монашескому ордену лазаристов, которые прибыли в Краков в 1682 году по приглашению краковского епископа Яна Малаховского.",0,1,0,0,0,0
"Состоит из 190 пергаментных листов ин-фолио, имеет размеры 280×200 мм.","Состоит из 190 пергаментных листов ин-фолио, имеет размеры 280умножить на200 мм.",0,0,1,0,0,0
"∋ 9 декоративных инициалов и 27 миниатюр, изображающих сцены из Ветхого Завета, Страстей Христовых и жития Пресвятой Девы Марии, отличающиеся насыщенными красками.","содержит 9 декоративных инициалов и 27 миниатюр, изображающих сцены из Ветхого Завета, Страстей Христовых и жития Пресвятой Девы Марии, отличающиеся насыщенными красками.",0,1,0,0,0,0
"В отличие от предыдущего инструментального альбома, который в основном исполнялся оркестром, Moondog 2 ∋ вокальные композиции в канонах, раундах и мадригалах.","В отличие от предыдущего инструментального альбома, который в основном исполнялся оркестром, Moondog 2 содержит вокальные композиции в канонах, раундах и мадригалах.",0,1,0,0,0,0
"В большинстве разновидностей классического джаза ∃ соглашение, при котором в паре нот, записанных как ноты одинаковой длины, первая нота играется длиннее второй немного > чем на половину, воспринимаясь на слух как триоль, вторая нота как правило имеет небольшой акцент.","В большинстве разновидностей классического джаза существует соглашение, при котором в паре нот, записанных как ноты одинаковой длины, первая нота играется длиннее второй немного больше чем на половину, воспринимаясь на слух как триоль, вторая нота как правило имеет небольшой акцент.",0,2,0,0,0,0
"(795) Фини (лат. Fini) — небольшой астероид главного пояса, который ∈ к светлому спектральному классу C.","(795) Фини (лат. Fini) — небольшой астероид главного пояса, который принадлежит к светлому спектральному классу C.",0,1,0,0,0,0
"∃ две версии песни «Revolution»: быстрая версия для стороны «Б» сингла «Hey Jude» и медленная версия «Revolution 1», вошедшая в одноимённый альбом «Битлз».","Существует две версии песни «Revolution»: быстрая версия для стороны «Б» сингла «Hey Jude» и медленная версия «Revolution 1», вошедшая в одноимённый альбом «Битлз».",0,1,0,0,0,0
"1-я гвардейская танковая Краснознамённая армия (сокр. 1 ТА, в/ч 73621) — гвардейское оперативное ∪ в составе Вооружённых сил СССР (1943—1991) и России (1991—1999, 2014 — н. в.).","1-я гвардейская танковая Краснознамённая армия (сокр. 1 ТА, в/ч 73621) — гвардейское оперативное объединение в составе Вооружённых сил СССР (1943—1991) и России (1991—1999, 2014 — н. в.).",0,1,0,0,0,0
"Локомотивное депо Орехово — предприятие железнодорожного транспорта в Московской области, ∈ к Московской железной дороге.","Локомотивное депо Орехово — предприятие железнодорожного транспорта в Московской области, принадлежит к Московской железной дороге.",0,1,0,0,0,0
"В немецком языке «буттерброт» сохранил только прямое значение «хлеб с маслом», а для обозначения бутербродов с иными ингредиентами ∃ целый ряд других слов.","В немецком языке «буттерброт» сохранил только прямое значение «хлеб с маслом», а для обозначения бутербродов с иными ингредиентами существует целый ряд других слов.",0,1,0,0,0,0
"Всего официально ∃ 3 вида наград, остальные награды не присутствуют на сайте наград YouTube.","Всего официально существует 3 вида наград, остальные награды не присутствуют на сайте наград YouTube.",0,1,0,0,0,0
"Мужская сборная Анголы по баскетболу 3×3 представляет Анголу на международных соревнованиях по баскетболу 3×3.","Мужская сборная Анголы по баскетболу 3умножить на3 представляет Анголу на международных соревнованиях по баскетболу 3умножить на3.",0,0,1,0,0,0
"По состоянию на 21 сентября 2024, мужская сборная Анголы по баскетболу 3×3 занимает 103-е место в мировом рейтинге ФИБА мужских сборных по баскетболу 3×3.","По состоянию на 21 сентября 2024, мужская сборная Анголы по баскетболу 3умножить на3 занимает 103-е место в мировом рейтинге ФИБА мужских сборных по баскетболу 3умножить на3.",0,0,1,0,0,0
"Мужская эстафета 4×7,5 км в биатлоне на зимних Олимпийских играх 1968 года прошла 15 февраля.","Мужская эстафета 4умножить на7,5 км в биатлоне на зимних Олимпийских играх 1968 года прошла 15 февраля.",0,0,1,0,0,0
"Как и у большинства народных песен, у «Муромской дорожки…» нет единого текста: она ∃ во множестве вариантов, но все они повествуют о несчастной девушке, которой её возлюбленный пообещал «одну меня любить», но нарушил слово и женился на другой.","Как и у большинства народных песен, у «Муромской дорожки…» нет единого текста: она существует во множестве вариантов, но все они повествуют о несчастной девушке, которой её возлюбленный пообещал «одну меня любить», но нарушил слово и женился на другой.",0,1,0,0,0,0
"Тавлинцы (ед. ч. тавлинец; от тюркского слова «τ» — «гора»; досл. «горец») — в русских источниках времён Кавказской войны — название жителей Северной части горного Дагестана.","Тавлинцы (ед. ч. тавлинец; от тюркского слова «тау» — «гора»; досл. «горец») — в русских источниках времён Кавказской войны — название жителей Северной части горного Дагестана.",0,1,0,0,0,0
"∈ большой серии австрийских миноносцев типа (Tb 82 F) построенных в Фиуме и типа (Tb 98 M) построенных в Монфальконе.","Принадлежит большой серии австрийских миноносцев типа (Tb 82 F) построенных в Фиуме и типа (Tb 98 M) построенных в Монфальконе.",0,1,0,0,0,0
"«Азербайджанская община Нагорно-Карабахского региона Азербайджанской Республики» (азерб. Azərbaycan Respublikası Dağlıq Qarabağ bölgəsinin azərbaycanlı icması) — общественное ∪ в Азербайджане, заявлявшее себя как созданное в 1992 году (однако официально зарегистрированное в 2006 году) и представляющее интересы азербайджанцев, проживавших на территории Нагорного Карабаха до Первой карабахской войны и вынужденных сменить место проживания из-за конфликта.","«Азербайджанская община Нагорно-Карабахского региона Азербайджанской Республики» (азерб. Azərbaycan Respublikası Dağlıq Qarabağ bölgəsinin azərbaycanlı icması) — общественное объединение в Азербайджане, заявлявшее себя как созданное в 1992 году (однако официально зарегистрированное в 2006 году) и представляющее интересы азербайджанцев, проживавших на территории Нагорного Карабаха до Первой карабахской войны и вынужденных сменить место проживания из-за конфликта.",0,1,0,0,0,0
"Эффе́кт О́берта — в космонавтике — эффект, проявляющийся в том, что ракетный двигатель, движущийся с высокой скоростью, совершает > полезной работы, чем такой же двигатель, движущийся медленно.","Эффе́кт О́берта — в космонавтике — эффект, проявляющийся в том, что ракетный двигатель, движущийся с высокой скоростью, совершает больше полезной работы, чем такой же двигатель, движущийся медленно.",0,1,0,0,0,0
"Эффект Оберта вызывается тем, что при движении с высокой скоростью топливо имеет > энергии, доступной для использования (при скорости, превышающей половину скорости реактивной струи, кинетическая энергия может превысить потенциальную химическую энергию), и эта энергия может использоваться для получения большей механической мощности.","Эффект Оберта вызывается тем, что при движении с высокой скоростью топливо имеет больше энергии, доступной для использования (при скорости, превышающей половину скорости реактивной струи, кинетическая энергия может превысить потенциальную химическую энергию), и эта энергия может использоваться для получения большей механической мощности.",0,1,0,0,0,0
"При объяснении принципа действия многоступенчатых ракет также можно пользоваться эффектом Оберта: верхние ступени создают > кинетической энергии, чем ожидается при простом анализе по химической энергии топлива, которое они несут.","При объяснении принципа действия многоступенчатых ракет также можно пользоваться эффектом Оберта: верхние ступени создают больше кинетической энергии, чем ожидается при простом анализе по химической энергии топлива, которое они несут.",0,1,0,0,0,0
"∃ так называемый Клуб Игоря Нетто, в который входят футболисты, сыгравшие в составе сборных СССР и России более 50 матчей.","Существует так называемый Клуб Игоря Нетто, в который входят футболисты, сыгравшие в составе сборных СССР и России более 50 матчей.",0,1,0,0,0,0
"Литература на языке хинди ∈ к самым богатым и замечательным новоиндийским литературам.","Литература на языке хинди принадлежит к самым богатым и замечательным новоиндийским литературам.",0,1,0,0,0,0
