abbreviation,encounters
Альфами могут быть как самцы, так и самки, а также и те и др., в зависимости от вида.,1
В исследованиях по этологии социальным животным в иерархическом сообществе иногда присваиваются и др. градации, такие как бета, гамма и омега.,1
Омега-особи подчиняются всем остальным в сообществе, и др. в группе ожидают от них такого поведения.,1
Притоками её являются реки Куртиагу, Арли, Дудодо, Сингу, Уке (Вале) и др..,1
Неоднократно выезжал в «горячие точки» во Вьетнам, Лаос, Камбоджу, Эфиопию и др. страны.,1
Сестра — Коринна Кирилловна Гладкова, врач, учёный, д. м. н., профессор, чл. Академии медицинских наук СССР.,1
В последние гг. вышли «Тайны спецслужб III-го Рейха», книги серии «Жизнь замечательных людей» (о В. Р. Менжинском, Д. Н. Медведеве, А. М. Короткове, А. Х. Артузове), первая в стране кн. о выдающемся разведчике Якове Голосе и др..,1
Хроностратиграфическое сравнение с другими участками и биостратиграфия позволяют предположить возраст 5-й стадии изотопа кислорода (Oxygen Isotope Stage 5) или ранней 4-й стадии изотопа кислорода (ок. 70 000 лет до наст. времени) для мустьерских отложений, содержащих захоронение.,1
Другие группы этого жанра — Secret Trial Five, Fedayeen, Sarmust, KB и др. группы, записывающиеся в SG-Records.,1
В периодических изданиях был помещён ряд работ его по вопросам о церкви, о централизации, о войне за австр. наследство, о риксдаге в XVIII вв. и др..,1
В наст. время применяются подвижные клетки, подвешенные на гофрированном шланге или на пружинах, с помощью которых измеряют смещения клетки.,1
В наст. время орг-ция включает 5230 членов в 30 странах.,1
Музей артефактов включает в себя исторические документы, личные вещи, видео и устные рассказы, фотографии, памятные и др. значимые экспонаты со всего мира.,1
Переходной формой правления и те, и др. признавали демократическую республику с последующим преобразованием в республику Советов.,1
При этом промонархические силы не могли отказаться от политического блока с кадетами и поддержки Временного правительства, поэтому решение вопроса о будущей форме правления, как и др. партии, они откладывали до Учредительного собрания.,1
В наст. время право на тайну связи считается составной частью прав чел. — естественных и неотъемлемых прав личности, признанных на международном уровне.,1
Здесь уже до начала XVI вв. существовали почтовые гонцы, которые, помимо государственных сообщений, доставляли к столу царя свежую рыбу, фрукты и др. продукты.,1
В наст. время город — один из промышленных центров западной Словакии.,1
Пуэрто-Рико находится на границе Карибской и Северо-Американской плит и в наст. время тектонически деформируется под действием этих плит.,1
В наст. время Пуэрто-Рико стал крупным туристическим центром с развитой фармацевтической и производственной структурой.,1
Она продолжается и в наст. время, и в совокупности с падением рождаемости, в ближайшие 20 лет может привести к быстрому старению населения и его уменьшению.,1
Постоянно увеличивается кол-во регистраций в отелях (статистика с 1998 года), строятся новые гостиницы и др. центры туризма, что говорит о хорошем состоянии индустрии туризма.,1
В то время как Германская империя не включила в свой состав немецкоязычные владения Габсбургов, в составе её населения было значительное польск. меньшинство в некоторых частях восточной Пруссии и др. национальные меньшинства вдоль северных и западных границ.,1
К ним относятся вяз, липа, каштан, ясень и др..,1
Теннисный корт и дет. площадка, в наст. время действующие в Морском саду, открылись в 1928 г.,1
С 1929 года компания начала производить азотистые удобрения, позже и др. химикаты.,1
В 1990-е гг. был популярен цикл исторических детективов писателя Валентина Лаврова, написанных на основе архивных материалов: «Кровавая плаха», «Блуд на крови», «Тайны двора Государева», «рус. сила», «Агент S-25», »Эшафот и деньги», «жел. хватка», сериал «гр. Соколов — гений сыска» и др..,1
В наст. время мн. их потомки живут в городе Обера (Мисьонес) и его окрестностях.,1
К этой же культуре, по-видимому, относятся и др. памятники древней архитектуры — «гробницы гигантов».,1
Кроме того, мобильный телефон, радиолокатор, интроскоп/интравизор («Борьба в эфире»), беспилотные летательные аппараты («Властелин мира»); микробиологическое произ-во («Вечный хлеб»), искусств. шаровая молния и др..,1
По сюжету Ихтиандр, голова профессора Доуэля, женщина-Франкенштейн Брике, профессор Вагнер, Ариэль и др. герои Беляева объединяются, чтобы противостоять злодею Бэйли, к-рый ворует воздух.,1
В наст. время вопр. авторского права регулируются частью 4 Гражданского Кодекса, а также Федеральным законом Российской Федерации от 18 дек. 2006 года № 231-ФЗ «О введении в действие части четвёртой Гражданского кодекса Российской Федерации», к-рый ограничивает применение Гражданского кодекса в некоторых случаях (см. Статью 6): «Сроки охраны прав, предусмотренные статьями 1281, 1318, 1327 и 1331 Гражданского кодекса Российской Федерации, применяются в случаях, когда пятидесятилетний срок действия авторского права или смежных прав не истёк к 1 января 1993 года».,1
Кассационная инстанция отменила судебные акты нижестоящих инстанций и в иске полностью отказала, посчитав произведения А. Беляева перешедшими в обществ. достояние с 1 января 1993 года и в наст. время охране не подлежащими.,1
М. С. Магдеев (1930—1995) — писатель, литературовед, к. фил. н., нар. писатель Республики Татарстан, лауреат Государственной премии РТ им. Г. Тукая,1
Владимир Николаевич Костин — сов. гос. и хоз. деятель, д. т. н..,1
В наст. время в кратере располагается водохранилище Маникуаган.,1
Анна Самойловна Гинзбург (1915—1993) — сов. и рос. учёный в области эмбриологии и биологии развития, д. б. н., профессор.,1
В 1955 г защитила кандидатскую диссертацию, в 1967 г — докторскую диссертацию на соискание учёной степени д. б. н. по теме: «Оплодотворение у рыб и проблема полиспермии».,1
Первоначально в эпоху плейстоцена сформировалась кальдера, впосл. вокруг неё возник стратовулкан Мерапи и др. вулканические конусы.,1
В наст. время вулкан проявляет активность в виде незначительных фумарол и незначительных подземных толчков.,1
57 образцов и 346 документов были «эффективно использованы в научно-исследовательской деятельности и разработке новых систем оружия и военных материалов, а также в усовершенствовании систем оружия, находящихся на вооружении в наст. время», говорилось в отчёте.,1
Больше никто в убийстве Закотновой обвинён не был, таким образом, до наст. времени оно официально считается нераскрытым.,1
Криминалист «с двадцатисемилетним стажем работы в органах внутренних дел», д. ю. н. профессор Юрий Дубягин считает, что «парадоксальное выделительство» было специально придумано для того, чтобы оправдать халатность судебно-медицинского эксперта — заведующей судебно-биологическим отделением Бюро главной судебно-медицинской экспертизы Минздрава России С. В. Гуртовой, проводившей в 1984 г анализ крови Чикатило.,1
В 1972 г во время расследования дела Шеферс и др. против Уилсона, пр-во округа Колумбия объявило о своем намерении не преследовать кого-либо в судебном порядке за частную мужеложство взрослых по обоюдному согласию, действие, оспариваемое прокурором США по округу Колумбия.,1
Пол «X» в наст. время недоступен для свидетельств о рождении.,1
Софья Ивановна Набоко (13 (26) сентября 1909, Петербург — 17 февраля 2005, м.) — сов. учёный-вулканолог, одна из основоположников отечественной вулканологии, д. гм. н..,1
В 1935 г Софья Набоко переехала в Москву для работы в академическом Институте геологических наук (в наст. время ин-т геологии рудных месторождений, петрографии, минералогии и геохимии РАН).,1
Sede vacante — с 1963 года по наст. время.,1
В наст. время Джефф пытается оставить своё прошлое позади, в особенности свои конфликты с Deuce.,1
В наст. время Джефф владеет магазином биодизельных автомобилей, к-рый также показывали в: CNN ,LA times, New York Times , и Discovery Channel.,1
В 1970-е гг. перешёл на научную работу, кандидат, затем д. и. н..,1
В старину сапфир (или сафир), как и др. ценные минералы синей окраски, назывался баусом.,1
На Урале трудилась на Нижне-Туринском металлургическом заводе, в горячем листопрокатном цеху, на Исовском золото-платиновом прииске, работала на лесозаготовках (повести «Лесная история», «Дороже золота», «Несовершеннолетняя», «Ларион и Варвара» и др.).,1
В наст. время практически вся береговая линия реки м. Кокшага спланирована и укреплена посадками древесной и кустарниковой растительности.,1
Городские парки, скверы и др. зелёные насаждения занимают более 1414,6 га, из них 752,5 га — городские леса, для которых введён статус особо охраняемых природных территорий.,1
В наст. время в состав Йошкар-Олы входят следующие микрорайоны: 1—9, 9а, 9б, 9в, 10, Алёнкино, Берёзово, Больничный, Большое Чигашево, вост., Гомзово, Дубки, зап., Звёздный, Интеграл, Комсомольский, Ленинский, Машиностроитель, Мирный, Молодёжный, Мышино, Нагорный, Никиткино, Октябрьский, Оршанский, Предзаводской, Прибрежный, Ремзавод, Свердлова, сев., сов., Сомбатхей, Спортивный, Тарханово, центр., Черновка, Чихайдарово, Ширяйково, Юбилейный.,1
В наст. время водоснабжение города базируется на 2 источниках:,1
В наст. время 4326,7 тыс. м² (удельный вес 89,7 %) общей площади оборудовано газом.,1
В наст. время в Поволжском государственном технологическом университете обучаются 7500 студентов очной и 5000 студентов заочной формы обучения, более 3000 обучающихся по программам среднего профессионального образования, более 150 аспирантов, 10 докторантов.,1
Марийский гос. ун-т в наст. время ведёт подготовку на 17 факультетах по 60 специальностям.,1
Межрегиональный откр. соц. ин-т в наст. время ведёт подготовку на 6 факультетах по 20 специальностям, направлениям бакалавриата, магистратуры и программам MBA, открыта аспирантура по 7 специальностям.,1
В наст. время в МОСИ обучаются более 4500 студентов по очной, заочной и дистанционной форме обучения.,1
В наст. время в репертуаре две национальные оперы — «Акпатыр» Эрика Сапаева и «Алдиар» Элины Архиповой, а также балет «Лесная легенда» на музыку Анатолия Луппова.,1
В наст. время в залах 1, 2 и 3 установлен комплект оборудования для 3D-показа компании XpanD, кинотеатральный звук. процессор Dolby CP750 со стандартом звука Dolby Digital Surround EX.,1
К сохранившимся объектам дореволюционного периода относятся жилые дома, принадлежавшие зажиточным гражданам Царевококшайска: усадьба Чулкова (кон. XIX вв.); дом Кореповых (середина XIX вв.); дом Булыгина (1835 г.); дом Карелина (середина XVIII вв.); дом Наумова и др..,1
В наст. время на площади находятся пам. патриарху Московскому и Всея Руси Алексию II, фонтан-пам. Святым преподобным Петру и Февронии, часовня Петра и Февронии Муромских, часы «12 апостолов».,1
В наст. время на набережной находятся пам. царю Фёдору Иоанновичу, пам. А. С. Пушкину и Онегину (в месте пересечения с ул. Пушкина), пам. Н. В. Гоголю (в месте пересечения с улицей Гоголя), итал. парк, Архангельская слобода (строится), дом купца Карелина (пам. архитектуры, середина XVIII вв.).,1
В наст. время на набережной расположены мин-во здравоохранения РМЭ, мин-во социальной защиты населения и труда РМЭ, мин-во государственного имущества РМЭ, мин-во экономического развития и торговли РМЭ, мин-во промышленности, транспорта и дорожного хозяйства РМЭ, республ. фонд ОМС, отдел ЗАГС администрации города Йошкар-Олы, республ. антикризисный центр, президентская школа-интернат для одарённых детей, башня Дружбы народов (Спасская), жилые дома.,1
кол-во доступных плагинов в наст. время очень велико и включает, в т. числе, плагины, позволяющие непосредственно из Maven запускать web-приложение для тестирования его в браузере; плагины, позволяющие тестировать или создавать банки данных; плагины, позволяющие генерировать Web Services.,1
По умолчанию Maven использует Maven Central Repository, но разработчик может конфигурировать и др. публичные Maven-репозитории, такие, как Apache, Ibiblio, Codehaus или Java.Net.,1
В ночь с 5 на 6 августа отряд Павлюхина был переброшен на берег Волги выше пристани, куда также прибыли др. рабочие дружины и регулярные войска Красной гвардии.,1
Как и др. гуджаратские мусульмане, у них есть кастовая ассоциация, изв. как Джамат, к-рый действует как благотворит. орг-ция и инструмент социального контроля.,1
В наст. время город располагает 99 спортивными сооружениями.,1
Самсон Наумович Бройтман (27 октября 1937, Одесса, СССР — 16 дек. 2005, м., Россия) — сов. и рос. учёный-филолог и литературовед, д. фил. н., автор первого в мире учебника по исторической поэтике, крупнейший специалист в области теории и истории русской лирики XIX — начала XX вв..,1
Впрочем, комментируя свое Послание от 28 февраля, епископ Варнава сказал корреспонденту «Вертограда», что в наст. время необходимо поминать Первоиерарха РПЦЗ митрополита Виталия, которого владыка Варнава никоим образом не считает «глаголемым епископом».,1
