question,answer,count_simple,count_simple_translated,count_simple_long,count_simple_long_translated,count_cases_translated,count_cases_long
"Μ-34 (по кодификации НАТО: Hermit — «Отшельник») — лёгкий многоцелевой вертолёт.","Ми-34 (по кодификации НАТО: Hermit — «Отшельник») — лёгкий многоцелевой вертолёт.",0,1,0,0,0,0
"∃ мнение, что эльфы и феи — одни и те же существа, однако, несмотря на часто встречающуюся схожесть описания, традиционные кельтские «эльфы» — sidhe — например, могли изображаться крылатыми, в отличие от фей, которые в кельтских мифах мало чем отличаются от обычных людей.","Существует мнение, что эльфы и феи — одни и те же существа, однако, несмотря на часто встречающуюся схожесть описания, традиционные кельтские «эльфы» — sidhe — например, могли изображаться крылатыми, в отличие от фей, которые в кельтских мифах мало чем отличаются от обычных людей.",0,1,0,0,0,0
"В скандинавской мифологии существовали два типа альвов: верхние (светлые) и нижние (тёмные, или свартальвы), причём последним в «Эддах» уделяется значительно > внимания.","В скандинавской мифологии существовали два типа альвов: верхние (светлые) и нижние (тёмные, или свартальвы), причём последним в «Эддах» уделяется значительно больше внимания.",0,1,0,0,0,0
question,answer,count_simple,count_simple_translated,count_simple_long,count_simple_long_translated,count_cases_translated,count_cases_long
"Планета Kepler-32 b размерам < Юпитера и Нептуна, её радиус составляет 2,2 земного, масса грубо оценена в 6 земных, что приводит к средней плотности в 3,1 грамм на кубический сантиметр.","Планета Kepler-32 b размерам меньше Юпитера и Нептуна, её радиус составляет 2,2 земного, масса грубо оценена в 6 земных, что приводит к средней плотности в 3,1 грамм на кубический сантиметр.",0,1,0,0,0,0
"(344) Дезидерата (фр. Desiderata) — крупный астероид главного пояса, который ∈ к тёмному спектральному классу C.","(344) Дезидерата (фр. Desiderata) — крупный астероид главного пояса, который принадлежит к тёмному спектральному классу C.",0,1,0,0,0,0
"Нижегородское открытое акционерное общество «Гидромаш» имени В. И. Лузянина — российское предприятие по разработке, производству и испытаниям шасси, гидроцилиндров и гидроагрегатов ∀ типов летательных аппаратов.","Нижегородское открытое акционерное общество «Гидромаш» имени В. И. Лузянина — российское предприятие по разработке, производству и испытаниям шасси, гидроцилиндров и гидроагрегатов для всех типов летательных аппаратов.",0,0,0,1,0,0
"Седьмой сезон мультсериала «Симпсоны» был показан на телеканале Fox в период с 17 сентября 1995 по 19 мая 1996 года и ∋ 25 эпизодов.","Седьмой сезон мультсериала «Симпсоны» был показан на телеканале Fox в период с 17 сентября 1995 по 19 мая 1996 года и содержит 25 эпизодов.",0,1,0,0,0,0
"В августе 2017 года было запущено β-тестирование, в июле 2018 года состоялся полномасштабный запуск сервиса.","В августе 2017 года было запущено бета-тестирование, в июле 2018 года состоялся полномасштабный запуск сервиса.",0,1,0,0,0,0
"Образуются в результате бомбардировки диэлектриков потоками частиц, облучения их ультрафиолетовым, рентгеновским и Γ- излучениями, нагрева кристаллов в парах щелочных или щёлочноземельных металлов и другими способами.","Образуются в результате бомбардировки диэлектриков потоками частиц, облучения их ультрафиолетовым, рентгеновским и гамма- излучениями, нагрева кристаллов в парах щелочных или щёлочноземельных металлов и другими способами.",0,1,0,0,0,0
"ο-вариант SARS-CoV-2 (SARS-CoV-2 Omicron, SARS-CoV-2 B.1.1.529) — вариант коронавируса SARS-CoV-2, впервые идентифицированный в Ботсване и ЮАР в ноябре 2021 года, отличающийся большим числом мутаций в пепломерах.","Омикрон-вариант SARS-CoV-2 (SARS-CoV-2 Omicron, SARS-CoV-2 B.1.1.529) — вариант коронавируса SARS-CoV-2, впервые идентифицированный в Ботсване и ЮАР в ноябре 2021 года, отличающийся большим числом мутаций в пепломерах.",0,1,0,0,0,0
"При заражении ο-вариантом, согласно данным Всемирной организации здравоохранения, заболевание протекает легче или так же, как при заражении Δ-вариантом.","При заражении омикрон-вариантом, согласно данным Всемирной организации здравоохранения, заболевание протекает легче или так же, как при заражении дельта-вариантом.",0,2,0,0,0,0
"По данным на конец декабря 2021, быстро вытеснял Δ-вариант в тех странах, где начал распространение.","По данным на конец декабря 2021, быстро вытеснял дельта-вариант в тех странах, где начал распространение.",0,1,0,0,0,0
"ζ Во́рона (лат. ζ Corvi), 5 Ворона (лат. 5 Corvi) — кратная звезда в созвездии Ворона на расстоянии приблизительно 382 световых лет (около 117 парсек) от Солнца.","Дзета Во́рона (лат. ζ Corvi), 5 Ворона (лат. 5 Corvi) — кратная звезда в созвездии Ворона на расстоянии приблизительно 382 световых лет (около 117 парсек) от Солнца.",0,1,0,0,0,0
"С 2001 года Balenciaga ∈ французской группе Kering.","С 2001 года Balenciaga принадлежит французской группе Kering.",0,1,0,0,0,0
"При работе на наковальнях Бриджмена исследуемое вещество в виде диска помещается между двумя наковальнями и сжимается до необходимого давления, а затем одна из этих наковален поворачивается относительно другой, создавая практически неограниченное пластическое течение в материале, помещенном между наковальнями, причём ∠ вращения определяет величину деформации сдвига.","При работе на наковальнях Бриджмена исследуемое вещество в виде диска помещается между двумя наковальнями и сжимается до необходимого давления, а затем одна из этих наковален поворачивается относительно другой, создавая практически неограниченное пластическое течение в материале, помещенном между наковальнями, причём угол вращения определяет величину деформации сдвига.",0,1,0,0,0,0
"В то же время ∃ и несомненный научный аспект, связанный, главным образом, с необходимостью получения более глубоких представлений о структурных изменениях в полимерах, возникающих при их деформировании в сложнонапряженном состоянии.","В то же время существует и несомненный научный аспект, связанный, главным образом, с необходимостью получения более глубоких представлений о структурных изменениях в полимерах, возникающих при их деформировании в сложнонапряженном состоянии.",0,1,0,0,0,0
"Для каждого класса ∃ категория задач, которые являются «самыми сложными» в данном классе.","Для каждого класса существует категория задач, которые являются «самыми сложными» в данном классе.",0,1,0,0,0,0
"В период 1995—1997 годов как часть греческого чемпионата устраивались гонки от Марафон до Афин, известные как Афинский марафон, но > они не проводятся.","В период 1995—1997 годов как часть греческого чемпионата устраивались гонки от Марафон до Афин, известные как Афинский марафон, но больше они не проводятся.",0,1,0,0,0,0
"Берлинский кружок поэтов (также просто «Кружок поэтов», иногда «Берлинский клуб поэтов») — неформальное ∪ русскоязычных поэтов-эмигрантов в Берлине (1928—1933).","Берлинский кружок поэтов (также просто «Кружок поэтов», иногда «Берлинский клуб поэтов») — неформальное объединение русскоязычных поэтов-эмигрантов в Берлине (1928—1933).",0,1,0,0,0,0
"В регулярном чемпионате приняло участие тринадцать команд, на две >, чем в прошлом.","В регулярном чемпионате приняло участие тринадцать команд, на две больше, чем в прошлом.",0,1,0,0,0,0
"Sony α, Sony Alpha («Сони-α») — серия цифровых фотоаппаратов компании Sony.","Sony α, Sony Alpha («Сони-альфа») — серия цифровых фотоаппаратов компании Sony.",0,1,0,0,0,0
"β-коэффициент (β-фактор) — показатель, рассчитываемый для ценной бумаги или портфеля ценных бумаг.","Бета-коэффициент (бета-фактор) — показатель, рассчитываемый для ценной бумаги или портфеля ценных бумаг.",0,2,0,0,0,0
"В программу Олимпийских игр включён гладкий бег на 100, 200 и 400 метров у мужчин и женщин, эстафетный бег 4×100 и 4×400 метров у мужчин и женщин.","В программу Олимпийских игр включён гладкий бег на 100, 200 и 400 метров у мужчин и женщин, эстафетный бег 4умножить на100 и 4умножить на400 метров у мужчин и женщин.",0,0,1,0,0,0
"∃ аналогичная Большая премия Гобера, присуждаемая Академией надписей и изящной словесности","Существует аналогичная Большая премия Гобера, присуждаемая Академией надписей и изящной словесности",0,1,0,0,0,0
"Было разыграно 11 комплектов наград, на один >, чем на предыдущих Олимпийских играх — 6 апреля 2011 года исполком Международного олимпийского комитета (МОК) принял решение о включении в программу зимних Олимпийских игр смешанной эстафеты.","Было разыграно 11 комплектов наград, на один больше, чем на предыдущих Олимпийских играх — 6 апреля 2011 года исполком Международного олимпийского комитета (МОК) принял решение о включении в программу зимних Олимпийских игр смешанной эстафеты.",0,1,0,0,0,0
"«Золото́й рис» (англ. Golden rice) — проект генетической модификации риса посевного (Oryza sativa), благодаря которой в его зёрнах содержится β-каротин.","«Золото́й рис» (англ. Golden rice) — проект генетической модификации риса посевного (Oryza sativa), благодаря которой в его зёрнах содержится бета-каротин.",0,1,0,0,0,0
"Вид Platynereis dumerilii используется в биологии развития для изучения развития (эмбриогенеза), в частности потому, что их эмбрионы довольно прозрачны и, ⇒, их легко исследовать.","Вид Platynereis dumerilii используется в биологии развития для изучения развития (эмбриогенеза), в частности потому, что их эмбрионы довольно прозрачны и, следовательно, их легко исследовать.",0,1,0,0,0,0
"Сегодня компания ∈ группе Jolies Céramiques sans kaolin, которая также владеет и другими компаниями — производителями плитки из керамики, фаянса, керамогранита, терракоты, имеющими не менее богатую историю: Carré, Capron, Aurum и Cérafrance.","Сегодня компания принадлежит группе Jolies Céramiques sans kaolin, которая также владеет и другими компаниями — производителями плитки из керамики, фаянса, керамогранита, терракоты, имеющими не менее богатую историю: Carré, Capron, Aurum и Cérafrance.",0,1,0,0,0,0
"TAR-21 (англ. Tavor Assault Rifle-21 — штурмовая винтовка «Тавор» XXI века) или «Таво́р» (ивр. תבור‎) — модель современного израильского автомата калибра 5,56×45 мм, выпускаемого концерном Israel Weapon Industries.","TAR-21 (англ. Tavor Assault Rifle-21 — штурмовая винтовка «Тавор» XXI века) или «Таво́р» (ивр. תבור‎) — модель современного израильского автомата калибра 5,56умножить на45 мм, выпускаемого концерном Israel Weapon Industries.",0,0,1,0,0,0
"При этом плоды, уступают плодам Антоновки обыкновенной по вкусовым качествам (содержат > кислоты), хуже хранятся и, по данным ВНИИСПК, легче поражаются паршой и плодовой гнилью, яблони этого сорта менее зимостойки.","При этом плоды, уступают плодам Антоновки обыкновенной по вкусовым качествам (содержат больше кислоты), хуже хранятся и, по данным ВНИИСПК, легче поражаются паршой и плодовой гнилью, яблони этого сорта менее зимостойки.",0,1,0,0,0,0
"В настоящее время замок ∈ Национальному Фонду Шотландии.","В настоящее время замок принадлежит Национальному Фонду Шотландии.",0,1,0,0,0,0
"Fiat Panda (Фиа́т Па́нда) — городской автомобиль итальянской компании Fiat, входящей в ∪ Stellantis.","Fiat Panda (Фиа́т Па́нда) — городской автомобиль итальянской компании Fiat, входящей в объединение Stellantis.",0,1,0,0,0,0
"Впервые показанный осенью 2011 года на Франкфуртском автосалоне, Panda третьего поколения стал >, просторнее, безопаснее и экономичнее.","Впервые показанный осенью 2011 года на Франкфуртском автосалоне, Panda третьего поколения стал больше, просторнее, безопаснее и экономичнее.",0,1,0,0,0,0
"∪ русских художников в Эстонии (ОРХЭ эст. Vene Kunstnike Ühendus Eestis) — творческая некоммерческая организация, членами которой являются проживающие в Эстонии и занимающиеся изобразительным искусством представители разных национальностей и разных культурных традиций, объединяющим звеном которых является русский язык.","Объединение русских художников в Эстонии (ОРХЭ эст. Vene Kunstnike Ühendus Eestis) — творческая некоммерческая организация, членами которой являются проживающие в Эстонии и занимающиеся изобразительным искусством представители разных национальностей и разных культурных традиций, объединяющим звеном которых является русский язык.",0,1,0,0,0,0
"В ∪ в основном входят профессиональные художники, среди которых есть выпускники Академии художеств Эстонии, российских профессиональных художественных школ и вузов.","В объединение в основном входят профессиональные художники, среди которых есть выпускники Академии художеств Эстонии, российских профессиональных художественных школ и вузов.",0,1,0,0,0,0
"Несмотря на то, что 7 августа 1820 года Комитетом Главного штаба по аттестации Козен был включён в список «генералов, которых служба ∉ до рассмотрения Комитета», фактическое решение о написании его портрета было принято несколько ранее, поскольку уже 17 декабря 1819 года Доу был выплачен аванс, а оставшуюся часть гонорара он получил 20 июня 1820 года.","Несмотря на то, что 7 августа 1820 года Комитетом Главного штаба по аттестации Козен был включён в список «генералов, которых служба не принадлежит до рассмотрения Комитета», фактическое решение о написании его портрета было принято несколько ранее, поскольку уже 17 декабря 1819 года Доу был выплачен аванс, а оставшуюся часть гонорара он получил 20 июня 1820 года.",0,0,0,1,0,0
"Галактика ∈ к Скоплению Девы, а также составляет часть так называемой цепочки Маркаряна.","Галактика принадлежит к Скоплению Девы, а также составляет часть так называемой цепочки Маркаряна.",0,1,0,0,0,0
"В конце 1980-х стал почетным братом студенческого братства κ κ ψ в Бостонском университете.","В конце 1980-х стал почетным братом студенческого братства Каппа Каппа Пси в Бостонском университете.",0,3,0,0,0,0
"«Мотобратия во Христе» (полное название Межрегиональная общественная организация ∪ православных мотоциклистов «Мотообъединение „Мотобратия во Христе“») — российский мотоклуб, формата мотообъединения (МО), созданный в 2013 году.","«Мотобратия во Христе» (полное название Межрегиональная общественная организация объединение православных мотоциклистов «Мотообъединение „Мотобратия во Христе“») — российский мотоклуб, формата мотообъединения (МО), созданный в 2013 году.",0,1,0,0,0,0
"Топоним «Албания» ∈ ряду географических объектов, располагавшихся в различных регионах — от Кавказа до Шотландии.","Топоним «Албания» принадлежит ряду географических объектов, располагавшихся в различных регионах — от Кавказа до Шотландии.",0,1,0,0,0,0
"∃ ряд обобщений данной теоремы — для произвольных треугольников, для фигур в пространствах высших размерностей.","Существует ряд обобщений данной теоремы — для произвольных треугольников, для фигур в пространствах высших размерностей.",0,1,0,0,0,0
"В 1858 году поступил в Болонский университет, но по окончании первого курса ушёл добровольцем в армию Сардинского королевства для участия в войне за ∪ Италии.","В 1858 году поступил в Болонский университет, но по окончании первого курса ушёл добровольцем в армию Сардинского королевства для участия в войне за объединение Италии.",0,1,0,0,0,0
