question,answer,count_simple,count_simple_translated,count_simple_long,count_simple_long_translated,count_cases_translated,count_cases_long
"Пластинка > компиляция синглов, выпущенных на протяжении двух лет, чем специально запланированный альбом.","Пластинка больше компиляция синглов, выпущенных на протяжении двух лет, чем специально запланированный альбом.",0,1,0,0,0,0
"∋ разнообразную информацию о ветеринарии, включая сведения про эпизоотологию и инфекционные болезни, паразитологию и инвазионные болезни, внутренние незаразные болезни животных, о хирургии, акушерстве, патологии, анатомии и физиологии животных, по микробиологии включая вирусологию; сведения о фармакологии, зоогигиене, ветеринарно-санитарной экспертизе, ветеринарной санитарии, и о проблемах организации ветеринарного дела в целом.","Содержит разнообразную информацию о ветеринарии, включая сведения про эпизоотологию и инфекционные болезни, паразитологию и инвазионные болезни, внутренние незаразные болезни животных, о хирургии, акушерстве, патологии, анатомии и физиологии животных, по микробиологии включая вирусологию; сведения о фармакологии, зоогигиене, ветеринарно-санитарной экспертизе, ветеринарной санитарии, и о проблемах организации ветеринарного дела в целом.",0,1,0,0,0,0
"Календарь святых Церкви Англии ∋ дни памяти многих святых из литургического календаря Римско-католической церкви и дни памяти разных известных христиан, большей частью живших после Реформации и имевших английское происхождение.","Календарь святых Церкви Англии содержит дни памяти многих святых из литургического календаря Римско-католической церкви и дни памяти разных известных христиан, большей частью живших после Реформации и имевших английское происхождение.",0,1,0,0,0,0
"Р-2 стала дальнейшим развитием технологий, заложенных в А-4 с добавлением идей советских конструкторов: Р-2 была >, имела ряд конструктивных отличий, среди которых самым заметным было использование топливного бака в качестве несущего элемента конструкции.","Р-2 стала дальнейшим развитием технологий, заложенных в А-4 с добавлением идей советских конструкторов: Р-2 была больше, имела ряд конструктивных отличий, среди которых самым заметным было использование топливного бака в качестве несущего элемента конструкции.",0,1,0,0,0,0
"E-flat tuning (рус. Строй Μ бемоль) — гитарный строй, который происходит от исторически всеми применяемого «испанского строя» (E-B-G-D-A-E) и заключающийся в понижении каждой струны на гитаре с данным строем на полутон, что превращает классическую настройку в настройку с нотами E♭-B♭-G♭-D♭-A♭-E♭ (или же по-другому D#-A#-F#-C#-G#-D#).","E-flat tuning (рус. Строй Ми бемоль) — гитарный строй, который происходит от исторически всеми применяемого «испанского строя» (E-B-G-D-A-E) и заключающийся в понижении каждой струны на гитаре с данным строем на полутон, что превращает классическую настройку в настройку с нотами E♭-B♭-G♭-D♭-A♭-E♭ (или же по-другому D#-A#-F#-C#-G#-D#).",0,1,0,0,0,0
"∈ к числу древнейших славянских поселений.","Принадлежит к числу древнейших славянских поселений.",0,1,0,0,0,0
"β Резца (лат. β Caeli) — звезда в южном созвездии Резца.","Бета Резца (лат. β Caeli) — звезда в южном созвездии Резца.",0,1,0,0,0,0
"«Венские мастерские» (нем. Wiener Werkstätte) — ∪ архитекторов, художников, ремесленников и коммерсантов, основанное в 1903 году в Вене художниками группы Сецессион Йозефом Хоффманом и Коломаном Мозером при участии состоятельного банкира Фрица Верндорфера.","«Венские мастерские» (нем. Wiener Werkstätte) — объединение архитекторов, художников, ремесленников и коммерсантов, основанное в 1903 году в Вене художниками группы Сецессион Йозефом Хоффманом и Коломаном Мозером при участии состоятельного банкира Фрица Верндорфера.",0,1,0,0,0,0
"Ва сёги (яп. 和将棋 ва:сё:ги, «спокойные шахматы») — вариант сёги на доске 11×11, все фигуры в котором названы в честь животных.","Ва сёги (яп. 和将棋 ва:сё:ги, «спокойные шахматы») — вариант сёги на доске 11умножить на11, все фигуры в котором названы в честь животных.",0,0,1,0,0,0
"Филосо́фский коммунитари́зм — течение, считающее, что общины, общество формируют каждого отдельного человека, в отличие от либеральной и либертарианской философий, рассматривающих общины как ∪ личностей.","Филосо́фский коммунитари́зм — течение, считающее, что общины, общество формируют каждого отдельного человека, в отличие от либеральной и либертарианской философий, рассматривающих общины как объединение личностей.",0,1,0,0,0,0
"Астра ивовая, также симфио́трихум ивовый, американская астра ивовая (лат. Symphyótrichum ×salígnum), — многолетнее травянистое растение, входящее в род Симфиотрихум семейства Сложноцветные (Compositae).","Астра ивовая, также симфио́трихум ивовый, американская астра ивовая (лат. Symphyótrichum умножить наsalígnum), — многолетнее травянистое растение, входящее в род Симфиотрихум семейства Сложноцветные (Compositae).",0,0,1,0,0,0
"Мост Веррацано ∈ городской администрации Нью-Йорка и находится под управлением компании «Triborough Bridge and Tunnel Authority» — агентства, аффилированного с «Metropolitan Transportation Authority».","Мост Веррацано принадлежит городской администрации Нью-Йорка и находится под управлением компании «Triborough Bridge and Tunnel Authority» — агентства, аффилированного с «Metropolitan Transportation Authority».",0,1,0,0,0,0
"Список дипломатических миссий Израиля — ∋ 77 представительств в ранге посольств, 20 — на уровне консульств и 5 «специальных миссий» в 163 государствах, признающих Израиль.","Список дипломатических миссий Израиля — содержит 77 представительств в ранге посольств, 20 — на уровне консульств и 5 «специальных миссий» в 163 государствах, признающих Израиль.",0,1,0,0,0,0
"Английский язык ∈ к языкам международного общения в Украине наряду с государственным языком.","Английский язык принадлежит к языкам международного общения в Украине наряду с государственным языком.",0,1,0,0,0,0
"Размеры Бучинской иконы Богородицы — 65×80 см.","Размеры Бучинской иконы Богородицы — 65умножить на80 см.",0,0,1,0,0,0
"Победу на турнире разделили команды Уэльса и Ирландии (хотя разница очков у Уэльса была >, чем у Ирландии).","Победу на турнире разделили команды Уэльса и Ирландии (хотя разница очков у Уэльса была больше, чем у Ирландии).",0,1,0,0,0,0
"23 мая 2008 года суд постановил, что Педра-Бранка находится под суверенитетом Сингапура, а Мидл-Рокс ∈ Малайзии.","23 мая 2008 года суд постановил, что Педра-Бранка находится под суверенитетом Сингапура, а Мидл-Рокс принадлежит Малайзии.",0,1,0,0,0,0
"Блюму ∈ опера «Амарапура» (1926, на либретто возглавлявшего в это время Цюрихский оперный театр Эгона Нойдегга), восемь симфоний, оркестровые сюиты, многочисленные сочинения для духового оркестра.","Блюму принадлежит опера «Амарапура» (1926, на либретто возглавлявшего в это время Цюрихский оперный театр Эгона Нойдегга), восемь симфоний, оркестровые сюиты, многочисленные сочинения для духового оркестра.",0,1,0,0,0,0
"7,5×54 мм MAS (7.5 French) — французский винтовочный патрон, разработанный в 1929 году.","7,5умножить на54 мм MAS (7.5 French) — французский винтовочный патрон, разработанный в 1929 году.",0,0,1,0,0,0
"Остров ∈ норвежской Рабочей молодёжной лиге, молодёжной организации Рабочей партии, которая устраивает на нём летний лагерь.","Остров принадлежит норвежской Рабочей молодёжной лиге, молодёжной организации Рабочей партии, которая устраивает на нём летний лагерь.",0,1,0,0,0,0
"На многих Alpha-системах, например, Digital Personal Workstation, в ЭСППЗУ, которое ∋ загрузочную микропрограмму, могли быть записаны как SRM, так и ARC.","На многих Alpha-системах, например, Digital Personal Workstation, в ЭСППЗУ, которое содержит загрузочную микропрограмму, могли быть записаны как SRM, так и ARC.",0,1,0,0,0,0
"TAR-21 (англ. Tavor Assault Rifle-21 — штурмовая винтовка «Тавор» XXI века) или «Таво́р» (ивр. תבור‎) — модель современного израильского автомата калибра 5,56×45 мм, выпускаемого концерном Israel Weapon Industries.","TAR-21 (англ. Tavor Assault Rifle-21 — штурмовая винтовка «Тавор» XXI века) или «Таво́р» (ивр. תבור‎) — модель современного израильского автомата калибра 5,56умножить на45 мм, выпускаемого концерном Israel Weapon Industries.",0,0,1,0,0,0
"Цели в области устойчивого развития (ЦУР) (англ. Sustainable Development Goals (SDGs)) — набор из 17 взаимосвязанных целей, разработанных в 2015 году Генеральной ассамблеей ООН в качестве «плана достижения лучшего и более устойчивого будущего ∀».","Цели в области устойчивого развития (ЦУР) (англ. Sustainable Development Goals (SDGs)) — набор из 17 взаимосвязанных целей, разработанных в 2015 году Генеральной ассамблеей ООН в качестве «плана достижения лучшего и более устойчивого будущего для всех».",0,0,0,1,0,0
"∃ мнение, что икра не должна подаваться с металлической ложкой, потому что металл может придать нежелательный вкус.","Существует мнение, что икра не должна подаваться с металлической ложкой, потому что металл может придать нежелательный вкус.",0,1,0,0,0,0
"Данный список ∋ краткое описание всех сезонов, сыгранных футбольным клубом «Челси» с 1905 года (когда клуб был избран в Футбольную лигу во Второй дивизион и принял участие в розыгрыше Кубка Англии) по настоящее время.","Данный список содержит краткое описание всех сезонов, сыгранных футбольным клубом «Челси» с 1905 года (когда клуб был избран в Футбольную лигу во Второй дивизион и принял участие в розыгрыше Кубка Англии) по настоящее время.",0,1,0,0,0,0
"Использовался ∀ процессоров Intel Core (Solo и Duo), а также для ранних мобильных версий Core 2, для Celeron M серий 4xx и 5xx, для мобильных Pentium Dual-Core и для Xeon LV и ULV c ядром Sossaman.","Использовался для всех процессоров Intel Core (Solo и Duo), а также для ранних мобильных версий Core 2, для Celeron M серий 4xx и 5xx, для мобильных Pentium Dual-Core и для Xeon LV и ULV c ядром Sossaman.",0,0,0,1,0,0
"∃ попытка библиографии, где собрано 547 произведений драматургической формы, имеющих элементы фантастического.","Существует попытка библиографии, где собрано 547 произведений драматургической формы, имеющих элементы фантастического.",0,1,0,0,0,0
"9×17 мм (обозначение в США — .380 ACP (от Automatic Colt Pistol), см. также Иные обозначения) — пистолетный унитарный патрон центрального воспламенения с бесфланцевой гильзой цилиндрической формы, разработанный Джоном Браунингом в 1908 году для фирмы Colt на основе патрона 9×20 мм SR Browning Long.","9умножить на17 мм (обозначение в США — .380 ACP (от Automatic Colt Pistol), см. также Иные обозначения) — пистолетный унитарный патрон центрального воспламенения с бесфланцевой гильзой цилиндрической формы, разработанный Джоном Браунингом в 1908 году для фирмы Colt на основе патрона 9умножить на20 мм SR Browning Long.",0,0,1,0,0,0
"Альбом ∋ перезаписаную версию песни «Knuckleduster» из мини-альбома Trashed, Lost & Strungout 2004 года.","Альбом содержит перезаписаную версию песни «Knuckleduster» из мини-альбома Trashed, Lost & Strungout 2004 года.",0,1,0,0,0,0
"Некоторые македонские слова с буквой Ќ взгляду русскоязычного читателя кажутся очень странными, так как в русском языке на её месте часто присутствует Т, Ч или Щ, а ничего похожего на К нет: браќа — братья, зафаќа — занимает (захватывает), Ивановиќ — Иванович, бидејќи — будучи, среќаваме — встречаем, веќе — > (вяще) и т. п.","Некоторые македонские слова с буквой Ќ взгляду русскоязычного читателя кажутся очень странными, так как в русском языке на её месте часто присутствует Т, Ч или Щ, а ничего похожего на К нет: браќа — братья, зафаќа — занимает (захватывает), Ивановиќ — Иванович, бидејќи — будучи, среќаваме — встречаем, веќе — больше (вяще) и т. п.",0,1,0,0,0,0
"Со временем Робинсон стал уделять < времени киберспортивной карьере, и > — карьере комментатора.","Со временем Робинсон стал уделять меньше времени киберспортивной карьере, и больше — карьере комментатора.",0,2,0,0,0,0
"Цель создания ПИФа — получение прибыли на объединённые в фонд активы и распределение полученной прибыли между инвесторами (пайщиками) ∝ количеству паёв.","Цель создания ПИФа — получение прибыли на объединённые в фонд активы и распределение полученной прибыли между инвесторами (пайщиками) пропорционально количеству паёв.",0,1,0,0,0,0
"Авиакатастрофа Μ-8 рядом с селом Лата — уничтожение вертолёта Μ-8 российских ВВС 14 декабря 1992 года во время грузино-абхазской войны 1992-93 годов, при совершения гуманитарного рейса из осажденного абхазского города Ткварчели (ныне Ткуарчал) в Гудауту.","Авиакатастрофа Ми-8 рядом с селом Лата — уничтожение вертолёта Ми-8 российских ВВС 14 декабря 1992 года во время грузино-абхазской войны 1992-93 годов, при совершения гуманитарного рейса из осажденного абхазского города Ткварчели (ныне Ткуарчал) в Гудауту.",0,2,0,0,0,0
"Древнейший письменный источник русского права; ∋ нормы закона Русского.","Древнейший письменный источник русского права; содержит нормы закона Русского.",0,1,0,0,0,0
"Микроинтервал (нем. Mikrointervall, фр. micro-intervalle, англ. microinterval) — общее обозначение музыкальных интервалов < полутона (четвертитон, трететон, шестинатон и т. д.).","Микроинтервал (нем. Mikrointervall, фр. micro-intervalle, англ. microinterval) — общее обозначение музыкальных интервалов меньше полутона (четвертитон, трететон, шестинатон и т. д.).",0,1,0,0,0,0
"ρ Лавениа Ратумаимури (англ. Ro Lavenia Ratumaimuri, 13 мая 1998) — фиджийская хоккеистка (хоккей на траве), вратарь.","Ро Лавениа Ратумаимури (англ. Ro Lavenia Ratumaimuri, 13 мая 1998) — фиджийская хоккеистка (хоккей на траве), вратарь.",0,1,0,0,0,0
"Календарь из Гезера — известняковая табличка (11.1×7,2 см), найденная в 1908 году Робертом Макалистером при раскопках Тель-Гезера.","Календарь из Гезера — известняковая табличка (11.1умножить на7,2 см), найденная в 1908 году Робертом Макалистером при раскопках Тель-Гезера.",0,0,1,0,0,0
"Майлар (англ. Mylar; также BoPET (Biaxially-oriented polyethylene terephthalate), Melinex, Hostaphan) — ® компании DuPont для плёнки на основе синтетического полиэфирного волокна (полиэтилентерефталата, в России называемого лавсан).","Майлар (англ. Mylar; также BoPET (Biaxially-oriented polyethylene terephthalate), Melinex, Hostaphan) — торговая марка компании DuPont для плёнки на основе синтетического полиэфирного волокна (полиэтилентерефталата, в России называемого лавсан).",0,0,0,1,0,0
question,answer,count_simple,count_simple_translated,count_simple_long,count_simple_long_translated,count_cases_translated,count_cases_long
"В 2014 году произошло ∪ городов Королёв и Юбилейный Московской области.","В 2014 году произошло объединение городов Королёв и Юбилейный Московской области.",0,1,0,0,0,0
"Дебютировала в составе сборной страны на Олимпийских играх 2004 в эстафете 4×200 метров вольным стилем.","Дебютировала в составе сборной страны на Олимпийских играх 2004 в эстафете 4умножить на200 метров вольным стилем.",0,0,1,0,0,0
"Данная статья ∋ список серий мультсериала «Аватар: Легенда об Аанге».","Данная статья содержит список серий мультсериала «Аватар: Легенда об Аанге».",0,1,0,0,0,0
"Командование Армии США в Европе и Африке (англ. United States Army Europe and Africa (USAREUR-AF)) — оперативное ∪ Сухопутных войск США в Европе и Африке.","Командование Армии США в Европе и Африке (англ. United States Army Europe and Africa (USAREUR-AF)) — оперативное объединение Сухопутных войск США в Европе и Африке.",0,1,0,0,0,0
