question,answer,count_simple,count_simple_translated,count_simple_long,count_simple_long_translated,count_cases_translated,count_cases_long
"ЭХО — экспериментальное художественное ∪, существовало в Омске в начальные годы перестройки 1987—1990.","ЭХО — экспериментальное художественное объединение, существовало в Омске в начальные годы перестройки 1987—1990.",0,1,0,0,0,0
"42-я воздушная истребительная армия ПВО (42-я ВИА ПВО) — оперативное ∪ ВВС, впоследствии войск ПВО СССР, предназначенное для обеспечения задач противовоздушной обороны самостоятельно и во взаимодействии с другими видами Вооружённых Сил и родами войск (сил) ВС СССР.","42-я воздушная истребительная армия ПВО (42-я ВИА ПВО) — оперативное объединение ВВС, впоследствии войск ПВО СССР, предназначенное для обеспечения задач противовоздушной обороны самостоятельно и во взаимодействии с другими видами Вооружённых Сил и родами войск (сил) ВС СССР.",0,1,0,0,0,0
"Южные Δ-Аквариды (англ. Southern Delta Aquariids) — метеорный поток, наблюдаемый ежегодно с середины июля до середины августа; пик активности приходится на 28 или 29 июля.","Южные дельта-Аквариды (англ. Southern Delta Aquariids) — метеорный поток, наблюдаемый ежегодно с середины июля до середины августа; пик активности приходится на 28 или 29 июля.",0,1,0,0,0,0
"∈ «объединённому кибуцному движению»","Принадлежит «объединённому кибуцному движению»",0,1,0,0,0,0
"Катастрофа Μ-26 в Чечне 19 августа 2002 года — самая крупная авиакатастрофа в истории российских вооружённых сил, произошедшая в ходе второй чеченской войны.","Катастрофа Ми-26 в Чечне 19 августа 2002 года — самая крупная авиакатастрофа в истории российских вооружённых сил, произошедшая в ходе второй чеченской войны.",0,1,0,0,0,0
"После смерти участника Carter Family Эй π Картера (в 1960 году) Мейбелль и Carter Sisters стали использовать название «Carter Family».","После смерти участника Carter Family Эй Пи Картера (в 1960 году) Мейбелль и Carter Sisters стали использовать название «Carter Family».",0,1,0,0,0,0
"∈ к Иверскому благочинию Московской епархии Русской православной церкви.","Принадлежит к Иверскому благочинию Московской епархии Русской православной церкви.",0,1,0,0,0,0
"Галактика ∋ два бара, встроенные друг в друга, причём скорость вращения основного бара <, чем у второстепенного.","Галактика содержит два бара, встроенные друг в друга, причём скорость вращения основного бара меньше, чем у второстепенного.",0,2,0,0,0,0
"∃ мнение, что Кэвитт является «величайшим ведущим ток-шоу всех времен».","Существует мнение, что Кэвитт является «величайшим ведущим ток-шоу всех времен».",0,1,0,0,0,0
"(729) Ватсония (лат. Watsonia) — астероид главного пояса, который возглавляет одноимённое семейство астероидов, состоящее из 31 — 139 объектов и ∈ к спектральному классу L.","(729) Ватсония (лат. Watsonia) — астероид главного пояса, который возглавляет одноимённое семейство астероидов, состоящее из 31 — 139 объектов и принадлежит к спектральному классу L.",0,1,0,0,0,0
"Движение «Круглый стол» (англ. The Round Table movement), основанное в 1909 году, представляло собой ∪ организаций, выступающих за более тесный союз между Великобританией и ее самоуправляющимися колониями.","Движение «Круглый стол» (англ. The Round Table movement), основанное в 1909 году, представляло собой объединение организаций, выступающих за более тесный союз между Великобританией и ее самоуправляющимися колониями.",0,1,0,0,0,0
"∃ множество городских легенд о происхождении этого существа и о том, как именно оно убивает своих жертв.","Существует множество городских легенд о происхождении этого существа и о том, как именно оно убивает своих жертв.",0,1,0,0,0,0
"∃ распространенное заблуждение, что эстакада заброшена и > не используется; на самом деле мост является главной железнодорожной артерией в Луисвилле.","Существует распространенное заблуждение, что эстакада заброшена и больше не используется; на самом деле мост является главной железнодорожной артерией в Луисвилле.",0,2,0,0,0,0
"∃ легенда о появлении раухбира, по которой однажды в пивоварне произошёл пожар и хранившийся там солод пропитался дымом.","Существует легенда о появлении раухбира, по которой однажды в пивоварне произошёл пожар и хранившийся там солод пропитался дымом.",0,1,0,0,0,0
"В настоящее время в южных штатах Бразилии Санта-Катарина и Риу-Гранди-ду-Сул ∃ несколько крупных общин, за которыми закреплены обширные территории в статусе киломбу, поскольку их лидерам удалось доказать, что они являются прямыми наследниками киломбу периода рабовладения, и по этой причине принадлежащие им земли являются неотчуждаемыми.","В настоящее время в южных штатах Бразилии Санта-Катарина и Риу-Гранди-ду-Сул существует несколько крупных общин, за которыми закреплены обширные территории в статусе киломбу, поскольку их лидерам удалось доказать, что они являются прямыми наследниками киломбу периода рабовладения, и по этой причине принадлежащие им земли являются неотчуждаемыми.",0,1,0,0,0,0
"Игра была представлена публике на фестивале BlizzCon 2014 и до весны 2016 года находилась в режиме закрытого β-тестирования; открытое β-тестирование в мае 2016 года привлекло почти 10 млн игроков.","Игра была представлена публике на фестивале BlizzCon 2014 и до весны 2016 года находилась в режиме закрытого бета-тестирования; открытое бета-тестирование в мае 2016 года привлекло почти 10 млн игроков.",0,2,0,0,0,0
"Продолжение игры, Overwatch 2, было анонсировано в 2019 году и выпущено в виде β-версии в 2022 году.","Продолжение игры, Overwatch 2, было анонсировано в 2019 году и выпущено в виде бета-версии в 2022 году.",0,1,0,0,0,0
"«Моя геройская академия» (яп. 僕のヒーローアカデミア Боку но χ:ρ: акадэмиа, англ. My Hero Academia) — манга, написанная и иллюстрированная Кохэем Хорикоси.","«Моя геройская академия» (яп. 僕のヒーローアカデミア Боку но хи:ро: акадэмиа, англ. My Hero Academia) — манга, написанная и иллюстрированная Кохэем Хорикоси.",0,2,0,0,0,0
"Γ Козерога (γ Козерога, γ Cap, Nashira) — звезда-гигант в созвездии Козерога.","Гамма Козерога (γ Козерога, γ Cap, Nashira) — звезда-гигант в созвездии Козерога.",0,1,0,0,0,0
"CAP Märkte (с нем. «магазины CAP») — немецкая ®, социальная франшиза и сеть супермаркетов в формате «у дома», в которых работают в основном инвалиды.","CAP Märkte (с нем. «магазины CAP») — немецкая торговая марка, социальная франшиза и сеть супермаркетов в формате «у дома», в которых работают в основном инвалиды.",0,0,0,1,0,0
"Каждый магазин CAP обычно находится в ведении местной ассоциации инвалидов, но бренд ∈ общему благотворительному кооперативу мастерских инвалидов (англ. co-operative of sheltered workshops) GDW Süd — Genossenschaft der Werkstatten für behinderte Menschen Süd eG, расположенному в Баден-Вюртемберге (Бавария).","Каждый магазин CAP обычно находится в ведении местной ассоциации инвалидов, но бренд принадлежит общему благотворительному кооперативу мастерских инвалидов (англ. co-operative of sheltered workshops) GDW Süd — Genossenschaft der Werkstatten für behinderte Menschen Süd eG, расположенному в Баден-Вюртемберге (Бавария).",0,1,0,0,0,0
"Кроме того, Кожухарову ∈ также первый музыковедческий комментарий к сохранившимся фрагментам музыки оперы Михаила Матюшина «Победа над Солнцем», вошедший в состав послесловия к публикации либретто Алексея Кручёных.","Кроме того, Кожухарову принадлежит также первый музыковедческий комментарий к сохранившимся фрагментам музыки оперы Михаила Матюшина «Победа над Солнцем», вошедший в состав послесловия к публикации либретто Алексея Кручёных.",0,1,0,0,0,0
"Название «Понто-тё» — это ∪ английского слова «point» или португальского «ponto» (оба означают «точка») и японского «町», означающего «район», «улица» или «дорога».","Название «Понто-тё» — это объединение английского слова «point» или португальского «ponto» (оба означают «точка») и японского «町», означающего «район», «улица» или «дорога».",0,1,0,0,0,0
"Действие Star Wars Jedi: Survivor происходит через пять лет после событий из Star Wars Jedi: Fallen Order, и, ⇒, в том же промежутке, что и сериал «Оби-Ван Кеноби».","Действие Star Wars Jedi: Survivor происходит через пять лет после событий из Star Wars Jedi: Fallen Order, и, следовательно, в том же промежутке, что и сериал «Оби-Ван Кеноби».",0,1,0,0,0,0
"26 апреля 2014 года на чемпионате Кении в составе эстафетной команды 4×1500 метров установила мировой рекорд.","26 апреля 2014 года на чемпионате Кении в составе эстафетной команды 4умножить на1500 метров установила мировой рекорд.",0,0,1,0,0,0
"Durex («Дю́рекс») — британская ® контрацептивов и товаров для секса.","Durex («Дю́рекс») — британская торговая марка контрацептивов и товаров для секса.",0,0,0,1,0,0
"Изначально продукция была разработана в Лондоне под руководством London Rubber Company и British Latex Products Ltd., где и производилась с 1932 по 1994 год. London Rubber Company была образована в 1915 году, а ® Durex (Durability, Reliability and Excellence — «прочность, надёжность и превосходство») была запущена в 1929 году, хотя London Rubber начала производство презервативов под собственной маркой только в 1932 году, в сотрудничестве со студентом-технологом из Польши по имени Люциан Лундау.","Изначально продукция была разработана в Лондоне под руководством London Rubber Company и British Latex Products Ltd., где и производилась с 1932 по 1994 год. London Rubber Company была образована в 1915 году, а торговая марка Durex (Durability, Reliability and Excellence — «прочность, надёжность и превосходство») была запущена в 1929 году, хотя London Rubber начала производство презервативов под собственной маркой только в 1932 году, в сотрудничестве со студентом-технологом из Польши по имени Люциан Лундау.",0,0,0,1,0,0
"(561) Ингвельда (нем. Ingwelde) — астероид главного пояса, который ∈ к спектральному классу X.","(561) Ингвельда (нем. Ingwelde) — астероид главного пояса, который принадлежит к спектральному классу X.",0,1,0,0,0,0
"У.Б. Баймуратову ∈ научный приоритет в создании теоретических основ дуальности социума «Гармония-дисгармония», новой гармоничной социальной экономики, в открытии экономических законов Гармони.","У.Б. Баймуратову принадлежит научный приоритет в создании теоретических основ дуальности социума «Гармония-дисгармония», новой гармоничной социальной экономики, в открытии экономических законов Гармони.",0,1,0,0,0,0
"Парк ∋ по крайней мере пять видов приматов, таких как Орангутанг, Гиббоновые, пушистые Долгопяты с их огромными круглыми глазами.","Парк содержит по крайней мере пять видов приматов, таких как Орангутанг, Гиббоновые, пушистые Долгопяты с их огромными круглыми глазами.",0,1,0,0,0,0
"Ватиканский палимпсест — старославянская пергаментная рукопись на 203 страницах, записанная кириллицей, которая ∋ Евангелие, старейшее из сохранившихся на славянском языке.","Ватиканский палимпсест — старославянская пергаментная рукопись на 203 страницах, записанная кириллицей, которая содержит Евангелие, старейшее из сохранившихся на славянском языке.",0,1,0,0,0,0
"∃ версия для Windows и консольная β-версия для POSIX-систем.","Существует версия для Windows и консольная бета-версия для POSIX-систем.",0,2,0,0,0,0
"Об его детстве, отрочестве и образовании информации не сохранилось, да и прочие биографические сведения о нём практически отсутствуют; известно лишь, что перу Владимира Цветкова ∈ книга: «Новые употребительнейшие, просто греческие и российские разговоры, разделенные на 120 уроков», которую автор издал в 1809 году в городе Москве в типографии Решетникова.","Об его детстве, отрочестве и образовании информации не сохранилось, да и прочие биографические сведения о нём практически отсутствуют; известно лишь, что перу Владимира Цветкова принадлежит книга: «Новые употребительнейшие, просто греческие и российские разговоры, разделенные на 120 уроков», которую автор издал в 1809 году в городе Москве в типографии Решетникова.",0,1,0,0,0,0
"Этот роман ∋ многочисленные аллюзии на историю доктора Фауста, «Илиаду» Гомера, «Божественную комедию» Данте и другие литературные памятники.","Этот роман содержит многочисленные аллюзии на историю доктора Фауста, «Илиаду» Гомера, «Божественную комедию» Данте и другие литературные памятники.",0,1,0,0,0,0
"Дипломатическая миссия в Китае ∃ со времён Империи Цин.","Дипломатическая миссия в Китае существует со времён Империи Цин.",0,1,0,0,0,0
"∃ два философских подхода: литература Тайваня может считаться как традицией отдельной независимой территории, так и частью китайской литературы, куда также входят произведения с территорий, не входивших в состав материкового Китая, таких как Британский Гонконг, Португальский Макао, Сингапур и произведения диаспоры.","Существует два философских подхода: литература Тайваня может считаться как традицией отдельной независимой территории, так и частью китайской литературы, куда также входят произведения с территорий, не входивших в состав материкового Китая, таких как Британский Гонконг, Португальский Макао, Сингапур и произведения диаспоры.",0,1,0,0,0,0
"Амоксициллин относится к группе β-лактамных антибиотиков, по своим фармакологическим свойствам он близок к ампициллину, но, в отличие от последнего, обладает лучшей биодоступностью при пероральном приёме.","Амоксициллин относится к группе бета-лактамных антибиотиков, по своим фармакологическим свойствам он близок к ампициллину, но, в отличие от последнего, обладает лучшей биодоступностью при пероральном приёме.",0,1,0,0,0,0
"Амоксициллин, как и многие другие β-лактамные антибиотики, подвержен деградации β-лактамазами, продуцируемыми некоторыми бактериями, поэтому он часто применяется в комбинациях с клавулановой кислотой, выступающей ингибитором таких ферментов.","Амоксициллин, как и многие другие бета-лактамные антибиотики, подвержен деградации бета-лактамазами, продуцируемыми некоторыми бактериями, поэтому он часто применяется в комбинациях с клавулановой кислотой, выступающей ингибитором таких ферментов.",0,2,0,0,0,0
"В связи с инаугурацией нового Президента США Джона Кеннеди, состоявшейся 20 января 1961 года, Первый секретарь ЦК КПСС Никита Хрущёв направил ему поздравительное послание, в котором объявил о том, что советское руководство «готово к развитию самых дружественных отношений между советским и американским народами» и подчеркнул свою убеждённость в том, что «не ∃ непреодолимых препятствий к сохранению и укреплению мира».","В связи с инаугурацией нового Президента США Джона Кеннеди, состоявшейся 20 января 1961 года, Первый секретарь ЦК КПСС Никита Хрущёв направил ему поздравительное послание, в котором объявил о том, что советское руководство «готово к развитию самых дружественных отношений между советским и американским народами» и подчеркнул свою убеждённость в том, что «не существует непреодолимых препятствий к сохранению и укреплению мира».",0,1,0,0,0,0
