"Планы по сокращению выбросов углекислого газа на 20 % стали основной целью экологической программы компании.","Планы по сокращению выбросов углекислого газа на 20 процентов стали основной целью экологической программы компании."
"Эксперты прогнозируют снижение стоимости электроэнергии на 1,5 %, что, по их мнению, приведёт к улучшению экономической обстановки в стране.","Эксперты прогнозируют снижение стоимости электроэнергии на 1,5 процента, что, по их мнению, приведёт к улучшению экономической обстановки в стране."
"Рейтинг одобрения среди клиентов вырос на 8,7 %, что позволило компании укрепить свои позиции на рынке услуг.","Рейтинг одобрения среди клиентов вырос на 8,7 процента, что позволило компании укрепить свои позиции на рынке услуг."
"Согласно отчету, налогообложение было увеличено на 3 %, что вызвало рост расходов для малого бизнеса.","Согласно отчету, налогообложение было увеличено на 3 процента, что вызвало рост расходов для малого бизнеса."
"Эффективность новой производственной линии увеличилась на 12 %, что позволило сократить издержки и повысить объемы производства.","Эффективность новой производственной линии увеличилась на 12 процентов, что позволило сократить издержки и повысить объемы производства."
"В результате оптимизации процессов, производительность труда в компании возросла на 6,3 %, что отразилось на росте общего дохода.","В результате оптимизации процессов, производительность труда в компании возросла на 6,3 процента, что отразилось на росте общего дохода."
"Согласно заключению экспертов, только 15 % жителей страны поддерживают внедрение новых реформ в экономике.","Согласно заключению экспертов, только 15 процентов жителей страны поддерживают внедрение новых реформ в экономике."
"Снижение стоимости сырья на 5 % дало возможность снизить отпускные цены и повысить доступность продукции.","Снижение стоимости сырья на 5 процентов дало возможность снизить отпускные цены и повысить доступность продукции."
"Благодаря внедрению новых технологий, компания смогла сократить энергозатраты на 7 %, что снизило общие расходы на производство.","Благодаря внедрению новых технологий, компания смогла сократить энергозатраты на 7 процентов, что снизило общие расходы на производство."
"До конца года компания планирует увеличить свои доли на рынке на 3,5 %, что укрепит её позиции среди конкурентов.","До конца года компания планирует увеличить свои доли на рынке на 3,5 процента, что укрепит её позиции среди конкурентов."
"Индекс потребительских настроений снизился на 2 %, что отразилось на уровне доверия к финансовым институтам.","Индекс потребительских настроений снизился на 2 процента, что отразилось на уровне доверия к финансовым институтам."
"Из-за сложных экономических условий объемы экспорта сократились на 8,2 %, что повлекло за собой значительное снижение прибыли.","Из-за сложных экономических условий объемы экспорта сократились на 8,2 процента, что повлекло за собой значительное снижение прибыли."
"Компания сократила расходы на рекламу на 5 %, что позволило перераспределить бюджет на развитие производства.","Компания сократила расходы на рекламу на 5 процентов, что позволило перераспределить бюджет на развитие производства."
"В условиях инфляции на уровне 3 % предприятиям становится сложнее поддерживать доступные цены для потребителей.","В условиях инфляции на уровне 3 процентов предприятиям становится сложнее поддерживать доступные цены для потребителей."
"По оценкам аналитиков, рынок электроники может вырасти на 6,5 %, если спрос останется стабильным.","По оценкам аналитиков, рынок электроники может вырасти на 6,5 процента, если спрос останется стабильным."
"Компания выделила на научные исследования и разработки 4 % своего годового бюджета, что поспособствует технологическому росту.","Компания выделила на научные исследования и разработки 4 процента своего годового бюджета, что поспособствует технологическому росту."
"На предприятии уровень автоматизации увеличился на 10 %, что позволило сократить численность рабочего персонала.","На предприятии уровень автоматизации увеличился на 10 процентов, что позволило сократить численность рабочего персонала."
"В результате повышения тарифов цены на продукцию увеличились на 2,8 %, что привело к снижению покупательского спроса.","В результате повышения тарифов цены на продукцию увеличились на 2,8 процента, что привело к снижению покупательского спроса."
"Согласно данным опроса, более 25 % граждан страны поддерживают реформу в сфере образования.","Согласно данным опроса, более 25 процентов граждан страны поддерживают реформу в сфере образования."
"Рентабельность нового продукта увеличилась на 9 %, что свидетельствует о его успешном внедрении на рынке.","Рентабельность нового продукта увеличилась на 9 процентов, что свидетельствует о его успешном внедрении на рынке."
"Снижение уровня безработицы на 1,2 % стало хорошим знаком для экономического развития региона.","Снижение уровня безработицы на 1,2 процента стало хорошим знаком для экономического развития региона."
"Объём производства вырос на 6 %, что позволило компании выйти на новые экспортные рынки.","Объём производства вырос на 6 процентов, что позволило компании выйти на новые экспортные рынки."
