abbreviation,encounters
Теперь представители США должны были голосовать против выделения Зимбабве любых кредитов при принятии решений в международных финансовых организациях, таких как МВФ, междунар. банк реконструкции и развития и др..,1
Sony Alpha NEX («Сони Альфа Нэкс») — семейство беззеркальных системных фотоаппаратов корпорации «Сони», выпускающихся с 2010 г по наст. время.,1
В туманных горных лесах, где деревья полностью покрыты мхами и лишайниками преобладают подокарпы, брунеллия, вейнманния и др..,1
В число 156 видов млекопитающих входят: очковый медведь, андская кошка, пума, ягуар, оцелот, перуанский олень, белобородый пекари, болотный олень, бразильская выдра, а также большое разнообразие обезьян: чёрные коаты, рыжие ревуны, бурые черноголовые капуцины и др..,1
В наст. время зарегистрировано 914 видов, однако считается, что на территории парка обитает более 1150 различных видов, что составляет 83 % от всех видов птиц страны.,1
Вячеслав Александрович Миронов (род. 12 августа 1939, л.) — рос. учёный, общественно- полит. деятель, предс. Законодательного собрания Тверской области (1997—2001), д. т. н., профессор, ректор и почётный през. Тверского государственного технического университета.,1
В наст. время епархией управляет архиепископ-митрополит Джованни Паоло Бенотто.,1
В непромышленным масштабах в пищевых целях культивируют и др. виды манго.,1
Такое деление сохраняется по наст. время.,1
1966 — наст. время: Чарльз Дэвид Александр Джон Спарроу Ачесон, 7-й гр. Госфорд (род. 13 июля 1942), единств. сын предыдущего.,1
В наст. время большинство болельщиков «Юнайтед» считает «Ливерпуль» главным соперником, что связано с успехами обоих клубов, а также их географической близостью, тогда как другие болельщики полагают, что злейшим соперником «Юнайтед» является «Манчестер Сити».,1
С момента основания английской Премьер-лиги в 1992 г «Манчестер Юнайтед» получил самую большую долю доходов от телекоммуникационной компании British Sky Broadcasting (в наст. время — Sky UK) по сравнению с другими клубами.,1
В Академии есть неск. команд, разделённых по возрасту: начиная с команды игроков до 9 лет и заканчивая флагманской группой игроков до 18 лет, к-рый в наст. время выступает в Северной зоне Премьер-лиги до 18 лет и Молодёжном кубке Англии (турнире, к-рый футболисты Академии «Юнайтед» выиграли рекордное число раз — одиннадцать).,1
нар. писательница Казахской ССР (с 1984), д. фил. н. (с 1981).,1
В последующие гг. выпущены поэтические сборники: «Песня за песней» (1962), «Знаешь ли ты их?» (1963), «Взлёт» (1966), «Душа моя — голубь» (1968), «Ключ» (1972), «Зрелость» (1974), «Белый луч» (М.,1971), «Нежность» (М., 1975), «Ларец жемчужин» (1975) и др..,1
Её поэмы «Степнячка», «Анар», «Гибель Карагера» и др. наполнены глубоким философским содержанием, яркой образностью.,1
В наст. время — ведущий авторских программ и продюсер ночного эфира на телеканале «Дождь».,1
Современные спортзалы имеют не менее дюжины таких тренажёров, как «Наутилус» и ему подобные (Hammer Strength от Гарри и др.).,1
Ему доверяются не только солдаты, но и др. офицеры, а также местные фермеры.,1
В наст. время здесь находится администрация Кунгурского района и другие государственные учреждения.,1
В наст. время здесь находится администрация Кунгурского района и др. государственные учреждения.,1
Сергей Серафимович Марченков (род. 1945) — математик, д. фм. н., профессор кафедры математической кибернетики факультета вычислительной математики и кибернетики МГУ.,1
В наст. время не рекомендуется использовать меларсопрол во время беременности.,1
Первая сетчатая башня была построена для всероссийской промышленной и художественной выставки в Нижнем Новгороде в 1896 г, после чего куплена фабрикантом Юрием Нечаевым-Мальцовым и сохранилась до наст. времени в его бывшем имении Полибино в Липецкой области.,1
Еле́на Алекса́ндровна Теле́гина (род. 6 июля 1962, м.) — рос. экономист, чл.-корр. РАН, д. э. н., профессор, Декан факультета международного энергетического бизнеса, зав. кафедрой стратегического управления ТЭК, дир. Института геополитики и энергетики России, дир. Международной школы бизнеса, рук. Программы МВА РГУ нефти и газа им. И. М. Губкина.,1
С 1987 года преподаватель Московского Института нефти и газа им. И. М. Губкина (в наст. время — Российского государственного Университета нефти и газа им. И. М. Губкина),1
С 1998 г. по наст. время чл. Совета Директоров Союза нефтеэкспортеров России,1
С января 2000 г. по наст. время дир. Института энергетики и геополитики России РГУ нефти и газа им. И. М. Губкина,1
С мая 2011 г. по наст. время декан факультета международного энергетического бизнеса РГУ нефти и газа им. И. М. Губкина, дир. Международной школы бизнеса.,1
Валентин Андреевич Шандра (1925—2008) — сов. и рос. учёный и педагог в области журналистики, организатор науки, д. и. н. (1978), профессор (1979).,1
В альбом вошли кавер-версии известных композиций других исполнителей — Боба Дилана, Нила Янга, песня «Out Of Time» группы The Rolling Stones и др..,1
Организаторам гастролей отказались предоставить площади и др. залы города (Филармония и пр. ДК).,1
Йоонас Хурри (род. 31 марта 1991, Лахти) — фин. профессиональный защитник по хоккею, к-рый в наст. время играет за HC Nikkō Ice Bucks of the ALIH.,1
В наст. время является свободным агентом.,1
Владимир Львович Эйнис (1890 Екатеринодар — 21 октября 1978, м.) — сов. фтизиатр, д. м. н., профессор, засл. деятель науки РСФСР (1958).,1
Жена, Нина Владимировна Эйнис (1892—1980), к. м. н., сын, Игорь Владимирович Эйнис (1918—1963), лётчик-испытатель 1 класса, инженер в области эргономики.,1
Шри Тричи Махасвамигал (ум. в 2005 г) из Ашрама Кайлаш, Бангалор, описывает важность храма: «Храм Ираиван будет для Америки тем же, чем храмы Чидамбарама, Мадурая, Рамешварама и др. великие храмы Шивы для Индии».,1
2008 — Луна и др. любовники — Дани,1
Эдмунд Гуссерль и др. философы (Вейль, Беккер и пр), связанные с феноменологической традицией, попытались преодолеть тот же кризис в математике через обращение к картезианской очевидности и интуитивности, хоть при этом и отвергалось многое очевидное прежде, напр., закон непротиворечия.,1
Кроме них, в архипелаг входят острова Подкова, сев. Плавниковый, Утиный, Костерина, Баранова, Носатый и др..,1
В частности, изд. InSight Crime и вовсе предрекало распад «Лос-Сетас» на неск. более слабых группировок, которых попытаются уничтожить при первой возможности др. крупные картели.,1
Она отметила, что мин-во реинтеграции Украины открыло круглосуточную горячую линию для жителей Курской области, которые нуждаются в гуманитарной помощи или хотят эвакуироваться на территорию Украины, и подчеркнула, что Россия пока не обращалась к украинским властям с просьбой открыть гуманитарный коридор, идущий дальше в Россию (а не на Украину), поэтому Украина в наст. время не может юридически содействовать созданию такого маршрута эвакуации.,1
Половой чл. при чесотке поражается часто, могут возникать бородавки, сыпь, скабиозные язвы (представляют собой твёрдые, красные, пруригинозные папулы, находящиеся на головке мужского полового члена) и др. патологические изменения.,1
Краусс Р. О. Джексоне Поллоке абстрактно // Краусс Р. Подлинность авангарда и др. модернистские мифы.,1
Помимо Али Джи в этом шоу присутствовали и др. персонажи Саши Барона Коэна: Борат Сагдиев и Бруно Гехард, о которых впосл. были сняты полнометражные фильмы («Борат» и «Брӱно» соответственно).,1
Среди авторских произведений Бориса Базурова — рок-оперы, саундтреки к кинофильмам и др. произведения на стыке симфонической, этнической и современной музыки.,1
Широко представлены семейства южных растений (Аизооновые и Толстянковые), акация (Acacia), молочай (Euphorbia), вереск (Erica) и др..,1
В наст. время флору этой области, состоящую из ок. 500 видов, составляют растения, интродуцированные из Европы.,1
Всего лишь неск. автомобилей имели заказные кузова, в наст. время они являются коллекционной редкостью.,1
Чечектерим и др..,1
В большинстве случаев виден только гирих, (и др. украшения в виде цветов), но не границы самих плиток.,1
Уктам Каримовна Вахабова (25.10.1928 – 10.11.2016) — сов. хоз., гос. и полит. деятель, д. м. н..,1
Был основателем и первым директором Института южноазиатских исследований в Экс-Провансе, основал и возглавляет по наст. время Центр азиатско-тихоокеанских исследований в Марселе.,1
Яков Авадьевич Бирштейн (1911—1970) — сов. биолог, д. б. н., профессор МГУ.,1
Сын — Вадим (род. 1944), генетик, д. б. н., историк, биограф отца (автор книги: Мой отец Яков Авадьевич Бирштейн. М.: Новый хронограф, 2012.,1
В работе круглого стола приняли участие: Саид Исмагилов, — муфтий ДУМУ «Умма»; Сейран Арифов — зам. председателя ВАОО «Альраид»; Мариуш Маршевський (Польша) — д. и. н., сотр. Института Востока исторического факультета Познанского университета; Татьяна Крупа — зав. реставрационной мастерской Музея археологии и этнографии Слободской Украины Харьковского национального университета им. В. Н. Каразина; Виталий Щепанський (Острог) — кандидат исторических наук.,1
В работе круглого стола приняли участие: Саид Исмагилов, — муфтий ДУМУ «Умма»; Сейран Арифов — зам. председателя ВАОО «Альраид»; Мариуш Маршевський (Польша) — д. и. н., сотр. Института Востока исторического факультета Познанского университета; Татьяна Крупа — зав. реставрационной мастерской Музея археологии и этнографии Слободской Украины Харьковского национального университета им. В. Н. Каразина; Виталий Щепанський (Острог) — к. и. н..,1
В наст. время, помимо головного музея в ратуше, включает филиалы: художеств., музей истории частного коллекционирования, музей-усадьба И. Е. Репина «Здравнёво», экспозиция в бывшей тюрьме СД, посв. памяти патриотов Витебщины.,1
Музей организует сменные выставки из собственных фондов и музеев Республики Беларусь, ближнего и дальнего зарубежья; проводит экскурсии, лекции, музейно-педагогические занятия, тематические вечера и др. мероприятия по краеведческой тематике.,1
Но в 1938 г вепсскоязычные книги были сожжены, а учителя и др. общ. деятели арестованы и высланы из родных мест.,1
В наст. время в здании церкви расположен музей, а все иконы из церкви Петра и Павла хранятся в Новгородском Историческом музее в кремле.,1
В конце ленты, в сцене романтичной прогулки влюблённых, в кадр попадает мост Форестхилл — самый высокий мост в Калифорнии с 1973 года по наст. время.,1
С этой целью, в недалекую старину, сталкивали в омут какого-нибудь запоздалого путника, а в наст. время бросают дохлых животных (непременно в шкуре).,1
Иван Сергеевич Таев (10 ноября 1919 — 6 июля 1997) — профессор, д. т. н..,1
Преподавателем этой дисциплины был д. т. н., профессор А. Я. Буйлов.,1
Среди них — к. т. н., доцент Евгений Георгиевич Акимов, к-рый вспоминал, что именно Иван Сергеевич Таев, как педагог, оказал на него, специалиста-электроаппаратчика, основное влияние.,1
В наст. время известны 19 трактатов Цицерона, посвящённые вопросам философии и политики, большая ч. которых написана в форме вымышленных диалогов.,1
Рукописи «О нахождении риторики» делятся на две группы, в зависимости от наличия или отсутствия в них нескольких значительных лакун — mutili («сломанные, изувеченные») и integri («целые»), хотя имеются и др. различия между ними.,1
В серии «Collection Budé» (латинские тексты с французскими переводами и комментариями) опубликованы более 50 томов сочинений Цицерона, вкл. переписку в 11 томах (в хронологическом порядке), речи в 20 томах (из них тома 1, 13, 16 в двух частях) и др. сочинения (пока отсутствуют издания «О природе богов», «О дивинации», «Учение академиков»): Cicèron.,1
14 августа 2001 года была основана Партия справедливости и развития (Ak Parti) и Али Бабаджан находился в числе основателей партии, среди которых также были Реджеп Тайип Эрдоган, Абдулла Гюль, Бюлент Аринч и др..,1
Юрий Николаевич Белозёров (24 августа 1929, Вятка — 5 февраля 2019, м.) — юрист, специалист в области уголовного судопроизводства; выпускник юридического факультета МГУ, к. ю. н. с диссертацией об обоснованности возбуждения уголовного дела (1972); профессор Московского университета МВД России (1994); полковник внутренней службы и засл. юрист РФ (1997).,1
В сюжет мультфильма введена тема соперничества Ворона и других птиц: Ворон и Лис похищают сойку Кетеван со свадьбы, однако затем Орёл и др. птицы наказывают разбойников.,1
вост. Тимор принимает участие в юношеских Олимпийских играх: в летних Играх — начиная с Игр 2010 года, в зимних Играх — на наст. время не принимал участия ни разу.,1
В наст. время вылов этого вида запрещён законодательно, но до принятия указанного запрета его популяция быстро сокращалась.,1
Имеются выходы некоторых типов минеральных вод, среди которых сульфатные, кремнёвые и др. редко встречающиеся в природе воды.,1
В наст. время (2012) посёлков городского типа в Молдавии нет.,1
Во время встречи с депутатами он подчеркнул основные вопр., с которыми председателю Солигорского районного исполнительного комитета придется столкнуться на своем посту: развитие малого и среднего бизнеса, стр-во жилья и улучшение инфраструктуры района, здравоохранение, сельское хозяйство, трудоустройство и др..,1
В наст. время официально насчитывается 3588 особей, благодаря согласованным усилиям по сохранению этого вида как в Индии, так и в Непале.,1
В наст. время с человеком и домашними животными индийский носорог в местах своего обитания сталкивается нередко, несмотря на меры, принимаемые для его изоляции от людей.,1
Александр Иванович Юрженко (16 августа 1910, с. Баратовка, Снегиревского района, Николаевской области — 19 июня 1999, г. Киев) — физико-химик; зав. лабораторией Всесоюзного научно-исследовательского института синтетического каучука (ВНИИСК) им. С. В. Лебедева (1941—1945), проректор по учебной работе Львовского государственного университета им. И. Франко (1957—1960), ректор Одесского государственного университета (ныне — Одесский нац. ун-т им. И. И. Мечникова) (1960—1970); д. х. н. (1949); профессор (1950); Орден Трудового Красного Знамени (1961), засл. деятель науки УССР (1965), лауреат премии им. С. В. Лебедева АН СССР (1947),1
С 1949 г. — д. х. н., а с 1950 г. — профессор.,1
Достоверно установлено, что статья в «Известиях» за июнь 1937 года, подписанная именем Куприна, принадлежит перу Вержбицкого; по мнению А. В. Храбровицкого, им же написаны и др. патриотические статьи, публиковавшиеся от им. Куприна.,1
До наст. времени сохранилась только липовая аллея, спускающаяся к реке.,1
В июне 2018 года НАСА сообщило, что Curiosity обнаружил кероген и др. сложные органические соединения в аргиллитовых породах возрастом примерно 3,5 млрд лет.,1
В наст. время в Швейцарии действует Фонд Рамю, вручается премия его им..,1
