abbreviation,encounters
Тейп Цорой среди основных ингушских тейпов называет чечен. исследователь, д. фил. н., К. З. Чокаев.,1
Изображения, используя метод шелкографии, наносились на бумагу, холст, сталь, стекло и др. нетрадиционные для обычной живописи поверхностях.,1
Взлётно-посадочная полоса 18L/36R в наст. время используется только военно-воздушными силами, однако, вследствие постоянного роста объёмов коммерческих авиаперевозок рассматривается вопрос об использовании полосы и в гражданских целях.,1
В наст. время в Эфиопии действуют приходы Эфиопской католической церкви (эфиопский обряд) и Римско-католической церкви (латинский обряд).,1
Эксплуатируемые в наст. время турбоагрегаты станции введены в эксплуатацию в 1971—2014 гг, при этом сама станция пущена в 1934 г.,1
Основная линия клана Цугару в наст. время вымерла.,1
В наст. время в теории автоматического управления широко используется математический аппарат интегральных преобразований Лапласа и Фурье.,1
В наст. время хариджиты-ибадиты сохранились в Омане.,1
В наст. время шиизм двенадцати имамов является государственной религией Ирана.,1
В наст. время султаны Сокото сохранили свою власть как духовные главы мусульман Нигерии.,1
В наст. время за возрождение института халифата выступает ряд исламских движений и организаций.,1
Предположительно, как и др. виды рода Heterospilus, паразитируют на жуках или бабочках.,1
Александр Михайлович Юзько (род. 10 августа 1954) — през. Украинской ассоциации репродуктивной медицины, д. м. н., профессор, лауреат Государственной премии Украины в области науки и техники за работу «Вспомогательные репродуктивные технологии лечения бесплодия», зав. кафедрой акушерства и гинекологии факультета последипломного образования и проректор по развитию Буковинского государственного медицинского университета, науч. рук. и гл. врач коллективного заведения охраны здоровья «Медицинский центр лечения бесплодия» в Черновцах.,1
С 1984 года — к. м. н., с 1990 года — доцент, врач акушер-гинеколог высшей категории.,1
С 1994 года — д. м. н., с 1995 года — профессор.,1
Как и др. виды авиценнии, имеет воздушные корни, позволяющие поглощать дополнит. кислород из окружающей среды, и достигающие в длину ок. 20 см.,1
В наст. время ботаниками выделяются три подвида:,1
Естественные пустоты в стволах деревьев в качестве жилья используются во всем мире с давних времён вплоть до наст. времени.,1
Содержат до 12 % сахаров, 0,6—2 % лимонной кислоты, до 50—65 мг аскорбиновой кислоты, тиамин, витамин P, соли кальция, калия, фосфора и др..,1
Как и др. цитрусовые, апельсин кислый, с уровнем pH от 2,9 до 4,0.,1
Белая ч. кожуры, вкл. сердцевину, является источником пектина и содержит почти такое же кол-во витамина С, как мякоть и др. питательные вещества.,1
Содержит книжные коллекции лауреатов нобелевской премии по литературе с 1901 года по наст. время.,1
Пациора Мария Демьяновна (25.10.1912, с. Куйтун Иркутской губернии — 14.08.1984, м.) — хирург, д. м. н. (1959), профессор, один из родоначальников гепатологии, инициатор создания первого в СССР специализированного отделения по хирургическому лечению портальной гипертензии в РНЦХ РАМН.,1
Специальные тросы связывали др. клавиши с молотками, бьющими по полым металлическим колоннам здания фабрики.,1
Маргарет «Марго» Изабель Мейбл Даррелл (англ. Margaret «Margo» Isabel Mabel Durrell; 4 мая 1919 года, Джаландхар, Пенджаб, брит. Индия — 16 января 2007 года, Борнмут, Дорсет, Великобритания) — мл. сестра романиста Лоуренса Даррелла и старшая сестра натуралиста, писателя и телеведущего Джеральда Даррелла: наиб. известна как персонаж его трилогии «Моя семья и др. звери» (1956), «Птицы, звери и родственники» (1969) и «Сад богов» (1978).,1
1987 г — в мини-сериале «Моя семья и др. животные» ее играла Сара-Джейн Холм.,1
2005 г — в полнометражном фильме «Моя семья и др. звери» роль Марго исполнила Тамзин Мерчант.,1
В наст. время потомки правнуки и праправнуки живут в Северной Каролине, США.,1
Было возведено новое здание общежития для учащихся, в наст. время — здание, находящееся по адресу: г. Егорьевск, ул. сов., д. 136.,1
В наст. время штаб-квартира находится в Берне.,1
С 2007 года и по наст. время профессор кафедры социального и физического воспитания Ульсанского университета науки и технологий.,1
Хотя Долгоруков, как и др. кадеты, считал, что займы должны получаться только с согласия народного представительства, он, будучи государственником, был сторонником получения займа и категорически отрицал слухи о т., что он совместно с В. А. Маклаковым действовал для срыва его реализации.,1
Сильно стимулирует аппетит, как впрочем и др. анаболические стероиды.,1
В наст. время чистые линии животных (в первую очередь крыс и мышей) и растений играют важнейшую роль в проведении биологических и медицинских исследований.,1
До наст. времени снимается в кино и телесериалах.,1
Александр Ильич Перельман (1916—1998) — сов. и рос. учёный, почвовед и геохимик, д. гм. н. (1954), профессор (1967), Лауреат Государственной премии СССР.,1
Повреждает такие растения как яблоня, хурма, мушмула, грецкий орех, маслины, гранат, розы, сирень, ясень, падуб и др..,1
Среди врагов фиолетовой щитовки отмечены паразитические наездники (Aphelinidae, Encyrtidae, Pteromalidae), хищные жуки (Coccinellidae, Nitidulidae) и др. (Hemisarcoptidae, Thripidae).,1
Наряду с традиционной банковской деятельностью, Амонатбанк оказывает услуги пенсионерам, привлекая свободные средства населения во вклады, прием коммунальных платежей от населения, выплату компенсаций, предоставление льготных кредитов малообеспеченным семьям, обращение ценных бумаг, облигаций и др. услуги.,1
Эксплуатируемые в наст. время турбоагрегаты введены в эксплуатацию в 2011 г, при этом сама станция работает с 1947 года, являясь старейшей ныне действующей электростанцией региона.,1
Эксплуатируемое в наст. время оборудование введено в эксплуатацию в 2014 г, при этом сама станция эксплуатируется с 1961 года.,1
зав. Научной библиотекой Государственного Эрмитажа, к. и. н., — Евгений Викторович Платонов.,1
В наст. время Шенгенское соглашение является частью acquis communautaire, а само соглашение утратило для членов ЕС статус договора, к-рый может быть изменён только в соответствии с его условиями.,1
Мощное, лит. течение, созд. Амири в те далекие гг., позволило появиться в Ферганской долине, известным просветителям, поэтам-демократам, таким как Мукими, Фуркат, Мухи, Орази, Тажалли и др..,1
Применяют антигельминтные препараты — альбендазол, мебендазол, левамизол, пиперазин, и др..,1
Победа императорских сил в войне Босин существенно повлияла на бюрократический аппарат, законодательство, администрацию, финансы, промышленность, дипломатию, образование, религию и др. сферы жизни японцев.,1
Практически забытые в наст. время, в XVIII веке его произведения были хорошо известны и тепло воспринимались по всей Италии, а также исполнялись в Германии, Австрии, Испании, Португалии и России.,1
С техническим прогрессом и дальнейшим развитием вооружения появлялись новые рода войск и специальных войск в которых были созданы такие типы бригад как авиационные, железнодорожные, миномётные, мотопехотные, сапёрные, танковые, противотанковые и др..,1
Также были созданы бригады: стрелковые, крепостные пехотные, пограничной стражи, резервные, кавалерийские запаса, запасные (на военное время), местные и др..,1
В последующем бригадами стали называться отряды однотипных судов (эсминцы, сторожевые корабли, тральщики и др.).,1
В период Гражданской войны в РСФСР в 1917—1922 гг РККА располагала стрелковыми бригадами, кавалерийскими бригадами, тяжёлые артиллерийские, резервные тяжёлой артиллерии, бригады особого назначения и др..,1
В специальных войсках тип бригады определяется их основным назначением: разведки, связи, инженерные, РХБЗ, автомобильные, трубопроводные и др..,1
К таковым относятся пехотные, мотопехотные, механизированные, танковые, бронетанковые, горнопехотные (альпийские), воздушно-десантные (аэромобильные) и др..,1
Также в армиях многих государств имеются бригады полевой артиллерии, бригады зенитных управляемых ракет, бригады армейской авиации (вертолётные), инженерные бригады, бригады связи и др..,1
Также в армиях некоторых государств в 1990-е гг. (Германия, Италия, Австрия и др.) имелись горнопехотные (альпийские) бригады.,1
Аналогичные формирования в других государствах СНГ (Украина, Казахстан, Белоруссия, Узбекистан и др.) на данный момент носят назв. отд. механизированная бригада (англ. mechanised brigade ↔ mech bde).,1
В состав бригады входили лёгкий разведывательный полк и броневой полк, отд. стрелковый батальон, артиллерийский дивизион и др. подразделения.,1
На современном этапе основу сухопутных войск многих государств СНГ (Украина, Казахстан, Белоруссия, Узбекистан и др.) также составляют отдельные механизированные бригады.,1
Также в военный период были созданы корпусные и армейские абр (2—3 полка по 2 дивизиона или по 5 батарей в каждом), миномётные бригады (48 160-мм миномётов), а также самоходные абр (76-мм, 100-мм, 122-мм и 152-мм САУ), тяжёлые (152-мм гаубицы), средние (122-мм пушки, 152-мм пушки-гаубицы), лёгкие (76-мм, 100-мм пушки) и др..,1
К примеру типовой штат зрбр на ЗРК «Куб» Советской армии в 1980-х гг включал в себя 3 отдельных зенитно-ракетных дивизиона (в каждом 3 зенитно-ракетные батареи по 3 пусковые установки), батарея управления, технич. батарея, рота связи, зенитно-ракетная технич. база и др. подразделения тылового обеспечения.,1
В войсках ПВО на разных исторических периодах встречались и встречаются следующие типы бригад: зенитные артиллерийские (зенабр), зенитно-ракетные (зрбр), радиотехнические (ртбр) и др..,1
Также инженерно-сапёрные бригады и др. типы инженерных войск встречаются в армиях различных государств.,1
По этим причинам мн. учёные считают Кодекс Алеппо самым авторитетным представителем масорской традиции как по огласовкам, так и по знакам кантилляции, несмотря на то, что большинство текста в наст. время отсутствует.,1
После падения Иерусалима (в 1099 г) во время первого крестового похода, крестоносцы захватили кодекс и др. святые реликвии с целью получения выкупа.,1
В наст. время в тексте отсутствует почти весь раздел Торы (от Бытия до большей части Второзакония).,1
В наст. время на сцене театра исполняет ведущие и характерные партии в балетах «Лебединое оз.», «Щелкунчик», «Лауренсия», «Пламя Парижа», «Ромео и Джульетта», «Дон Кихот», «Спящая красавица», «Корсар», «Жизель, или Вилисы», «Чиполлино», «Дуэнде», «В лесу», «Прелюдия», «Белая тьма», «Многогранность.,1
епископ Giuseppe Sandri M.C.C.I. (6.11.2009 — по наст. время).,1
радиогенные радионуклиды — продукты распада вышеуказанных долгоживущих радионуклидов (напр., радон-222 и др. радионуклиды из рядов радия, тория и актиния);,1
В наст. время Аждар Джафаров работает директором Республиканской специализированной детско-юношеской спортивной школы олимпийского резерва номер 2 при Спортивном центре «Тэхсил».,1
Даже окна, двери и др. деревянные части в мечетях и гробницах ходжей были, к великой скорби мусульман, употреблены на дрова.,1
«Тазкиряи Туглук-Тимур-хан» («История Туглук-Тимур-хана»), «Тазкиряи Ходжагян» («История ходжей»), «Абу-Муслим Маурузи» и др., а также коллекции нумизматики и горных пород, образцы нефрита, гербарий и многое другое.,1
В наст. время «Манас» является всемирно известным эпосом, к-рый в научном мире впервые записал Чокан Валиханов, назвав его творением народной мудрости, энциклопедическим сборником народных сказок, мифов и легенд, географических, религиозных понятий, обычаев и традиций; оценил как степную «Илиаду».,1
В наст. время является генеральным секретарем Федерации дзюдо Казахстана.,1
Алекса́ндр Глебович Ива́шенцов (4 [17] января 1915, Санкт-Петербург — 24 октября 1991, м.) — сов. геолог, к. гм. н., лауреат Ленинской премии (1966).,1
В наст. время школа находится в ведении правительства земли Саксония-Анхальт, однако ее делами до сих пор занимается специальный фонд Пфорты.,1
Среди них Сократ, Влассис Бонацос, Костас Папайоанну из Poll, Ставрос Логаридис, Такис Андроутсос, Вангелис Зисис из «Ноя» и др. …,1
Под влиянием того, что «Ребёнок Афродиты» уже «ушёл» и добился успеха, они говорят: «Вот и др. греки, которые добьются успеха».,1
Перевёд с греческого ряд источников по болгарской истории: послания на святого Климента Римского, послание константинопольского патриарха Фотия болгарскому князю Борису I (1917), письма блаженного Феофилакта Охридского, архиепископа Болгарского (1938) и др..,1
В 1854 г отца перевели на службу в акцизное управление в с. Сухой Бузим (в наст. время Сухобузимское, Сухобузимский р-н Красноярского края).,1
С тех пор СДПА активный чл. Социнтерна, в наст. время является полноправным членом данной организации.,1
Возвращение шотландца и др. эссе (1960),1
В наст. время степь распахана под сельхозугодья,1
В наст. время наводнением считается подъём воды выше 160 см от нуля Кронштадтского футштока.,1
франц. модельер Шанталь Томасс предложила концепцию «верхнего нижнего белья» — нижнее бельё, как и др. виды одежды, стало средством самовыражения.,1
«Успение Богоматери» — икона, созд. иконописцем Дионисием ок. 1500 года для местного чина иконостаса Троицкого собора Павло-Обнорского монастыря; в наст. время находится в собрании Вологодского музея-заповедника (инв. № 10128).,1
Возможно, что резная надпись повторяет другую, сделанную неск. выше чёрной краской, которую в наст. время можно прочитать лишь частично.,1
Однако, этим же словом в зоологии могут обозначаться и др. тонкие выросты тела, в частности, у членистоногих.,1
Среди мышц, обслуживающих щетинки, различают ретракторы и протракторы, а иногда и др. типы мышц, напр., для Stylaria показано также наличие передних и задних сгибателей и вращателей.,1
Ученая степень — к. э. н..,1
В то же время проверялись и др. версии катастрофы, но почти все они были отброшены.,1
В наст. время стадион «центр.» не существует.,1
Все оружие, патроны и др. предметы хранятся в инвентаре персонажа, к-рый изначально представлен 8 ячейками и впосл. может быть расширен с помощью набедренных сумок, каждая из которых увеличивает вместимость на 2 ячейки.,1
В наст. время каталонцы считают 988 г датой основания Каталонии.,1
С этого момента и до наст. времени епископ Урхеля является одним из двух номинальных соправителей этой страны.,1
Мажар, Николай Евгеньевич (р. 1954) — ректор Смоленского Гуманитарного Университета, д. п. н., профессор.,1
После окончания Второй мир. войны Мицубиси, как и др. крупные дзайбацу, был раздроблен оккупационными властями на сотни отдельных компаний.,1
В наст. время численность русского населения Бамборы сильно сократилась.,1
В наст. время входит в собр. экспонатов Оружейной палаты Московского кремля.,1
