abbreviation,encounters
В доступной литературе термин «объёмная сфигмография» или «volume sphygmography» можно встретить лишь в небольшом количестве публикаций отдельных российских авторов, а в мировом сообществе исследователей этот термин в наст. время не употребляется.,1
Для исследования артерий в наст. время используют в основном ультразвуковые методы (вкл. эластографию) и иногда магнито-резонанстную томографию.,1
Разделение контура пульсовой волны в одной артерии (с помощью специальных алгоритмов) на прямые и отраженные волны как метод анализа в наст. время не рекомендуется.,1
Кормовые растения гусениц — растения из семейства бобовые: астрагал, лядвенец, люцерна, клевер, горошек и др. растения.,1
В наст. время разработкой приборов для трёхмерного лазерного сканирования занимается множество фирм, все эти фирмы выпускают сканеры для различных целей.,1
В современном казахстанском музыкальном искусстве желдирме успешно используется в симфонических кантатах, ораториях (симфоническая поэма «Желдирме» Е. Г. Брусило́вского по мотивам И. Байзакова, кантата Е. Рахмадиева «Аястан» (1968) и др.).,1
В наст. время к роду относят 7 видов, распространённых на западе США:,1
В своей работе он экспериментально доказал классические в наст. время законы диффузии и осмоса.,1
1896 г — на перекрёстке Владимировской улицы и Владимировского спуска построена ж.-д. школа, на месте которой в наст. время располагается отд. социальной защиты населения.,1
1900 г — построено второе здание бывшей железнодорожной школы № 2, в котором сегодня располагается сиб. центр сертификации и др. организации.,1
Изначально, и по наст. время, по факту, считается, что гл. удар немцы решили нанести танковыми дивизиями СС «Рейх» и «Адольф Гитлер» на Берёзов — Быковка и далее на Яковлево вдоль ш. Обоянь — Белгород.,1
Выше по течению Малой Колокши в наст. время населенных пунктов нет.,1
Максат Нурадилович Калимолдаев (18.06.1957) — изв. учёный, специалист в области математическое моделирование и управление динамическими, техническими и экономическими системами, педагог, д. фм. н., профессор, акад. НАН РК.,1
• Супруга: Калимолдаева Салтанат Болатовна — д. м. н.,1
Филипп Бледный — Вениамин «Веник» Викторович Васильев , к. фм. н., со 2 сезона — преподаватель университета (1—2 сезоны, фильм),1
Позже были закуплены и др. распространенные молотилки, сначала с бензиновым приводом, после электрификации с электроприводом.,1
Пострадавшей от коммунистического режима стала и жена Берана, которую обвинили в т., что она не отдала во время конфискации имущества все семейные драгоценности, картины и др. предметы, в т. числе иностранную валюту.,1
В Москве Wi-Fi ДОМ.РУ работает в пределах Садового кольца, в Санкт-Петербурге — в исторической части города, где находятся Зимний дворец, Петропавловская крепость, Казанский собор, Александринский театр и др. достопримечательности.,1
Два каменных школьных здания рубежа XIX и XX веков, сохранившиеся до наст. времени.,1
В наст. время зарегистрирован в качестве эксперта Федерального реестра экспертов научно-технической сферы Минобрнауки России (2013-2016).,1
Серге́й Влади́мирович Саксо́нов (9 марта 1960, Сызрань, Куйбышевская область — 16 дек. 2020, Тольятти, Самарская область) — рос. учёный-ботаник, эколог, д. б. н. (2001), профессор (2006), акад. Международной академии наук экологии и безопасности жизнедеятельности (2003), засл. деятель науки Российской Федерации (2009).,1
Григорий Антонович Цулукидзе (груз. გრიგოლ ანტონის ძე წულუკიძე; 16 апреля 1889, Тифлис — 22 дек. 1950, Тбилиси) — сов. геолог, д. т. н. (1939), профессор (1930), акад. АН Грузинской ССР (1944).,1
В 1939 г защитил докторскую диссертацию на соискание учёной степени д. т. н..,1
23 апреля 2019 года на конференции OPAG Роберт Паппалардо сообщил, что магнитомер, к-рый предлагается на замену отмененного ICEMAG, значительно хуже оригинального инструмента: если ICEMAG смог бы измерить толщину ледяной коры Европы с точностью до 20 км, то у нового прибора разброс составит 20—100 км, что ненамного лучше тех данных, которые есть в наст. время.,1
В наст. время все спортивные тренажеры российского сегмента МКС расположены в модуле «Звезда», в котором также находятся каюты для сна, туалет, центр. пост управления и обеденный стол.,1
В наст. время в замке расположен отель.,1
Присутствовавшие на собрании члены коммуны Нестеров и др. подтвердили это.,1
назв. «Фёдор Мухин» носило судно – буксир-толкач (проект: 758АМ; использовался в 1973-2012 гг.; порт: Благовещенск; в наст. время списан; изначально – Амурское пароходство; выведен из эксплуатации, использовался как учебное судно; затем находился в отстое в Хабаровске; разрезан на Хабаровской РЭБ в 2012 г.).,1
Поскольку большинство приложений, требующих вычислений, в наст. время выполняются небольшими цифровыми компьютерами, оставшееся полезное прилож. — измерение мощности в одном устройстве с эффектом Холла, к-рый объединяет измерение тока с измерением напряжения.,1
26 октября 1944 года, Хавива Рейк и др. парашютисты во главе группы из 40 евреев ушли из Банской-Бистрицы в горы, где построили врем. лагерь.,1
Однако тот сам присоединился к протестующим и создал организационную группу, в которую вошли экономист Грамоз Пашко, археолог Неритан Цека, врач-кардиолог Шахин Кадаре, юрист Люан Омари, лидер студенческого движения Азем Хайдари и др..,1
Обширное описание жизни и исследовательской работы Яна Черского составил к. г. н., доцент П. А. Лярский.,1
После того, как пиратство было подавлено, в игру вступили др. соображения, такие как стратегическая необходимость британцев исключить другие державы из региона.,1
В наст. время власти Абу-Даби имеют не менее амбициозные планы, чем Дубай, в числе них стр-во метро и застройка целого острова Саадият, расположенного в северо-восточной части города.,1
В наст. время петушиные бои в США подвергаются резкой критике из-за связанной с крупными денежными ставками криминализации и жестокого обращения с животными (особенно критикуется практика использования металлических шпор или лезвий, способствующие причинению сильных травм).,1
Аналитик В. Шоукросс и др. считают, что беспорядки при поддержке Лон Нола организовал сам Сианук с целью оказать давление на Ханой.,1
В наст. время проживает в Киеве, работает тренером.,1
В наст. время вопрос о т., как можно объяснить подобные переживания — точнее, могут ли они вообще иметь место, — остается окутанным неясностью и спорностью».,1
В наст. время он входит в заявочные комитеты на зимние игры в Солт-Лейк-Сити и летние игры 2028 года в Лос-Анджелесе.,1
Эта орг-ция и др. оппоненты Чавеса обвинили его в стремлении превратить Венесуэлу в диктатуру путём централизации власти среди сторонников президента в Национальной ассамблее и предоставления ему всё больших и больших полномочий.,1
Влади́мир Исаа́кович Ко́робов (5 октября 1936, Лубны, укр. ССР — 16 октября 1980, Ереван, Армянская ССР) — сов. врач-рентгенолог, учёный, д. м. н., профессор.,1
Супруга — Любовь Акимовна Коробова (1939 г.) — врач-рентгенолог, к. м. н., сын — Илья Владимирович Кор (1965 г.), дочь — Наталья Владимировна Браславская (1970 г.).,1
Статьи и др. науч. работы:,1
Окончил ун-т Далхаузи в Новой Шотландии (почётный д. ю. н.).,1
На сегодняшний день существует неск. взглядов на деление Мирового океана, учитывающих гидрофизические и климатические особенности, характеристики воды, биологические и др. факторы.,1
Разработка месторождений газогидратов является более дорогой по сравнению с разработкой традиционных месторождений природного газа, поэтому она в наст. время не осуществляется.,1
Интервью с пятью предполагаемыми жертвами и 17 свидетелями, стенограммы старшей школы и др. предметы, найденные в мусорном ведре в доме Эпштейна, показали, что некоторым из причастных девушек было меньше 16 лет.,1
Робертс также утверждала, что Эпштейн и др. подвергли её физическому и сексуальному насилию.,1
Позднее Эпштейна стали называть миллиардером и др. СМИ, в т. числе Associated Press, New York Post, New York Daily News, Newsday, Boston Globe, Miami Herald.,1
Под руководством И. Б. Загайтов в 1978 г была создана Лаборатория долгосрочных прогнозов агроуниверситета, научным руководителем которой он является по наст. время.,1
1998 — по наст. время Профессор кафедры экономики АПК Воронежского ГАУ,1
Премии Аттилы Йожефа (1986), Тибора Дери (1989, 1992), Лайоша Кошута (2003) и др. награды.,1
К этой тенденции присоединились и др. ютуберы, в т. числе латвийская группа Auļi, Graywyck, Константин Бард и Самус Ордикус.,1
Драко также был спародирован под именем Сакко (его играет Шейн Лайонс) в скетче Harry Blandder телесериала «Всякая всячина», в котором Гарри Бладдер и др. студенты часто сталкиваются с злодейскими замыслами Сакко.,1
В 1928 г Бельгия присоединилась к Танжерскому протоколу, учредившему междунар. контрольный комитет и др. органы международной администрации при номинальном сохранении власти марокканского султана Мухаммеда V над этим африканским городом и его окрестностями.,1
Павел Васильевич Леошко род. в казачьей семье в станице Петро́вская Темрюкского отдела Кубанской области (в наст. время слав. р-н Краснодарского края).,1
произ-во британского телеканала BBC совместно с американской телесетью A&E Television Networks по одноимённой пьесе Саймона Грея из книги «Неестественный поиск и др. пьесы: Дневник автора» (англ. An Unnatural Pursuit & Other Pieces: A Playwright's Journal, 1985).,1
Оюн Араптанович Толгар-оол (13 августа 1912-?) — к. и. н., почетный гражданин г. Кызыла, засл. работник культуры Тувинской АССР.,1
1 мая 1955 г., Семёнов, Горьковская область, Россия) – языковед, д. фил. н. (1999), профессор (2008), автор многочисленных научных работ по функциональной грамматике и лингвистике текста, школьных и вузовских учебников по русскому и белорусскому языкам.,1
О функционировании страдательных причастий наст. времени в текстах различных стилистических систем // Styl a text.,1
Семейная резиденция — Ситон Делавал Холл (в наст. время находится в распоряжении Национального фонда Великобритании).,1
2007 — наст. время: Делавал Томас Гарольд Эстли, 23-й бар. Гастингс (род. 25 апреля 1960), старший сын предыдущего;,1
За короткое время М. И. Соколов и др. члены группы успели побывать в Минске, Гомеле, Белостоке и ряде других мест Северо-Западного края, посетить неск. городов юга России и Поволжья.,1
Начиная с середины XVII вв. стали появляться утверждения, что труд Пьера Белона L'Histoire de la nature des oyseaux, вышедший в свет в 1555 г, за к-рый тот считается в наст. время одним из основоположником сравнительной анатомии, полностью или частично основан на записях Жиля.,1
В наст. время эти слухи считаются не имеющими оснований.,1
В наст. время .NET Framework развивается в виде .NET.,1
В FCL входят классы Windows Forms, ADO.NET, ASP.NET, Language Integrated Query, Windows Presentation Foundation, Windows Communication Foundation и др..,1
В разные гг. жюри конкурса возглавляли И.Д. Кобзон, А.Б. Пугачева, Л.В. Лещенко, Л.А. дол., И.М. Бутман и др. звезды российской эстрады.,1
междунар. ин-т по исследованию видов был основан в 2007 г и вначале работал при Университете штата Аризона, позже он стал работать при Университете штата Нью-Йорк и в наст. время (2014) базируется в городе Сиракьюс.,1
Фонд также развивает отношения и поддерживает культурный диалог со странами-партнерами, в т. числе реализуя знаковые проекты совместно с ведущими театрами и музеями России, такими как Мариинский театр, гос. Эрмитаж, гос. рус. музей и др..,1
В наст. время в храме совершаются регулярные Богослужения.,1
В наст. время Мосиг преподает психологию в Университете Небраски в Кирни, где он также занимается исследованиями Пунических войн и карьеры Ганнибала.,1
Станислав Васильевич Янко — д. т. н.; предс. Всеукраинского отраслевого объединения организаций работодателей угольной промышленности «Укруглеработодатели»; АГНУ, вице-президент, рук. отделения угля, торфа и горючих сланцев; чл. Общественной коллегии при Министерстве топлива и энергетики Украины (с июня 2005).,1
Предполагается восстановить бывшую парковую оранжерею и др. сооружения.,1
В наст. время быв. форбург используется в качестве социального центра и клиники психиатрии и психотерапии.,1
В наст. время здесь периодически проходят театральные представления.,1
В наст. время парк открыт для публики.,1
В об-во влились христ. Студенческий Клуб Львовского Государственного Университета им. Франко, Теологический Клуб Львовского Медицинского Института и др. объединения.,1
Фовисты расширили область применения цвета и свободу в его использовании, так же как и немецкие экспрессионисты из группы «Die Brücke» и др. ранние модернисты.,1
В наст. время проект не обновляется с 3 дек. 2015 года.,1
Компания IBM продолжает поддержку языка и в наст. время, так как на нём написан громадный объём кода, к-рый невыгодно переводить на другие языки программирования.,1
В наст. время ок. 57 % производимого человечеством углекислого газа удаляется из атмосферы растениями и океанами.,1
Макси́м Ани́симович Кронга́уз (род. 11 марта 1958, м.) — сов. и рос. лингвист, д. фил. н., профессор РГГУ и НИУ ВШЭ, первый зам. председателя Комиссии по развитию высшего образования и науки Общественной палаты РФ.,1
Кандидат филологических наук (1989, дис. «Использование механизмов референции при анализе текста»), д. фил. н. (2000, дис. «Семантические механизмы глагольной префиксации»), профессор (2001).,1
Сестра — Фаня (Феня) Филипповна Кронгауз (в документах Фейга Нохим-Липмановна, ?—1975), филолог, к. п. н., науч. сотр. Института теории и истории педагогики АПН РСФСР, автор книги «К истории советской школы на Крайнем Севере» (1948), сост. сборников «В помощь учителю школ Крайнего Севера».,1
В этих лесах господствуют псевдотсуга Мензиса (Pseudotsuga menziesii) и др. растения, в т. числе пихта миловидная (Abies amabilis), туя складчатая (Thuja plicata), ель (Picea), майник широколистный (Maianthemum dilatatum), кандык крупноцветковый (Erythronium grandiflorum), земляника (Fragaria), гаультерия (Gaultheria), представители рода вакциниум (Vaccinium) и люпин (Lupinus).,1
Йо́нас Бу́час (лит. Jonas Bučas; 24 ноября 1900, дер. Пуоджюнай Линковской волости Ковенской губернии, ныне Пакруойский р-н — 15 октября 1973, Вильнюс) — литовский экономист, д. э. н. (1933), ректор Вильнюсского государственного университета (1948—1956); чл.-корр. Академии наук Литовской ССР (1946).,1
В наст. время проходит одно основное кубковое соревнование в греческом футболе — Кубок Греции, в котором соревнуются команды из всех футбольных лиг Греции, команды низших дивизионов имеют шанс победить сильные клубы, однако команды низших дивизионов редко попадают в финал.,1
Палата общин и др. крупные здания Лондона разместили на внешних стенах проекции заключительной речи Дэниела Блейка в рамках «Партизанской маркетинговой кампании».,1
