abbreviation,encounters
(В составе ВМФ СССР на это время был только один полноценный авианосец «Адмирал Кузнецов» (в наст. время в составе Северного флота Российской Федерации) и 4 авианесущих крейсера.),1
В царские гг. в посёлке располагался Арсениево-Комельский Ризоположенский муж. (с 1904 года жен.) мон., в наст. время осталось только настоятельский и братский корпуса.,1
мн. из них носили наименования по территориальной или национальной принадлежности: «Валлония», «Галичина», «Богемия и Моравия», «Викинг», «Денмарк», «Гембез», «Лангемарк», «Нордланд», «Недерланд», «Шарлемань» и др..,1
В составе армии гитлеровской Германии воевал 15-й казачий кавалерийский корпус СС генерала фон Паннвица и др. казачьи части.,1
Туда же набирались и др. военнопленные вермахта, бывшие гражданами Югославии.,1
В соответствии с принятым планом, в начале 1942 года были предприняты наступательные операции: Ржевско-Вяземская стратегическая наступательная операция, Керченско-Феодосийская десантная операция и др..,1
Эти изменения отражены в трансформации экспозиции главного Музея Победы на Поклонной горе, за которым следуют и др. музеи; проходящих во многих российских регионах судах, рассматривающих преступления военного времени; центральной роли, которую в российской политике памяти занял федеральный проект «Без срока давности», начатый в 2019 г с целью изучения преступлений нацистских оккупантов на территории России.,1
Кроме вооружения из США по ленд-лизу направлялись автомобили, тракторы, мотоциклы, суда, локомотивы, вагоны, продовольствие и др. товары.,1
Об этом факте очень много говорили впосл. мн. советские военачальники, как напр. И. С. Конев и др..,1
Автор первого обзора рукописного наследия Маяковского, нескольких публикаций его неизвестных произведений и документов биографии (сб. «Владимир Маяковский» 1940 года и др. издания).,1
Бродрик бы вынужден продать дом и др. ценные активы, чтобы возместить ущерб организаторам.,1
В феврале 2010 года в интервью журналу «Terrorizer» Бродрик ответил на вопрос о будущем Godflesh: «В наст. время Godflesh только выступят на Hellfest.,1
В состав первого правления вошли Пётр Вильямс, Сергей Герасимов, Александр Дейнека, Павел Кузнецов, Аристарх Лентулов, Илья Машков, Д. Моор, Павел Радимов, Георгий Ряжский, Давид Штеренберг, Константин Юон и др. известные мастера изобразительного искусства.,1
Но уже в 1933 г Союзу была передана ч. помещений на наб. р. Мойки, дом 83, где Союз располагается по наст. время.,1
Аквилино Бокос Мерино — (28 июня 2018 — по наст. время).,1
гр. Владислав Замойский переехал в Польшу, когда он унаследовал Курник (с замком, библиотекой и дендрарием) в Великой Польше, и др. поместья от своего дяди, Яна Канты Дзялынского в 1881 г.,1
В наст. время с. Тагаверд является центром Тагавердского сельского административно-территориального округа Ходжавендского района, причём в состав Тагавердского сельского административно-территориального округа входят также сёла Зарданашен и Чагадюз.,1
Для достижения своей цели Монти придётся совершить путешествие по Европе, собирая на своём пути деньги и др. предметы, выполняя некоторые задания.,1
В наст. время месторождение находится в опытно-промышленной эксплуатации (АО “Приийск Удерейский”).,1
Разработка технологий производства бутилкаучука — в наст. время по разработкам института работаю производства на ТПО «Синтезкаучук» и ПО «Нижнекамскнефтехим», хлорированного и бромированного каучуков — на ПО «Нижнекамскнефтехим» организовано произ-во галобутилкаучуков.,1
В состав НИИ «Ярсинтез» входят 14 лабораторий, 5 технологических цехов, 3 научно-производственных отдела, в которых работают 2 доктора наук, профессора, заслуженных деятеля науки РФ (Г. Р. Котельников и О. П. Яблонский) и более 50 кандидатов наук и др. сотрудники.,1
В наст. время лорд-канцлер, в основном, выполняет функции министра юстиции Великобритании.,1
Поэтому в наст. время лорд-канцлер именуется лордом-канцлером Великобритании, а не лордом-канцлером Соединенного королевства.,1
В «Яму», чтобы послушать споры народных искателей Бога и Божьей правды с православными, «спускались» известные рос. интеллектуалы — религиозные мыслители Н. А. Бердяев, С. Н. Булгаков, В. С. Соловьёв, литераторы П. Д. Боборыкин, Е. К. Герцык, E. Н. Чириков, толстовцы Ф. А. Страхов, В. Г. Чертков и др..,1
Церковь перестраивалась, существующее в наст. время здание относится к 1739 г.,1
В наст. время Хайхэ является самой загрязнённой рекой Китая.,1
В наст. время сохранились только два: один — на углу напротив центральной почты (когда-то там был райвоенкомат, потом сельский Совет, а сейчас две квартиры), и второй дом на улице Красной между милицией(бывшей) и детским садом (№ 7).,1
Каган, Борис Моисеевич, красноармеец 1-го стрелкового полка, впосл. сов. и рос. учёный и конструктор в области автоматики, информатики и вычислительной техники, д. т. н., профессор, лауреат Сталинской премии.,1
На кон. 1919 года технич. обеспечение частей особого назначения оставалось плохим — оружие в первую очередь поставлялось в Красную армию, а ЧОНы, как и др. отряды самообороны, получали в-основном устаревшее вооружение.,1
Доцент кафедры метеорологии и физики околоземного космического пространства,к. г. н. Инна Латышева назвала причиной мощного наводнения затяжные ливневые дожди, прошедшие в регионе.,1
зав. лабораторией гидроэнергетических и водохозяйственных систем ИСЭМ СО РАН им. Мелентьева, д. т. н. Вячеслав Никитин утверждал, что версия о влиянии на паводок Ангарского каскада ГЭС (в частности Братское водохранилище/Братская ГЭС, Иркутское водохранилище/Иркутская ГЭС) не получила своего подтверждения.,1
В наст. время из города можно добраться до Каменных Палаток трамваями 5, 8, 13, 15, 23 и 32 маршрутов, а также автобусами 25, 27, 61, 077, 80, 082 маршрутов Остановка «Каменные палатки».,1
с 2003 года по наст. время - зав. кафедрой "Транспортное стр-во" Алтайского государственного технического университета им. И.И. Ползунова;,1
с 2006 года по наст. время - през. Ассоциации дорожников г.Москвы;,1
с 2008 года по наст. время - генеральный дир. Саморегулируемой организации «Союз дорожно-транспортных строителей «СОЮЗДОРСТРОЙ»,;,1
c 2010 года по наст. время - генеральный дир. Саморегулируемой организации Союз «Межрегиональное объединение организаций энергетического обследования транспортного комплекса «СоюзДорЭнерго».,1
В наст. время членами Комитета являются:,1
В наст. время на острове развивается туризм.,1
к. п. н. (1998);,1
Авиакомпания создана в 2011 г и получила своё назв., имущество и др. активы от ликвидированной авиакомпании Livingston Energy Flight.,1
Увеличивающейся стремительно в размерах империей руководили преданные, опытные люди (албанцы, фанариоты, армяне, сербы, венгры и др.).,1
Поэтому Мехмед II и его преемник Баязид II поощряли миграцию евреев-ремесленников и евреев-купцов в Стамбул и др. крупные порты.,1
Картины и др. биографические данные можно найти на сайте Simonis & Buunk.,1
Алексей Папин, Андрей Сироткин, Фатима Дудиева, Георгий Челохсаев и др..,1
нем. нас. депортировано в Сибирь и Казахстан, с.,, как и др. населённые пункты Красноярского кантона было включено в состав Саратовской области.,1
Наряду с электрооборудованием производства Крюковского завода, значительную ч. нового электрооборудования поставили японские и немецкие компании, такие как ITOCHU, Mitsubishi Electric, Knorr Bremse, Fuji Electric, Schaltbau и др..,1
В наст. время преемство исторического Угорского монастыря оспаривают неканоническая Украинской автокефальной православной церкви, возродившая его в 2004 г в Угорниках как Угорницкий Спасо-Преображенский мон. и каноническая укр. православная церковь, возродившая его в 2010 г в Бабянке как Михайловский Угорницкий мон..,1
Одновременно в 1980 г окончил аспирантуру Академии общественных наук при ЦК КПСС, к. э. н. (1982).,1
Помимо этого были и др. причины.,1
В наст. время они лидируют по количеству концертов, проводимых каждый г в Brixton Academy.,1
В наст. время разработка этого продукта прекращена;,1
В наст. время служит в Магнитогорском драматическом театре им. А. С. Пушкина.,1
В наст. время Кейси живёт в Хингем, штат Массачусетс со своей семьей.,1
В дальнейшем такое соседство привлекло в р-н и др. крупные корпорации.,1
Нападение 11 сентября 2001 года привело к падению деловой активности в районе, и в результате бизнес стал переезжать в другие районы города, а также в соседние штаты и др. деловые центры Америки, такие как Чикаго и Бостон.,1
В наст. время назв. сохраняется в наименовании 1-го и 2-го Бабьегородских переулков.,1
В наст. время на территории Бабьего городка расположены центр. дом художника и парк «Музеон».,1
Выходя из города Антиоча в Картахену, когда мы её заселили, капитан Хорхе Робледо и др. обнаружили столько рыбы, что мы убивали палками каких только хотели бы поймать.,1
Этот рудиментарный светочувствительный орган достался животному от его далёких предков — в наст. время он не в состоянии давать изображение, хотя и имеет недоразвитый хрусталик и сетчатку.,1
В желудках ящериц действительно могут оказаться насекомые и др. мелкие беспозвоночные, однако специалисты полагают, что они проглатываются лишь случайно вместе с растительной пищей: напр., игуана может проглотить насекомое, сидящее на ложе цветка, вместе с цветком.,1
В природе у игуан большое кол-во врагов — среди них ястребы и др. хищные птицы, крокодилы, кайманы, ящерицы василиски, кошачьи, лисы, хорьки, крысы и некоторые виды змей, вкл. анаконд и обыкновенных удавов.,1
В наст. время информация о зелёной игуане в Красной книге Международного союза охраны природы отсутствует, то есть её статус остаётся неопределённым.,1
На съезде в Вильне (1883) к «Пролетариату» присоединились и др. польские социалистические кружки Варшавы, Вильны, Москвы, Петербурга, Киева, Одессы и был избран центр. Комитет в составе Варынского, Куницкого, Рехневского и других.,1
Алевти́на Анато́льевна Черникова (род. 22 мая 1966 года) — рос. экономист, д. э. н., ректор НИТУ «МИСиС» с 2013 года.,1
Во время войны на Кавказе, как и др. офицеры, Ермолов держал при себе неск. наложниц «из азиатцев».,1
По мнению советского историка Николая Кровякова, Ермолова отличала от его преемников только прямолинейность: «Воронцов, Барятинский и др. были не менее свирепы и жестоки.,1
Персонажи книги — Владимир Ленин, Владимир Путин, Берлускони, Клод Дебюсси, Жанна Фриске, Зоя Космодемьянская, Алёна Долецкая, Михаил Фрадков, Михаил Прохоров, Ксения Собчак и др..,1
Руководители органов внутренних дел республики c 1920 года по наст. время//21.мвд.рф,1
Также действуют предприятия, представляющие сферы бытового обслуживания, торговли, общественного питания, автосалоны «БМВ», «Изар-авто», «Тойота» и др. [1].,1
Василий Яковлевич Арсенин (24 апреля 1915, Еросимово, Клинский уезд, моск. губерния, рос. империя — 20 апреля 1990, м., сов. Союз) — сов. математик, д. фм. н. (18 дек. 1970), профессор, чл.-корр. АН СССР, лауреат Государственной премии СССР в области техники (1984).,1
Характерные черты стадионного хауса KLF — семплированный шум толпы, а также использование в разных песнях одних и тех же узнаваемых вокальных семплов — впосл. использовали др. группы начала 90-х, напр., Utah Saints, N-Joi и Messiah.,1
В глубине души мне хотелось сделать карьеру успешного артиста, а Билла всегда интересовали др., странные вещи.,1
Высказывались и др., скептические точки зрения — обозреватель Trouser Press Айра Роббинс называл творч. KLF «серией ярких музыкальных маркетинговых экспериментов».,1
Один из них дожил до наст. времени и находится у Джеймса Фогерти, основавшего вместе с Коти арт-группу Blacksmoke.,1
Профессор, д. фм. н..,1
После начала в 1973 г Войны Судного дня, Саудовская Аравия, Ливия и др. арабские гос-ва, объявили эмбарго на поставку нефти в страны которые поддерживали Израиль, в первую очередь — в Соединённые Штаты Америки.,1
Семейство муравьёв включает по разным оценкам от 5 до 6 вымерших подсемейств (Armaniinae, Formiciinae, Haidomyrmecinae, Sphecomyrminae и др.), 5 вымерших триб, 121 вымерший род, ок. 600 вымерших видов.,1
Как и др. насекомые, муравьи имеют экзоскелет — наружную хитиновую оболочку, к-рый обеспечивает поддержку и защиту тела.,1
Крупные семьи состоят в основном из бесплодных бескрылых самок, формирующих касты рабочих, солдат или др. специализированные группы.,1
Как и др. насекомые, муравьи воспринимают запахи своими длинными и тонкими усиками.,1
В случае опасности рабочий сокращением мышц разрывает брюшко и разбрызгивает секрет железы, содержащий ацетофенон и др. химические вещества, которые склеивают врага.,1
насекомые и др. беспозвоночные — 33 %,,1
Так, тли и др. членистохоботные насекомые выделяют сладкую жидкость, называемую падью, когда они питаются соком растений.,1
Чёрные муравьи собирают и хранят их и др. семена в своём гнезде, откуда люди могут собирать семена.,1
Муравьи также упоминаются в религиозных текстах, вкл. Библию (кн. притчей Соломоновых), Коран и др..,1
В станице Кочетовская писатель создал такие свои произведения как: «Матерь человеческая», «Плавучая стан.», «Сотворение мира», «Мать сыра земля», «Цвет лазоревый» и др..,1
Отец — инженер-авиаконструктор Владимир Яковлевич Леонтьев, мать — преподаватель статистики Московского института народного хозяйства им. Плеханова, соавтор учебника «Статистика торговли» Мира Моисеевна Леонтьева (род. 1926), к. э. н..,1
В июне 2009 года вместе с «Первым каналом» стал учредителем журнала «Однако», в котором помимо Леонтьева публикуются Евгений Додолев и Александр Невзоров и др. журналисты и колумнисты, ранее работавшие в «Профиле».,1
В наст. время сказочные шахматы — обязательный раздел в командных чемпионатах мира и России по шахматной композиции.,1
В виленской типографии Кухты до Первой мир. войны было отпечатано св. 300 литовских книг и брошюр, здесь же печатались литовские периодические издания „Balsas“, „Lietuvis“, „Lietuvos aidas“ («Летувос айдас»), „Lietuvos žinios“, „Viltis“ («Вильтис») и др. газеты, а также журналы.,1
анс. осуществил премьерные исполнения многих сочинений, среди которых камерная опера «Gespenstersonate» (Берлин, 1984) А. Раймана, кантата «Andere Schatten» (1985) и др. сочинения В. Рима, оратория «Symeon der Stylit» (1988) Э. Кшенека, Двойной концерт для фортепиано и виолончели с оркестром Д. Куртага (1990), «Zwei Gefühle…» (1992) Х. Лахенмана, 2-я версия Реквиема (1993) и опера «Федра» (Берлин, 2007) Х. В. Хенце, видеоопера «Three tales» (Вена, 2002) С. Райха, «Chronos-Aios» Б. Фёрнихоу (2008), «Gougalön» Чин Ынсук (2009), «Lunea» (версия для баритона с ансамблем, 2014) Х. Холлигера, опера «зол. дракон» П. Этвёша (Франкфурт, 2014).,1
Его обвинили в слабоволии и те и др..,1
В наст. время[когда?] встречается очень редко не только на родине, но и за её пределами.,1
В наст. время порода очень редкая.,1
