abbreviation,encounters
Два лидера обсуждали такие вопр., как разделение власти, вооружённые силы, собственность на землю и др. проблемы, которые могут возникнуть в случае воссоединения острова.,1
род. 24 февраля 1815 года в Хайбери, Мидлсекс (в наст. время Лондон), был единственным сыном Энея Баркли, вест-Индского торговца.,1
Ещё одной темой творчества Виталия Шанова являются «пруды» – декоративные композиции, в которых сочетаются стебли, листья и цветы водных растений, легкокрылые стрекозы, жуки и др. обитатели прудов и источников.,1
Основатель компании, её през. и генеральный дир. Аджай Вирмани в июле 2001 года приобрёл 50 % собственности подразделения у авиакомпании Canada 3000, а в феврале 2002 года — выкупил оставшиеся 50 %, после чего 21 февраля назв. перевозчика было изменено на действующее в наст. время Cargojet Airways.,1
В наст. время агентством Роскосмос заключены межправительственные соглашения о сотрудничестве в космической деятельности с 19-ю странами; среди них США, Япония, Индия, Бразилия, Швеция, Аргентина и страны, входящие в европ. космическое агентство (ЕКА),1
В те времена являлось производственным звеном и разработчиком порошков, отбеливателей, чистящих средств и иной продукции, вплоть до запатентованных уникальных составов, патенты на которые являются засекреченными до наст. времени.,1
В наст. время является действующим предприятием, занимается производством бытовой химии.,1
Также в состав руководителей общества входили А. Г. Воскресенский, А. Н. Моригеровский и др..,1
Под теорией финансов подразумеваются теории арбитражного ценообразования, структуры капитала, портфельная теория, теория ценообразования финансовых активов, опционов и др. теории, основанные Г. Марковицем, У. Шарпом, Р. Мертоном, Ф. Модильяни, М. Миллером, Дж. Тобином, Ф. Блэком, М. Шоулзом и др.,1
Такая трактовка финансов отражает начальную стадию развития западной финансовой науки и в наст. время утратила свою актуальность.,1
У вида Hospitalitermes hospitalis шир. колонн 2—3 см (до 8 термитов в ряд), они уходят от гнезда в среднем на 29 м (максимально — до 65 м), посещая соседние деревья и собирая лишайники, мхи, грибы и др. микроэпифиты.,1
В качестве научного руководителя выступил д. т. н., профессор B.C. Лисин, владелец НЛМК.,1
2013 — по наст. время — независимый неисполнительный дир. Совета директоров компании «Металлоиинвест».,1
Среди заметных работ актрисы в кино — роли в фильмах «Фокусники» (2007), «Беззаботная» (2008), «Не отпускай меня» (2010), «Сделано в Дагенхэме» (2010), «Брайтонский леденец» (2010), «МЫ. Верим в любовь» (2011), «Сопротивление» (2011) и др..,1
и др. кино- и телеадаптации.,1
В 1951—1954 гг. аспирант ЛОИИ АН СССР, к. и. н. (1954).,1
За отличия в боях стал полным Георгиевским кавалером (до наст. времени сохранились документы только о награждении Георгиевским крестом III степени за подвиг в бою 16 июля 1917 года).,1
Согласно хроникам династии Цин, нанайцы, нивхи, айны и др. народности, проживавшие на обширных землях нижнего течения рек Амур и Уссури (а также по материковому побережью Японского моря и острова Сахалин) находились под административным контролем канцелярии Саньсинского фудутуна (помощника генерал-губернатора) и рассматривались в качестве "внутренних вассалов".,1
В русской версии героя Джеймса Макавоя озвучивал Сергей Безруков, также в озвучивании принимали участие Гоша Куценко (Мистер Икс), Галина Тюнина (Фокс), Валерий Золотухин (Пекварски), Иван Ургант (Барри), Анатолий Максимов (Слоун), Мария Аронова (Дженис) и др..,1
Однако Барабак далее заявляет, что «учёные Белого дома и др. исследователи правительства согласны с тем, что никогда не было такого президента, как Дональд Трамп, чей объём лжи, искажений и серийных преувеличений» не имеет себе равных.,1
В наст. время (2021 г.) Георгий Иванович Пашков — предс. Московской гор. общественной организации пенсионеров, ветеранов войны, труда, Вооружённых Сил и правоохранительных органов ( моск. гор. Совет ветеранов, МГСВ).,1
Air France выпустила пресс-релиз, в котором сообщалось, что в наст. время ведётся расследование для определения причин отказа двигателя, в котором участвуют представители Бюро по расследованию и анализу безопасности гражданской авиации (BEA), компании «Airbus» и авиакомпании Air France.,1
Город Пятигорск находится в активной сейсмической зоне по причине близости к Главному Кавказскому хребту, в окружении гор (Машук, Бештау и др.), образовавшихся в процессе вулканической деятельности горы Эльбрус.,1
В наст. время официальным и основным языком города является рус..,1
В 1970-е гг. ковры фабрики экспонировались не только на выставках СССР, но и в Англии, Брюсселе, Индии, а с 1964 года поставлялись в ФРГ, Бельгию, Швейцарию и др..,1
В наст. время на Кавказских Минеральных Водах с лечебной целью используются св. 100 источников [130 — 2003 г.] (12)13 различных типов лечебных натуральных вод сложного химического состава (треть из которых изливаются на поверхность земли из недр горы Машук).,1
До недавнего времени вода источника № 20 широко применялась при различных болезнях органов пищеварения (кроме заболеваний печени, ввиду большого содержания сероводорода), однако в 1988 г самоизлив этой воды прекратился и для питьевого лечения в наст. время используются только воды источников № 2 и № 16.,1
В наст. время экспозиции музея располагаются в помещениях Пятигорского краеведческого музея;,1
Собственными библиотеками располагают и др. учреждения культуры, напр., Пятигорский краеведч. музей, музей-заповедник М. Ю. Лермонтова, а также мн. лечебно-профилактические учреждения города-курорта.,1
Центром заповедника стал старейший в Пятигорске гор. квартал — Лермонтовский квартал, внутри которого находится «домик Лермонтова», дом Верзилиных, дом Уманова и др. исторические постройки.,1
В галерее выступали мн. известные люди, в т. числе Шаляпин, Ермолова, Собинов, Маяковский, М. Балакирев и др..,1
В наст. время пл. парка 22,8 гектара, на которых расположены концертный зал «Камертон», кафе, стадион « центр.» («Труд»), теннисные корты, планетарий, различные аттракционы, оз. с лодочной станцией, контактный зоопарк.,1
В наст. время одно из мест, пользующееся популярностью у неформальных молодёжных движений,1
В наст. время находится в неудовлетворительном состоянии: пережило пожар, обвалилась лестница у центрального входа, нет крыши, в окнах нет стёкол.,1
В наст. время оз. является крупнейшим на Кавминводах разрешённым местом для купания.,1
В наст. время проводные радиосети практически перестали существовать.,1
В наст. время установлено существование непочтовых марок Пятигорска двух номиналов.,1
Дьяков, Анатолий Фёдорович (1936—2015) — рос. энергетик, д. т. н., министр топлива и энергетики РСФСР (1991);,1
Казначеев, Виктор Алексеевич (1935—2010) — д. и. н., профессор, акад., през. Пятигорского государственного технологического университета, предс. Совета ректоров Ставропольского края, действит. чл. трёх международных академий;,1
Калинский, Игорь Васильевич (1949—2009) — к. э. н., засл. работник торговли РФ, предприниматель, зам. главы Пятигорска (1998—2005);,1
Предприятие «Донрыба» и др..,1
Его произведения переведены на англ, исп., кит., франц., нем., сербский, хинди, польск., бангла, укр., португальский, турецкий, азерб., перc., туркменский, киргизский и др. языки.,1
Произведения Абдукаххора Косим переводили Атанас Ванчев де Траси, Резауддин Сталин, Тсай Дземин, Сергей Дзюба, Сантош Кумар Покхарел, Даяна Лазаревич, Генрих Дик, Ораз Мырадов, Мусакун Сатыбалдиев и др..,1
Как на начальных этапах, так и в наст. время главной задачей украинской общины является информационно — просветительская работа.,1
мин-во образования и науки Украины; Палеха Ю. И., рецензенты — д. ф. н. профессор Герасимчук А. А. (Польша) и доктор политических наук профессор Онищенко И. Г. (Украина), изд-во «Кондор», г. Киев, 2008 г. — 356 с. ISBN 978-966-351-061-3,1
На заре индустрии ламп их изготавливали с вакууммированными колбами; в наст. время только лампы малой мощности (для ламп общего назначения — до 25 Вт) изготавливают в вакуумированной колбе.,1
В наст. время вытесняются светодиодами;,1
В наст. время (XXI в.) практически вышли из употребления благодаря появлению более долговечных устройств сравнимой и более высокой эффективности.,1
В связи с необходимостью экономии электроэнергии и сокращения выброса углекислого газа в атмосферу во многих странах введён или планируется к вводу запрет на произ-во, закупку и импорт ламп накаливания с целью вынуждения замены их на энергосберегающие (компактные люминесцентные, светодиодные, индукционные и др.) лампы.,1
С 2009 года запрещены лампы мощностью 100 Вт и более, лампы с матовой колбой 75 Вт и более (с 1 сентября 2010 года) и др..,1
На всех пациентов стали заводить «скорбные листы» (историю болезни), впервые были введены рецептурная кн., должностные инструкции для персонала и др. документы, а также создана система труда, быта и отдыха больных.,1
В наст. время медицинское учреждение обслуживает жителей преимущественно Восточного и Центрального административных округов Москвы.,1
В наст. время хранится в музее герцога Антона Ульриха в Брауншвейге (Германия).,1
Её работа над «Анатомией страсти» принесла ей номинацию на Прайм-таймовую премию «Эмми» (она и др. члены съёмочной группы номинировались в 2006 и 2007 года в категории «Лучший драм. сериал») и Премию Гильдии сценаристов США (победа в категории «Лучший сценарий нового сериала»).,1
После внедрения эта вредоносная программа запрещала запуск и прекращала деятельность 156 программ различного рода, среди которых — ред. реестра, командная строка, Internet Explorer, Mozilla Firefox, Opera, Safari, Google Chrome и др. веб-браузеры, почтовые клиенты, клиенты мгновенных сообщений, медиапроигрыватели и некоторые развлекательные приложения.,1
При этом Груздев добавляет в примечании: «Алексей Максимович здесь неточен: „Девушка и Смерть“ была напечатана в 1917 г в газете „Новая жизнь“, а затем в 1918 г вошла в сб. „Ералаш и др. рассказы“».,1
Наряду с пропагандой новейшей французской музыки (Камиль Сен-Санс, Эдуар Лало, Венсан д’Энди и др.) во главе своего оркестра Ламурё на протяжении многих лет знакомил парижан с творчеством Рихарда Вагнера: в 1887 г под управлением Ламурё прозвучал «Лоэнгрин» (состоялось только первое исполнение, последующие были отменены из-за политического давления), а незадолго до смерти Ламурё дирижировал французской премьерой «Тристана и Изольды».,1
Среди её самых известных фильмов выделяются «Опасные связи» 1988 года, «Лжец, лжец» 1997, «Яркие огни, б. город» и др..,1
