abbreviation,encounters
В наст. время Президентом МКТС является В. И. Шадрин.,2
Volkswagen Passat (paˈsat) — семейство среднеразмерных автомобилей компании Volkswagen, производящееся с 1973 по наст. время.,2
За дополнительную плату на CL иногда ставили электропакет и др. опции, однако комплектация г от года дополнялась разными опциями.,2
Далее следовали более дорогие комплектации, такие как «Comfortline», «Highline» и др..,2
Чемпиона́т Росси́и по хокке́ю с ша́йбой разыгрывается с 1992 года по наст. время, в сезонах 1992/93—1995/96 в рамках Высшей лиги, в сезонах 1996/97—2007/08 — в Суперлиге, в сезонах 2008/09—2023/24 — в рамках Континентальной хоккейной лиги (КХЛ), с сезона 2024/25 — в рамках Всероссийской хоккейной лиги (ВХЛ).,1
Эти птицы живут вдоль заболоченных территорий, где их добычей становится рыба, лягушки и др. водные животные.,1
В наст. время она выпускает только грузовики.,1
Ожив после смертельной раны и будучи изгнанным из своей деревни, Маклауд находит воина Хуана Рамиреса (Коннери), к-рый объясняет, что они и др. родились бессмертными, непобедимыми, пока их не обезглавят.,1
Влади́мир Абдула́евич Дадали́ (род. 18 дек. 1937, Николаев, Николаевская область, УССР, СССР) — биохимик, д. х. н., профессор кафедры биологической и общей химии им. В. В. Соколовского (ныне кафедра клинической лабораторной диагностики, биохимии и общей химии) ФГБОУ ВО «Северо-Западный гос. медицинский ун-т им. И. И. Мечникова.,1
В наст. время занимается разработкой рецептур природных композиций, относящихся к биологически активным добавкам (БАД) , и внедряет их в практику здравоохранения.,1
При активной поддержке профессора В. А. Дадали на кафедре создан межрегиональный центр (инновационный) центр «Адаптоген» во главе с профессором В. Г. Макаровым (в наст. время ин-т фармакологии), в котором развёрнута научно-исследовательская работа в области теории и практики использования природных веществ, разработки и внедрения БАД и лекарственных препаратов на основе природного сырья.,1
Он является одним из самых популярных артистов в Таиланде и в наст. время является послом брендов Burberry и Calvin Klein.,1
Ге́рман Алексе́евич Барано́вский (15 августа 1926, Каменец-Подольский — 16 марта 2007) — сов. специалист в области радиосвязи, к. т. н. (1980), лауреат Государственной премии СССР.,1
Государственные награды СССР за производственные достижения и участие в войне — пять орденов, медаль «За отвагу» и др. медали.,1
В наст. время она проживает в калифорнийском городе Лос-Фелис с дочерью Катариной (род. 2000) и бойфрендом.,1
Ге́рман Ви́кторович Ермако́в (3 июня 1938, Пермь, Свердловская область — 10 июня 2012, Екатеринбург) — сов. и рос. учёный и педагог в области молекулярной физики, д. фм. н. (1989), профессор (1993).,1
науч. поиск признаков жизни начался в XIX веке и продолжается по наст. время.,1
Кроме того, поверхность Марса в наст. время исследует два марсохода — «Кьюриосити» и «Персеверанс».,1
Наблюдения в течение последних десятилетий позволили обнаружить в некоторых местах поверхности Марса признаки возможной гидрологической активности и в наст. время.,1
Характер рельефа и др. признаки позволяют предположить наличие астеносферы, состоящей из зон частично расплавленного вещества.,1
В наст. время условием для развития и поддержания жизни на планете считается наличие жидкой воды на её поверхности, а также нахождение орбиты планеты в так называемой зоне обитаемости, к-рый в Солнечной системе начинается за орбитой Венеры и заканчивается б. полуосью орбиты Марса.,1
Однако в наст. время крайне высокая стоимость доставки колонистов и грузов на Марс является основным ограничивающим фактором для потенциальной колонизации.,1
Земля, как и др. планеты, будет наблюдаться в полосе созвездий Зодиака.,1
С тех пор на марсианских картах значатся Эллада, Авзония, Фарсида, Земля Ноя, Земля Сирен и др..,1
Этого принципа именования в дальнейшем придерживались и др. астрономы.,1
Более того, «Договор о принципах деятельности государств по исследованию и использованию космического пространства», подписанный 133 странами, гласит, что космическое пространство, вкл. Луну и др. небесные тела, не подлежит национальному присвоению ни путём провозглашения на них суверенитета, ни путём использования или оккупации, ни любыми другими средствами, а гос-ва несут ответственность за национальную деятельность в космическом пространстве, вкл. небесные тела, и в т. случае, когда она осуществляется неправительственными юридическими лицами.,1
Галина Васильевна Максимова (род. 1948) ― сов. и рос. учёный-экономист, профессор, первый д. э. н. в Восточной Сибири и на Дальнем Востоке в области бухгалтерского учёта, анализа и аудита.,1
Согласно закону 2008 года о резервистской службе, солдаты обязаны к резервистской службе до 40 лет (женщины — до 38), боевые офицеры — до 42, а некоторые оговоренные специальности (врачи, техники, водители тяжёлого транспорта и др.) — до 49.,1
Существуют ночные поезда в Тируванантапурам и оттуда в Ченнай и др. города Индии.,1
Уже 6 августа 1949 года решением пленума Крымского обкома, к-рый начал второй секр. В. И. Никаноров, а фактически вёл прилетевший из Москвы А. Л. Дедов, М. И. Петровский и др. были выведены из состава обкома, позднее он исключён из ВКП(б), арестован 22 сентября 1949 года.,1
Так, относящие себя к католицизму старокатолики и др. группы, называющие себя «католическими», не признаются таковыми Католической церковью, поскольку основной признак католицизма — в признании папы римского главою церкви.,1
Также, такое деление совершенно не учитывает противников тринитарной концепции среди христиан, к числу которых из действующих религиозных организаций относятся, в частности, филиппинская Церковь Христа (действует в международном масштабе), Унитарианская церковь Трансильвании и иные организации, придерживающиеся унитарианства, а также Свидетели Иеговы, Церковь Иисуса Христа Святых последних дней и др..,1
Также Джон Браун отметил изменения Эванса в следующей постановке «Святая Иоанна»: «В эти вечера трудно поверить, что тот же самый актёр, к-рый в наст. время даёт такое богатое комическое представление в роли Дофина, совсем недавно был представлен на той же самой сцене в роли необычайно успешного Ромео.,1
В наст. время это поражение считается необратимым, а восстановление двигательной активности происходит за счёт образования новых синаптических связей.,1
Мед, кукурузный сироп и др. сладкие продукты могут содержать споры, но они не могут расти в высококонцентрированном растворе сахара.,1
Штатных антидотов и средств профилактики в наст. время не существует.,1
Здание, получившее в 1997 г статус памятника культуры, может похвастаться центром современной культуры им. Стивена Двека — залом на 189 мест, в котором с 2007 года проводятся лекции, чтения, музыкальные представления и др. мероприятия для всех возрастных групп.,1
В наст. время она считается наиб. выдающимся зданием в стиле ар-деко.,1
Среди авторов журнала были гроссмейстеры М. Ботвинник, М. Чибурданидзе, М. Таль, Игорь Зайцев, Николай Крогиус, Я. Эльвест, В. Салов, А. Белявский, Л. Полугаевский, Э. Гуфельд, С. Макарычев, Н. Александрия, а также М. Филип (ЧССР), А. Адорьян (Венгрия), А. Матанович (Югославия), Я. Тимман (Нидерланды), Р. Кин (Англия) и др..,1
Второй дворец с таким же названием был построен неподалеку и сохранился до наст. времени.,1
Вольфрам Флейшгауэр «Пурпурная линия» и др..,1
Среди его учеников Ромуалдас Чарна, Дангуоле Даукните и др..,1
Эта страна получила своё имя от тирийской Европы (раньше ведь она была безымянной, как и др. части света).,1
В наст. время (2009 г) является основной ракетой воздушного боя используемой ВВС Китайской Республики, наряду с ракетой Тяньцзянь-2 (англ. Sky Sword II) радиолокационного наведения.,1
Перес в наст. время держит рекорд МЛБ по количеству хоумранов за один сезон в качестве основного кетчера (46), превосходя Джонни Бенча, к-рый выбил 45 в сезоне 1970 года.,1
Сайт был основан в 2005 г Джеком О’Брайеном и в наст. время принадлежит E. W. Scripps Company.,1
Cracked.com выпустил свою первую книгу «Вы, возможно, зомби, и др. плохие новости» в 2010 г, изданную Plume.,1
В наст. время жидкое стекло получают обработкой в автоклаве кремнезёмсодержащего сырья концентрированными растворами едкого натра или сплавлением кварцевого песка с содой.,1
Известны также способы получения жидкого стекла, основанные на прямом растворении кремнистого сырья (опоки, трепелы, диатомиты и др.) в растворах щелочей при атмосферном давлении и относительно невысокой температуре (температура кипения раствора щелочи).,1
Можно привести и др. примеры.,1
Общая численность балкарцев в наст. время составляет ок. 135 тыс. чел. (2021, оценка).,1
В наст. время манускрипт находится в библиотеке св. Марка в Венеции (Cod. Mar. Lat. DXLIX).,1
В наст. время самым распространённым видом монтажа клинка в рукоять является способ, когда ставится заклёпка, «высшим пилотажем» считается спрятать заклёпку под крылышками оковки-«ошейника» (боюнлука).,1
В наст. время современные варианты ножа бичак серийно выпускаются на дагестанском оружейном заводе «Кизляр» и народными мастерами Балкарии и Карачая.,1
Характерны календарные и др. праздники, военизированные спортивные игры.,1
Разнообразен фольклор — нартский эпос, обрядовые, трудовые, героические и др. песни, благопожелания и прочее.,1
В наст. время большинство балкарцев относят себя к мусульманам-суннитам мазхаба Абу Ханифа.,1
Тем не менее, в наст. время экономический мейнстрим включает в себя описательные теории рынка и государственных неудач, а также частных и общественных благ.,1
В наст. время орг-ция представлена рядом независимых экспертов, продолжающих вести свою деятельность вне России.,1
В 2008-м Правозащитный центр «Мемориал» запустил программу «Поддержка политзаключенных и других жертв политических репрессий», в рамках которой оказывается помощь людям, которых в наст. время преследуют по политическим мотивам.,1
Андрей Жуков, сост. базы, в течение 15 лет работал в архивах, анализировал кадровые приказы НКВД, докл. о наградах президиума Верховного совета СССР и др. источники.,1
Среди прочих проектов «ММ»: «Личное дело каждого» (помогает искать архивные сведения о репрессированных), «Последние свидетели» (видеоинтервью с историями жертв политического террора), «Их защищал Сахаров» (колл. текстов и материалов правозащитной деятельности академика Сахарова) и др..,1
К актам давления на «Мемориал» также относятся преследование участников и организаторов детского исторического конкурса, DDoS-атаки сайтов различных проектов, отказ в проведении акции «Возвращение имён» на привычном месте — у Соловецкого камня на Лубянской площади — в 2018 г, срыв кинопоказа фильма о «Голодоморе» в центре Москвы в октябре 2021 и др. подобные случаи.,1
В 2017 г откр. письмо в защиту Дмитриева подписали 89 российских писателей, журналистов и гражданских активистов, в их числе — Борис Вишневский, Григорий Кружков, Людмила Улицкая и др..,1
С августа 1982 года семейство включало бетономешалки, мусоровозы, автоцистерны, рефрижераторы, автокраны, пожарные автомобили и др. типы.,1
Малярия, тифоидная лихорадка (брюшной тиф), менингит и др. инфекционные заболевания могут напоминать лихорадку Эбола.,1
Частота кровотечений в желудочно-кишечном тракте уменьшилась за последние гг. и в наст. время оценивается приблизительно в 10 %, что связано с улучшенной профилактикой ДВС-синдрома (внутрисосудистой коагуляции).,1
До кровоточащей фазы клинические симптомы болезни похожи на лихорадку Марбург, малярию и др. тропические лихорадки.,1
Предположительно, как и др. виды рода Heterospilus, паразитируют на жуках или бабочках.,1
Предложенная Шевченко концепция настолько впечатлила его коллег, что через неск. дней по рекомендации одного из них макет осмотрел лично нарком обороны Клим Ворошилов, начальник ВВС А.Локтионов, нарком авиационной промышленности М.Каганович и др. важные персоны советского руководства.,1
Бори́с Никола́евич Голо́вкин (22 августа 1934, м. — 22 сентября 2011) — сов. и рос. ботаник, популяризатор науки, д. б. н., профессор.,1
Брат — Александр Николаевич Головкин (1938—2001) — биолог, гидрохимик, д. б. н., сотр. КНЦ РАН.,1
Во время войны погибли ок. 407 тыс. жителей Боснии и Герцеговины, мн. населённые пункты были почти полностью уничтожены, в т. числе города Босанска-Крупа, Ключ, Гламоч, Вишеград, Бихач, Босански-Брод и др..,1
Босния и Герцеговина экспортирует вооружения (в Малайзию, Саудовскую Аравию и др. страны), в 2014 г объём экспорта продукции военной промышленности составил 93,8 млн конвертируемых марок.,1
Основные сельскохозяйственные культуры: фрукты (яблоки, сливы, груши, черешня, персики и др.), зерновые, технические культуры (рапс, соя, табак), овощи (капуста, томаты, лук, красный перец, морковь, огурцы и др.), картофель.,1
По данным на янв. 2016 года в стране выходило 10 ежедневных газет, ведущие из которых: «Oslobođenje» и «Дневни аваз» с редакцией в Сараеве, «Независне новине» и «Глас Српске» с редакциями в Баня-Луке, Dnevni list с редакцией в Мостаре, «Вечерние новости» с редакцией в Белграде и др.; 59 журналов в Федерации БиГ, в т. числе сараевские издания «Слободна Босна» и BH Dani, и 48 в Республике Сербской; 8 новостных агентств, в т. числе СРНА с редакцией в Биелине.,1
С 1950-х годов до наст. времени песни, в которых звучат народные мотивы, исполняла С. Арменулич, продолжают исполнять Х. Балшич, Х. Джинович, Х. Палдум.,1
В начале XXI вв. сняты фильмы «Ничья земля» (2001 г), «Дни и часы» (2004 г) и др..,1
К древнейшим памятникам XIV—XV веков относятся Дивошево евангелие, Хвалов сб. и др..,1
В XVII—XVIII веках францисканскими монахами-хорватами создавалась лит-ра религиозного и исторического характера, среди которых Матия Дивкович, Степан Маргитич и др..,1
Среди футбольных клубов страны: «Железничар» в Сараеве, «Борац», «Зриньски» в Мостаре и др..,1
Участие в международных соревнованиях по другим видам спорта принимают сборные страны по баскетболу — мужская и жен., сборные по волейболу — мужская и жен., сборная по регби, сборная по хоккею с шайбой, сборная по шахматам и др..,1
В 1995 г при поддержке местной администрации в станице начали возрождать казачество у истоков стояли предс. Каневского районного Совета Российской оборонно спортивно-технической организации (ДОСААФ) А.Кузьменко, дир. местной школы № 10 А.Мурый, жители станицы Придорожной В.Стыцюра, Д.Кощиенко, Н.Епешев и др..,1
Для более эффективной работы на ферме игрок должен покупать оборудование (трактор, комбайн, грузовик и др.).,1
В наст. время симметричные шифры — это:,1
