abbreviation,encounters
В наст. время имя М.В. Басина носит одна из улиц в Черикове.,1
Проходил производственную практику в первой художественно-керамической лаборатории, существовавшей при музее керамики в Москве (в наст. время — ГМК «Кусково»).,1
В это время появляются «Лиса и орел» (1933 г.), «Орел и змея» (1934 г.), «Лань и борзая» (1934 г.) и др..,1
1996—2020 — Владимир Иванович Плужников (1938—2020), к. иск., профессор Академии реставраций, действит. чл. Академии архитектурного наследия, лауреат премии Правительства Российской Федерации.,1
В наст. время работает журналистом в «Спортивной Якутии» и продолжает выступления в турнирах шашистов.,1
Там он устроился на работу в небольшое изд-во, пытаясь продавать свои рис. в газеты и др. печатные изд., но с малым успехом.,1
Среди них: Скрудж Макдак, самый богатый селезень в мире; Глэдстоун Гусак, невероятно счастливый кузен Дональда; бр. Гавс, незадачливые преступники; Флинтхарт Гломгольд, гл. конкурент Скруджа; колдунья Магика де Гипноз и др..,1
Художниками были и др. члены семьи.,1
Извержения вулкана наблюдались с 1835 года, до наст. времени вулкан давал о себе знать ок. десятка раз.,1
В результате в центре города возник новый микрорайон, вдвое увеличился объём жилья в поселке 5-я Пятилетка, были построены санаторий-профилакторий, поликлиника, четыре детских сада, Дом культуры «Ровесник», пионерский лагерь, две базы отдыха на Чёрном м. и др. объекты.,1
В наст. время епархией управляет епископ Жан-Поль-Морис Жажер.,1
Некоторые фабрики, самая изв. из которых — Todd Pacific Shipyards, предлагали обучающие курсы и создавали др. стимулы.,1
Американцы итальянского происхождения и др. вернулись в «старый р-н» для торговли деликатесами.,1
Как и др. манакиновые, синеспинный красноногий манакин — плотная, яркая лесная птица, как правило 13 см в длину и весом 19 г.,1
В августе 2008 года Мэрайя Кэри и др. артисты записали благотворит. сингл «Just Stand Up» под руководством Бэбифейса и Эл Эй Рида, в поддержку акции «Противостояние раку».,1
Лавров А. В. Символисты и др..,1
илл. была создана в 1891 г и в наст. время хранится в Государственной Третьяковской галерее в Москве.,1
Имение Здзеховских в XIX веке было крупным культурным центром, где бывали Э. Ожешко, именовавшая Раков «литовскими Афинами», и др..,1
В наст. время в Красный список угрожаемых видов МСОП (The IUCN Red List of Threatened Species) занесено 239 редких и исчезающих видов стрекающих, из них 204 вида — уязвимые, 28 видов — вымирающие и 7 видов — находящиеся на грани исчезновения.,1
науч. консультант — д. фил. н., профессор С. И. Тимина.,1
Официальные оппоненты — д. фил. н., профессор А. В. Блюм, д. фил. н. О. В. Богданова и д. фил. н., профессор А. В. Чернов.,1
«Крусейдер» и др..,1
Известны также просуществовавшая до 1922 года в местности реки Гилюй «вольно-старательская малина», «Олёкминская Калифорния» в Олёкминском округе и др. образования на Среднем Витиме, Зее, Охотском побережье, Чукотке и в Северном Китае.,1
В наст. время шоу «Закон и порядок: Специальный корпус» принадлежит рекорд, как самому длительному сериалу, к-рый ещё транслируется в эфире.,1
Робин Уильямс был номинирован на «Эмми» в 2008 г, также как и Марша Гэй Харден, Джейн Александр, Анджела Лэнсбери, Кэрол Барнетт и др..,1
Синтия Никсон, Аманда Пламмер, Энн-Маргрет и др. стали лауреатами премии в разные гг. в категории «Лучшая приглашенная актриса в драме».,1
В наст. время — дир. Музея современного искусства в Лос-Анджелесе.,1
Тойонага в интервью журналу Official Nintendo Magazine заметила, что: «Марио и др. персонажи Nintendo довольно-таки коротышки.,1
Большое число выпусков серии Need for Speed (Most Wanted, Carbon, Rivals, 2015 и др.),1
На территории скита в конце XX вв. проживали престарелые священнослужители — протоиерей Михаил Фирсовский из Гренобля, архимандрит Авраамий (Терешкевич) из Розе, приехавший из Китая протоиерей Александр Трофимов и др..,1
При его участии были изданы на узбекском языке произведения А. С. Пушкина («Сказка о рыбаке и рыбке»), Л. Н. Толстого («Чем люди живы»), брошюры «Краткая история древнего Египта», «Жизнь Колумба», «О пользе наук», «Рассказы из физической географии», « географич. карта всех частей света» и др. книги.,1
Этот перевод в «Оксфордском путеводителе по переводной литературе на английском языке» (2000) был назван лучшим в наст. время.,1
Во время Второй мир. войны компании по призыву правительства Соединённых Штатов стали производить армейские снаряды, алюминиевые бочки для продуктового транспорта и др. военные резиновые потребности.,1
В местных изданиях напечатал до 50 статей по церковной истории, археологии, библиографии и др..,1
Кияковой Деляфруз Жунусовной созданы казахские эстрадные и народные танцы: «Золотая домбра», «Кыздар-ай», «Сарбазы», « Куаныш», «Кос алка», «Ак бидай», «Акку», «Хрустальные статуэтки» и др..,1
Бренды «Boddingtons» в наст. время принадлежат международной пивоваренной компании «Anheuser-Busch InBev», к-рый в 2000 г приобрела компанию «Whitbread Beer Company».,1
Вы должны сознавать, что сильное давление, к-рый в наст. время оказывается на производителей, будет приводить к уничтожению индивидуальности и характерных особенностей многих потребительских товаров.,1
Однако вы в наст. время являетесь акционером одной из ещё остающихся независимых пивоваренных компаний, чье традиц. бочковое пиво имеет репутацию, полученную в награду за качество и индивид. характер продукта, в т. числе и за пределами северной части Англии, в которой мы работаем.,1
В сентябре 2004 года владельцы (в наст. время известны как "InBev") объявили о своих планах закрыть пивоварню "Strangeways" и переместить основную ч. производства из Манчестера в Магог, юж. Уэльс, и Самлсбери, Ланкашир, с сокращением 60 рабочих мест.[57],1
Майк Томпсон, быв. рабочий пивоварни, являющийся в наст. время представителем профсоюза разнорабочих и работников транспорта, сказал:,1
В наст. время орден славы 1 степени находится в США.,1
Появлялись организации, партии и движения, провозглашавшие целью освобождение народа: в XIX веке — нар. расправа, нар. воля, анархисты и др., в начале XX вв. — Партия народной свободы, Партия народных социалистов и др..,1
В наст. время в деревне нет ни одной улицы.,1
С ноября 1948 по дек. 1971 года возглавлял колхоз «Ошхамахо», добившись серьёзных преобразований и достижений в развитии не только экономической, но и социальной сферы (были построены дом культуры, школа, дет. сад, сельский водопровод и др. объекты производственного и культурно-бытового назначения).,1
В составе «Балхашбалык»: 2 рыбных завода, 1 рыболовецкая база, 3 холодильных, коптильный, консервный, жиромучной и др. цеха.,1
Затем с князем Витольдом спешил на коне король рим. Зигмунт, у которого был епископ краковский Збигнев, а тем временем трубы и др. различные инструменты звучали мощно.,1
Согласно сведениям из «Сборника летописей», теленгуты представляли собой одно из племён, «которых в наст. время называют монголами».,1
Он прошел по льду через Селенгу и др. реки, которые замерзли, и захватил [область] киргизов».,1
Именно с этого времени чиносы, теленгуты и др. племена из улуса Хорчи стали взаимодействовать с ойратскими племенами и оказались в составе ойратов-дербетов и позже калмыков-дербетов.,1
Её любимым фильмом была картина «Красные охранники на озере Хонлу» и, как вспоминала мама актрисы, девочка часто напевала строки из песни к киноленте, ровно как и др. фразы из понравившихся ей композиций.,1
Англо- амер. конвенция 1818 года определила границу между США и Великобританией (в наст. время эта граница сохраняется между США и Канадой) по 49-й параллели.,1
Возле промышленных предприятий строятся рабочие посёлки, которые очень быстро получают статус городов: Прокопьевск, Киселёвск, Осинники, Таштагол, Калтан, Междуреченск и др..,1
В муниципальной остались школы, больницы, поликлиники, основные объекты коммунального хозяйства, жилые дома и др. объекты соцкультбыта.,1
В недрах области обнаружены разнообразные полезные ископаемые: каменные и бурые угли, железные и полиметаллические руды, золото, фосфориты, строит. камень и др. минеральные ресурсы.,1
На территории области имеются аэродромы в Ленинске-Кузнецком (в наст. время не работает), Таштаголе, Междуреченске, Мариинске и Анжеро-Судженске.,1
В наст. время рос. компании наладили собств. произ-во фудтраков.,1
и др..,1
В КПЗ оказались Кари Унксова, Виктор Резунков, Андрей Изюмский, лидер группы «Россияне» Жора Ордановский и др..,1
ж. был быстро изъят КГБ, однако попал на з. и был сразу переведён на франц., затем португальский, япон. и др. языки.,1
Ахмеди Искакович Искаков (каз. Ахмеди Ысқақұлы Ысқақов; 19 ноября 1910, Абайский р-н, Семипалатинская область, Казахская ССР — 30 мая 1996, Алма-Ата, Казахстан) — сов. и казахский языковед-учёный, д. фил. н. (1965), профессор (1968), чл.-корр. АН Казахской ССР (1972).,1
Издается до наст. времени, с перерывами с 1918 по 1921 гг. и с 1941 по 1943 гг.,1
В наст. время ж. освещает такие вопр. :,1
Учредителями журнала «Электричество» в наст. время зарегистрированы рос. академия наук ( отд. энергетики, машиностроения, механики и процессов управления) и рос. научно-теоретическое об-во энергетиков и электротехников.,1
Секция электроэнергетики ( предс. секции — Строев, Владимир Андреевич, д. т. н., профессор),1
Секция техники высоких напряжений, электрических аппаратов, трансформаторов ( предс. секции — Белкин Г. С., д. т. н.),1
Секция электрических машин ( предс. секции — Беспалов В. Я., д. т. н., профессор),1
Секция электропривода и автоматизации технологических процессов ( предс. секции — Красовский А. Б., д. т. н., профессор),1
В Eunet входили европейские Интернет-пионеры: Теус Хаген, Даниэл Карренберг, Пит Беертема, Йохан Хельсингус и др..,1
К устному творчеству обращались мн. осетинские писатели, в т. числе Коста Хетагуров, Сека Гадиев, Александр Кубалов, Мисост Камбердиев и др..,1
Среди участников этой группы были Цомак Гадиев, Гино Бараков и др..,1
В ней активно участвовали Созруко Кулаев, Кудзаг Дзесов, Геор Кокиев, Сергей Джанаев и др. молодые писатели.,1
В Северной Осетии выходят литературные журналы: «Дарьял» (на русском языке), «Ираф» (на дигорском диалекте осетинского языка) и «Мах дуг» (на иронском диалекте осетинском языке) и др..,1
Гидроагрегаты изготовлены предприятиями, в наст. время входящими в концерн «Силовые машины».,1
В то время как Dark Souls II и Dark Souls III просто наследовали механики и оформление Dark Souls без революционных изменений, FromSoftware выпускала и др. крупные Action/RPG, развивающие ту же формулу — так, Bloodborne практически лишала игрока возможности блокировать удары, подталкивая его постоянно атаковать врага и вести себя более агрессивно, чем в Dark Souls; Sekiro: Shadows Die Twice содержала намного меньше элементов RPG, но вводила сложную, но вознаграждающую за внимательность и скорость реакции систему парирования ударов.,1
терр. Серовского района в наст. время полностью совпадает с территорией Сосьвинского городского округа, в связи с чем для них едино географич. описание.,1
Сосьва — правый приток Тавды и крупнейшая р. района, протекает в северной его части с запада на в., принимает в пределах района следующие притоки: Курья, Каменка, Берёзовка, Ляля, Монастырка, Нюрма, Молва, Негла, Пата и др. реки;,1
Ляля — правый приток Сосьвы, протекает в северо-западной части района с запада на в., притоки в районе: Большая Каскунка, ручей сев., Берёзовка и др.;,1
Он первым перевел на франц. «Тараса Бульбу» и др. произведения Гоголя, мн. рассказы Тургенева; «Капитанскую дочку» и драматические произведения Пушкина.,1
Таким образом в неё были интегрированы функции интерактивной работы, скриптовый яз. REXX, средства виртуализации и др. возможности СВМ.,1
В наст. время Сандра занимается постановкой мюзиклов.,1
Приступив к работе, постановщик рассматривал на главную женскую роль Анджелину Джоли, Натали Портман, Блейк Лайвли, Скарлетт Йоханссон, Марион Котийяр, Рэйчел Вайс, Наоми Уоттс и др. кандидатуры.,1
Аминокислоты и др. молекулы, синтезированные Миллером и Юри, содержали не более трех атомов углерода.,1
В наст. время пам. испытывает интенсивную нагрузку от многочисленных экскурсионных посещений, а также в связи с паломничествами различных сектантствующих[каких?] и эзотерических групп.,1
Павел Викторович Стефаненко (24 октября 1960г, Дзержинск, Сталинская область) - д. п. н., профессор, полковник запаса, засл. работник образования Украины, Почетный начальник «Академия гражданской защиты» МЧС ДНР, Отличник образования ДНР, Почетный работник образования ДНР,1
В наст. время – профессор кафедры гуманитарных дисциплин ФГКОУ ВО «Донецкий ин-т ГПС МЧС России».,1
В наст. время П.В. Стефаненко является главным редактором научных журналов « вест. Академии гражданской защиты» и «Пожарная и техносферная безопасность: проблемы и пути совершенствования», которые выпускаются в ФГКОУ ВО "Донецкий ин-т ГПС МЧС России", членом специализированного Ученного совета по защите диссертаций на соискание ученой степени кандидата и доктора наук на базе ФГБОУ ВО «ЛГПУ» г. Луганск.,1
(Решение специализированного Ученного совета, Института педагогики и психологии профессионального образования АПН Украины, протокол №18 от 20.09.1995 г., дир. Института- акад., профессор Зязюн Иван Андреевич, зам. директора Института по научной работе - акад., профессор Ничкало Нелля Григорьевна, науч. рук. - профессор Пикельная Валерия Семеновна); доцент – 1996 г. (Решение Ученного совета Донецкого Государственного Технического Университета, протокол №1 от 23.02.1996 г., ректор Университета-профессор Минаев Александр Анатольевич.); полковник – 1998 г. (Приказ МОУ №0299 от 18.08.1998 г.); д. п. н. – 2003 г.,1
В 1849 г. вместе с Генрихом Хенкелем основал во Франкфурте музыкальную школу, где среди его учеников были Фридрих Гернсхайм, Адольф Розенбекер, Реджинальд Де Ковен, Вильгельм Хилль, Адриенна Пешель и др..,1
Селестино Аос Брако — (28 ноября 2020 — по наст. время).,1
В наст. время сов. анаморфотная оптика используется зарубежными операторами-постановщиками для получения эффекта «винтажного» изображения.,1
Таким образом снимались фильмы «Три плюс два», «Алые паруса», «Дон Кихот» и др..,1
В наст. время отечественная широкоэкранная система уступила место иностранным аналогам, главным образом, «Панавижн», имеющим сходные характеристики.,1
В 2023 г Верховный комиссар ООН по правам чел. Фолькер Тюрк заявил, что «пытки и др. виды жестокого обращения широко распространены в центрах содержания под стражей на оккупированных Россией территориях».,1
82 % христиан — католики, остальные — англикане и др. протестанты.,1
В наст. время титул герцога Гандия также носят представители дома Осуна.,1
