abbreviation,encounters
и др..,4
Ветераны сборной (Майкон, Жулио Сезар, Робиньо и др.) стали испытывать проблемы в клубах, а молодые игроки практически ничем не смогли помочь.,2
В наст. время входит в состав Института наследия.,2
В свою очередь, Бенедикт XVI и ныне правящий Франциск (по имеющимся данным) до наст. времени не совершили ни одного тайного кардинальского посвящения.,2
В наст. время она экспонируется в Романовском музее на постоянной выставке «„Моё забытое, родное…“ (творч. Ефима Васильевича Честнякова)».,2
В наст. время Анаи является одной из наиб. успешных мексиканских актрис (она много снимается в телесериалах).,2
Система классификации секретной информации, действующая в Российской Федерации в наст. время, установлена Законом Российской Федерации «О государственной тайне» № 5485-1 от 21 июля 1993 года.,1
В наст. время существует три уровня секретности и соответствующие им грифы секретности: секретные, совершенно секретные, особой важности.,1
Дмитрий Дмитриевич Ангельев (1918—1985) — сов. работник сельского хозяйства, дир. совхоза, Герой Социалистического Труда, к. сх. н..,1
искусств. интеллект также опирается на психологию, лингвистику, философию, нейронауку и др. области.,1
В наст. время[когда?] в отрасли здравоохранения работает более 90 стартапов, основанных на применении искусственного интеллекта.,1
Он использует как исторические данные, так и данные в реальном времени, чтобы понять, что сработало хорошо в прошлом, а также то, что в наст. время имеет тенденцию в Интернете.,1
Ряд моделей Škoda (Škoda Fabia) также в наст. время включает контроллер на основе нечеткой логики.,1
В наст. время методология когнитивного моделирования развивается в направлении совершенствования аппарата анализа и моделирования ситуации.,1
а после — Карагандинский гос. технич. ун-т (почётным доктором технических наук которого в наст. время является) по специальности «горный инженер-строитель» и Карагандинский гос. ун-т им. Е. А. Букетова по специальности «юрист».,1
В наст. время осуществляется перевод земель поселка в группу земель сельхоз назначения.,1
В наст. время данные народы принято называть науа.,1
Также важную роль в составлении исторических хроник играли индейские летописцы, такие как Чимальпаин, Фернандо Альварадо Тезозомок, Фернандо де Альва Иштлильшочитль, Хуан Баутиста де Помар, Диего Муньос Камарго и др..,1
Различные племена народа науа, как и др. мезоамериканские коренные народы колониальной Новой Испании, смогли сохранить мн. аспекты своей социальной и политической структуры в условиях колониального правления.,1
Воины их презирали, однако так или иначе отдавали им награбленное в обмен на одеяла, перья, рабов и др. товары.,1
Как и др. божественные пантеоны индейцев мезоамерики, религия ацтеков совмещала многобожие и анимизм.,1
Коллектив и его лидер Фаррух Закиров разработали свой подход к интонационно-ритмическому началу узбекского фольклора и создали такие известные песни, как «Маджнунтол» («Плакучая ива»), «Бойчечак» («Подснежник»), «Яллама ёрим» и др..,1
В 1979 г в анс. пришли новые музыканты, которые играют в нём по наст. время, за исключением музыкального руководителя и бас-гитариста Рустама Ильясова, к-рый после 15-летней творческой деятельности в «Ялле» в 1994 г расстался с коллективом и переехал на пост. жительство в США.,1
После университета жил в 2003—2004 в Сантьяго, где проживают его отец и др. родственники.,1
В 1940 г для здания было изготовлено 7 скульптур («Парашютистка» скульптора А. Я. Белобородова и др.).,1
Токсыбай, Пибулат, Пияндык, Чиндубай, Очибай, Очей, Паим, Аптыл, Конак, Памыдек, Токман, Абли (Аблей), Ердыган (Ядыган), Пидыган, Ситыган и др..,1
В Сернуре имеется сыродельный завод и др. предприятия пищевой промышленности.,1
Юрий Григорьевич Павленко (род. 30 января 1938) — сов. и рос. физик, педагог, д. фм. н., засл. профессор МГУ им. М. В. Ломоносова.,1
Терекеме (азерб. Tərəkəmə) — историко-географич. область, делился на верх. и ниж.; в наст. время его терр. входит в состав Дербентского ,Кайтагского ,Каякентского и Табасаранского районов Дагестана.,1
На базе личной коллекции А. Р. Бродовского и по его инициативе в 1918 основан Витебский губ. музей (в наст. время Витебский областной краеведч. музей).,1
В городе построен Ледовый Дворец спорта, появился примечательный комплекс пирамид торгово-развлекательного центра Марко-сити, реконструированы центр. стадион и Летний Амфитеатр символического для города международного фестиваля искусств «слав. базар», реконструирован ж.-д. вокзал и др. объекты, восстанавливаются исторические памятники, сооружён ряд новых храмов и других общественных объектов, строятся новые жилые районы.,1
В наст. время в состав города входят, Кызылжар и с. Тендик.,1
В наст. время группировкой руководят Эктор Бельтран Лейва и Фаусто Исидро Меса Флорес.,1
Ранее исчезли деревни: Высочка, Головчиха, Крутцы, Трубачиха, Смелово, Храброво, Фишково и др..,1
В наст. время семья проживает в Лугано, Швейцария.,1
В наст. время формально послеобеденный чай, как правило, потребляется в качестве закуски в отелях или чайных магазинах.,1
В наст. время в значительной степени сопровождается лёгкой едой поздно вечером.,1
В наст. время обязательной традицией не является.,1
К данному приёму пищи подаются обычно только сладкие продукты, чаще всего сливочные и кремовые торты (как шварцвальдский торт), также могут быть и др. торты, фруктовые пироги и пирожные.,1
Обычай в наст. время становится очень модным во Франции.,1
Бори́с Самуи́лович Думеш (30 сентября 1947, Щербаков, яросл. область — 14 января 2010, м.) — рос. физик-экспериментатор, д. фм. н..,1
В наст. время он проводит крупнейшее систематич. иссл. по ИППП в Германии (иссл. BRAHMS), целью которого является понять, кто заражается ИППП.,1
Зазы и др. курдские подгруппы имеют один и тот же генетический обр. по причине того, что переселенные дейлемиты мало того, что смешались с местным загросским населением, но и вошли в этногенез и остальных курдов, — в курдской истории были известны частые случаи внутрикурдского диалектного ассимиляционного процесса, в т. числе переход носителей горани и зазаки на другие диалекты курдского языка (в особенности на сорани и курманджи).,1
В монастырских помещениях действует возобновлённая духовная семинария, жен. Свято-Васильевский мон., церк. лавка, а также светский учреждения — б-ка, изд-во, фото-студия и др..,1
С 1938 года — к. фил. н..,1
Также существует устойчивая частица с одним положительным элементарным зарядом — протон (масса равна 1,67⋅10−27 кг) и др., менее распространённые частицы.,1
Он был впервые экспериментально подтверждён в 1843 г английским учёным Майклом Фарадеем и считается на наст. время одним из фундаментальных законов сохранения в физике (подобно законам сохранения импульса и энергии).,1
Затем дорога пересекает Чергинский хребет, Семинский хребет и др. хребты Алтая, которые достигают 1900—2000 м над уровнем моря, а также крупные межгорные котловины Курайскую и Чуйскую (1500—1900 м).,1
На выбор существуют различные персонажи (метал. робот, безумный учёный, смертоносный ниндзя и др.).,1
Прокуратуры городов, районов и др. территориальные прокуратуры,1
Неизменяемые данные, включающие в себя переменные, объявленные с модификатором const, строковые литералы и др. составные литералы, помещаются в сегмент текста программы.,1
Также для Си существуют и др. инструменты, облегчающие и дополняющие разработку, вкл. статические анализаторы и утилиты для форматирования кода.,1
Отдельно необходимо упомянуть о целой группе языков, которые в большей или меньшей мере унаследовали базовый синтаксис Си (использование фигурных скобок в качестве ограничителей блоков кода, описание переменных, характерные формы операторов for, while, if, switch с параметрами в скобках, комбинированные операции ++, --, +=, -= и др.), из-за чего программы на этих языках имеют характерный внеш. вид, ассоциирующийся именно с Си.,1
При этом стандартным средством форматированного ввода-вывода являются именно функции с переменным числом параметров (printf(), scanf() и др.), не способные проверить соответствие списка аргументов строке формата.,1
Отец — Сафронов Борис Владимирович 1928 года рождения, военный, д. ф. н..,1
В наст. время Киево-Печерская лавра находится в центре Киева, на правом, высоком берегу Днепра и занимает два холма, разделённых глубокой ложбиной, спускающейся до Днепра.,1
В одном из корпусов была размещена гос. историч. б-ка Украины (находится там до наст. времени).,1
Никакие священники, монахи или др. местные люди, которые обычно работают там, не имеют права входить в мон., к-рый содержится в цитадели Киева.,1
Борис Васильевич Романовский (12 сентября 1933 — 27 июля 2019, м.) — сов. химик, специалист в области гетерогенного катализа, д. х. н., профессор, лауреат Ломоносовской премии МГУ.,1
С начала XIX вв. и по наст. время в замке расположен музей.,1
После обращения Корнилия к христианской общине начали присоединяться и др. язычники, и возник вопрос, должны ли язычники, перешедшие в христианство, соблюдать все предписания Закона Моисея: обрезание, жертвоприношение животных в Храме, левират, а также множества обрядовых ритуалов, введённых книжниками и фарисеями в религиозную жизнь иудеев.,1
Лев Ильи́ч Руси́нов (21 апреля 1907 года, Минск — 18 мая 1960 года, л.) — инженер-физик, д. фм. н., профессор, участник советского Атомного проекта, науч. рук. проекта современного реактора с высокими нейтронными параметрами, Лауреат Государственной премии СССР, кавалер ордена Ленина.,1
В наст. время старейшая из существующих газет — «Красноярский рабочий» (издаётся с 10 дек. 1905 года).,1
В наст. время в городе работают радиостанции:,1
В наст. время в городе работают 3 вещательных каналов:,1
, а результаты лабораторных исследований позволяют предположить, что биомасса созд. с их помощью может достигать порядка 6•1020 кг, что в 100 000 раз больше всей биомассы на Земле в наст. время.,1
В наст. время проектом «Экономический рост России» руководит предс. научного Совета ВЭО России, вице-президент ВЭО России, чл.-корр. РАН Д. Е. Сорокин.,1
Новейшая история ВЭО России связана с именами таких выдающихся ученых и общественных деятелей современной России, как Л. И. Абалкин, А. Г. Аганбегян, С. Д. Бодрунов, С. Ю. Глазьев, Р. С. Гринберг, Н. Н. Гриценко, В. И. Гришин, М. Г. Делягин, Я. Н. Дубенецкий, А. А. Дынкин, М. В. Ершов, В. В. Ивантер, С. В. Калашников, С. П. Капица, А. Н. Клепач, А. Л. Кудрин, Г. Л. Мурадов, А. В. Мурычев, А. Д. Некипелов, В. С. Павлов, Г. Х. Попов, Н. Я. Петраков, Б. Н. Порфирьев, Е. М. Примаков, Ю. В. Росляк, С. Н. Рябухин, Д. Е. Сорокин, С. В. Степашин, Е. С. Строев, Г. А. Тосунян, Г. Н. Цаголов, М. В. Шмаков, Н. П. Шмелев, В. И. Щербаков, А. Н. Шохин, В. С. Черномырдин, М. А. Эскиндаров, Ю. В. Якутин, Е. Г. Ясин и др..,1
всерос. экономический диктант и др. проекты.,1
В наст. время концерн состоит из 13 компаний, входящих в 5 структурных подразделений: автоматизация, станкостроение, обрабатывающее оборудование, тяжелое и энергетическое машиностроение, произ-во текстильного оборудования.,1
Кристиан Столт — старший пожарный Рэнди «Мауч» Макхолланд, машина 81 (повторяющаяся роль в первом сезоне; сезон 2 — наст. время).,1
Джо Минозо — пожарный Джо Круз, пожарный / водитель (повторяющаяся роль в первом сезоне; сезон 2 — наст. время); машина 81 / машина 3.,1
Миранда Рэй Мейо — лейтенант (ранее — пожарный) Стелла Кидд, машина 81 (повторяющаяся роль в четвёртом сезоне; сезон 5 — наст. время).,1
Альберто Розенде — стажёр Блейк Галло, машина 81 (сезоны 8 — наст. время).,1
Дэниэл Кайри — стажёр Даррен Риттер, машина 51 (повторяющаяся роль в сезонах 7—8; основная роль: сезон 9 — наст. время).,1
Ханако Гринсмит — парамедик Вайолет Миками (повторяющаяся роль в сезонах 8—9; основная роль: сезон 10 — наст. время).,1
Рэнди Флаглер — старший пожарный Гарольд Кэпп, бригада 3 (сезон 1 — наст. время).,1
Энтони Феррарис — пожарный Тони Феррарис, бригада 3 (сезон 1 — наст. время).,1
Мелисса Понцио — Донна Боден (сезон 2 — наст. время), школьная учительница, в которую влюбляется шеф Боден и в конце концов женится.,1
Кэтлин Шеннет — Кайли Эстевес (сезон 8 - наст. время), участница программы Стеллы Кидд по подготовке женщин пожарных, позже новая секретарша шефа Бодена.,1
2024 — наст. время: Лорд Ральф Уильям Фрэнсис Джозеф Керр, 14-й маркиз Лотиан (род. 7 ноября 1957), мл. брат предыдущего;,1
Афака используется до наст. времени, однако уровень грамотности носителей языка низок и составляет менее 10 %.,1
До 1 января 2005 года община входила в состав управления «Вольгаст-Ланд» (нем. Amt Wolgast-Land), но наст. время подчинена управлению «Ам Пенестром» (нем. Amt Am Peenestrom), со штаб-квартирой в Вольгасте.,1
В наст. время община подразделяется на пять сельских округов.,1
Создатель научной школы, давшей многих выдающихся советских физиков, таких как А. П. Александров, Л. А. Арцимович, Я. Г. Дорфман, П. Л. Капица, И. К. Кикоин, П. П. Кобеко, И. В. Курчатов, П. И. Лукирский, Н. Н. Семёнов, Я. И. Френкель и др..,1
Дочь — д. фм. н. Валентина Абрамовна Иоффе (1910—1985), зав. лабораторией в Институте химии силикатов АН СССР, жена оперного певца, народного артиста РСФСР С. И. Мигая.,1
В наст. время Уорд состоит в третьем браке с Марией-Луизой Уайт.,1
Общины, основанные Сеймуром в Виргинии, в наст. время составляют «объед. братство оригинальной миссии на Азуза-стрит» (United Fellowship of the Original Azusa Street Mission).,1
В наст. время исследователи рассматривают Сеймура как одну из ключевых фигур начала мирового пятидесятнического движения.,1
В наст. время прихожанами чилийских пятидесятнических церквей являются 2,5 млн чел.; большинство пятидесятнических общин возводят свою историю к служению Уиллиса Гувера.,1
Эндоспоры образуют представители ок. 25 родов из типа фирмикут: Bacillus, Clostridium, Dendrosporobacter, Desulfosporosinus, Desulfotomaculum, Halobacillus, Heliophilum, Oscillospira, Sporobacter, Sporobacterium, Sporohalobacter, Sporolactobacillus, Sporomusa, Sporosarcina, Sporotomaculum, Sulfobacillus, Thermoactinomyces и др..,1
В наст. время эту стадию не выделяют, так как характерных морфологических признаков она лишена, а мутанты, не способные её проходить, неизвестны.,1
Индукторы прорастания могут быть как физиологическими (некоторые аминокислоты и сахара, пуриновые нуклеозиды и др. соединения или их смеси), так и нефизиологическими (минеральные соли, экзогенный дипиколинат кальция, лизоцим, катионные детергенты, сублетальный тепловой шок, давление от 100 до 600 МПа).,1
В 2008 г, к 100-летию издания поэмы «Нарспи», две новые сформировавшиеся улицы Чандрова были названы именами героев произведения — Нарспи и Сетне́ра, но в наст. время в черте Чандрова таких улиц нет.,1
В начале 1990-х годов по решению местных активистов была создана письм. сидамо на латинской основе, к-рый в наст. время является единственной используемой для этого языка.,1
