abbreviation,encounters
При этом топ-10 Hot 100 и др. основные моменты по-прежнему будут публиковаться каждый понедельник после полудня (за исключением недель, на которые повлияли праздничные дни) в еженедельных обзорах топ-10 на сайте.,1
Вечеринки делились на кинсеаньеру (сладкие 15), сладкие 16 и др. дни рождения, такие как сладкие 21 (к-рый транслировался во время весенних каникул на MTV) и супер-свэг 18.,1
В наст. время он также выходит в эфир на MTV Teen на сервисе Pluto TV.,1
Во время двух мандатов Перику на посту мэра Генуи после нескольких лет простоя возобновились работы по расширению линии городского метро, к-рый от железнодорожной станции Piazza Principe доходила до исторического центра через р-н старого порта, с открытием четырех из восьми действующих в наст. время станций (Сан-Джорджо, Дарсена, Де Феррари и Сарцано/Сант-Агостино).,1
В наст. время на территории Песоченской епархии нет действующих монастырей.,1
В 2018 г телескоп получил грант в размере 4,5 млн долл. США на расширение центра для посетителей и др. программы, а также на общее возрождение национального символа.,1
«Народ Израиля и др. народы» (1986),1
Как и в большинстве вики-проектов на языках небольших народов, в удмуртской Википедии развита культурная, краеведч. и др. национальные темы.,1
Как и др. представители семейства ктенохазматид, птеродаустро имели вытянутый торс и пропорционально массивные растопыренные лапы, приспособленные для плавания.,1
В общих чертах новая конституция, за малыми исключениями удержавшаяся до наст. времени, была повторением конституции 1849 года с отменой только всеобщей подачи голосов для выборов в ландстинг.,1
В наст. время виды рода Gastrochilus разделены на три секции.,1
Некоторые команды используют аккордеон, губную гармонику, фортепиано, ударные, электрогитару и др. инструменты.,1
В наст. время музыку с элементами блюграсса исполняют следующие рос. группы: «ГрАссМейстер» из Москвы, стиль которой сочетает элементы кантри-рока, блюграсса, авторской песни и бард-рока; Grass Pistols из Нижнего Новгорода, исполняющие «нью-грасс» и традиционные произведения, «Граблю Бэндъ» из Иваново, исполняющие классические инструментальные блюграсс-произведения; «Братобатя» из Магнитогорска, играющие в стиле блюграсс/фолк-панк и выпустившие в 2017 г. свой дебютный мини-альбом; Real Russian Bluegrass Band из Иваново, исполняющие инструментальный ньюграсс/этно/джаз-фьюжн и выпустившие дебютный альбом RRBB (2017, ArtBeat Music); Red Brick Boys из Москвы, исполняющий чисто акустический блюграсс; Rosewood Bluegrass Band из Санкт-Петербурга — исполняют классические американские стандарты и перекладывают в блюграсс знаковые песни из русского рока.,1
Потомками олони, живущие в наст. время, являются немногочисленные члены племени мувекма-олони (англ. Muwekma Ohlone Tribe) проживающие в области залива Сан-Франциско, а также племени румсенов (англ. Rumsen tribe) и племени муцунов (англ. Mutsun tribe), которые находятся в процессе признания на федеральном уровне.,1
Однако венгерско-амер. антрополог Отто фон Садовски полагает, что олони и др. калифорнийские северные племена перебрались на эту территорию ок. 1000 лет до н.э. из Северо-Западной Сибири.,1
Были и др. различные аттракционы.,1
В наст. время округ возглавляет генерал-майор Ярон Финкельман.,1
В 1937 г папа Пий XII возвёл аббатство Гроттаферрата в статус территориального аббатства с прямым подчинением Ватикану, аббатство в наст. время представляет собой самостоятельную единицу в составе итало-албанской католической церкви.,1
Новая Конституция, принятая всенародным голосованием 12 дек. 1993 года и действующая с некоторыми изменениями до наст. времени, предоставляет президенту Российской Федерации существенно более широкие полномочия, чем действовавшая на момент конфликта Конституция 1978 года (с изменениями, внесёнными в 1989—1992 гг).,1
Отключены были в здании парламента и др. виды связи.,1
к Борису Ельцину — отменить Указ № 1400 и др. нормативные акты, связанные с его реализацией, восстановить в стране конституционную законность;,1
29 сентября в Новосибирске представители законодательных структур власти республик Бурятия и Тува, Алтайского и Красноярского краёв, Амурской, Иркутской, Кемеровской, Томской, Омской, Тюменской, Читинской и Новосибирской областей потребовали снять блокаду Белого дома, снять цензуру СМИ, отменить указы № 1400 и др. указы и распоряжения Бориса Ельцина.,1
23 сентября пр-во Черномырдина передало в ведение правительства издания, учредителем которых являлся Верховный Совет, такие как «рос. газ.», теле- и радиопрограммы «РТВ-Парламент» и др..,1
Также комиссии Госдумы были показаны видеоматериалы, согласно которым во время митингов журналист Дмитрий Холодов неоднократно в сопровождении иностранных журналистов подходил к сторонникам Верховного Совета, выбирал наиб. малокультурных, плохо одетых, неуравновешенных пожилых людей и вызывал их на матерную брань и др. экстремистские проявления, снимая это на видеокамеру.,1
По мнению комиссии Госдумы, следствие фактически рассматривало указ Ельцина № 1400 и др. нормативные акты и действия, направленные на его реализацию, как правомерные и, соответственно, не имевшие прямого отношения к возникновению массовых столкновений и иных тяжких последствий.,1
26 февраля постановление об амнистии было исполнено директором ФСК Николаем Голушко и Генеральным прокурором Алексеем Казанником, несмотря на попытки противодействия со стороны Бориса Ельцина: Александр Руцкой, Руслан Хасбулатов, Виктор Анпилов и др. оппозиционные лидеры были освобождены из следственного изолятора «Лефортово».,1
Как «гос. переворот» квалифицируют события 21 сентября — 4 октября 1993 года Краткая историч. энциклопедия, написанная авторским коллективом под редакцией директора Института Всеобщей Истории РАН А. О. Чубарьяна, изданная в 2002 г издательством «Наука», быв. рук. Верховного Совета России Руслан Хасбулатов, д. ю. н. Елена Лукьянова, выступавшая на стороне Верховного Совета и находившаяся в Доме Советов во время событий, политолог Лилия Шевцова.,1
Октябрьская (центр.), Амурская, 50-лет Комсомола, Вокзальная, Кировская, Желябовского, Семафорная, вост., Осовская и др..,1
В посёлке Бурея есть муницип. культурно-досуговый центр «Гармония» (быв. клуб железнодорожников), где проходят концерты, дискотеки и др. культурные мероприятия.,1
Этот чип представляет собой сигнальный процессор для работы с числами с фиксированной точкой, позволяющий быстрее выполнять векторные вычисления, конвертировать побитовые изображения, трансформировать двух- и трёхмерные координаты и др. функции.,1
Обвинения во вмешательстве: лидер турецкой оппозиции К. Кылычдароглу 12 мая заявил в Твиттере о т., что Россия проводит кампанию по дезинформации на стороне нынешнего президента Турции; комментируя это, Д. Песков, посол в Турции и др. официальные лица отвергли обвинения во вмешательстве в дела Турции.,1
Участвовал в подготовке ряда профессоров: Михаэль Рот, Райнер Мюллер, Юрген Вернштедт, Манфред Гюнтер, Татьяна Ланге, Ян Лунце, Гюнтер Штайн, Йозеф Шпонер, Ульрих Энгманн, и др..,1
С 2000 года по наст. время, в связи с приватизацией ГСП №2 был назначен на должность директора Стоматологической клиники «Шипа-Дент».,1
Дипломная работа — картина «За мир!» в наст. время находится в Научно-исследовательском музее Академии художеств в Санкт-Петербурге.,1
Среди написанных там работ «Ветер с Ладоги» (1961), «Улочка в Новой Ладоге» (1965), «с. Чернавино» (1968), «с. Извоз на Волхове» (1968), «Тёмный Волхов» (1974), «Мика у крыльца» (1979), «Староладожский монастырский двор» (1978), «Старая Ладога» (1988) и др..,1
В состав Верхнеолбянского сельсовета входили (в наст. время не существующие) до 1962 года посёлки Дружный, Равище, Зоровский, до 1966 года пос. Садовый.,1
В наст. время является профессором кафедры миссиологии Миссионерского факультета ПСТГУ, а также профессором кафедры истории Церкви и канонического права Богословского факультета и профессором кафедры теологии Факультета дополнительного образования.,1
А д. ф. н., профессор ИППК МГУ им. М. В. Ломоносова И. Я. Кантеров в научно-теоретическом журнале «Религиоведение» включил книгу «Сектоведение» в раздел «Монографии» списка «дополнительной рекомендуемой литературы» по «Программе дисциплины „Новые религиозные движения и культы“», курс которой читает в ИППК МГУ.,1
Дедушка — д. э. н. и профессор, был репрессирован (освобождён в 1955-м, реабилитирован примерно через полтора года), работал старшим экономистом на сыроваренном заводе в Угличе, часто посещал внука и был ему как отец.,1
М. О. Шахов, религиовед, специалист по сравнительному изучению французского и российского опыта государственно-конфессиональных отношений, профессор РАГС профессор РГТЭУ, д. ф. н., чл. Экспертного совета Комитета по делам общественных и религиозных организаций Государственной Думы Федерального Собрания РФ отмечает, что по состоянию на 2009 г:,1
рос. религиовед И. Я. Кантеров (д. ф. н., профессор ИППК МГУ) считает понятия «тоталитарная секта» и «деструктивная секта» бессодержательными.,1
15 мая 2006 года с заявлением по поводу интервью Сергея Косенко «Порталу-Credo.Ru» выступили официальные представители РАЦИРС — Вице-президент РАЦИРС протоиерей Александр Новопашин, Вице-президент РАЦИРС протоиерей Александр Шабанов, и Ответственный секр. РАЦИРС, к. и. н., доцент, священник Лев Семёнов, где высказались следующим образом:,1
зав. сектором философии религии Института философии РАН и кафедрой истории и теории мир. культуры философского факультета МГУ, д. ф. н. В. К. Шохин и религиовед, д. ф. н. Е. Г. Балагушкин в опубликованной в 2006 г статье «религ. плюрализм в современной России» поставили Александра Дворкина в один ряд с Серафимом Роузом и Томасом Гандоу, отмечая, что он также «неправомерно огульно объявляет все многообразие НРД врагами Христа и сатанинской прелестью», тем самым «разжигая межконфессиональную вражду» в России.,1
Религиовед А. В. Муравьёв и журналист М. Н. Ситников в статье на Портал-Credo.Ru писали, что сопредседатель Всемирного русского народного собора и Всемирного русского конгресса, к. и. н. И. А. Кольченко в рец. (датирована январём 2001 года) на «Сектоведение.,1
В свою очередь дир. Департамента геополитических исследований Института гуманитарного образования, к. ф. н. С. А. Шатохин в вошедшем в тот же сб. отзыве (датирован мартом 2003 года) «о выступлениях А. Л. Дворкина» по вопросам канонизации Ивана Грозного и Григория Распутина, в качестве вывода отмечает, что промежуточной целью данных выступлений «является провоцирование церковных расколов в Русской Православной Церкви».,1
Ведущий науч. сотр. Института русской литературы РАН, д. фил. н. А. А. Панченко, критикуя в 2009 г в интервью Портал-Credo.Ru назначение А. Л. Дворкина председателем экспертного религиоведческого совета при Министерстве юстиции РФ, назвал Дворкина «одиозным активистом антисектантского движения», которого следует подвергнуть «судебному преследованию за разжигание религиозной розни».,1
В 2005 г религиовед Е. И. Аринин и к. ф. н. И. Д. Нефедова, в учебном пособии «Психология религии» написанном для студентов специальности «Религиоведение», выразили согласие с мнением И. Я. Кантерова о термине «тоталитарная секта», отмечали, что Дворкин, имеющий строго негативное отношение к новым религиям, использует этот термин для всех до единого новых религиозных движений.,1
Элбакян назвала некорректным то, что Дворкина именуют «доктором философии», ведь в России «такого учёного звания нет, есть д. ф. н.».,1
Философ А. А. Мишучков, к. ф. н., доцент кафедры истории философии Факультета гуманитарных и социальных наук ОГУ в рецезии на книгу Сектоведение.,1
В наст. время на этом месте находится отель The Dylan.,1
Театр заменил Первую Нидерландскую академию Самуила Костера, ранее находившуюся на этом месте, первоначально созданную для расширения доступа к науке путём проведения лекций на национальном языке вместо латыни (хотя проводились и др. мероприятия, такие как конкурсы живописи).,1
В наст. время этот участок является популярным местом отдыха краковян и называется Закшувским заливом.,1
В связи с этим и вопрос о дате рождения Карла Великого также не разрешён однозначно до наст. времени.,1
Она же в наст. время переиздаётся издательством «Азбука».,1
В русле учений русских символистов внутренним источником действия в романе выступает извечное противостояние сил аполлонических (Аполлон Аполлонович и др. сановники) и сил дионисийских (Липпанченко и революционеры).,1
В наст. время хор работает над новым сборником песен, к-рый увидит свет уже в текущем 2008 г.,1
Вейде Евгений Владимирович (в наст. время),1
Теория струн, ведущий кандидат на квантовую теорию гравитации, использует термин квантовая геометрия для описания экзотических явлений, таких как T-дуальность и др. геометрические дуальности, зеркальная симметрия, переходы с изменением топологии, минимально возможный масштаб расстояний и других явлений, которые бросают вызов интуиции.,1
В наст. время этого двухэтажного небольшого дома с двором, с многочисленными закутками и сарайчиками, в которых Валера играл с товарищами не существует.,1
Георгий Иванович Пондопуло (Попандопуло) (1910—1994) — сов. деятель спецслужб и педагог, полковник госбезопасности, к. фм. н. (1941), профессор (1965).,1
В 1941 г защитил диссертацию на соискание учёной степени к. фм. н. по теме: «Обтекание решётки газом при больших скоростях».,1
Несмотря на то, что в наст. время на восстановление здания потрачены значительные суммы, большая ч. его фасада, вкл. башню с часами, обрушилась в декабре 2020 года.,1
Характерные черты стадионного хауса KLF — семплированный шум толпы, а также использование в разных песнях одних и тех же узнаваемых вокальных семплов — впосл. использовали др. группы начала 90-х, напр., Utah Saints, N-Joi и Messiah.,1
В глубине души мне хотелось сделать карьеру успешного артиста, а Билла всегда интересовали др., странные вещи.,1
Высказывались и др., скептические точки зрения — обозреватель Trouser Press Айра Роббинс называл творч. KLF «серией ярких музыкальных маркетинговых экспериментов».,1
Один из них дожил до наст. времени и находится у Джеймса Фогерти, основавшего вместе с Коти арт-группу Blacksmoke.,1
Целый ряд игроков (Фаузи Гулам, Софиан Фегули, Хассан Йебда, Рияд Махрез, Ислам Слимани, Сафир Тайдер и др.) даже имеют опыт выступлений за юношеские и молодёжные сборные Франции до того, как приняли решение играть за историческую родину.,1
В числе племен, проживающих на границе епархии, перечисляются: Пшоване, Хорваты и др. Хорваты, Зласане… (лат. Psouane, Crouati et altera Chrouati, Zlasane…).,1
