abbreviation,encounters
В наст. время применяются: резекция, электрокоагуляция, лазерная вапоризация.,1
Удаление матки и придатков в наст. время применяется все реже, большинство методик сосредоточено на удалении только очагов эндометриоза и восстановлении нормальной анатомии тазовой области.,1
В посёлке находится локомотивное депо и др. предприятия железнодорожного транспорта.,1
К концу XIX вв. в Кузнецке проживали 17 тыс. чел., насчитывались 63 кожевни, 30 овчинных и верёвочно-шпагатных, 6 маслобойных, одно чугунолитейное и др. заведения, в которых работали 530 рабочих.,1
В наст. время официальным и основным языком города является рус..,1
В наст. время в Кузнецке издаются газеты:,1
Ножан, как и др. окрестные поселения, также испытал все тяготы военных действий, был неоднократно разграблен.,1
В наст. время фасад, находящийся в парке Эбер, является самостоятельным произведением архитектуры и считается памятником истории.,1
Шато Рошер, в наст. время ― культурный центр,1
В 1969 г была удостоена звания «засл. деятель искусств РСФСР», с 1954 года д. иск..,1
В наст. время в Риме подготовлен проект возведения арки EUR.,1
Лия Закировна Шакирова (9 февраля 1921, Уфа, СССР — 29 июля 2015, Казань, Россия) — сов. и рос. уч., д. п. н., профессор, засл. деятель науки РСФСР и Татарской АССР.,1
Пояс включает Судан, Сомали, Сенегал, Индию, Йемен, Мексику, Венесуэлу, Колумбию, Аргентину и др..,1
Нейропептид Y в наст. время считается основным медиатором чувства голода, именно он стимулирует пищевое поведение.,1
Для мукополисахаридозов характерен синдром гаргоили́зма (от фр. gargouille — гротескная фигурка, напоминающая чел., которыми украшали крыши, карнизы и др. детали старых домов): массивный череп, короткая шея, западающее широкое переносье, гипертелоризм, толстые губы, высокое нёбо, сросшиеся брови, б. яз..,1
Однако, существуют и др. версии их происхождения на основе лингвистического анализа, напр., из зол. Орды, где был распространен яз., близкий к языку литовских и галицких караимов.,1
В наст. время различными компаниями продолжается активная точечная застройка улицы Парижская Коммуна, возведено и в ближайшее время ожидается сдача еще нескольких многоэтажек.,1
В наст. время проводятся исследования, направленные на возможность влияния на колоректальный рак, а также по их эффективности в лечении сердечно-сосудистых заболеваний.,1
Николай Григорьевич Ляхтеров (21 апреля 1905 года, Могилёв — 11 марта 1998 года, м.) — разведчик, генерал-майор (1954), к. воен. н..,1
В пакет CorelDRAW также входит ред. растровой графики Corel Photo-Paint и др. программы — напр., для захвата изображений с экрана — Corel Capture.,1
В июле 2009 года Денис Евсюков и др. сотрудники УВД ЮАО (в т. числе бывшие, привлечённые к уголовной ответственности за другие преступления) стали фигурантами дела о похищении экспедитора Андрея Власкина (см. также статью про Евгения Чичваркина), подозревавшегося в краже мобильных телефонов, принадлежащих «Евросети».,1
«В наст. время он один из нескольких критиков, которые, основываясь на более или менее общем давнем прошлом культуры, в состоянии смоделировать один из возможных вариантов её ещё необщего недавнего прошлого, принципиально необщего настоящего и бесконечно вариативного будущего».,1
В 2006 г большинство жителей составляли украинцы (56,9 %) и русские (40,7 %), живут также белорусы, татары и др.; наиб. распространённая конфессия — православие (приход организован вокруг церкви Святого Николая).,1
В наст. время Кировскому городскому совету Луганской Народной Республик подчинены 5 населённых пунктов:,1
Он также, как и др. критики отмечал, что Абдул была обделена вокальными данными, но находил, что именно такой высокий голос идеально подходил для синтезаторного данс-попа конца 1980-х гг.,1
Таким образом, Прачечный мост сохранился до наст. времени без всяких изменений, за исключением смягчения уклонов его проезжей части.,1
Из отряда хищных в области обитают волк, лисица обыкновенная, лисица-корсак, енотовидная собака, степной хорёк, перевязка, горностай, ласка, барсук, выдра, каспийская нерпа и др..,1
В наст. время в области функционирует 134 предприятия, пл. используемых водоёмов составляет ок. 32 тыс. га.,1
В наст. время действует 36 предприятий индустриальной аквакультуры, общая пл. которых составляет ок. 85 га.,1
В наст. время наблюдается новое отступание моря.,1
В числе известных актёрских работ Дюжева такие фильмы, как «Жмурки», «о-в», «Мне не больно», телесериал «Бригада» и др..,1
и др.,1
Три сценария, которые не были адаптациями, но, тем не менее, были основаны на романах Гарднера, но подверглись настолько глубокой переработке, что, в конечном итоге, серии получили др. названия: «Дело о мёртвом двойнике» («Дело о нанятой брюнетке»), «Дело отчаявшейся дочери» («Дело о гламурном призраке») и «Дело блудного родителя» («Дело подозрительного жениха»):8821.,1
В фильмах, которые были сняты после этого, характерные для стиля «нуар» приёмы движения камеры, использования глубокого пространства и др. стилевые особенности были смягчены или вовсе отсутствовали.,1
