abbreviation,encounters
Кубики Lego 1958 года по-прежнему взаимосвязаны с теми, которые производятся в наст. время, а наборы Lego для маленьких детей совместимы с наборами, созданными для подростков.,1
Статьи Галана перестали публиковать и др. издания, пьесы браковали.,1
Хотя Галан, как и др. инкриминируемые Стахуру жертвы, был гражданским лицом, судил его военный трибунал Прикарпатского военного округа.,1
В наст. время списан.,1
В наст. время общее число советских и российских генерал-полковников составляет неск. сотен чел. (список).,1
В наст. время звание генерал-полковник в Грузии отсутствует, а вторым по старшинству после генерала армии является воинское звание генерал-лейтенант.,1
Во Флорентийской опере выступали такие известные исполнители, как Диана Александер (Diane Alexander), Джун Андерсон, Анджела Браун, Хосе Каррерас, Джильда Крус-Ромо, Пласидо Доминго, Мариса Гальвани, Джером, Хайнс, Лиз Линдстрем, Спиро Малас, Джеймс МакКракен, Шерил Милнз, Жан Пирс, Лучано Паваротти, Эва Подлещ, Сэмюэл Рэми, Беверли Силлс, Эрика Суннегард, Ричард Такер и др..,1
В наст. время — урочище Полевое.,1
После завершения игровой карьеры Ламадрид много лет работал спортивным обозревателем на телеканале Imevisión (в наст. время — TV Azteca), вел передачу вместе с Фернандо Маркосом.,1
Кыл-Мухаммед-сейд, Кара-Сейд, Бузунджар-бий-кият, Хасан-оглан-чимбай, Пишин-кде-оглан-ииджан, [101] Мустафа-оглан-балгы-джар, Тимур-оглан-суюнич-кылый, Мухаммед-бек-конрат, Даулет-ходжа-диван-кушчи, Тули-ходжа-бий-кушчи, Кунгурбай-кушчи, Кибек-бий-кушчи, Сарыг-Шиман-мангыт, Абубекр-найман, Якуб-бий-дурман и др. багадуры и воины, обратив лицо на врага, отправились к местности Кук-Кашане 60…,1
[Однако] Бахтияр-султан и др. известные [багадуры], вопреки содержанию стиха: «Мир лучше [всякой] неосторожности», проявили беспечность этому миру, [а] когда перо предопределения божественного предначертало этим двум султанам [Бахтияр-султану и Ахмед-султану] правоверным и багадурам славным мученическую смерть за веру, они не вняли словами мира и согласия, слухам разума.,1
Так же, как и др. учёные, он пользовался особой благосклонностью и защитой знаменитого сельджукского визиря Низам аль-Мулька, к-рый в молодости вместе со своим братом посещал лекции аль-Вахиди.,1
В альбом также вошли Thank You For Loving Me, Just Older, Say It Isn’t So и др..,1
Саул Григорьевич (Шевель Гиршевич) Ханин (28 сентября 1902, Шамово Могилёвской губернии — 10 августа 1981, Смоленск) — сов. и рос. бактериолог, д. м. н., профессор Смоленского государственного медицинского института.,1
Позже биомаркеры одного из образцов показали, что там присутствовали смешанные собачьи и человеческие липиды и ДНК, а значит собаки, скорее всего, употребляли фекалии людей докловисской культуры, живших от 12 125 ± 30 до 11 315 ± 25 лет до наст. времени.,1
Был награждён многими наградами, среди которых рос. орден Святого Георгия 4-й степени (№ 3012; 6 августа 1815), а также орден Бани, Орден Святого Михаила и Святого Георгия, Королевский Гвельфский орден и др..,1
В наст. время применяются тампоны из полиэфируретанов и силиконовых каучуков.,1
В наст. время стала возможна растровая печать изображений хорошего качества.,1
Сэссю Хаякава род. 10 июня 1889 года в городке Тикура (в наст. время — город Минамибосо в префектуре Тиба).,1
Выше по течению Малой Колокши в наст. время населенных пунктов нет.,1
ч. дороги расширили с одной до двух проездных полос, а также на некоторых участках появились тротуары, ограждения и др. элементы, сделали маршрут значительно безопаснее, чем он был до того.,1
Это были Н. И. Лорер, В. Н. Лихарев, А. И. Черкасов, А. И. Вегелин, М. А. Назимов и др..,1
Кроме этих двух семейств, большими капиталами располагали семейства Эльмурзаевых, Башировых, Шептукаевых, Курумовых, Арсамирзоевых и др..,1
Были приняты решения о введении 8-часового рабочего дня, повышении зарплаты, равной с мужчинами оплате труда женщин и др..,1
Одними из первых чеченских актёров были Асет Исаева, Зинаида Исакова, Шамсудин Кагерманов и др..,1
В национальном театре в разные гг. работали режиссёры Мамед Алили, В. Э. Вайнштейн, Н. К. Децик, А. Г. Ридаль, М. Г. Минаев, балетмейстер Л. А. Леонов, художники Ираклий Гамрекели и Эдгар Бернгард, композиторы Г. Мепурнов, А. А. Алексадров и др. деятели культуры, оказывавшие помощь в подготовке национальных кадров.,1
Грозненский биохимический завод выпускал растворители (ацетон, бутанол, этанол), кормовой витамин В12, премиксы, ацидофилин, лизин и пр. Чечено-Ингушский химический завод местной промышленности производил краски, эмали, олифу, мастику и др. товары бытовой химии.,1
В рамках федеральной программы восстановления экономики и социальной сферы поступило 41,5 млрд руб., что позволило восстановить 71 школу, 70 медицинских учреждений, 48 км магистральных теплотрасс, 484 км электрических сетей, 428 объектов связи, 679 тыс. м² жилой площади и др. объекты.,1
Альбом в наст. время библ. редкость и ценный источник по истории и архитектуре Крыма.,1
Устройство в наст. время является неполным, и только его создатель Доктор Уоттс знает, как его закончить.,1
Николай Егорович Лысов (16 февраля 1903 года, Орехово-Зуево — 1967) — специалист в области электрических аппаратов, д. т. н., профессор, зав. кафедрой электрических аппаратов Московского энергетического института (1960-1961).,1
B т. же г к. т. н. Н. Е. Лысов был направлен на работу в моск. научно-исследовательский ин-т Минсудпрома.,1
Всего было построено 4 эсминца этого типа, все они в наст. время выведены из состава флота и проданы на слом.,1
В наст. время ToS поле называется поле differentiated services и имеет 6 бит поля DiffServ Code Point (DSCP) и 2 бит поля Explicit Congestion Notification.,1
Через месяц, ознакомившись с возможностями нескольких научных центров, Менделеев выбрал Гейдельбергский ун-т, где работали незаурядные естествоиспытатели: Роберт Вильгельм Бунзен, Густав Кирхгоф, Герман Людвиг Фердинанд Гельмгольц, Эмиль Эрленмейер и др..,1
В наст. время «молекулярная механика», основные положения которой пытался сформулировать Д. И. Менделеев, имеет лишь историч. значение, однако проведённые учёным исследования позволяют оценить актуальность его взглядов, соответствовавших передовым представлениям эпохи и получившим общее распространение только после Международного химического конгресса в Карлсруэ (1860).,1
Сведения эти использовали в критике теории электролитической диссоциации Х. Кромптон, Э. Пикеринг, Г. Е. Армстронг и др. учёные.,1
Всё лето 1892 года Менделеев и др. известные учёные читали публичные лекции на курорте «Старая Русса».,1
1861—1864 — Садовая улица, гл. инженерное уч-ще (Инженерный замок) — Садовая улица, дом 2; в наст. время здесь расположен филиал Русского музея;,1
На наст. время на тренерской работе, возглавляет секцию борьбы в кадетском корпусе Ростова-на-Дону.,1
род. в Дзауджикау Северо–Осетинской АССР (в наст. время — Владикавказ).,1
Алекса́ндр Константи́нович Нефёдкин (род. 13 января 1968, л.) — рос. историк, исследователь военного дела греков, македонян, персов, сарматов, готов, чукчей, эскимосов и тунгусов; а также отдельных родов войск (мегаристов, элефантерии, конницы и тяжёлой пехоты); переводчик античных военных трактатов; д. и. н. (окт. 2007).,1
Есть и др. теории относительно его личности.,1
Эсфирь Мироновна Конюс (также Зайдеман-Конюс, урождённая Зайдеман; 6 (18) дек. 1896, м. — 1964, там же) — сов. врач-педиатр, гигиенист, организатор здравоохранения и историк медицины, д. м. н. (1943), профессор.,1
Дочь — Елена Александровна Конюс (1923—2020), к. фил. н. (1953).,1
В 1938—39 гг сектором планировки городов треста «Башпрогор» разработан генеральный план строительства Ишимбая (архитекторы А. И. Филонов, Б. Г. Калимуллин, П. И. Тришин, П. П. Дохтуров и др.).,1
В наст. время Ишимбай занимает территорию в 103,47 км², представляющую собой центральную ч. с кварталами, девятью микрорайонами № 1, 2, 3, 4, 5, 6, 9, Тайруком и Южным, а также микрорайонами (жилыми районами) малоэтажной застройки Алебастровым, Бурводстроем, Восточным, 2-м Восточным, Железнодорожным, Кузьминовкой, Кусяпкулово, Майским, Нефтяником, Новостройкой, Перегонным, Речным, Смакаево, Старым Ишимбаем, Юрматы.,1
Впервые за всё время существования города появились заасфальтированные тротуары и улицы Геологическая, Промысловая, Октябрьская (ныне просп. Ленина) и др..,1
Это как местные сетевые магазины, так и сети федерального значения «Магнит», «Пятёрочка», «Полушка», «Монетка», «Матрица», «Красное & Белое», «Белая техника», «Корпорация Центр», DNS, «Техно», «Евросеть», «Связной», «Цифроград», «Стройландия», «585», «Военная экипировка» и др..,1
Перевозки осуществляет как ИАТП, так и др. филиалы ГУП «Башавтотранс» РБ.,1
В наст. время не функционирует, находится в сильном запустении.,1
В городе расположены историко-краеведч. музей, музей народного образования, картинная гал. и др. музеи.,1
В наст. время издаётся неск. газет, не считая рекламных: «Восход», «Подметки+», «Здравствуйте, соседи!» и «Торатау».,1
Гостями фестиваля нередко являются звезды мир. величины, такие как Джо Коккер, Deep Purple, Status Quo, Брайан Адамс и др..,1
Также в состав продукта могут входить растительное масло и др. компоненты.,1
В наст. время в странах региона свободно продаётся на рынках, обычно на лотках с сигаретами, семечками.,1
В наст. время запасы древесины на корню в Норвегии в два раза больше, чем сто лет назад.,1
В наст. время дворец используется как ресторан, и место для проведения концертов.,1
В наст. время город делится на следующие районы: «Алеф», «Бэт», «Гимель», «Далет», «Хей», «Вав», «Тэт», «Юд алеф», «Рамот», «Неве Менахем» («Нахаль Ашан»), «Нахаль Бека», «Неот Лон», «Неве Ной», «Неве Зеэв», «Даром», «ха-Ир ха-Атика» («старый город»).,1
Кроме того, в городе действуют Беэр-Шевский филиал академического инженерного колледжа им. Сами Шамуна (англ. Sami Shamoon College of Engineering - SCE) — крупнейшего инженерного колледжа в Израиле, основанного в 1995 г (в наст. время в нём обучаются ок. 5000 студентов первой и второй степени); и Технологический колледж.,1
Владимир Олегович Самойлов (7 мая 1941, Горький — 8 ноября 2023) — сов. и рос. физиолог и биофизик, чл.-корр. РАМН (1988), д. м. н., генерал-майор медицинской службы в запасе.,1
В Новгороде сформировались боярские роды Гюрятиничей, Мирошкиничей, Мишиничей-Анциферовичей, Борецких и др., представители которых выбирались в посадники.,1
В наст. время, она является репортёром и ведущей телеканала CBS Sports и Turner Sports, где является ведущим репортёром SEC.,1
Евге́ний Па́влович Спа́нгенберг (25 февраля 1898, Андриановка, Забайкальская область, рос. империя — 25 июля 1968, м., СССР) — сов. орнитолог, писатель-натуралист, к. б. н., лауреат Сталинской премии (1952).,1
Небольшие месторождения природного газа эксплуатируются в регионе Гура — Жмигруд — Милич, залежи каменного угля расположены в Нижнесилезском угольном бассейне, к-рый перестал эксплуатироваться в 2000 г, в то же время месторождения бурого угля расположены в западной части региона, и в наст. время эксплуатируются только в угольной шахте Туров.,1
В Йизерских горах известны также залежи олова, но из-за низкого качества руды в наст. время не разрабатываются.,1
Залежи гипса и ангидрита зарегистрированы в окрестностях Львувека-Слёнски и Болеславца, в наст. время работают две шахты.,1
В наст. время для нужд промышленности и дорожного строительства добываются магматические глубинные породы (гранитоиды, габбро) и вулканические (базальт, порфир, мелафиры), осадочные породы (песчаник, граувакка, известняк и доломит) и метаморфические породы (гнейсы, амфиболиты, серпентиниты, мрамор).,1
В качестве базовых масел обычно используют дистиллятные и остаточные компоненты различной вязкости (углеводороды), их смеси, углеводородные компоненты полученные гидрокрекингом и гидроизомеризацией, а также синтетические продукты (высокомолекулярные углеводороды, полиальфаолефины, сложные эфиры и др.).,1
Для смазывания цилиндров паровых машин использовались сначала животные жиры, а затем — специальные высоковязкие остаточные нефтяные масла (цилиндровые масла: цилиндровое 24 — вискозин, цилиндровое 52 — вапор и др.) с добавкой животных жиров, обладающие достаточно высокой температурной стабильностью и водоотталкивающими свойствами.,1
впосл. появились и др. типы присадок к смазочным маслам: противоокислительные, предотвращающие окисление масла; противоизносные и противозадирные, уменьшающие износ деталей двигателя, работающих без смазки под давлением, в условиях граничного трения, вроде кулачков распределительного вала и толкателей клапанов; противокоррозионные (ингибиторы), замедляющие коррозию вкладышей подшипников скольжения; противопенные, предотвращающие повышенное вспенивание масел, вызванное введением в него присадок; и др..,1
В наст. время практически все присадки к моторным маслам являются комплексными.,1
На остальных игроков (Chevron Oronite, ТСМ Afton Chemical, British Petroleum, ВНИИ НП, НПП «КВАЛИТЕТ» и др.) приходится менее 20 % рынка.,1
К середине девяностых годов все ведущие производители смазочных материалов стали предлагать в своём ассортименте полностью синтетические моторные масла, и этот сегмент рынка продолжает активно расти вплоть до наст. времени.,1
В наст. время для оценки этого свойства масла как правило используется индекс вязкости, характеризующий пологость кривой зависимости кинематической вязкости масла от температуры.,1
В наст. время данный признак не является определяющим при определении качества моторного масла, поскольку современные масла могут иметь широкий спектр цветов, в зависимости от типа базового масла и состава пакета присадок.,1
В 1969—1970 гг API, ASTM и SAE совместно разработали полностью новую систему классификации моторных масел, в общих чертах используемую вплоть до наст. времени.,1
Несмотря на значительные изменения на рынке моторных масел, произошедшие начиная с конца восьмидесятых — начала девяностых годов (широкое распространение синтетических, «полусинтетических» и гидрокрекинговых масел, появление новых категорий смазочных материалов, таких как энергосберегающие, Long Life и т. п., необходимость обеспечения совместимости с современным экологическим оборудованием и новыми видами топлив, вкл. биоэтанол, и так далее), данная классификация в общих своих чертах не претерпела принципиальных изменений вплоть до наст. времени, за исключением введения всё более новых эксплуатационных категорий масел, которые в последние десятилетия появляются с б. регулярностью, отражая быстрый прогресс в области двигателестроения и пост. ужесточение требований к экологичности и энергосбережению.,1
