abbreviation,encounters
После того, как был определён участок, обеспечены стройматериалы и рабочие, 8 октября 1708 года (23 раджаб 1120 по хиджре) в среду по приказу падишаха приглашённые визири, богословы и др. государственные чиновники сели в месте, приготовленном кетхюдой валиде-султан, и провели молитву, а потом в час, признанный главным провидцем кадия Ускюдара Мехмедом-эфенди удачным, был заложен фундамент мечети.,1
Комплекс Новой валиде, завершённый в 1708—1710 гг, включал в себя мечеть с двумя минаретами со средним куполом и султанским махфилем, шадырваном, питьевыми фонтанами-чешме, имаретом, мектебом, комнатой махьяджи, небольшой базар и др. помещения.,1
В наст. время образцы доступны для широкого изучения, и неск. экз. вида представлены в Музее естествознания в Лондоне.,1
В наст. время заключение однополых союзов в Тайване находится под запретом.,1
Также в наст. время Цай управляет собственной звукозаписью и руководит фирмой Eternal.,1
При добавлении классификатора к другим частям речи используется форма наст. времени.,1
Отмечается, что по аналогичной схеме можно использовать и др. существительные:,1
Её модель (STQ-77/FET) в наст. время предлагает, что черта Импульсивность отражает скорость инициации поведенческого акта при эмоциональной регуляции поведения, когда интеграция акта ещё незрелая и не прошла полный когнитивный контроль.,1
Представителем данной школы являются Малик ибн Анас, Абу Ханифа, Мухаммад аш-Шафии, Ахмад ибн Ханбаль и др. известные богословы.,1
Основная окраска оперения в условиях современного промышленного разведения белая, хотя имеются и др. разновидности: тёмная, палевая, красная с окаймлением, серо-голубая и пр..,1
Следует подчеркнуть то что в наст. время чистопородные куры корниш как таковые уже не выращиваются в промышленных масштабах, а скорее используются как биологический материал отцовской родительской формы для получения межпородных гибридов (кроссов) – мясных бройлеров.,1
Переводит прозу с белорусского языка (Виктор Карамазов, Лариса Гениюш и др.).,1
Тема «борьбы с тунеядством» стала основой сюжета новеллы «Напарник» в кинокомедии Леонида Гайдая «Операция «Ы» и др. приключения Шурика».,1
Вместе с отцом работал на виндавской судоверфи герцога Якоба, после её закрытия создавал церковные интерьеры, в частности, алтарь и кафедру церкви Вентспилсского замка (сохранившиеся элементы выставлены в часовне замка Ливонского ордена и в лютеранской церкви в Дзирциемсе Тукумского края), органный просп. для церкви Митавского замка (не сохранился), внутреннее оформление и алтарь церкви св. Анны в Лиепае (1697, включено в Культурный канон Латвии) и др. произведения.,1
В наст. время в посёлке работает ЗАО «Арзамасская сельхозтехника» и ООО «АрзамасАгроПромЭнерго», мн. жители работают в Арзамасе.,1
В число акций фонда входит проведение благотворительных аукционов, благотворит. футбольный матч и др. мероприятия.,1
В наст. время терр. бывшей Никитинской Сечи находится на территории города Никополя.,1
Sede vacante (с 1975 года — по наст. время),1
12 мая — Туполев, Алексей Андреевич — сов. авиаконструктор, акад. Российской академии наук, Герой Социалистического Труда, д. т. н. (1963), профессор (1964).,1
К ним относятся моторные масла, трансмиссионные масла и др. специальные продукты.,1
В наст. время к этим сериям относятся Чемпионат мира по ралли (Ford Abu Dhabi, Mini, M-Sport Stobart Ford, Monster World Rally Team, Team Abu Dhabi), WTCC (SR Customer Racing, Volvo Polestar), Dakar Series (Ралли-рейды «Дакар» и «Шелковый Путь» — «КАМАЗ-мастер», Volkswagen), IRC (Skoda Motorsport), ETRC (Team Allgäuer), MotoGP (San Carlo Honda Gresini), World Superbikes (Castrol Honda), дрэг-рейсинг (John Force Racing), V8 Supercars (Rod Nash Racing, Ford Performance Racing), ALMS (BMW Team RLL) и «24 часа Ле-Мана» (Audi Sport).,1
Периодичность водоотлива, а, следовательно, и периодич. затопление котлована водою имеет и др. хорошие стороны: если ночью бывают заморозки, слой воды, покрывающий кладку фундамента, защищает её от мороза; неокрепший бетон не размывается и т. д.,1
Ученая степень — д. ю. н..,1
43 км проходила ведомств. Оборская жел. дорога, в наст. время разобрана.,1
Юрий Борисович Виноградов (7 дек. 1932, Самарканд — 30 сентября 2012, Санкт-Петербург) — сов. и рос. учёный-гидролог, д. г. н., профессор, автор монографий по математическому моделированию гидрологических процессов, катастрофическим прорывным паводкам и селевым потокам.,1
24 июня 81-я мд понесла потери в боях под Яворовом: пропали без вести командир дивизии, начальник штаба, начальник разведотдела и др. члены штаба дивизии.,1
науч. воспитанники: Н. П. Дыренкова, Е. П. Крейнович, Г. Н. Прокофьев, Г. М. Василевич, С. В. Иванов, Л. Э. Каруновская, С. М. Абрамзон, Л. П. Потапов, А. А. Попов и др..,1
Так, если он и его сослуживцы-лётчики вплоть до командира дивизии включительно курили махорку, обёрнутую в обрывок газеты (других табачных изделий у них просто не было) и все были одеты в изношенную залатанную форму, то сотрудники органов госбезопасности, — особисты и смершевцы, с которыми ему довелось встречаться, — самим своим видом производили впечатление сытой тыловой жизни, носили кители индивидуального покроя, курили дорогие сигареты и папиросы, импортные марки «Кэмел» и советские «Казбек», — ни те, ни др. невозможно было купить в советских магазинах.,1
Этот и др. случаи послужили для них точкой невозврата, после которой они с Барсовым приняли решение лететь на з., причём «двигателем» в их команде выступал именно Пирогов, заприметивший Барсова из-за взрывного характера последнего и его регулярных конфликтов с начальством.,1
Позже на средства Администрации международной информации США она была переведена на франц., кит., гуджаратский, хинди, маратхи и др. языки мира.,1
В наст. время является ассистентом главного тренера «Фулхэма» Марку Силвы.,1
Кроме вышеупомянутых аналогов известны и др. (напр., α-азафенилаланин, конформационно-фиксированные аналоги, такие как 1,2,3,4-тетрагидроизохинолин-3-карбоновая кислота ), которые фигурируют в различных исследованиях, в т. числе и по поиску новых лекарств (биологически активные псевдопептиды и др.).,1
Крупнейшие озёра Югры — Кондинский Сор, Тормэмтор, Леушинский Туман, Пильтанлор, Турсунтский Туман, Итщитох, Сырковое и др..,1
В наст. время древнейшим местом племенного пребывания людей считается откр. археологами палеолитическая стоянка на местонахождении «Луговское».,1
Итогом проекта станет изд. «академич. история Югры», один из источников, как для создаваемой в наст. время 20-томной «Истории России», так и для учебников и учебно-методических пособий по истории Югры для школ и вузов региона.,1
В наст. время в округ наблюдается интенсивный приток мигрантов-мусульман.,1
В наст. время ханты занимают большую ч. Ханты-Мансийского автономного округа — Югры (кроме западных районов округа, где расселены манси), а также юго-запад Ямало-Ненецкого автономного округа и северо-восток Томской области.,1
В наст. время, в связи с промышленным освоением Югры, изменилась и жизнь большинства манси.,1
Экономика автономного округа имеет приоритетными сектора добычи углеводородного сырья, в автономном округе также развиваются энергетика, стр-во, транспортная инфраструктура и др. отрасли.,1
В наст. время Ханты-Мансийский авт. округ — Югра является основным нефтегазоносным регионом России и одним из крупнейших нефтедобывающих регионов мира, относится к регионам-донорам России и лидирует по ряду основных экономических показателей:,1
междунар. экологич. акция «Спасти и сохранить» и др..,1
этнич. состав: конго 48 %, санга 5,6 %, мбоши 12 %, теке 17 %, пигмеи 10 %, европейцы и др. 3 %.,1
Действие сюжета разворачивается в 2010 г, а не в викторианскую эпоху, и в сериале фигурируют современные особенности, такие как мобильные телефоны, лондонские такси TX1, никотиновые пластыри вместо традиционной трубки и др. стандартные реквизиты.,1
Связь с историей наименования села в наст. время утеряна, даже старожилы предполагают, что назв. с. получило потому, что «...тундра кругом, торф, болотистые места».,1
Выпускаются также капельные воронки, воронки для порошков с широкой трубкой, предохранительные воронки, и др..,1
Химическая посуда и др. принадлежности // Техника лабораторных работ. — 9-е изд., перераб. и доп. — М.: Химия, 1969.,1
Но встречаются и др. конструкции, напр. отсечная крановая с шаровой пробкой арматура, оснащенная электрическим приводом, на рисунке слева.,1
Вместе с Академическим симфоническим оркестром Московской филармонии, Симфоническим оркестром филармонии «Джордже Энеску» и Национальным оркестром Радио Румынии, Ботнарь записал произведения Чайковского, Рахманинова, Мусоргского и др..,1
Ладислава Бецеле / Ladislava Becele; 25 мая 1920, Зград — сент. 2008, Белград) — югославский политик, д. э. н., участница Народно-освободительной войны Югославии.,1
После успешной битвы на сторону Тимолеонта стали переходить и др. сицилийские города.,1
В наст. время вновь является Генеральным директором архитектурно-консалтинговой фирмы «УРБИС-СПБ», совмещая эту работу с должностью приглашенного Главного архитектора проектной фирмы ВиПС.,1
В наст. время является советником Губернатора Санкт-Петербурга по вопросам градостроительства и архитектуры на общественных началах и профессором кафедры архитектуры и проректором Санкт-Петербургского института живописи, скульптуры и архитектуры им. И. Е. Репина.,1
Уэмура род. в городе Хидака (в наст. время — ч. города Тоёока в префектуре Хёго).,1
Долгая борьба Геда за признание и принятие «теневой» стороны своей личности породила ряд интерпретаций в критической литературе, вкл. психологические, теологические, этические и др..,1
Писательница использует слово mage, из которого создаёт ряд составных слов: Верховный Маг (Archmage), волшебство / магия (magery), волшебный ветер (magewind) и др..,1
По мнению Шиппи, магию Земноморья можно трактовать как неизвестную технологию, к-рый зависит от знания, что сближает её с «интеллектуалистскими» теориями XIX вв. (Спенсер, Тайлор, Фрэзер и др.).,1
Как отмечает Хогсетт, писательница, как и др. авторы постсекулярного фэнтези XX вв. (отвечавшие на ужасы двух мировых войн), отвергла связанную с секуляризацией философию материализма, однако, в отличие Толкина, Льюиса, Ч. Уильямса, Л’Энгл, М. Энде и других, отказалась от теологических и этических принципов христианства, обратившись к даосизму, дуализму добра и зла в восточном мистицизме.,1
Хумай (С. Рахман, «Алигулу женится»), Афат (М. Шамхалов, «Свекровь»), Графиня (У. Шекспир, «кон. — делу венец»), Диляра (Анар, «Летние дни города»), Дильбар ханум (Н. Везиров, «Хаджи Гамбар»), Огудалова (А. Островский, «Бесприданница»), Смеральдина (К. Гольдони, «Служанка двух господ»), Буюкханум (Дж. Джаббарлы, «Айдын»), Тетя (У. Гаджибеков, «Аршин мал алан»), Назик (С. Рахман, «Улдуз») и др. её роли завоевали зрительские симпатии.,1
Дочь —Татьяна Юрьевна Сем, к. и. н., доцент, старший науч. сотр. отдела этнографии народов Сибири Российского этнографического музея.,1
«Горе от ума» — А. Грибоедова и др.,1
«Desilu» приобрела два студийных комплекса «RKO», расположенных на улице Гауэр в Голливуде и в Калвер-Сити (в наст. время ч. «Paramount» и «Culver Studios»), а также участок в Калвер-Сити под названием «Сорок акров».,1
«Я люблю Люси: фильм и др. раритеты» (англ. I Love Lucy: The Movie and Other Great Rarities) — (1 диск, выпущен 27 апреля 2010 года), был включён в качестве бонус-диска в полном комплекте сериала).,1
В этот список входят: Теннесси Эрни Форд, Уильям Холден, Джон Уэйн, Боб Хоуп, Уилл Райт, Эльза Ланчестер, Ван Джонсон, Орсон Уэллс, Рок Хадсон, Ив Арден, Шарль Буайе, Харпо Маркс, Барбара Пеппер, Пепито Перес, Пегги Ри, Херб Вигран, Барбара Иден, Артур К. Брайан, Джанет Уолдо, Ричард Кренна, Корнел Уайлд, Уидмарк, Ричард, Гэйл Гордон, Натали Шафер, Хедда Хоппер, Боб Джеллисон, Луис Николетти, Ричард Ривз, Дорис Синглтон, Хай Авербэк, Кэтрин Кард, Джей Новелло, Джордж Ривз, Мэри Джейн Крофт, Джерри Хауснер, Элизабет Паттерсон, Аарон Спеллинг, Росс Эллиотт, Ганс Конрид, Джонни Джейкобс и др..,1
Среди поэм М.Бебана наиб. популярны «Мезень колга морайхть нюдихне» («О чем поют свирели»), «Лятфнемат» («Воспоминания»), «Ошэряй мокшавати» («гор. мокшанке»), «Вень поезтт» («Ночные поезда») и др..,1
В наст. время самозарядная версия AMD-65 доступна для продажи во многих штатах.,1
Хуан Чунь-мин (кит. трад. 黃春明, пиньинь Huáng chūnmíng, палл. Хуан Чуньмин) — тайваньский писатель, видный представитель почвеннического течения в тайваньской литературе в 1970-х гг; его романы, дет. лит-ра, пьесы были переведены на япон., корейский, англ, франц., нем. и др. языки.,1
В самом начале «Йога-сутр» Патанджали утверждается «йогаш читта-вритти-ниродхах» (1.2): «Йога есть обуздание волнений, присущих уму» (санскр., есть и др. переводы, близкие по смыслу).,1
Доктор юридических наук (2002), к. и. н. (1989), профессор (2006).,1
В наст. время профессор и зам. директора Института международных отношений, истории и востоковедения КФУ.,1
Владимир Иванович Осадчий (укр. Володи́мир Іва́нович Оса́дчий; род. 28 сентября 1955 года, с. Добрык, Брасовский р-н, Брянская область) — сов. и укр. гидролог, гидрохимик, д. г. н., чл.-корр. НАН Украины (2009).,1
рос. (ОКБ Туполева, ОКБ Сухого, Концерн ПВО «Алмаз-Антей», НПО машиностроения, ФГУП Базальт, ГКНПЦ им. М. В. Хруничева и др.) и зарубежные фирмы (Boeing, Thales, Мотор Сич и др.) представили свои разработки в 19 крытых павильонах.,1
Асадора в наст. время транслируется в Японии с понедельника по субботу утром на канале NHK General TV с 8:00 до 8:15, с повтором в тот же день с 12:45 до 13:00.,1
После этого для лечения рака было одобрено более 10 препаратов, среди которых алемтузумаб (2001), офатумумаб (2009), ипилимумаб (2011) и др. антитела.,1
В наст. время в стране продолжают действовать 60 угольных шахт.,1
Из общего числа лишь приблизительно 60 пригодны для проживания или заселены в наст. время.,1
Широко распространены мхи, в наст. время в Новой Зеландии известны 523 их разновидности.,1
Однако ни это решение, ни др. подобные идеи, не были осуществлены до организации Первого Всемирного сионистского конгресса Герцлем в 1897 г.,1
Поставив перед собой только одну цель — создание национального гос-ва, они недооценивали др. национальные приоритеты.,1
На площади расположены 48 колонн с флагами европейских стран, служащие в наст. время опорами рекламных конструкций.,1
Зебулон Монтгомери Пайк (англ. Zebulon Montgomery Pike, 5 января 1779 года — 27 апреля 1813 года) — амер. бригадный генерал и исследователь, в честь которого названы гора Пайкс-Пик, нац. лес в штате Колорадо, ряд округов и др. объекты.,1
Его имя можно найти на картинах, четыре из которых в наст. время хранятся в Эрмитаже в России и четыре в Метрополитен-музее в США.,1
